lemma	pos	date	grouping	identifier	description	context	indexes_target_token	indexes_target_sentence	context_tokenized	indexes_target_token_tokenized	indexes_target_sentence_tokenized	context_lemmatized
ingående		1797	1	bib19225772_17971027_148003_86_0003_alto.xml-2-3	 	som til fridens ingående stal wara imellan Exvenetianstä Statens folkflag.	16:24	0:74	som til fridens ingående stal wara imellan Exvenetianstä Statens folkflag .	3	0:11	som til frid ingående stjäla wara imellan exvenetianstä stat folkflag $
ingående		1828	1	bib19225792_18280426_147359_17_0008_alto.xml-5-11	 	Uti Chalmerska Indnstrie-Skolans Wäfnnderwisnings-ansialt här i Staden kunna, under snart ingående Wäfcermin, mindre bemedlade fruntimmer af allaclatzer, som önska en fullkomliqare kännedom i den mera » » vanliga » vafnadSkonsteu efter Ekeiiinarkska methoden, erhålla fri » nderivisiiing.	90:98	0:288	Uti Chalmerska Indnstrie-Skolans Wäfnnderwisnings-ansialt här i Staden kunna , under snart ingående Wäfcermin , mindre bemedlade fruntimmer af allaclatzer , som önska en fullkomliqare kännedom i den mera » » vanliga » vafnadSkonsteu efter Ekeiiinarkska methoden , erhålla fri » nderivisiiing .	11	0:42	uti chalmersk $ $ här i stad kunna $ under snar ingående wäfcermin $ föga bemedla fruntimmer af allaclatzer $ som önska en fullkomliqare kännedom i den mera $ $ vanlig $ vafnadskonsteu efter ekeiiinarkska methoden $ erhålla fri $ nderivisiiing $
ingående		1797	1	bib13506739_17970111_144030_8_0003_alto.xml-9-1	 	och ingåendet uti et Rum, följande Klädespersedlar: En grä Silkes-Chal, twänne st.	4:13	0:82	och ingåendet uti et Rum , följande Klädespersedlar : En grä Silkes-Chal , twänne st.	1	0:15	och ingående uti et rum $ följa klädespersedel $ en grä $ $ twänne $
ingående		1811	1	bib13506739_18111118_144030_269_0004_alto.xml-6-13	 	Stockholm, bli skjutsade ner och j ' å, efter approbation och ingående till tjenstgörinz, resten af Legan.	62:70	0:106	Stockholm , bli skjutsade ner och j ' å , efter approbation och ingående till tjenstgörinz , resten af Legan .	13	0:21	stockholm $ bli skjutsa ner och j $ å $ efter approbation och ingående till tjenstgörinz $ rest af lega $
ingående		1814	1	bib11653828_18140214_144028_36_0002_alto.xml-6-10	 	sta Riket pä denna sidan och Tullvisitationsstattet för ut- sch ingående resande.	64:72	0:81	sta Riket pä denna sidan och Tullvisitationsstattet för ut- sch ingående resande .	10	0:13	sta rike pä denna sida och tullvisitationsstattet för ut sch ingående resande $
ingående		1792	1	bib19225792_17920218_147359_7_0001_alto.xml-0-18	 	i, kas wär Frälsares JEsu Christi Pinos Historia tom » W ma uti Domkyrkan, under nu ingående Fastelags lid, följande stycken ö nedanstående dagar at förklaras, namnligen: Febr.	84:92	0:176	i , kas wär Frälsares JEsu Christi Pinos Historia tom » W ma uti Domkyrkan , under nu ingående Fastelags lid , följande stycken ö nedanstående dagar at förklaras , namnligen : Febr .	18	0:34	i $ kase wär frälsare jesu christi pinos historia tom $ w ma uti domkyrka $ under nu ingående fastelag lid $ följa styck ö nedanstående dag at förklara $ namnligen $ febr $
ingående		1808	1	bib11653825_18080625_145134_76_0007_alto.xml-18-81	 	Eric Ohlin- Som anwärsde Soldaten (F. Carlström, hwilken med mig trvlofwad ax, icke pä 6 LrS lid lätit höra af sig, eller äktenskapet sökt fullborda; sä och för att ej wid annat äktenskaps ingående wam hindrad, far iag i anledning af Kongl- Majestäts Nädigste Förordning ben 26 Oetober 1791, anmana honom, att inom ben tid Författningarne bjuda, hos HLrivarande Pastor sig anmäla, helst jag i annor händelse mig mi annat giftes ingående icke anser hindrad; hwilket andia gängen kungöres.	428:436	0:487	Eric Ohlin- Som anwärsde Soldaten ( F. Carlström , hwilken med mig trvlofwad ax , icke pä 6 LrS lid lätit höra af sig , eller äktenskapet sökt fullborda ; sä och för att ej wid annat äktenskaps ingående wam hindrad , far iag i anledning af Kongl- Majestäts Nädigste Förordning ben 26 Oetober 1791 , anmana honom , att inom ben tid Författningarne bjuda , hos HLrivarande Pastor sig anmäla , helst jag i annor händelse mig mi annat giftes ingående icke anser hindrad ; hwilket andia gängen kungöres .	81	0:91	eric $ som anwärsde soldat $ $ carlström $ hwilken med jag trvlofwad ax $ icke pä 6 lrs lid lätit höra af sig $ eller äktenskap söka fullborda $ sä och för att ej wid annan äktenskap ingående wam hindra $ fara iag i anledning af $ majestät nädigste förordning ben 26 oetober 1791 $ anmana han $ att inom ben tid författning bjuda $ hos hlrivarande pastor sig anmäla $ gärna jag i annor händelse jag mi annan giftas ingående icke anse hindra $ hwilket andia gäng kungöra $
ingående		1821	1	bib15650837_18210124_146391_7_0004_alto.xml-4-7	 	Den 14 i denne monad förlorades hwid ingåendet uti Tysta Kurkan cn Guldring ^ uti densaimr graverad C.	37:46	0:102	Den 14 i denne monad förlorades hwid ingåendet uti Tysta Kurkan cn Guldring ^ uti densaimr graverad C .	7	0:19	den 14 i denna monad förlora hwid ingående uti tyst kurkan cn guldring $ uti densaimr gravera c $
ingående		1809	1	bib19225792_18090211_147359_6_0002_alto.xml-0-24	 	I Garnizoitskyrkan blifwer wär Frälsares JEsti lz Christi Pinos Historia pä följande satt indelad p" till Tcxker för Afconsängs och weckopredikningar f under ingående Fastelag: Fastlags Sänd.	158:166	0:191	I Garnizoitskyrkan blifwer wär Frälsares JEsti lz Christi Pinos Historia pä följande satt indelad p " till Tcxker för Afconsängs och weckopredikningar f under ingående Fastelag : Fastlags Sänd .	24	0:30	i garnizoitskyrkan blifwer wär frälsare jesti lz christi pinos historia pä följa sitta indela p $ till tcxker för afconsängs och weckopredikningar f under ingående fastelag $ fastlag sända $
ingående		1827	1	bib19277277_18270818_147682_192_0001_alto.xml-23-36	 	bostapsfallet Därstädes, har ödet ocksä läcit » vederfaras rättwisa ät nägra af dessa talares förtjenst; ty t OtheniS Socken hafwa twennc grannar, och hwilka just warit bland de ifrigaste atl motsätta sig hwarje ingående pä löningsi bidrag, inom twenne dygi » hwardera niistat sina fyra par dragare, de enda de för sitt gärdsbruk ägde; icke nog der- f med, ty de » voro ej i ständ, af farhåga för smittan, att fa hjelp genom län af deras Sockneboer.	212:220	0:449	bostapsfallet Därstädes , har ödet ocksä läcit » vederfaras rättwisa ät nägra af dessa talares förtjenst ; ty t OtheniS Socken hafwa twennc grannar , och hwilka just warit bland de ifrigaste atl motsätta sig hwarje ingående pä löningsi bidrag , inom twenne dygi » hwardera niistat sina fyra par dragare , de enda de för sitt gärdsbruk ägde ; icke nog der- f med , ty de » voro ej i ständ , af farhåga för smittan , att fa hjelp genom län af deras Sockneboer .	36	0:88	bostapsfallet därstädes $ ha öde ocksä läcit $ vederfaras rätt äta nägra af denna talare förtjenst $ ty t othenis socken hafwa twennc granne $ och hwilka just warit bland en ifrig atl motsätta sig hwarje ingående pä löningsi bidrag $ inom twenne dygi $ hwardera niistat sig fyra par dragare $ en enda en för sig gärdsbruk äga $ icke nog $ f med $ ty de $ voro ej i ständ $ af farhåga för smitta $ att fa hjelp genom län af de sockneboer $
ingående		1808	1	bib11653825_18080227_145134_26_0004_alto.xml-1-4	 	Listan pä ut- och ingående fartyg wisar wcrkan af sista Decrerei, som tillstucer Landers hanmar för alla handelsskepp, i det blott nägre Frai-este Kapare uppglfwas sä- som ankomne.	18:26	0:180	Listan pä ut- och ingående fartyg wisar wcrkan af sista Decrerei , som tillstucer Landers hanmar för alla handelsskepp , i det blott nägre Frai-este Kapare uppglfwas sä- som ankomne .	4	0:31	lista pä ut och ingående fartyg wisar wcrkan af sista decrerei $ som tillstucer landers hanmar för all handelsskepp $ i den blott nägre $ kapare uppglfwas $ som ankomma $
ingående		1827	1	bib13506739_18270818_144030_192_0001_alto.xml-8-13	 	nar, och hwilka just warit bland de ifrigaste att motsatta sig hwarje ingående pä löningsbidrag, inom lwenne dygn hwardera mistat sina fyra par dragare, de enda de för sitt gärdsbrnk egde; icke nog dermed, ty de woro ej i ständ, af farhäga för smittan, att fä hj-lv genom län af deras Sockneboer.	70:78	0:296	nar , och hwilka just warit bland de ifrigaste att motsatta sig hwarje ingående pä löningsbidrag , inom lwenne dygn hwardera mistat sina fyra par dragare , de enda de för sitt gärdsbrnk egde ; icke nog dermed , ty de woro ej i ständ , af farhäga för smittan , att fä hj-lv genom län af deras Sockneboer .	13	0:60	nar $ och hwilka just warit bland en ifrig att motsatt sig hwarje ingående pä löningsbidrag $ inom lwenne dygn hwar mista sig fyra par dragare $ en enda en för sig gärdsbrnk egde $ icke nog dermed $ ty de woro ej i ständ $ af farhäga för smitta $ att fä $ genom län af de sockneboer $
ingående		1824	1	bib11653823_18241112_144010_264_0006_alto.xml-8-41	 	Undertecknad, solli nägon t! » warit pä Prosestion utoni Fäderneslandet, och för samma lid saknar bets » om HinderlöShct till Äktenstap, sär härmedelst anmoda den sig befogad finner, att mig ätala, i händelse af gistermäls ingående, att fädant, enligt Lag, inom ett ärs förlopp efter denna amionceS införande i AllmÄaua Tidningarne, anmäla hos PastorSLmbetei t St. Clacä Församling, der iag lii, wistas, hwilker andra gängen kungöres.	223:231	0:434	Undertecknad , solli nägon t ! » warit pä Prosestion utoni Fäderneslandet , och för samma lid saknar bets » om HinderlöShct till Äktenstap , sär härmedelst anmoda den sig befogad finner , att mig ätala , i händelse af gistermäls ingående , att fädant , enligt Lag , inom ett ärs förlopp efter denna amionceS införande i AllmÄaua Tidningarne , anmäla hos PastorSLmbetei t St. Clacä Församling , der iag lii , wistas , hwilker andra gängen kungöres .	41	0:80	underteckna $ solli nägon t $ $ wari pä prosestion utoni fädernesland $ och för samma lid sakna b $ om hinderlöshct till äktenstap $ sär härmedelst anmoda den sig befogad finna $ att jag ätala $ i händelse af gistermäls ingående $ att fädant $ enligt lag $ inom en ära förlopp efter denna amionces införande i allmäaua tidning $ anmäla hos pastorslmbetei t $ clacä församling $ der iag lii $ wistas $ hwilker andra gäng kungöra $
ingående		1828	1	bib19225792_18280517_147359_20_0008_alto.xml-7-13	 	Uti Chalmerska J«dnstrie - Skolans Wäfullderwisnlngsanstalt här i Staden kunna, under snart ingående Wäftermin, mindre bemedlade fruntimmer af alla clafier, so&gt; n önsta en fullkomligare kännedom i den mera owanliga wäs » adskonsteu efter Ekenmarksta methodeu, erhälla fri underwisning.	92:100	0:288	Uti Chalmerska J«dnstrie - Skolans Wäfullderwisnlngsanstalt här i Staden kunna , under snart ingående Wäftermin , mindre bemedlade fruntimmer af alla clafier , so&gt ; n önsta en fullkomligare kännedom i den mera owanliga wäs » adskonsteu efter Ekenmarksta methodeu , erhälla fri underwisning .	13	0:45	uti chalmersk $ $ skola wäfullderwisnlngsanstalt här i stad kunna $ under snar ingående wäftermin $ föga bemedla fruntimmer af all clafier $ $ $ n önsta en fullkomlig kännedom i den mera owanliga wäs $ adskonsteu efter ekenmarksta methodeu $ erhälla fri underwisning $
ingående		1829	1	bib11653828_18291021_144028_244_0002_alto.xml-2-47	 	kunde väl beskäras Öfver-Donaukretsen, änden tankan: hanhända bevärdigar han sjelf den tillbedde Monarken våra offentliga expositioner med en huldrik blick, kanhända nalkas fadren sine trogna barns hrets, vänligt emottagande gdfvorna af deras kärlek, godhets fullt prof vande deras handlingar, verksamhet och ingående i hans upphöjda planeri Hvarje hjerta klappar vid en sådan möjlighet med kraftigare slag, och från hvarje öga flyta tårar af längtan och lycksaliggörande väntan."	309:317	0:480	kunde väl beskäras Öfver-Donaukretsen , änden tankan : hanhända bevärdigar han sjelf den tillbedde Monarken våra offentliga expositioner med en huldrik blick , kanhända nalkas fadren sine trogna barns hrets , vänligt emottagande gdfvorna af deras kärlek , godhets fullt prof vande deras handlingar , verksamhet och ingående i hans upphöjda planeri Hvarje hjerta klappar vid en sådan möjlighet med kraftigare slag , och från hvarje öga flyta tårar af längtan och lycksaliggörande väntan . "	47	0:76	kunna väl beskära $ $ ände tankan $ hanhända bevärdiga han sjelf den tillbe monark vi offentlig exposition med en huldrik blick $ kanhända nalkas fadren sine trogen barn hrets $ vänlig emotta gdfvorna af de kärlek $ godhet full prof vänja de handling $ verksamhet och ingående i han upphöja planeri hvarje hjerta klappa vid en sån möjlighet med kraftig slag $ och från hvarje öga flyta tår af längtan och lycksaliggöra väntan $ $
ingående		1830	1	bib19277277_18300406_147682_79_0003_alto.xml-37-24	 	Eli Härda lid, öfwer eli » lius tange, utan stafs, af ett bninickebandS bredd, förlorades den 2 dennes, wid ingående nti rrängwlit till stora Mästerad-Bälra.	108:116	0:157	Eli Härda lid , öfwer eli » lius tange , utan stafs , af ett bninickebandS bredd , förlorades den 2 dennes , wid ingående nti rrängwlit till stora Mästerad-Bälra .	24	0:31	eli härda lid $ öfwer eli $ lius tange $ utan staf $ af en bninickebands bredd $ förlora den 2 denna $ wid ingående nti rrängwlit till stor $ $
ingående		1827	1	bib19225792_18270505_147359_17_0003_alto.xml-3-21	 	Sedan Consistorii Rum nti Nya Gymnasii och Skolhuset nu blifwit färdige, komma Consistorii Sestioner hädanefter och ifrän och med nu ingående Maj manad att hallas derstädes; hwarjemte tillkännagifwes sa wäl, att Consistorii Anslag frätt samma tid flyttas fran Oomkyrkodörren till den för desie anstag anbragta Tafla uti Consistorii förstuga, som ock att Conststorii-Notarien hädanefter i Embetsärenderne träffas a dest Embetsrum i samma Hus, emellan kl. n och 12 al!a Söcknedagar.	133:141	0:480	Sedan Consistorii Rum nti Nya Gymnasii och Skolhuset nu blifwit färdige , komma Consistorii Sestioner hädanefter och ifrän och med nu ingående Maj manad att hallas derstädes ; hwarjemte tillkännagifwes sa wäl , att Consistorii Anslag frätt samma tid flyttas fran Oomkyrkodörren till den för desie anstag anbragta Tafla uti Consistorii förstuga , som ock att Conststorii-Notarien hädanefter i Embetsärenderne träffas a dest Embetsrum i samma Hus , emellan kl. n och 12 al !a Söcknedagar .	21	0:77	sedan consistorii rum nti nya gymnasii och skolhus nu blifwit färdig $ komma consistorii sestioner hädanefter och ifrän och med nu ingående maj mana att halla derstädes $ hwarjemte tillkännagifwes säga wäl $ att consistorii anslag fräta samma tid flytta fran oomkyrkodörren till den för desie anstag anbragta tafla uti consistorii förstuga $ som ock att $ hädanefter i embetsärenderne träffa a dest embetsrum i samma hus $ emellan $ n och 12 al $ söcknedagar $
ingående		1790	1	bib13506739_17900601_144030_123_0002_alto.xml-5-18	 	Jag h, r säledes trodt mig ej kunna anse denna bestormning, uti en i Landet djupt ingående men » ren och okänd Hamn annorlunda, än underkastad de manlige Krigshändelser, so » & gt; wäderlek och tilfal » len t il sta p a ech förändra, men hwilken i » lla tider bör witsorda Swensta Flagg ns tappra tiltag och HSndciktighet, hwilka ej sällan ädragit henne fiendens aktning och tilstyndat öfwerwigt St mindre antai och mindre movenS.	82:90	0:430	Jag h , r säledes trodt mig ej kunna anse denna bestormning , uti en i Landet djupt ingående men » ren och okänd Hamn annorlunda , än underkastad de manlige Krigshändelser , so » & gt ; wäderlek och tilfal » len t il sta p a ech förändra , men hwilken i » lla tider bör witsorda Swensta Flagg ns tappra tiltag och HSndciktighet , hwilka ej sällan ädragit henne fiendens aktning och tilstyndat öfwerwigt St mindre antai och mindre movenS .	18	0:84	jag h $ r säledes trodt jag ej kunna anse denna bestormning $ uti en i land djup ingående men $ ren och okänd hamn annorlunda $ än underkasta en manlig krigshändelse $ so $ $ gt $ wäderlek och tilfal $ len t il sta p a ech förändra $ men hwilken i $ lla tid böra witsorda swensta flagg n tapper tiltag och hsndciktighet $ hwilka ej sällan ädragit hon fiende aktning och tilstyndat öfwerwigt st liten antai och liten moven $
ingående		1820	1	bib13506739_18200623_144030_143_0007_alto.xml-9-47	 	ll t b j n d e s « 11 arrendera sel, hvra En större Ladugård, en och en half mil sjö- och landwäg srän Stockholm, kan pä billigt arrende häll^S; men mage ej nägon göra sig beswär, som sör uppfyllandet af ingående förbindelse, ej kan sätta we » derhilstig borgen.	204:212	0:262	ll t b j n d e s « 11 arrendera sel , hvra En större Ladugård , en och en half mil sjö- och landwäg srän Stockholm , kan pä billigt arrende häll^S ; men mage ej nägon göra sig beswär , som sör uppfyllandet af ingående förbindelse , ej kan sätta we » derhilstig borgen .	47	0:58	ll t b j n d e s $ 11 arrendera sel $ hvra en stor ladugård $ en och en half mil sjö och landwäg srän stockholm $ kunna pä billig arrende $ $ men mage ej nägon göra sig beswär $ som sör uppfyllande af ingående förbindelse $ ej kunna sätta we $ derhilstig borgen $
ingående		1800	1	bib19225772_18000221_148004_21_0002_alto.xml-2-13	 	— Appighet befordrar icke folkökningen, ty den ar et hinder emot gistermäls ingående, emedan ganffa fä hafwa räd at underhälla et hushäll pä et sä lysande sätt, som det allmänna bruket fordrar.	76:84	0:193	— Appighet befordrar icke folkökningen , ty den ar et hinder emot gistermäls ingående , emedan ganffa fä hafwa räd at underhälla et hushäll pä et sä lysande sätt , som det allmänna bruket fordrar .	13	0:36	$ appighet befordra icke folkökning $ ty den ar et hinder emot gistermäls ingående $ emedan ganffa fä hafwa räd at underhälla et hushäll pä et sä lysa sätt $ som den allmän bruk fordra $
ingående		1806	1	bib15650837_18060111_146391_3_0003_alto.xml-3-3	 	Till Hlisförvör i ingående wecka ined Qwadraterne Musseten och Källan I, os Snusmästaren irerr östergren, Tisdagen klockan 9 förmiddagen; med AwadrStcrne Bladet, Barken och Spetsen dos Bagaren Herr Hultström, Fredagen kl.ockan 9 förmiddagen; med Qwadraterne Wattenkonsten cch Läbeck, Tisdagen klockan 9 förmiddagens hös Bryggaren Herr Grästen; mcd Qwadraterne Flaggan, Bakugnen och Ruddammen, Torsdagen kl. 9 förmiddagen hos Kofferdi-Kapitenen Herr Wallin; med Qwadralen Backen, Onsdagen klockan 9 förmiddagen hos Tenngjutaren Herr Kruth; med Qwadraten Kopparkypen, bos Sekreteraren Herr Klein Torsdagen klockan 9 förmiddagen; med Qwadraterne S:t Johannis och landskyrkan, hos Guldsmeden Herr Isleben Onsdagen klockan 2.eftermiddagen, kallas alla som i nämnde Qwadrater bo, att ä utsatt tid och ställe fig mangrant infinna.	18:26	0:823	Till Hlisförvör i ingående wecka ined Qwadraterne Musseten och Källan I , os Snusmästaren irerr östergren , Tisdagen klockan 9 förmiddagen ; med AwadrStcrne Bladet , Barken och Spetsen dos Bagaren Herr Hultström , Fredagen kl.ockan 9 förmiddagen ; med Qwadraterne Wattenkonsten cch Läbeck , Tisdagen klockan 9 förmiddagens hös Bryggaren Herr Grästen ; mcd Qwadraterne Flaggan , Bakugnen och Ruddammen , Torsdagen kl. 9 förmiddagen hos Kofferdi-Kapitenen Herr Wallin ; med Qwadralen Backen , Onsdagen klockan 9 förmiddagen hos Tenngjutaren Herr Kruth ; med Qwadraten Kopparkypen , bos Sekreteraren Herr Klein Torsdagen klockan 9 förmiddagen ; med Qwadraterne S:t Johannis och landskyrkan , hos Guldsmeden Herr Isleben Onsdagen klockan 2 .eftermiddagen , kallas alla som i nämnde Qwadrater bo , att ä utsatt tid och ställe fig mangrant infinna .	3	0:131	till hlisförvör i ingående wecka ined qwadraterne musseten och källa i $ os snusmästaren irerr östergren $ tisdag klocka 9 förmiddag $ med awadrstcrne blad $ bark och spets dos bagare herr hultström $ fredag $ 9 förmiddag $ med qwadraterne wattenkonsten cch läbeck $ tisdag klocka 9 förmiddag hö bryggare herr grästen $ mcd qwadraterne flagga $ bakugn och ruddamm $ torsdag $ 9 förmiddag hos $ herr wallin $ med qwadralen backen $ onsdag klocka 9 förmiddag hos tenngjutare herr kruth $ med qwadraten kopparkypen $ bo sekreterare herr klein torsdag klocka 9 förmiddag $ med qwadraterne $ johannis och landskyrka $ hos guldsmed herr isleben onsdag klocka 2 $ $ kalla all som i nämna qwadrater bo $ att ä $ tid och ställe fig mangrann infinna $
ingående		1826	1	bib19223423_18260826_145063_68_0004_alto.xml-7-12	 	da information uti Danö, behagade anmäla det hvS undertecknad, innan ingående mäaod.	69:77	0:84	da information uti Danö , behagade anmäla det hvS undertecknad , innan ingående mäaod .	12	0:15	da information uti danö $ behaga anmäla den hvs underteckna $ innan ingående mäaod $
ingående		1828	1	bib11653823_18281011_144010_238_0003_alto.xml-2-53	 	GunnarSdvuer, 8r nedanstående ÄktenstapSförord och oryggliga disposition af cgen fri wilja samt mod bästa Lfwertygelsc och förstånd öst emellan aftalad och fastställd, äf, vensom wi pä det kraftigaste förklare, au, då ingen af öst äger annan äir förwärfv Egendom, och sä wida atti nu eller framdeles möjligen ingående annat äktenskap inga Bröstarfwingar tillkomma, deli af öst, font öfwerlekwcr ben andra, skalk behålla i fin lifstid all qwarlätenjkapen orubbad, utan minsta klander af wära Arfwingar å ömse sidor; meri sedan, och i jemnlikhet med ofwanllående beting och erinran, wi båda öro tued döden aflidna, stall all wär lilla efrerleinoade Egendom ensamt tillhöra denna Stadens Fattiga, och i synnerhet dem af sadaiie olycklige, somt äro blinde, holte och sängliggande sjuka; och i dea händelse wart nu iboende Ha » och Gärd ännu ivid den sist aflidande af öst är i behåll och i wär ägo, sä stall ' delta delta Hu§ derefter blifwa ett Skolehus, det en ofärdig fattig ka » bebo, som äger uddig kunstap att mrderwisa och lära fattiga fader- och moderlösa Barn uti räitstaffenS dygd och GitdS fanna fruftan; uti hwilket fall dea härwarande Stadens Wallofl.	309:317	0:1160	GunnarSdvuer , 8r nedanstående ÄktenstapSförord och oryggliga disposition af cgen fri wilja samt mod bästa Lfwertygelsc och förstånd öst emellan aftalad och fastställd , äf , vensom wi pä det kraftigaste förklare , au , då ingen af öst äger annan äir förwärfv Egendom , och sä wida atti nu eller framdeles möjligen ingående annat äktenskap inga Bröstarfwingar tillkomma , deli af öst , font öfwerlekwcr ben andra , skalk behålla i fin lifstid all qwarlätenjkapen orubbad , utan minsta klander af wära Arfwingar å ömse sidor ; meri sedan , och i jemnlikhet med ofwanllående beting och erinran , wi båda öro tued döden aflidna , stall all wär lilla efrerleinoade Egendom ensamt tillhöra denna Stadens Fattiga , och i synnerhet dem af sadaiie olycklige , somt äro blinde , holte och sängliggande sjuka ; och i dea händelse wart nu iboende Ha » och Gärd ännu ivid den sist aflidande af öst är i behåll och i wär ägo , sä stall ' delta delta Hu§ derefter blifwa ett Skolehus , det en ofärdig fattig ka » bebo , som äger uddig kunstap att mrderwisa och lära fattiga fader- och moderlösa Barn uti räitstaffenS dygd och GitdS fanna fruftan ; uti hwilket fall dea härwarande Stadens Wallofl .	53	0:210	gunnarsdvuer $ 8r nedanstående äktenstapsförord och orygglig disposition af cgen fri wilja samt mod bra lfwertygelsc och förstånd öst emellan aftalad och fastställd $ äf $ vensom wi pä den kraftig förklara $ au $ då ingen af öst äga annan äir förwärfv egendom $ och sä wida atti nu eller framdeles möjligen ingående annan äktenskap ingen bröst tillkomma $ deli af öst $ font öfwerlekwcr ben andra $ skalk behålla i fin lifstid all qwarlätenjkapen orubbad $ utan liten klander af wära arfwingar å ömse sida $ meri sedan $ och i jemnlikhet med ofwanllående beting och erinran $ wi båda öro tued död aflidna $ stall all wär liten efrerleinoade egendom ensam tillhöra denna stad fattig $ och i synnerhet de af sadaiie olycklig $ somt äro blind $ holte och sängliggande sjuk $ och i dea händelse wart nu iboende ha $ och gärd ännu ivid den sist aflidande af öst vara i behåll och i wär ägo $ sä stall $ delta delta $ derefter blifwa en skolehus $ den en ofärdig fattig ka $ bebo $ som äga uddig kunstap att mrderwisa och lära fattig fader och moderlös barn uti räitstaffens dygd och gitds fanna fruftan $ uti hwilket fall dea härwarande stad wallofl $
ingående		1828	1	bib19225792_18280503_147359_18_0008_alto.xml-1-13	 	Il ti Chalnicrjka Industrie- Skolans Wäfnndermisningsanstalt här i Staden knnna, under snart ingående LZäftcrmin, mindre bemedlade fruntimmer af allaclatzer, som onsta en fullkomligare kännedom i den mera owanliga wäfuadskonsten efter Ekenmarksta methoden, erhålla fri underwisning.	93:101	0:282	Il ti Chalnicrjka Industrie- Skolans Wäfnndermisningsanstalt här i Staden knnna , under snart ingående LZäftcrmin , mindre bemedlade fruntimmer af allaclatzer , som onsta en fullkomligare kännedom i den mera owanliga wäfuadskonsten efter Ekenmarksta methoden , erhålla fri underwisning .	13	0:40	il ti chalnicrjka $ skola wäfnndermisningsanstalt här i stad knnna $ under snar ingående lzäftcrmin $ föga bemedla fruntimmer af allaclatzer $ som onsta en fullkomlig kännedom i den mera owanliga wäfuadskonsten efter ekenmarksta methoden $ erhålla fri underwisning $
