lemma	pos	date	grouping	identifier	description	context	indexes_target_token	indexes_target_sentence	context_tokenized	indexes_target_token_tokenized	indexes_target_sentence_tokenized	context_lemmatized
mode		1900	2	bib11653811_19001012_145317_158_0003_alto.xml-90-37	 	Redman blef sedan af polisen dömd till 35 kronors böter, men han klagade och blef frikänd, emedan Redman, ehuru han brutit mot lagen, förtjenat allt tack för sitt mod att motsätia sig ett mode, som höll på att bli allt för allmänt bland damer i Eörenta staterna.	188:192	0:262	Redman blef sedan af polisen dömd till 35 kronors böter , men han klagade och blef frikänd , emedan Redman , ehuru han brutit mot lagen , förtjenat allt tack för sitt mod att motsätia sig ett mode , som höll på att bli allt för allmänt bland damer i Eörenta staterna .	37	0:53	redman blef sedan af polis dömd till 35 krona böter $ men han klaga och blef frikänd $ emedan redman $ ehuru han bryta mot lag $ förtjenat all tack för sig mod att motsätia sig en mode $ som hålla på att bli all för allmän bland dam i eörenta stat $
mode		1895	2	bib19277330_18950502_0_52_0001_alto.xml-14-27	 	Brandsyn i qvarteron Agnar och Edda jemte de gårdar med undantag af inom qvarteret Blenda, hvilka äro belägna nordost örn Skolgatan fram till jernvägen, samt Mode, Magne, Bredablick, Balder, Tofven och Hjorten.	158:162	0:210	Brandsyn i qvarteron Agnar och Edda jemte de gårdar med undantag af inom qvarteret Blenda , hvilka äro belägna nordost örn Skolgatan fram till jernvägen , samt Mode , Magne , Bredablick , Balder , Tofven och Hjorten .	27	0:39	brandsyn i qvarteron agne och edda jemte en gård med undantag af inom qvarter blenda $ hvilka äro belägen nordost örn skolgatan fram till jernväg $ samt mode $ magne $ bredablick $ balder $ tofva och hjort $
mode		1895	2	bib15761097_18950323_145020_35_0004_alto.xml-25-15	 	Då jag nu antagit en mycket skicklig hattmakare och fått hem formar eftor allra nyaste mode kan jag utlofva ett verkligt välgjordt arbete till billigt pris.	87:91	0:156	Då jag nu antagit en mycket skicklig hattmakare och fått hem formar eftor allra nyaste mode kan jag utlofva ett verkligt välgjordt arbete till billigt pris .	15	0:27	då jag nu anta en mycket skicklig hattmakare och få hem forma eftor allra ny mode kunna jag utlofva en verklig välgjordt arbete till billig pris $
mode		1897	2	bib11653830_18970308_146968_19_0004_alto.xml-39-3	 	En tidning i Modena innehöll nämligen för några dagar sedan ett bref från en italiensk officer, som är stationerad i Zanzibar.	13:19	0:126	En tidning i Modena innehöll nämligen för några dagar sedan ett bref från en italiensk officer , som är stationerad i Zanzibar .	3	0:23	en tidning i mode innehålla nämligen för någon dag sedan en bref från en italiensk officer $ som vara stationera i zanzibar $
mode		1895	2	bib19277180_18951121_147374_95_0004_alto.xml-31-12	 	Och detta, min söta Georgine, fortsatte Ia kante å Ia mode de Bretagne, är det å propos, sorn kan framkalla medaljens vackra sida, så vida man förstår att begagna sig deraf, det vill säga att vid Axels återkomst låta Sigrid sorn fästmö till baronen, eller ännu bättre, sorn bans friherrinna presentera sig.	54:58	0:306	Och detta , min söta Georgine , fortsatte Ia kante å Ia mode de Bretagne , är det å propos , sorn kan framkalla medaljens vackra sida , så vida man förstår att begagna sig deraf , det vill säga att vid Axels återkomst låta Sigrid sorn fästmö till baronen , eller ännu bättre , sorn bans friherrinna presentera sig .	12	0:61	och denna $ jag söt georgine $ fortsätta ia kanta å ia mode de bretagne $ vara den å propos $ sorn kunna framkalla medalj vacker sida $ så vida man förstå att begagna sig deraf $ den vilja säga att vid axel återkomst låta sigrid sorn fästmö till baron $ eller ännu bra $ sorn ban friherrinna presentera sig $
mode		1902	2	bib11653811_19020108_145317_3_0004_alto.xml-133-13	 	är lätt löst genom att för det nya året prenumerera på » Iduns Mode tidning », som på sitt område intar hedersplatsen som	63:67	0:121	är lätt löst genom att för det nya året prenumerera på » Iduns Mode tidning » , som på sitt område intar hedersplatsen som	13	0:24	vara lätt lösa genom att för den ny år prenumerera på $ idun mode tidning $ $ som på sig område inta hedersplats som
mode		1896	2	bib11653811_18960425_145317_62_0001_alto.xml-47-5	 	förfärdigar Herrkosty nior efter nyaste mode till billigt pris från 1 april.	40:44	0:76	förfärdigar Herrkosty nior efter nyaste mode till billigt pris från 1 april .	5	0:13	förfärdiga herrkosty nia efter ny mode till billig pris från 1 april $
mode		1895	2	bib19277277_18950205_147683_35_0005_alto.xml-170-0	 	moden sorum ännu endast i ringa utsträckning användes, var dödligheten 39, s proc., lindy de fem sista, medan det stora flertalet barn behandlades mod serum, deremot 18 proc.	0:5	0:174	moden sorum ännu endast i ringa utsträckning användes , var dödligheten 39 , s proc . , lindy de fem sista , medan det stora flertalet barn behandlades mod serum , deremot 18 proc .	0	0:35	mode sorum ännu endast i ringa utsträckning använda $ vara dödlighet 39 $ s proc $ $ lindy en fem sista $ medan den stor flertal barn behandla mod serum $ deremot 18 proc $
mode		1895	2	bib15760690_18951128_145050_184_0003_alto.xml-55-14	 	apa efter äfwcn det fulaste och dummaste mode, blott sör att det är mode — det är bern ej wärdigt och wittnar ej fördelaktigt om deras ombömesförmäga.	68:72	0:150	apa efter äfwcn det fulaste och dummaste mode , blott sör att det är mode — det är bern ej wärdigt och wittnar ej fördelaktigt om deras ombömesförmäga .	14	0:29	apa efter äfwcn den ful och dum mode $ blott sör att den vara mode $ den vara bern ej wärdigt och wittnar ej fördelaktig om de ombömesförmäga $
mode		1900	2	bib11653811_19000822_145317_129_0003_alto.xml-54-10	 	Det var den gode assessorns inbundna siitt och något ovanligare mode att flera gånger om dagen byta örn kostym som väckte misstankarne.	64:68	0:135	Det var den gode assessorns inbundna siitt och något ovanligare mode att flera gånger om dagen byta örn kostym som väckte misstankarne .	10	0:23	den vara den god assessor inbunden siitt och någon ovanlig mode att flera gång om dag byta örn kostym som väcka misstanke $
mode		1895	2	bib15650837_18950928_146391_226_0004_alto.xml-46-9	 	med godt affärsläge, ocb hvari längre tid bedrifvits mode, sybehörs- samt kortvaruaffär, uthyres från 1 Oktober.	53:57	0:112	med godt affärsläge , ocb hvari längre tid bedrifvits mode , sybehörs- samt kortvaruaffär , uthyres från 1 Oktober .	9	0:20	med god affärsläge $ ocb hvari lång tid bedrifvits mode $ sybehör samt kortvaruaffär $ uthyra från 1 oktober $
mode		1899	2	bib11653811_18991204_145317_187_0003_alto.xml-157-9	 	var han tongifvande och der skapade han de nya moden för sprättarne.	47:52	0:68	var han tongifvande och der skapade han de nya moden för sprättarne .	9	0:13	vara han tongifvande och der skapa han en ny mode för sprätt $
mode		1895	2	bib15761097_18950912_145020_108_0003_alto.xml-74-21	 	intressanta boken behandlar emellertid ej blott skrädderikonsten, utan innehåller äfven historiska minnen, åtskilliga definitioner på hvad som kallas“ mode" och en rad pikanta detaljer angående uppkomsten af en och annan modeforra.	151:155	0:231	intressanta boken behandlar emellertid ej blott skrädderikonsten , utan innehåller äfven historiska minnen , åtskilliga definitioner på hvad som kallas “ mode " och en rad pikanta detaljer angående uppkomsten af en och annan modeforra .	21	0:36	intressant bok behandla emellertid ej blott skrädderikonst $ utan innehålla äfven historisk minne $ åtskillig definition på hvad som kalla $ mode $ och en rad pikant detalj angående uppkomst af en och annan modeforra $
mode		1896	2	bib15873936_18961229_147385_152_0001_alto.xml-43-2	 	Omkring 70 mode- oell liandarbets.mönster med omkring 70 tillskäringsmönster tor endast 10 öre.	11:16	0:95	Omkring 70 mode- oell liandarbets.mönster med omkring 70 tillskäringsmönster tor endast 10 öre .	2	0:14	omkring 70 mode oell $ med omkring 70 tillskäringsmönster tor endast 10 öre $
mode		1897	2	bib11653830_18970125_146968_7_0002_alto.xml-26-25	 	Gent emot denna förkortade reformrörelse här i landet synes heller icke böra lemnäs oanmärkt den rörelse i retrograd riktning som nu pågår inom den pålisiska modeverlden.	158:169	0:170	Gent emot denna förkortade reformrörelse här i landet synes heller icke böra lemnäs oanmärkt den rörelse i retrograd riktning som nu pågår inom den pålisiska modeverlden .	25	0:27	gen emot denna förkorta reformrörelse här i land synas heller icke böra lemnäs oanmärkt den rörelse i retrograd riktning som nu pågå inom den pålisiska mode $
mode		1895	2	bib15761570_18950403_146176_58_0002_alto.xml-169-5	 	förhållanden kunde samarbeta med de mode ' rate utan att dock öfvergifva helnykterhetsprincipen.	36:40	0:96	förhållanden kunde samarbeta med de mode ' rate utan att dock öfvergifva helnykterhetsprincipen .	5	0:14	förhållande kunna samarbeta med en mode $ rate utan att dock öfvergifva helnykterhetsprincipen $
mode		1895	2	bib15978012_18950425_148361_95_0004_alto.xml-15-9	 	Beställningar af färdigsydda kläder emottagas och utföras efter nyaate mode genom platsens skickligaste skräddare.	71:75	0:114	Beställningar af färdigsydda kläder emottagas och utföras efter nyaate mode genom platsens skickligaste skräddare .	9	0:15	beställning af färdigsydda kläder emotta och utföra efter nyaate mode genom plats skicklig skräddare $
mode		1895	2	bib15650837_18951009_146391_235_0006_alto.xml-46-5	 	Sålunda skapar tillfälligheten ofta ett mode, sorn förmår bålla sig en hel säsong igenom, ibland till och med längre.	40:44	0:117	Sålunda skapar tillfälligheten ofta ett mode , sorn förmår bålla sig en hel säsong igenom , ibland till och med längre .	5	0:22	sålunda skapa tillfällighet ofta en mode $ sorn förmå bålla sig en hel säsong igenom $ ibland till och med länge $
mode		1896	2	bib11653830_18961116_146968_92_0001_alto.xml-24-35	 	Naemie Johanna Bergegren, som under firma N. Bergegren i Årjeng af Silbodals socken och Vermlands län drifver handelsrörelse, ämnar under oförändrad firma i Bengtsfors af Ertemarks socken öppna filial för försäljning af mode- tapetserioch korta varor.	220:225	0:251	Naemie Johanna Bergegren , som under firma N . Bergegren i Årjeng af Silbodals socken och Vermlands län drifver handelsrörelse , ämnar under oförändrad firma i Bengtsfors af Ertemarks socken öppna filial för försäljning af mode- tapetserioch korta varor .	35	0:40	naemie johanna bergegren $ som under firma n $ bergegren i årjeng af silbodals socken och vermlands län drifver handelsrörelse $ ämna under oförändrad firma i bengtsfors af ertemarks socken öppna filial för försäljning af mode tapetserioch kort vara $
mode		1895	2	bib19225758_18950812_144022_185_0004_alto.xml-206-7	 	kompetent att på eg-eu kand sköta tn mode aflär, får plats stiax för fir eller säsong.	37:41	0:86	kompetent att på eg-eu kand sköta tn mode aflär , får plats stiax för fir eller säsong .	7	0:18	kompetent att på $ kand sköta ten mode aflär $ få plats stiax för fir eller säsong $
mode		1902	2	bib11653811_19020827_145317_130_0003_alto.xml-26-7	 	Ur en utländsk tidning återgifva vi följande modebref, dateradt London don 19 augusti: Jag hade begifvit mig till ett af de stora, eleganta modemagasinen för att taga ut en passande hatt före ett kort besök i Ostende.	45:53	0:217	Ur en utländsk tidning återgifva vi följande modebref , dateradt London don 19 augusti : Jag hade begifvit mig till ett af de stora , eleganta modemagasinen för att taga ut en passande hatt före ett kort besök i Ostende .	7	0:41	ur en utländsk tidning återgifva vi följa mode $ dateradt london don 19 augusti $ jag ha begifvit jag till en af en stor $ elegant modemagasin för att ta ut en passande hatt före en kort besök i ostende $
mode		1895	2	bib19277277_18950920_147683_256_0008_alto.xml-27-9	 	n Butik med rnm och kök samt Bntlkrnm för mode, sybehörs- eller kortvaruaffär.	42:46	0:78	n Butik med rnm och kök samt Bntlkrnm för mode , sybehörs- eller kortvaruaffär .	9	0:15	n butik med rnm och kök samt bntlkrnm för mode $ sybehör eller kortvaruaffär $
mode		1895	2	bib15650837_18950817_146391_190_0004_alto.xml-62-9	 	med godt affärsläge, och hvari längre tid bädrifvita mode-, sjbehörs- samt kortvaruaffär, uthyres från 1 Oktober.	53:58	0:113	med godt affärsläge , och hvari längre tid bädrifvita mode- , sjbehörs- samt kortvaruaffär , uthyres från 1 Oktober .	9	0:20	med god affärsläge $ och hvari lång tid bädrifvita mode $ $ samt kortvaruaffär $ uthyra från 1 oktober $
mode		1899	2	bib11653811_18991007_145317_154_0002_alto.xml-9-12	 	— Om så önskas emottages äfven beställningar och utföres dessa efter sista mode samt mjöligast billiga priser.	75:79	0:110	— Om så önskas emottages äfven beställningar och utföres dessa efter sista mode samt mjöligast billiga priser .	12	0:18	$ om så önska emotta äfven beställning och utföra denna efter sista mode samt mjölig billig pris $
mode		1896	2	bib15869824_18961010_145700_81_0001_alto.xml-26-6	 	utföres noggrant och till de mest mode rata priser hos	34:38	0:54	utföres noggrant och till de mest mode rata priser hos	6	0:10	utföra noggrann och till en mycket mode rata pris hos
mode		1895	2	bib19225758_18950313_144022_61_0001_alto.xml-53-1	 	Nyaste mode, utmärkta tyger tilljytterst billiga priser nu inkomna i stort urval hos	7:11	0:84	Nyaste mode , utmärkta tyger tilljytterst billiga priser nu inkomna i stort urval hos	1	0:14	ny mode $ utmärka tyg tilljytterst billig pris nu inkomma i stor urval hos
mode		1896	2	bib15873936_18961219_147385_148_0004_alto.xml-7-22	 	Blommor, Spetsar, Hårklädsel, Halskrås, för säsongen öfverblifna Dam- och Barnhattar samt Mössor slutförsäljes ytterst billigt i Alma Palmgrens Mode- och Kortvaruaffär, 18 Smedjegatan 18.	144:149	0:187	Blommor , Spetsar , Hårklädsel , Halskrås , för säsongen öfverblifna Dam- och Barnhattar samt Mössor slutförsäljes ytterst billigt i Alma Palmgrens Mode- och Kortvaruaffär , 18 Smedjegatan 18 .	22	0:30	blomma $ spets $ hårklädsel $ halskrås $ för säsong öfverblifna dam och barnhatt samt mössa slutförsälja ytterst billig i alma palmgrens mode och kortvaruaffär $ 18 smedjegatan 18 $
mode		1897	2	bib19227291_18970107_145289_3_0003_alto.xml-99-8	 	Anna Pelago ligger i Apenninerna ungefär midt emellan Modena och Pisa i Scoltenn-s källområde, hvilken i sitt nedre lopp heter Panaro och utmynnar i Po.	54:60	0:152	Anna Pelago ligger i Apenninerna ungefär midt emellan Modena och Pisa i Scoltenn-s källområde , hvilken i sitt nedre lopp heter Panaro och utmynnar i Po .	8	0:27	anna pelago ligga i apenninerna ungefär midt emellan mode och pisa i $ källområde $ hvilken i sig nedre lopp heta panaro och utmynna i po $
mode		1895	2	bib19349359_18950509_148383_55_0003_alto.xml-121-6	 	ämnar man endast iniöra detta nya mode på sällskapstoalettor.	34:38	0:61	ämnar man endast iniöra detta nya mode på sällskapstoalettor .	6	0:10	ämna man endast iniöra denna ny mode på sällskapstoalettor $
mode		1895	2	bib19277349_18951219_147403_159_0006_alto.xml-101-21	 	En med mig nära lierad familj, han i sin våning stolar, hvilka på befallning af hennes majestät » La mode » äro så fint och etheriskt konstruerade, att man har svårt att begripa, huru de kunna stå på sina ben.	101:105	0:209	En med mig nära lierad familj , han i sin våning stolar , hvilka på befallning af hennes majestät » La mode » äro så fint och etheriskt konstruerade , att man har svårt att begripa , huru de kunna stå på sina ben .	21	0:45	en med jag nära liera familj $ han i sig våning stol $ hvilka på befallning af hon majestät $ la mode $ äro så fin och etherisk konstruera $ att man ha svår att begripa $ huru de kunna stå på sig ben $
mode		1897	2	bib11653811_18970410_145317_56_0003_alto.xml-145-24	 	Prenumerera derför på ‘ •Nordisk Mönster-Tidning", hvilken som bekant nu utkommer i betydligt utvidgadt format och i hvarje n:r har omkring 70 mode- och handarbetsmönster med omkring 70 tillskärnings mönster för blott 10 öre.	143:148	0:225	Prenumerera derför på ‘ •Nordisk Mönster-Tidning " , hvilken som bekant nu utkommer i betydligt utvidgadt format och i hvarje n:r har omkring 70 mode- och handarbetsmönster med omkring 70 tillskärnings mönster för blott 10 öre .	24	0:37	prenumerera derför på $ $ $ $ $ hvilken som bekant nu utkomma i betydlig utvidgadt format och i hvarje $ ha omkring 70 mode och handarbetsmönster med omkring 70 tillskärning mönster för blott 10 öre $
mode		1895	2	bib11653811_18950930_145317_151_0003_alto.xml-15-33	 	Han tager kannan och slår i en hel kopp full, och när han fått det i ordning, tager han skeden, äter och säger: «Ja, det måste väl vara moden, det! » Och så äter lian långsamt och försigtigt med skeden, äter och äter, men det blir ingenting utaf det.	136:141	0:250	Han tager kannan och slår i en hel kopp full , och när han fått det i ordning , tager han skeden , äter och säger : «Ja , det måste väl vara moden , det ! » Och så äter lian långsamt och försigtigt med skeden , äter och äter , men det blir ingenting utaf det .	33	0:59	han ta kanna och slå i en hel kopp full $ och när han få den i ordning $ ta han sked $ äta och säga $ $ $ den måste väl vara mode $ den $ $ och så äta lian långsam och försigtigt med sked $ äta och äta $ men den bli ingenting utaf den $
mode		1895	2	bib19277277_18950204_147683_34_0008_alto.xml-119-3	 	En väl upparbetad Mode, Sybehörs- och Kortvaruhandel, passande för att eller två fruntimmer, finnes nu genast att öfvertaga.	18:22	0:124	En väl upparbetad Mode , Sybehörs- och Kortvaruhandel , passande för att eller två fruntimmer , finnes nu genast att öfvertaga .	3	0:22	en väl $ mode $ sybehör och kortvaruhandel $ passande för att eller två fruntimmer $ finna nu genast att öfvertaga $
mode		1895	2	bib15760690_18951128_145050_184_0003_alto.xml-55-7	 	apa efter äfwcn det fulaste och dummaste mode, blott sör att det är mode — det är bern ej wärdigt och wittnar ej fördelaktigt om deras ombömesförmäga.	41:45	0:150	apa efter äfwcn det fulaste och dummaste mode , blott sör att det är mode — det är bern ej wärdigt och wittnar ej fördelaktigt om deras ombömesförmäga .	7	0:29	apa efter äfwcn den ful och dum mode $ blott sör att den vara mode $ den vara bern ej wärdigt och wittnar ej fördelaktig om de ombömesförmäga $
mode		1895	2	bib15873371_18950903_145112_239_0002_alto.xml-106-43	 	Dan Danske bestyrelse for det syvende nordiske skolemöde, der har väret samlet til et afsluttende mode, sender herred den svenske bestyrelse sin hjerteligste kilsen og bedste tak for det i enhver henseende vellykkede mode i Sveriges skonne hov edstad, et mode der af os alle vil blive bevarat i kär erindring.	255:259	0:309	Dan Danske bestyrelse for det syvende nordiske skolemöde , der har väret samlet til et afsluttende mode , sender herred den svenske bestyrelse sin hjerteligste kilsen og bedste tak for det i enhver henseende vellykkede mode i Sveriges skonne hov edstad , et mode der af os alle vil blive bevarat i kär erindring .	43	0:55	dan dansk bestyrelse fara den syvende nordisk skolemöde $ der ha väret saml til et afsluttende mode $ sender herred den svensk bestyrelse sig hjerteligste kils og bedste tak fara den i enhver henseende vellykkede mode i sverige skonne hov edstad $ et mode der af os alle vil bli bevara i kär erindring $
mode		1898	2	bib11653830_18980113_146968_4_0003_alto.xml-134-1	 	billigaste mode- och bandarbotstianing ” » orYiUu, it«-rTidning ”, YiUu, it«-rTidning ”, hvilken utkommer 2 gånger i månaden, kostar 10 öre numret, 60 öre kvartalet och som genom sm rikhaltigasamling af tillskärningsmönster och modeafbildningar sätter hvarje dam i stånd att, äfven om hon saknar alla förkunskaper i damskräddar-sömnad, tillskära sy och ommodernisera allt som hör till dam, flick- och gossgarderoben Hvarje nummer innehåller omkr. 70 mode- och handarbetsafbildningar samt 70 utmärkta tillskärningsmönster.	11:16	0:521	billigaste mode- och bandarbotstianing ” » orYiUu , it«-rTidning ” , YiUu , it«-rTidning ” , hvilken utkommer 2 gånger i månaden , kostar 10 öre numret , 60 öre kvartalet och som genom sm rikhaltigasamling af tillskärningsmönster och modeafbildningar sätter hvarje dam i stånd att , äfven om hon saknar alla förkunskaper i damskräddar-sömnad , tillskära sy och ommodernisera allt som hör till dam , flick- och gossgarderoben Hvarje nummer innehåller omkr. 70 mode- och handarbetsafbildningar samt 70 utmärkta tillskärningsmönster .	1	0:82	billig mode och bandarbotstianing $ $ oryiuu $ $ $ $ yiuu $ $ $ $ hvilken utkomma 2 gång i månad $ kosta 10 öre nummer $ 60 öre kvartal och som genom sm rikhaltigasamling af tillskärningsmönster och modeafbildningar sätta hvarje dam i stånd att $ äfven om hon sakna all förkunskaper i $ $ tillskära sy och ommodernisera all som höra till dam $ flicka och gossgarderoben hvarje nummer innehålla $ 70 mode och handarbetsafbildningar samt 70 utmärka tillskärningsmönster $
mode		1895	2	bib15650814_18950426_146365_97_0004_alto.xml-40-3	 	Gardindekorationer efter senaste mode, Markiser, hållbara och prydliga.	33:37	0:71	Gardindekorationer efter senaste mode , Markiser , hållbara och prydliga .	3	0:11	gardindekorationer efter sen mode $ markis $ hållbar och prydlig $
mode		1895	2	bib19225758_18950316_144022_64_0005_alto.xml-25-1	 	Nyaste mode, utmärkta tyger till ytterst billiga priser nu in komna i stort urval hos	7:11	0:85	Nyaste mode , utmärkta tyger till ytterst billiga priser nu in komna i stort urval hos	1	0:16	ny mode $ utmärka tyg till ytterst billig pris nu in komma i stor urval hos
mode		1895	2	bib15650814_18950524_146365_120_0004_alto.xml-24-3	 	Qardindekorationer efter senaste mode, Markiser, hållbara och prydliga.	33:37	0:71	Qardindekorationer efter senaste mode , Markiser , hållbara och prydliga .	3	0:11	qardindekorationer efter sen mode $ markis $ hållbar och prydlig $
mode		1903	2	bib11653811_19031028_145317_167_0002_alto.xml-58-20	 	huru ytterlighetsmeningarna å ömse sidor trängts undan eller utplånats och huru de politiska åskådningarna så väl vänsterns som högerns, mode rerats, tills nu den upplysta moderna vänstern och den upplysta moderna högern kunnat räcka hvarandra han den i broderlig endräkt för att söka föra fram de unionella konfliktspörs målen och nu närmast konsulatfrågan till sin lösning och söka leda in sitt lands finans- och socialpolitik på sun dare banor.	137:141	0:447	huru ytterlighetsmeningarna å ömse sidor trängts undan eller utplånats och huru de politiska åskådningarna så väl vänsterns som högerns , mode rerats , tills nu den upplysta moderna vänstern och den upplysta moderna högern kunnat räcka hvarandra han den i broderlig endräkt för att söka föra fram de unionella konfliktspörs målen och nu närmast konsulatfrågan till sin lösning och söka leda in sitt lands finans- och socialpolitik på sun dare banor .	20	0:72	huru ytterlighetsmeningarna å ömse sida tränga undan eller utplåna och huru en politisk åskådning så väl vänster som höger $ mode rerats $ tills nu den $ modern vänster och den $ modern höger kunna räcka hvarandra han den i broderlig endräkt för att söka föra fram en unionell konfliktspörs mål och nu nära konsulatfrågan till sig lösning och söka leda in sig land finans och socialpolitik på sun dare bana $
mode		1895	2	bib19225758_18950219_144022_42_0004_alto.xml-24-15	 	ilar öppnat SyataJier cch emottager roed tacksamhet beställningar på såväl danie- som barnklädningar efter nyaste mode Arbetet utföres fermt cch billiet.	114:118	0:153	ilar öppnat SyataJier cch emottager roed tacksamhet beställningar på såväl danie- som barnklädningar efter nyaste mode Arbetet utföres fermt cch billiet .	15	0:22	ila öppna syatajier cch emotta roed tacksamhet beställning på $ $ som barnklädning efter ny mode arbete utföra ferm cch billi $
mode		1895	2	bib19225758_18951119_144022_270_0002_alto.xml-272-52	 	Bloms Hotell... Aron Jonason brag te det på tal i verser, fyndiga som alltid: » Jag mins den ljufva tiden, jag mins den som i går », då linne, sammet, siden och bomull, ylle, blår, kattun och paramatta — allt efter sista mode — folk köpte, som besatta, i Laaso Haglunds bod.	221:225	0:274	Bloms Hotell ... Aron Jonason brag te det på tal i verser , fyndiga som alltid : » Jag mins den ljufva tiden , jag mins den som i går » , då linne , sammet , siden och bomull , ylle , blår , kattun och paramatta — allt efter sista mode — folk köpte , som besatta , i Laaso Haglunds bod .	52	0:65	blom hotell $ aron jonason brag te den på tal i vers $ fyndig som alltid $ $ jag mins den ljufva tid $ jag mins den som i $ $ $ då linne $ sammet $ siden och bomull $ ylle $ blår $ kattun och paramatta $ all efter sista mode $ folk köpa $ som besatt $ i laaso haglund bod $
mode		1902	2	bib11653811_19021010_145317_155_0004_alto.xml-54-5	 	Herr- och Damhattar i nyaste mode, Pelsvaror och Mössor samt äkta Ryska och Svenska Galoscher ni.	29:33	0:97	Herr- och Damhattar i nyaste mode , Pelsvaror och Mössor samt äkta Ryska och Svenska Galoscher ni .	5	0:18	herr och damhatt i ny mode $ pelsvaror och mössa samt äkta rysk och svensk galosch ni $
