lemma	pos	date	grouping	identifier	description	context	indexes_target_token	indexes_target_sentence	context_tokenized	indexes_target_token_tokenized	indexes_target_sentence_tokenized	context_lemmatized
mode		1825	1	bib11653828_18250709_144028_155_0004_alto.xml-10-37	 	sörckallna lräffningar aflupit till Grekernas fördel; » länge fängne Officerare wörö införde till staden — Omständigheterna af segern wid Navarinouppgifwas för öfrigt hafwa warit följande: Dä Miaulis den 12 anställde en sä stor förödelse wid Moden, flyktade en fiendtlig afdelning i ristning till Navarino, intog bn Sphakteria (Sphagia) och Gamla Navarino, samt blokerade fästningen sä strängt, att den säg sig nödsakad att kapitulera med Ibrahim Pascha.	242:247	0:454	sörckallna lräffningar aflupit till Grekernas fördel ; » länge fängne Officerare wörö införde till staden — Omständigheterna af segern wid Navarinouppgifwas för öfrigt hafwa warit följande : Dä Miaulis den 12 anställde en sä stor förödelse wid Moden , flyktade en fiendtlig afdelning i ristning till Navarino , intog bn Sphakteria ( Sphagia ) och Gamla Navarino , samt blokerade fästningen sä strängt , att den säg sig nödsakad att kapitulera med Ibrahim Pascha .	37	0:75	sörckallna lräffningar aflöpa till grek fördel $ $ länge fängne officer wörö införa till stad $ omständighet af seger wid navarinouppgifwas för öfrig hafwa warit följande $ dä miaulis den 12 anställa en sä stor förödelse wid mode $ flykta en fiendtlig afdelning i ristning till navarino $ inta bn sphakteria $ sphagia $ och gammal navarino $ samt blokerade fästning sä sträng $ att den säga sig nödsaka att kapitulera med ibrahim pascha $
mode		1827	1	bib19227291_18270117_145289_3_0003_alto.xml-9-22	 	frän Zante af ben r December hade Ibrahim med 5000 man anlaiidt frän Tripvlizza lhwarest han qwarl«mnat 1000 mans besättning) lill Moden.	131:136	0:137	frän Zante af ben r December hade Ibrahim med 5000 man anlaiidt frän Tripvlizza lhwarest han qwarl«mnat 1000 mans besättning ) lill Moden .	22	0:24	frän zante af ben r december ha ibrahim med 5000 man anlaiidt frän tripvlizza lhwarest han $ 1000 man besättning $ lill mode $
mode		1798	1	bib19225772_17980515_148003_38_0002_alto.xml-1-8	 	Fransoser hafwa ifrän A-icona genom Bologna marscherat til Moden » och Ferrara, * u pä nägra dagar har man ock markt en stark rörelse ibland trupparne, hwars » fsigt man ej ännu känner.	59:64	0:185	Fransoser hafwa ifrän A-icona genom Bologna marscherat til Moden » och Ferrara , * u pä nägra dagar har man ock markt en stark rörelse ibland trupparne , hwars » fsigt man ej ännu känner .	8	0:36	fransos hafwa ifrän $ genom bologna marschera til mode $ och ferrara $ $ u pä nägra dag ha man ock markt en stark rörelse ibland trupparne $ hwars $ fsigt man ej ännu känna $
mode		1811	1	bib19225772_18110219_148004_20_0001_alto.xml-2-30	 	Buenos Ayres och Chilis exempel, sä är hela Spansta America, ur hwilket Spanien allt sedan Carl ben z.te hämtat asta sina resourcer, att anse säsom stiljdt frän Mode, landet, och de statler förmodeligen de siste som det med Bulwark erhällit frän Occidenken.	161:165	0:257	Buenos Ayres och Chilis exempel , sä är hela Spansta America , ur hwilket Spanien allt sedan Carl ben z.te hämtat asta sina resourcer , att anse säsom stiljdt frän Mode , landet , och de statler förmodeligen de siste som det med Bulwark erhällit frän Occidenken .	30	0:48	buenos ayres och chili exempel $ sä vara hel spansta america $ ur hwilket spanien allt sedan carl ben $ hämta asta sig resourcer $ att anse säsom stiljdt frän mode $ land $ och en statler förmodeligen en sista som den med bulwark erhällit frän occidenken $
mode		1828	1	bib11653828_18280401_144028_77_0004_alto.xml-11-11	 	wara och säkert icke sä som Längfredags-koncerten troligen blir, emedan moden är icke likofä allmän att besöka Kapellets koncerter.	72:77	0:131	wara och säkert icke sä som Längfredags-koncerten troligen blir , emedan moden är icke likofä allmän att besöka Kapellets koncerter .	11	0:21	wara och säker icke sä som $ troligen bli $ emedan mode vara icke likofä allmän att besöka kapell koncert $
mode		1805	1	bib11653792_18051116_146919_46_0002_alto.xml-8-80	 	tänker ej blott den förständige och dygdige utan oé den osedige och mcd det qwinliga hjertatS swaghtter förtrogne ynglingen; behöfwer ock den sednare en maka, sä föredrager han den sediga flickan framför alla andra, emedan han tror, och det med stäl, at han med mera säkerhet kan äga henne än en skön kokett: Men mången ärbar och sedig flicka inbillar sig at ingen ting mer uphöjer hennes älstanswärdhet, än en lysande klädsel efter moden; och" dock förminstar hon densamma just genom sin kärlek för prakt och modsjuka.	433:438	0:519	tänker ej blott den förständige och dygdige utan oé den osedige och mcd det qwinliga hjertatS swaghtter förtrogne ynglingen ; behöfwer ock den sednare en maka , sä föredrager han den sediga flickan framför alla andra , emedan han tror , och det med stäl , at han med mera säkerhet kan äga henne än en skön kokett : Men mången ärbar och sedig flicka inbillar sig at ingen ting mer uphöjer hennes älstanswärdhet , än en lysande klädsel efter moden ; och " dock förminstar hon densamma just genom sin kärlek för prakt och modsjuka .	80	0:97	tänka ej blott den förständiga och dygdig utan oé den osedig och mcd den qwinliga hjertats swaghtter förtrogen yngling $ behöfwer ock den sednare en maka $ sä föredra han den sedig flicka framför all annan $ emedan han tro $ och den med stäl $ at han med $ säkerhet kunna äga hon än en skön kokett $ men mången ärbar och sedig flicka inbilla sig at ingen ting mer uphöjer hon älstanswärdhet $ än en lysa klädsel efter mode $ och $ dock förminsta hon densamma just genom sig kärlek för prakt och modsjuka $
mode		1816	1	bib19225772_18160124_148004_10_0002_alto.xml-4-36	 	qwarrering för sig gärt och Skattsedlar samt Llqvider i följd deraf blifwit upprat1-de och JnqwarteringZgifware tillställde; sä warder häl medelst kungjorde, att nedan ».linnde dagar äro bestämde för uppbörden och liqviden as veste mode!	232:236	0:237	qwarrering för sig gärt och Skattsedlar samt Llqvider i följd deraf blifwit upprat1-de och JnqwarteringZgifware tillställde ; sä warder häl medelst kungjorde , att nedan » .linnde dagar äro bestämde för uppbörden och liqviden as veste mode !	36	0:38	qwarrering för sig gärt och skattsedel samt llqvider i följd deraf blifwit $ och jnqwarteringzgifware tillställa $ sä warder häl medelst kungöra $ att nedan $ $ dag äro bestämma för uppbörd och liqviden as veste mode $
mode		1828	1	bib11653828_18280112_144028_10_0002_alto.xml-10-28	 	rätt att määtä besia egenstaper hos personer, sam för det westa befinna sig i en beroende ställning, förlägna om utwägars anffaffande för olla de behof, mode och mana gjort nödwändiga, och dem en sälst blygsel förbjuber ali afsäga sig?	153:157	0:235	rätt att määtä besia egenstaper hos personer , sam för det westa befinna sig i en beroende ställning , förlägna om utwägars anffaffande för olla de behof , mode och mana gjort nödwändiga , och dem en sälst blygsel förbjuber ali afsäga sig ?	28	0:44	rätt att määtä besia egenstaper hos person $ simma för den westa befinna sig i en bero ställning $ förlägen om utwägar anffaffande för olla de behof $ mode och mana göra nödwändiga $ och de en sälst blygsel förbjuber ali afsäga sig $
mode		1797	1	bib13506739_17971117_144030_264_0002_alto.xml-4-18	 	i fina Hamnar icke inläta pä en gäng fler än 6 armerade Fartyg fron de Krigför.nSe Hertigen af Modena far i •jrfdttning af Kejsaren ägande rätten af Srisgau.	95:101	0:157	i fina Hamnar icke inläta pä en gäng fler än 6 armerade Fartyg fron de Krigför.nSe Hertigen af Modena far i •jrfdttning af Kejsaren ägande rätten af Srisgau .	18	0:29	i fin hamna icke inläta pä en gäng fler än 6 armera fartyg fron en $ hertig af mode fara i $ af kejsare ägande rätt af srisgau $
mode		1812	1	bib15650837_18120205_146391_10_0003_alto.xml-6-5	 	Diverse sorter Hattar af nyaste mode finnas till köps hos Trädgärdsmästaren Törnqwist.	32:36	0:86	Diverse sorter Hattar af nyaste mode finnas till köps hos Trädgärdsmästaren Törnqwist .	5	0:13	diverse sort hatta af ny mode finna till köpa hos träd törnqwist $
mode		1811	1	bib13506739_18110903_144030_204_0006_alto.xml-0-4	 	Ä^undaS art köpa en mode n Täckstäda för s:ne Personer, och v.vt fastat, något orufao; hwarom Underrättelse lemnas af WaktmästariN Sjöberg uti Riks Diiconten, alla fdrmid dagar.	20:24	0:177	Ä^undaS art köpa en mode n Täckstäda för s:ne Personer , och v.vt fastat , något orufao ; hwarom Underrättelse lemnas af WaktmästariN Sjöberg uti Riks Diiconten , alla fdrmid dagar .	4	0:32	$ art köpa en mode n täckstäda för $ person $ och $ fasta $ någon orufao $ hwarom underrättelse lemna af waktmästarin sjöberg uti riks diiconten $ all fdrmid dag $
mode		1824	1	bib11653828_18241214_144028_291_0001_alto.xml-4-37	 	Hans puls war matt, och en mörkblä dimma för ögat uppsteg, ur hwilken med ett han tusen ringlande stiernor säg glimma, som hade smä Ljusalser pä honom sett; i örat ringde den upprörde Moden likt hwirfwclwinden, som spelar ibland sin rörpipa » ti.den hwasiiigra floden.	184:189	0:268	Hans puls war matt , och en mörkblä dimma för ögat uppsteg , ur hwilken med ett han tusen ringlande stiernor säg glimma , som hade smä Ljusalser pä honom sett ; i örat ringde den upprörde Moden likt hwirfwclwinden , som spelar ibland sin rörpipa » ti.den hwasiiigra floden .	37	0:51	han puls war matt $ och en mörkblä dimma för öga uppstiga $ ur hwilken med ett han tusen ringla stiernor säga glimma $ som ha smä ljusalser pä han se $ i öra ringa den uppröra mode lik hwirfwclwinden $ som spela ibland sig rörpipa $ $ hwasiiigra flod $
mode		1816	1	bib19225772_18160705_148004_75_0001_alto.xml-10-6	 	och klädde sig beständigt efter den moden som herrstabe under Konung Georg 7.	36:41	0:77	och klädde sig beständigt efter den moden som herrstabe under Konung Georg 7 .	6	0:14	och klä sig beständig efter den mode som herrstabe under konung georg 7 $
mode		1804	1	bib19520388_18040118_147487_3_0003_alto.xml-1-14	 	— De » flora hopen lifter leva sig af tidens anda; nian följer moden, utan att eftersinna, ou » den är förnufttq ekler icke.	63:68	0:124	— De » flora hopen lifter leva sig af tidens anda ; nian följer moden , utan att eftersinna , ou » den är förnufttq ekler icke .	14	0:28	$ de $ flora hop lift leva sig af tid anda $ nia följa mode $ utan att eftersinna $ ou $ den vara förnufttq ekle icke $
mode		1822	1	bib11653828_18220829_144028_200_0004_alto.xml-0-17	 	Att wt Sttbfft meningkk och beflut alla dagar, att Wl l morgon göra narr af det mode, hwarefter wi öro galna i dag, att wära dekreter följa pä och §f« wcrändakasta hwarandra, utan det minsta sten af förständ och att det bizarra ofta sär företräde frauiför den goda siiiaken, endast derföre att det är nytt.	80:84	0:306	Att wt Sttbfft meningkk och beflut alla dagar , att Wl l morgon göra narr af det mode , hwarefter wi öro galna i dag , att wära dekreter följa pä och §f« wcrändakasta hwarandra , utan det minsta sten af förständ och att det bizarra ofta sär företräde frauiför den goda siiiaken , endast derföre att det är nytt .	17	0:61	att wt sttbfft meningkk och beflut all dag $ att wl l morgon göra narr af den mode $ hwarefter wi öro galen i dag $ att wära dekreter följa pä och $ wcrändakasta hwarandra $ utan den liten sten af förständ och att den bizarra ofta sär företräde frauiför den god siiiaken $ endast derföre att den vara ny $
mode		1818	1	bib11653828_18180908_144028_206_0001_alto.xml-10-45	 	phi; ty af den har han hämtat sä wäl den formcla winsten af logiik rigtighet och cons.qvens, af ö ning i ett ämnes klara uppfattning och fullständiga disposition, som ock dea måleri la winsten aftank-r.kcdom; men icke har han länat nägon mode, phils.	238:242	0:250	phi ; ty af den har han hämtat sä wäl den formcla winsten af logiik rigtighet och cons.qvens , af ö ning i ett ämnes klara uppfattning och fullständiga disposition , som ock dea måleri la winsten aftank-r.kcdom ; men icke har han länat nägon mode , phils .	45	0:49	phi $ ty af den ha han hämta sä wäl den formcla winsten af logiik rigtighet och $ $ af ö ning i en ämne klar uppfattning och fullständig disposition $ som ock dea måleri lägga winsten $ $ men icke ha han läna nägon mode $ phil $
mode		1829	1	bib19225772_18290708_148004_75_0002_alto.xml-0-7	 	Edins under Nro 64;: te Moden ivid Norra stora Hamngatan belägna huS, för wederbörandeS rakning, arr försäljas 60 tunnor mer och mindre städadt Hwetemjöl, under haveri fran Norrköping hit ankomne med Slupen Romulus, förd af Skepparen C.	24:29	0:236	Edins under Nro 64 ; : te Moden ivid Norra stora Hamngatan belägna huS , för wederbörandeS rakning , arr försäljas 60 tunnor mer och mindre städadt Hwetemjöl , under haveri fran Norrköping hit ankomne med Slupen Romulus , förd af Skepparen C .	7	0:44	edin under nro 64 $ $ te mode ivid norra stor hamngata belägen hus $ för wederbörande rakning $ arr försälja 60 tunna mer och föga städadt hwetemjöl $ under haveri fran norrköping hit ankomma med slup romulus $ föra af skeppare c $
mode		1901	2	bib11653838_19010809_147024_32_0001_alto.xml-159-22	 	och ni, min far, och min mor ha lust att göra er löjliga, genom att sätta er öfver ett mode, ett bruk, en allmänt antagen plägsed, så gör jag det icke.	87:91	0:151	och ni , min far , och min mor ha lust att göra er löjliga , genom att sätta er öfver ett mode , ett bruk , en allmänt antagen plägsed , så gör jag det icke .	22	0:38	och ni $ jag far $ och jag mor ha lust att göra ni löjlig $ genom att sätta ni öfver en mode $ en bruk $ en allmän anta plägsed $ så göra jag den icke $
mode		1895	2	bib19277330_18950810_0_94_0001_alto.xml-80-5	 	rekommenderar sitt välsorterade lager af mode * och korta varor till de billigaste priser Herrartiklar, kragar, manschetter halsdukar i vackra mönster, rosetter linnevock in.	41:45	0:174	rekommenderar sitt välsorterade lager af mode * och korta varor till de billigaste priser Herrartiklar , kragar , manschetter halsdukar i vackra mönster , rosetter linnevock in .	5	0:28	rekommendera sig välsorterad lager af mode $ och kort vara till en billig pris herrartiklar $ krage $ manschett halsduk i vacker mönster $ rosett linnevock in $
mode		1897	2	bib11653811_18970409_145317_55_0003_alto.xml-59-26	 	i Paris hafva nu icke längre sina egna eki pager med förtjusande små vagnar, hvari de åka ut för att göra uppköp — verldsherskarinnan » Mode » fordrar nu, att en rik dam skall rå om en egen jernvägsvagn.	136:140	0:203	i Paris hafva nu icke längre sina egna eki pager med förtjusande små vagnar , hvari de åka ut för att göra uppköp — verldsherskarinnan » Mode » fordrar nu , att en rik dam skall rå om en egen jernvägsvagn .	26	0:42	i paris hafva nu icke länge sig egen eki page med förtjusa liten vagn $ hvari de åka ut för att göra uppköp $ verldsherskarinnan $ mode $ fordra nu $ att en rik dam skola rå om en egen jernvägsvagn $
mode		1895	2	bib19277330_18951024_0_126_0004_alto.xml-51-5	 	önskar plats som nybörjare i Mode- eller Manufak turaffär.	29:34	0:58	önskar plats som nybörjare i Mode- eller Manufak turaffär .	5	0:10	önska plats som nybörjare i mode eller manufak turaffär $
mode		1895	2	bib15650837_18950809_146391_183_0003_alto.xml-61-87	 	» Nåja, det är väl heller lote så underligt », hör jag våra älskvärda damer Invända, » ett sådant der bälte är ju ytterst klädsamt, häller uppe klädnfngslifvet, ger kroppen stadga, och skadar gör det visst inte — det är ju elastiskt. » Ocb dock våga vi p&stå, att detta härliga bälte, som ju, för att vara en veritabel haute nouveauté, skall ha sina 15 centimeters bredd, är det mest skadliga tortyrredskap, sorn herskarinnan Mode bar på sitt samvete, sedan korsetten sig dagen.	426:430	0:478	» Nåja , det är väl heller lote så underligt » , hör jag våra älskvärda damer Invända , » ett sådant der bälte är ju ytterst klädsamt , häller uppe klädnfngslifvet , ger kroppen stadga , och skadar gör det visst inte — det är ju elastiskt . » Ocb dock våga vi p&stå , att detta härliga bälte , som ju , för att vara en veritabel haute nouveauté , skall ha sina 15 centimeters bredd , är det mest skadliga tortyrredskap , sorn herskarinnan Mode bar på sitt samvete , sedan korsetten sig dagen .	87	0:98	$ nåja $ den vara väl heller lote så underlig $ $ höra jag vi älskvärd dam invända $ $ en sån der bälte vara ju ytterst klädsam $ hälla uppe klädnfngslifvet $ ge kropp stadga $ och skada göra den viss inte $ den vara ju elastisk $ $ ocb dock våga vi $ $ att denna härlig bälte $ som ju $ för att vara en veritabel haute nouveauté $ skola ha sig 15 centimeter bredd $ vara den mycket skadlig tortyrredskap $ sorn herskarinnan mode bära på sig samvete $ sedan korsett sig dag $
mode		1903	2	bib11653811_19031030_145317_168_0004_alto.xml-52-33	 	sorn förrättas i Nybro torsdagen den 5 nästa november med början kl. li f.m., kommer att försäljas liandelsidkerskin Cecilia Ahrens ’ i Nybro konkursmassas handelsvarulager, bestående af cigarrer, tyger, mode- och galanterivaror m. m.	204:209	0:234	sorn förrättas i Nybro torsdagen den 5 nästa november med början kl. li f.m. , kommer att försäljas liandelsidkerskin Cecilia Ahrens ’ i Nybro konkursmassas handelsvarulager , bestående af cigarrer , tyger , mode- och galanterivaror m . m .	33	0:40	sorn förrätta i nybro torsdag den 5 nästa november med början $ lie $ $ komma att försälja liandelsidkerskin cecilia ahrens $ i nybro konkursmassa handels $ bestå af cigarr $ tyg $ mode och galanterivara m $ m $
mode		1895	2	bib19277180_18950606_147374_46_0004_alto.xml-40-18	 	savoir vivre och den veneration, du är skyldig din noble fars kusin, din taute a Ia mode de	84:88	0:91	savoir vivre och den veneration , du är skyldig din noble fars kusin , din taute a Ia mode de	18	0:20	savoir vivre och den veneration $ du vara skyldig du nobel far kusin $ du taute a ia mode de
mode		1895	2	bib11653815_18950815_146944_96_0003_alto.xml-83-16	 	Podrida ”, ni begär!, lätta fram för cr miier abla BoenkS a ta mode: och i st diet för de mitt besjungna inantiljerua och lombreror får ni se flackar, cylinderhattar och härfäkyrer tont comn e chez nous och nied grämelse i hjertat stola ni med en betydligt lättad börs äter styra kosan tillbaka till ert hem i norden.	63:67	0:317	Podrida ” , ni begär ! , lätta fram för cr miier abla BoenkS a ta mode : och i st diet för de mitt besjungna inantiljerua och lombreror får ni se flackar , cylinderhattar och härfäkyrer tont comn e chez nous och nied grämelse i hjertat stola ni med en betydligt lättad börs äter styra kosan tillbaka till ert hem i norden .	16	0:64	podrida $ $ ni begära $ $ lätta fram för cr miier abla boenks a ta mode $ och i st diet för en mitt besjunga inantiljerua och lombreror få ni se flacka $ cylinderhatt och härfäkyrer tont comn e chez nous och nied grämelse i hjertat stola ni med en betydlig lätta börs äta styra kosa tillbaka till ni hem i nord $
mode		1895	2	bib15760600_18950427_146401_50_0002_alto.xml-58-7	 	och sommarkappor endast nyinkomna oell af senaste mode till här på platsen lägsta priser ifrån 6 kronor till högre Föröfrigt är lagret betydligt utvidgadt såväl inom hvitvaru och sybehörsbranchen som allt öfrigt som tillhör aflären.	50:54	0:232	och sommarkappor endast nyinkomna oell af senaste mode till här på platsen lägsta priser ifrån 6 kronor till högre Föröfrigt är lagret betydligt utvidgadt såväl inom hvitvaru och sybehörsbranchen som allt öfrigt som tillhör aflären .	7	0:36	och sommarkappa endast nyinkomna oell af sen mode till här på plats låg pris ifrån 6 krona till hög föröfrigt vara lager betydlig utvidgadt $ inom hvit och sybehörsbranchen som all öfrig som tillhöra aflären $
mode		1895	2	bib15650837_18950223_146391_46_0004_alto.xml-77-13	 	En Hörnbutik, belägen vid två starkt trafikerade gator, hvari nu bedrifves Mode- och Sybehörsaffär, uthyres från 1 April till samma sorts affär.	75:80	0:144	En Hörnbutik , belägen vid två starkt trafikerade gator , hvari nu bedrifves Mode- och Sybehörsaffär , uthyres från 1 April till samma sorts affär .	13	0:26	en hörnbutik $ belägen vid två stark trafikera gata $ hvari nu bedrifves mode och sybehörsaffär $ uthyra från 1 april till samma sort affär $
mode		1895	2	bib15975087_18950809_145596_121_0007_alto.xml-4-1	 	aldrig modes falla; ty Gud kan icke, sedan han tagit dig ut ur mörkret, störta dig tillbaka i detsamma, emedan han är trofast.	7:12	0:126	aldrig modes falla ; ty Gud kan icke , sedan han tagit dig ut ur mörkret , störta dig tillbaka i detsamma , emedan han är trofast .	1	0:28	aldrig mode falla $ ty gud kunna icke $ sedan han ta du ut ur mörker $ störta du tillbaka i densamma $ emedan han vara trofast $
mode		1895	2	bib15761570_18951015_146176_170_0002_alto.xml-56-12	 	skulle den nya ministären komma ati bestå af 4 vänstermän och 2 mode rate.	64:68	0:74	skulle den nya ministären komma ati bestå af 4 vänstermän och 2 mode rate .	12	0:15	skola den ny ministär komma ati bestå af 4 vänsterman och 2 mode rate $
mode		1895	2	bib19277330_18951008_0_119_0004_alto.xml-80-3	 	Iklädningar efter nyaste mode fort, väl och billigt.	25:29	0:52	Iklädningar efter nyaste mode fort , väl och billigt .	3	0:10	iklädningar efter ny mode fort $ väl och billig $
mode		1895	2	bib15978012_18950423_148361_93_0004_alto.xml-37-9	 	Beställningar af färdigsydda kläder emottagas och utföras efter nyaste mode genom platsens skickligaste skräddare.	71:75	0:114	Beställningar af färdigsydda kläder emottagas och utföras efter nyaste mode genom platsens skickligaste skräddare .	9	0:15	beställning af färdigsydda kläder emotta och utföra efter ny mode genom plats skicklig skräddare $
mode		1895	2	bib15760690_18951005_145050_153_0004_alto.xml-89-9	 	åtager flg sörsäidigandet af Dam- och Barnhattar ester nyaste mode.	62:66	0:67	åtager flg sörsäidigandet af Dam- och Barnhattar ester nyaste mode .	9	0:11	åtager flg sörsäidigandet af dam och barnhatt est ny mode $
mode		1896	2	bib11653811_18960422_145317_60_0001_alto.xml-53-4	 	förfärdigar Herrkostyiner efter nyaste mode till billigt pris från 1 april, Prof a engelska tyger förevisas.	39:43	0:108	förfärdigar Herrkostyiner efter nyaste mode till billigt pris från 1 april , Prof a engelska tyger förevisas .	4	0:18	förfärdiga herrkostyiner efter ny mode till billig pris från 1 april $ prof a engelsk tyg förevisa $
mode		1895	2	bib15650837_18950627_146391_146_0002_alto.xml-135-27	 	skulla befrämjas af frilagersinrättningen vöre, som sagdt är, import för landets egen konsumtion, och då i främsta rummet af artiklar som tillhöra textilindustrien, mode- och lyxvarubransobsn.	165:170	0:192	skulla befrämjas af frilagersinrättningen vöre , som sagdt är , import för landets egen konsumtion , och då i främsta rummet af artiklar som tillhöra textilindustrien , mode- och lyxvarubransobsn .	27	0:31	skulla befrämja af frilagersinrättningen vöre $ som sagdt vara $ import för land egen konsumtion $ och då i främst rum af artikel som tillhöra textilindustri $ mode och lyxvarubransobsn $
mode		1899	2	bib11653811_18990602_145317_82_0003_alto.xml-104-35	 	helsan är mycket vansklig, uppehålla herrar och damer i eleganta drägter sig der under en följd af år, ja kan- efter senaste Pariser- eller Wiener ske under hela sitt lif för att sjuk- mode.	185:189	0:190	helsan är mycket vansklig , uppehålla herrar och damer i eleganta drägter sig der under en följd af år , ja kan- efter senaste Pariser- eller Wiener ske under hela sitt lif för att sjuk- mode .	35	0:37	hel vara mycket vansklig $ uppehålla herre och dam i elegant drägter sig der under en följd af år $ ja kana efter sen $ eller wiener ske under hel sig lif för att sjuka mode $
mode		1895	2	bib19227462_18950828_147640_199_0003_alto.xml-102-1	 	Vallområdet mode medlemmar af de föreningar, som skulle bilda häck vid konungens lärd från stationen till residenset.	12:16	0:117	Vallområdet mode medlemmar af de föreningar , som skulle bilda häck vid konungens lärd från stationen till residenset .	1	0:19	vallområdet mode medlem af en förening $ som skola bilda häck vid konung lärd från station till residens $
mode		1895	2	bib19225758_18950202_144022_28_0002_alto.xml-108-9	 	gon man af ära i högerns eller i de mode-, es läger, eom tinner, att nägon ’ man ’ man afjMan t inom vänstern kunde pä sådana vilkor licke in i någon norsk regering?	36:41	0:165	gon man af ära i högerns eller i de mode- , es läger , eom tinner , att nägon ’ man ’ man afjMan t inom vänstern kunde pä sådana vilkor licke in i någon norsk regering ?	9	0:38	gon man af ära i höger eller i en mode $ es läger $ eom tinner $ att nägon $ man $ man afjman t inom vänster kunna pä sån vilkor licke in i någon norsk regering $
mode		1895	2	bib19225758_18950829_144022_200_0001_alto.xml-60-1	 	Svarta Mode ■tyger, alltid nytt och stort urval.	7:11	0:48	Svarta Mode ■tyger , alltid nytt och stort urval .	1	0:10	svart mode $ $ alltid ny och stor urval $
