lemma	pos	date	grouping	identifier	description	context	indexes_target_token	indexes_target_sentence	context_tokenized	indexes_target_token_tokenized	indexes_target_sentence_tokenized	context_lemmatized
mode		1825	1	bib19227291_18251221_145289_51_0003_alto.xml-1-26	 	Undertecknad, svin härstädes ivunnit Burstap ä Skräddare-Professionen, lär härigenoni reeommendera mig till förfärdigande sä wäl af Uliikorms- som andra Kläder, efter no aste mode, och för billigt pris.	175:179	0:202	Undertecknad , svin härstädes ivunnit Burstap ä Skräddare-Professionen , lär härigenoni reeommendera mig till förfärdigande sä wäl af Uliikorms- som andra Kläder , efter no aste mode , och för billigt pris .	26	0:33	underteckna $ svin härstädes ivunnit burstap ä $ $ lär härigenoni reeommendera jag till förfärdigande sä wäl af $ som andra kläder $ efter no aste mode $ och för billig pris $
mode		1824	1	bib13506739_18241228_144030_301_0001_alto.xml-20-41	 	Men, ehuru mycket man söker att gagna, glömmer man cj berf5re att hckr As, wen roa sig, och pä mer än ett sätt, soni jag hoppas ingen skall neka wara i cnlighct med tidens anda och mode.	181:185	0:186	Men , ehuru mycket man söker att gagna , glömmer man cj berf5re att hckr As , wen roa sig , och pä mer än ett sätt , soni jag hoppas ingen skall neka wara i cnlighct med tidens anda och mode .	41	0:43	men $ ehuru mycken man söka att gagna $ glömma man cj berf5re att hckr as $ wen roa sig $ och pä mer än en sätt $ soni jag hoppa ingen skola neka wara i cnlighct med tid anda och mode $
mode		1828	1	bib19225792_18280607_147359_23_0008_alto.xml-8-25	 	Undertecknas, som bor uti Glasmästaren Wen« nergrens hus wid Sillegatan, förfärdigar alla sorter Tygskänger samt andra fina Skosorter, allt pt&gt; finaste moden arbetadt.	155:160	0:170	Undertecknas , som bor uti Glasmästaren Wen« nergrens hus wid Sillegatan , förfärdigar alla sorter Tygskänger samt andra fina Skosorter , allt pt&gt ; finaste moden arbetadt .	25	0:28	underteckna $ som bo uti glasmästare $ nergren hus wid sillegatan $ förfärdiga all sort tygskänger samt andra fin skosort $ all $ $ fin mode arbetadt $
mode		1800	1	bib19225772_18001219_148004_146_0004_alto.xml-1-5	 	Ser stycken Stolar pa nya moden med lösa såten, en Soffa och en Sele som kan nyttjas lil Chais eller Släda, äro kil salu pa et ställe, wiil nämnes pa Trycke, iet.	26:31	0:162	Ser stycken Stolar pa nya moden med lösa såten , en Soffa och en Sele som kan nyttjas lil Chais eller Släda , äro kil salu pa et ställe , wiil nämnes pa Trycke , iet .	5	0:37	se styck stola pa ny mode med lös såt $ en soffa och en sele som kunna nyttja lil chais eller släda $ äro kil salu pa et ställe $ wiil nämna pa trycke $ i $
mode		1829	1	bib11653828_18290616_144028_136_0003_alto.xml-4-17	 	är medelpunkten för hela det närvarande Berlinska lif vet, samtalsämnet i högre oell lägre kretsar, mode- och galanteri-handlares lösen, tidningarnes thema och poeternas ämne.	100:105	0:175	är medelpunkten för hela det närvarande Berlinska lif vet , samtalsämnet i högre oell lägre kretsar , mode- och galanteri-handlares lösen , tidningarnes thema och poeternas ämne .	17	0:28	vara medelpunkt för hel den närvara berlinska lif veta $ samtalsämne i hög oell låg krets $ mode och $ lösen $ tidning thema och poet ämne $
mode		1823	1	bib11653828_18230613_144028_134_0004_alto.xml-8-24	 	man en lid för DonadieuS öde, och i staden säg man anflagSscdlar uppspikade, of inncbäll, att" en General a Ia mode gäll förlorad i Cataloniens berg; dea, svin tillrattastaffar honom, bar att nndsZ hederlig wedergällning."	111:115	0:222	man en lid för DonadieuS öde , och i staden säg man anflagSscdlar uppspikade , of inncbäll , att " en General a Ia mode gäll förlorad i Cataloniens berg ; dea , svin tillrattastaffar honom , bar att nndsZ hederlig wedergällning . "	24	0:44	man en lid för donadieus öde $ och i stad säga man anflagsscdlar $ $ of inncbäll $ att $ en general a ia mode gäll förlora i cataloniens berg $ dea $ svin tillrattastaffar han $ bära att nndsz hederlig wedergällning $ $
mode		1810	1	bib19277346_18100131_147394_1_0004_alto.xml-2-11	 	blott derpä att pikera och upreta hennes högmod och wara pä moden.	60:65	0:66	blott derpä att pikera och upreta hennes högmod och wara pä moden .	11	0:13	blott derpä att pikera och upreta hon högmod och wara pä mode $
mode		1821	1	bib11653828_18211213_144028_292_0001_alto.xml-6-50	 	i Constantinopel hofwa jÄledcs erhällik instruktioner i Kswerensstämmelse med detta be flut, till följe hwaraf dc ofördröjligen stola i en Note till Niis Effendi erbjuda fin heniedUng att förmä Ryfiland inställa hmarje fiendtlighet mot Porten, men tillika fordra, att denna i fina framtida ätgärdcr mätte iagttaqa klokheten^och mode, rationens söreffrifter, afstä frän alla förföljelser mot fina kr flin a, m de, sätare, filerställa freden genom förkunnandet af en allmän amnesti, samt noga uppfylla de nied Ryfiland bcstäende traktater.	328:332	0:537	i Constantinopel hofwa jÄledcs erhällik instruktioner i Kswerensstämmelse med detta be flut , till följe hwaraf dc ofördröjligen stola i en Note till Niis Effendi erbjuda fin heniedUng att förmä Ryfiland inställa hmarje fiendtlighet mot Porten , men tillika fordra , att denna i fina framtida ätgärdcr mätte iagttaqa klokheten^och mode , rationens söreffrifter , afstä frän alla förföljelser mot fina kr flin a , m de , sätare , filerställa freden genom förkunnandet af en allmän amnesti , samt noga uppfylla de nied Ryfiland bcstäende traktater .	50	0:88	i constantinopel hofwa jäledcs erhällik instruktion i kswerensstämmelse med denna be flut $ till följe hwaraf dc ofördröjligen stola i en note till niis effendi erbjuda fin heniedung att förmä ryfiland inställa hmarje fiendtlighet mot port $ men tillika fordra $ att denna i fin framtida ätgärdcr mäta iagttaqa $ mode $ ration söreffrifter $ afstä frän all förföljelse mot fin kr flin a $ m de $ sätare $ filerställa fred genom förkunnande af en allmän amnesti $ samt noga uppfylla en nied ryfiland bcstäende traktat $
mode		1822	1	bib19227291_18221106_145289_45_0001_alto.xml-1-8	 	efter att hafwa besökt Milano, Parma, Modena och Bologna.	38:44	0:57	efter att hafwa besökt Milano , Parma , Modena och Bologna .	8	0:12	efter att hafwa besöka milano $ parma $ mode och bologna $
mode		1826	1	bib19227291_18261206_145289_49_0001_alto.xml-5-2	 	hamnen för Moden; betz styrka belkper sig till, Li.	11:16	0:51	hamnen för Moden ; betz styrka belkper sig till , Li .	2	0:12	hamn för mode $ betz styrka belkper sig till $ li $
mode		1814	1	bib11653828_18140829_144028_198_0002_alto.xml-5-7	 	siller sig, att äfwen Parma, Modena och Guasialla siola afträdas till Napoleon, och att han stall framdeles flytta lill fasta landet.	29:35	0:133	siller sig , att äfwen Parma , Modena och Guasialla siola afträdas till Napoleon , och att han stall framdeles flytta lill fasta landet .	7	0:25	sille sig $ att äfwen parma $ mode och guasialla siola afträda till napoleon $ och att han stall framdeles flytta lill fast land $
mode		1798	1	bib11653828_17980301_144028_50_0002_alto.xml-2-7	 	— Har i London ar nu i mode bland Fruntimren al äswen	23:27	0:53	— Har i London ar nu i mode bland Fruntimren al äswen	7	0:12	$ ha i london ar nu i mode bland fruntimmer al äswen
mode		1797	1	bib19225772_17971205_148003_97_0002_alto.xml-2-26	 	en för hwardera könet, och desse stulle wara försedde med hyllor, pä hwilka man lunde ställa lädor, hwaruti beflrifning pä hwart och et mode förwarades, jamte alla de konstord och talesätt, som more hörande bartil, och det uti samma ordning, som böckerne uti ek Bibliotheqve, och desse rum stulle stängas med dubbla dörrar.	136:140	0:323	en för hwardera könet , och desse stulle wara försedde med hyllor , pä hwilka man lunde ställa lädor , hwaruti beflrifning pä hwart och et mode förwarades , jamte alla de konstord och talesätt , som more hörande bartil , och det uti samma ordning , som böckerne uti ek Bibliotheqve , och desse rum stulle stängas med dubbla dörrar .	26	0:62	en för hwardera kön $ och desse stulle wara förse med hylla $ pä hwilka man lunde ställa lädor $ hwaruti beflrifning pä hwart och et mode förwarades $ jamte all en konstord och talesätt $ som more höra bartil $ och den uti samma ordning $ som böckerne uti ek bibliotheqve $ och desse rum stulle stänga med dubbel dörr $
mode		1819	1	bib11653828_18190113_144028_9_0002_alto.xml-3-27	 	Det flulle säledes beteckna en Man, som icke frägar efter, om han tänker Kätt ' blott han ränker Nytt » följaktligen en raisonneur » Ia mode.	136:140	0:141	Det flulle säledes beteckna en Man , som icke frägar efter , om han tänker Kätt ' blott han ränker Nytt » följaktligen en raisonneur » Ia mode .	27	0:29	den flulle säledes beteckna en man $ som icke frägar efter $ om han tänka kätt $ blott han ränker ny $ följaktligen en raisonneur $ ia mode $
mode		1805	1	bib19225772_18051213_148004_144_0002_alto.xml-18-0	 	Moden är den fruktanswardaste därstaperncs moder, förmodeligen medan ho » sjelf ax en ärtsnarr.	0:5	0:95	Moden är den fruktanswardaste därstaperncs moder , förmodeligen medan ho » sjelf ax en ärtsnarr .	0	0:16	mode vara den fruktanswardaste därstaperncs moder $ förmodeligen medan ho $ sjelf ax en ärtsnarr $
mode		1792	1	bib19225772_17920918_148003_74_0002_alto.xml-3-7	 	Hemligheter och en blind tro aro okunnsghetens moden och wäldets grundwas.	47:52	0:74	Hemligheter och en blind tro aro okunnsghetens moden och wäldets grundwas .	7	0:12	hemlighet och en blind tro aro okunnsghetens mode och wäldets grundwas $
mode		1826	1	bib19277277_18261016_147682_240_0002_alto.xml-34-3	 	Uti Fru HaSselhuhnS Mode- och NipperhandelSbod wid Drottninggatan » li Grosth.	20:25	0:78	Uti Fru HaSselhuhnS Mode- och NipperhandelSbod wid Drottninggatan » li Grosth .	3	0:12	uti fru hasselhuhns mode och nipperhandelsbod wid drottninggatan $ lie grosth $
mode		1825	1	bib13506739_18251207_144030_284_0008_alto.xml-13-24	 	beställningar emottagas, och är af Löslockar ett fullkomligt fortament färdigt och att tlllgZ fä n&gt; äl i iiiitr logis » soin i Mode- och Nipperbodcti wid Mvnttorgrt, i flerr EastelliS Galanteribod wid Siad » Smediegatan samt i Boden N:v 2 nti Stadens Nva Hus ivid Södermalms Torg.	130:135	0:283	beställningar emottagas , och är af Löslockar ett fullkomligt fortament färdigt och att tlllgZ fä n&gt ; äl i iiiitr logis » soin i Mode- och Nipperbodcti wid Mvnttorgrt , i flerr EastelliS Galanteribod wid Siad » Smediegatan samt i Boden N:v 2 nti Stadens Nva Hus ivid Södermalms Torg .	24	0:51	beställning emotta $ och vara af löslock en fullkomlig fortament färdig och att tlllgz fä $ $ äl i iiiitr logi $ soi i mode och nipperbodcti wid mvnttorgrt $ i flerr eastellis galanteribod wid siad $ smediegatan samt i boden $ 2 nti stad nva hus ivid södermalm torg $
mode		1824	1	bib19277277_18240519_147682_115_0005_alto.xml-6-8	 	Ett större och godt Klaver, en stor moden.	36:41	0:42	Ett större och godt Klaver , en stor moden .	8	0:10	en stor och god klaver $ en stor mode $
mode		1806	1	bib11653828_18060925_144028_221_0003_alto.xml-5-12	 	I en Engelst Tidning berättas, att Mulåsnor nu äro mpckct i mode uti London.	60:64	0:76	I en Engelst Tidning berättas , att Mulåsnor nu äro mpckct i mode uti London .	12	0:16	i en engelst tidning berätta $ att mulåsna nu äro mpckct i mode uti london $
mode		1823	1	bib13506739_18230609_144030_129_0011_alto.xml-4-1	 	Twenre mode, nr broderade Klädningar, el färtigsyddo, finnas til salu uti Hornet Bod wid Gustaf «d.	7:11	0:99	Twenre mode , nr broderade Klädningar , el färtigsyddo , finnas til salu uti Hornet Bod wid Gustaf «d .	1	0:20	twenre mode $ nr brodera klädning $ el färtigsyddo $ finna til salu uti horn bod wid gustaf $ $
mode		1798	1	bib13506739_17980220_144030_42_0009_alto.xml-6-12	 	hos nZqvt hederlig » Herrskap; hon kan kamma här pS nyaste mode », roä!	59:63	0:71	hos nZqvt hederlig » Herrskap ; hon kan kamma här pS nyaste mode » , roä !	12	0:17	hos nzqvt hederlig $ herrskap $ hon kunna kamma här ps ny mode $ $ roä $
mode		1827	1	bib19225792_18270113_147359_1_0008_alto.xml-5-24	 	Privilegium och kunstap i nämnde tillwerkningar, hmaraf de stönaste profwer kunna företes, samt har nu nyligen låtit förfärdiga ett alldeles efter nyaste moden nytt Fabriks-Inventarium; tillwerkningen är en snygg och renlig handtering, samt kan drifwas med litet folk och litet utrum; stulle nagon, som har lust för ofwannämnda, haftva 2 a 3 Rum att uthyra wore sa myckel bättre.	154:159	0:379	Privilegium och kunstap i nämnde tillwerkningar , hmaraf de stönaste profwer kunna företes , samt har nu nyligen låtit förfärdiga ett alldeles efter nyaste moden nytt Fabriks-Inventarium ; tillwerkningen är en snygg och renlig handtering , samt kan drifwas med litet folk och litet utrum ; stulle nagon , som har lust för ofwannämnda , haftva 2 a 3 Rum att uthyra wore sa myckel bättre .	24	0:67	privilegium och kunstap i nämna tillwerkningar $ hmaraf en stönaste profwer kunna förete $ samt ha nu nyligen låta förfärdiga en alldeles efter ny mode ny $ $ tillwerkningen vara en snygg och renlig handtering $ samt kunna drifwas med liten folk och liten utrum $ stulle nagon $ som ha lust för ofwannämnda $ haftva 2 a 3 rum att uthyra wore säga myckel bra $
mode		1796	1	bib11653828_17960608_144028_127_0001_alto.xml-1-3	 	Emedlertid älades Hcrtigdömet Modena at betala 6 Millioner i reda Penningar,	30:36	0:76	Emedlertid älades Hcrtigdömet Modena at betala 6 Millioner i reda Penningar ,	3	0:12	emedlertid älades hcrtigdömet mode at betala 6 million i reda penning $
mode		1797	1	bib13506739_17970825_144030_193_0003_alto.xml-15-7	 	fordrad med Cattnn, gjord vä gammalt mode, dito en Holl.	37:41	0:56	fordrad med Cattnn , gjord vä gammalt mode , dito en Holl .	7	0:13	fordra med cattnn $ gjord vä gammal mode $ dito en holl $
mode		1805	1	bib19225772_18051002_148004_113_0001_alto.xml-10-22	 	ar alldeles detsamna och blott en afstrift af Aristoteles, liksom Garve i sednare tider asstrifwit Schaftsbury, och detta alltid warit moden hos de sä kallade Lärde.	135:140	0:165	ar alldeles detsamna och blott en afstrift af Aristoteles , liksom Garve i sednare tider asstrifwit Schaftsbury , och detta alltid warit moden hos de sä kallade Lärde .	22	0:29	ar alldeles detsamna och blott en afstrift af aristoteles $ liksom garve i sednare tid asstrifwit schaftsbury $ och denna alltid warit mode hos en sä kalla lära $
mode		1820	1	bib19277346_18200311_147394_11_0003_alto.xml-2-14	 	Mitt första Croesus war tills Cyrns honoin fann (: Ett S. för gammal mode man dertill lagga kan:)	69:73	0:97	Mitt första Croesus war tills Cyrns honoin fann ( : Ett S. för gammal mode man dertill lagga kan : )	14	0:21	jag första croesus war tills cyrns honoin finna $ $ en $ för gammal mode man dertill lagga kunna $ $
mode		1793	1	bib19225772_17930827_148003_67_0002_alto.xml-11-93	 	Der torde pä ben räkningen blifwa en gansta obelydelig hjelp mot deli stada lurendrägerierne göra, oni man endast wille förbjuda Allmogen och tjenstefolkcl » lt bruk of Sidentyg, ky en hwar lärer finna och medgifwa, at ek enda Fruntimmer, endast af medelståndet, med sitt klädnad bidrager mera lil underwigt r handeln, a » tck asweatyis en hel Sokn, källste helt Härad, ty hennes Garderobe stal fourneras va) andras yw.. rr är, dä Allmogens Sidenplagg, warac en Mansålder utan ali förändring af mode.	495:499	0:500	Der torde pä ben räkningen blifwa en gansta obelydelig hjelp mot deli stada lurendrägerierne göra , oni man endast wille förbjuda Allmogen och tjenstefolkcl » lt bruk of Sidentyg , ky en hwar lärer finna och medgifwa , at ek enda Fruntimmer , endast af medelståndet , med sitt klädnad bidrager mera lil underwigt r handeln , a » tck asweatyis en hel Sokn , källste helt Härad , ty hennes Garderobe stal fourneras va ) andras yw .. rr är , dä Allmogens Sidenplagg , warac en Mansålder utan ali förändring af mode .	93	0:95	der torde pä ben räkning blifwa en gan obelydelig hjelp mot deli stada lurendrägerierne göra $ oni man endast wille förbjuda allmoge och tjenstefolkcl $ lt bruk of sidentyg $ ky en hwar lärer finna och medgifwa $ at ek enda fruntimmer $ endast af medelståndet $ med sig klädnad bidra mera lil underwigt r handel $ a $ tck asweatyis en hel sokn $ käll hel härad $ ty hon garderobe stjäla fournera va $ annan yw $ rr vara $ dä allmoge sidenplagg $ warac en mansålder utan ali förändring af mode $
mode		1803	1	bib11653825_18030618_145134_69_0006_alto.xml-1-11	 	Som Möbelhandiaren Axel Lundgrens Enka, Madam Htttna Lundgren, född Moden, den 15 Mart detta ör i Upsala ined döden akgätt, sedan hon t lifstiden fcror&nat, det all dek qwariätenffap.	68:73	0:183	Som Möbelhandiaren Axel Lundgrens Enka , Madam Htttna Lundgren , född Moden , den 15 Mart detta ör i Upsala ined döden akgätt , sedan hon t lifstiden fcror&nat , det all dek qwariätenffap .	11	0:35	som möbelhandiaren axel lundgren enka $ madam htttna lundgren $ föda mode $ den 15 mart denna ör i upsala ined död akgätt $ sedan hon t lifstid $ $ den all dek qwariätenffap $
mode		1826	1	bib19277277_18261222_147682_298_0003_alto.xml-3-35	 	Italienska Hattar till & gt; 2, & gt; ö a 2 » R:dr R:gd, Florsband, vllna Shawlar.och diverse gcnrila saker passande till Julklappar fbr de mest santa pris i undertecknadS Mode- och Nipperhandel, hörnet af OdcnZ gränd och Drottninggatan.	172:177	0:237	Italienska Hattar till & gt ; 2 , & gt ; ö a 2 » R:dr R:gd , Florsband , vllna Shawlar.och diverse gcnrila saker passande till Julklappar fbr de mest santa pris i undertecknadS Mode- och Nipperhandel , hörnet af OdcnZ gränd och Drottninggatan .	35	0:46	italiensk hatt till $ gt $ 2 $ $ gt $ ö a 2 $ $ $ $ florsband $ vllna $ diverse gcnrila sak passa till julklapp fbr en mycket santa pris i undertecknads mode och nipperhandel $ hörn af odcnz gränd och drottninggatan $
mode		1790	1	bib13506739_17900716_144030_161_0005_alto.xml-11-8	 	E » modern Choise på Fjädrar och en mode? » Calesche på Fjädrar finnas til salu; underrältelse sås i Kryddboden midt emot » ya Opera-Huset wid Norrmalms Torg.	36:40	0:158	E » modern Choise på Fjädrar och en mode ? » Calesche på Fjädrar finnas til salu ; underrältelse sås i Kryddboden midt emot » ya Opera-Huset wid Norrmalms Torg .	8	0:31	e $ modern choise på fjäder och en mode $ $ calesche på fjädra finna til salu $ underrältelse så i kryddbod midt emot $ ya $ wid norrmalms torg $
mode		1793	1	bib15650837_17930119_146391_6_0002_alto.xml-6-15	 	," Länk örn det blefwe mode at intet nytta kläder," (Ty moden stifta liksom wäder) '" Dä satt jag där ined nnn perftil - *.ff Med krokig rygg w.är Mästare straxk träder, Lil Tastenspelaren och gansta ödmjukt ber At fä hans wästra konster lära:" Zag dä mot denna Gunst mm gärd wist Ek förära," Och hivad i löst jag äger mer" Det will iag alf med Eder dela."	56:61	0:356	, " Länk örn det blefwe mode at intet nytta kläder , " ( Ty moden stifta liksom wäder ) ' " Dä satt jag där ined nnn perftil - * .ff Med krokig rygg w.är Mästare straxk träder , Lil Tastenspelaren och gansta ödmjukt ber At fä hans wästra konster lära : " Zag dä mot denna Gunst mm gärd wist Ek förära , " Och hivad i löst jag äger mer " Det will iag alf med Eder dela . "	15	0:83	$ $ länk örn det blefwe mode at intet nytta kläder $ $ $ ty mode stifta liksom wäder $ $ $ dä sitta jag där ined nnn perftil $ $ $ med krokig rygg $ mästare straxk trä $ lil tastenspelaren och gansta ödmjuk be at fä han wästra konst lära $ $ zag dä mot denna gunst mm gärd wist ek förära $ $ och hiva i lös jag äga mer $ den will iag alf med ni dela $ $
mode		1808	1	bib11653825_18081103_145134_130_0006_alto.xml-17-8	 	tan ali förstä etl annat sprak än sitt mode- smal, är en Pasioraph t ständ alt läsa h.var och en pasigraphlsk ssrift, och i sitt modersmål, uttrycka den, emedan den ej bestar af oro, utan af idéer.	39:44	0:197	tan ali förstä etl annat sprak än sitt mode- smal , är en Pasioraph t ständ alt läsa h.var och en pasigraphlsk ssrift , och i sitt modersmål , uttrycka den , emedan den ej bestar af oro , utan af idéer .	8	0:43	tana ali förstä etl annan sprak än sig mode smal $ vara en pasioraph t ständ alt läsa $ och en pasigraphlsk ssrift $ och i sig modersmål $ uttrycka den $ emedan den ej best af oro $ utan af idé $
mode		1798	1	bib11653828_17981019_144028_241_0003_alto.xml-12-1	 	i mode, at med grönt granris (särdeles qwistar af Idegran, somär Nordens Cypress och borde almänt planteras) swepa de döda.	2:6	0:123	i mode , at med grönt granris ( särdeles qwistar af Idegran , somär Nordens Cypress och borde almänt planteras ) swepa de döda .	1	0:25	i mode $ at med grön granris $ särdeles qwistar af idegran $ somär norden cypress och böra almänt plantera $ swepa en död $
mode		1825	1	bib11653828_18250521_144028_115_0003_alto.xml-3-15	 	wisshet, att Ibrahim Pascha ännu ben 2 April stod i ett förstansadt lager ivid Moden, sedan han ivid sikt misslyckade anfall pä Navarino förlorat 4.000 man.	79:84	0:156	wisshet , att Ibrahim Pascha ännu ben 2 April stod i ett förstansadt lager ivid Moden , sedan han ivid sikt misslyckade anfall pä Navarino förlorat 4.000 man .	15	0:29	wisshet $ att ibrahim pascha ännu ben 2 april stå i en förstansadt lager ivid mode $ sedan han ivid sikt misslyckad anfall pä navarino förlora $ man $
mode		1813	1	bib11653828_18130519_144028_114_0003_alto.xml-7-27	 	handlade med gamla kläder, blef för godt köp deraf ägarinna, och öfwerenskom med ett resande fruntimmer att hon stulle bringa t&gt; enna prydnad i mode.	147:151	0:152	handlade med gamla kläder , blef för godt köp deraf ägarinna , och öfwerenskom med ett resande fruntimmer att hon stulle bringa t&gt ; enna prydnad i mode .	27	0:29	handla med gammal kläder $ blef för god köp deraf ägarinna $ och öfwerenskom med en resa fruntimmer att hon stulle bringa $ $ enna prydnad i mode $
mode		1821	1	bib11653828_18210718_144028_165_0002_alto.xml-10-21	 	— Konungarne Carl Felix och Vi » ctor Enianuel, fom i Lucca baft ett möte, hafwa derifrän asrest till Modena.	102:108	0:109	— Konungarne Carl Felix och Vi » ctor Enianuel , fom i Lucca baft ett möte , hafwa derifrän asrest till Modena .	21	0:23	$ konung carl felix och vi $ ctor enianuel $ få i lucca baft en möte $ hafwa derifrän asrest till mode $
mode		1815	1	bib19225772_18150502_148004_49_0001_alto.xml-0-17	 	von Frimont, som kommenderar Italie, sta armeen, att Konung Murat tagit sitt högqvarter i Modena, och ester flera, sannuolikt i afstkt för att narra ost, företagna fram-och ätermarcher, wandt sm hufwudstyrka mot Ferrara och kringränt denna plars, hwilket försik dock af der kommenderande General Friherre v. Laner afflogs.	90:96	0:322	von Frimont , som kommenderar Italie , sta armeen , att Konung Murat tagit sitt högqvarter i Modena , och ester flera , sannuolikt i afstkt för att narra ost , företagna fram-och ätermarcher , wandt sm hufwudstyrka mot Ferrara och kringränt denna plars , hwilket försik dock af der kommenderande General Friherre v. Laner afflogs .	17	0:57	von frimont $ som kommendera italie $ sta armeen $ att konung mura ta sig högqvarter i mode $ och est flera $ sannuolikt i afstkt för att narra ost $ företa $ ätermarcher $ wandt sm hufwudstyrka mot ferrara och kringränna denna plars $ hwilket försik dock af der kommendera general friherre $ lan afflogs $
mode		1814	1	bib11653828_18140307_144028_54_0002_alto.xml-6-17	 	wistande wid Konungarnas och Furstarnas Zos hade pä bada könens klädedrägt och prydnader; samt betraktelser öfwer Modens ursprung och werling i de förflutna århundraden.	114:120	0:169	wistande wid Konungarnas och Furstarnas Zos hade pä bada könens klädedrägt och prydnader ; samt betraktelser öfwer Modens ursprung och werling i de förflutna århundraden .	17	0:26	wistande wid konung och furste zos ha pä bada kön klädedrägt och prydnad $ samt betraktelse öfwer mode ursprung och werling i en förfluten århundrade $
mode		1797	1	bib13506739_17971114_144030_261_0001_alto.xml-0-2	 	Hertigen af Modena sär stade-ersättning i Land emellan Ltsch och po.	12:18	0:68	Hertigen af Modena sär stade-ersättning i Land emellan Ltsch och po .	2	0:12	hertig af mode sär $ i land emellan ltsch och po $
mode		1800	1	bib13506739_18000228_144030_49_0012_alto.xml-9-28	 	Uli lredje Klädständet föder otn Fransyska Kprkan, lämnas en säker underrättelse om et Frunlimmer! » m spt Fruntimmers, Kläder «f alla sorter, etter nyaste mode; hon önstar at fä förtroende as Hertstaper, fi stola de sä se at wärket stall prisa Mästaren.	156:160	0:254	Uli lredje Klädständet föder otn Fransyska Kprkan , lämnas en säker underrättelse om et Frunlimmer ! » m spt Fruntimmers , Kläder «f alla sorter , etter nyaste mode ; hon önstar at fä förtroende as Hertstaper , fi stola de sä se at wärket stall prisa Mästaren .	28	0:49	uli lredje klädständet föda otn fransysk kprkan $ lämna en säker underrättelse om et frunlimmer $ $ m spt fruntimmer $ kläder $ all sort $ etter ny mode $ hon önstar at fä förtroende as hertstaper $ fi stola de sä se at wär stall prisa mästare $
