lemma	pos	date	grouping	identifier	description	context	indexes_target_token	indexes_target_sentence	context_tokenized	indexes_target_token_tokenized	indexes_target_sentence_tokenized	context_lemmatized
aktiv		1806	1	bib11653828_18060329_144028_72_0002_alto.xml-1-29	 	Lord Holland:" Man har försökt att af en Man, fom stundom och i roifja f ll » varit inkallad i hemliga Konseljen, göra en wcrkeligen aktiv Minister; och jemwäl har man bc&gt;.iödat si q ritt fasta answarighet wid personer, i anseende rill hwilka den icke äger rum.	133:138	0:264	Lord Holland : " Man har försökt att af en Man , fom stundom och i roifja f ll » varit inkallad i hemliga Konseljen , göra en wcrkeligen aktiv Minister ; och jemwäl har man bc&gt ; .iödat si q ritt fasta answarighet wid personer , i anseende rill hwilka den icke äger rum .	29	0:56	lord holland $ $ man ha försöka att af en man $ få stundom och i roifja f ll $ vara inkalla i hemlig konselj $ göra en wcrkeligen aktiv minister $ och jemwäl ha man $ $ $ si q ritt fasta answarighet wid person $ i anseende rill hwilka den icke äga rum $
aktiv		1828	1	bib11653828_18280315_144028_64_0003_alto.xml-11-37	 	— Lord Cochrane har akgätt till Paris, sör att söka förmä Grck-kommilt6erna pä kontinenten att befordra hans plan till hämmande af fjörösiverierna i Levanten, — T&gt; ll Chatbam bfl order ankommit att ofördröjligen till aktiv tjenstgöring utrusta ätta liniestcpp.	220:225	0:263	— Lord Cochrane har akgätt till Paris , sör att söka förmä Grck-kommilt6erna pä kontinenten att befordra hans plan till hämmande af fjörösiverierna i Levanten , — T&gt ; ll Chatbam bfl order ankommit att ofördröjligen till aktiv tjenstgöring utrusta ätta liniestcpp .	37	0:43	$ lord cochrane ha akgätt till paris $ sör att söka förmä $ pä kontinent att befordra han plan till hämma af fjörösiverierna i levanten $ $ $ $ ll chatbam bfl order ankomma att ofördröjligen till aktiv tjenstgöring utrusta ätta liniestcpp $
aktiv		1805	1	bib19520388_18050213_147487_7_0003_alto.xml-4-26	 	& gt; Frankrike för nästa ar, kommer likasom i ar att bestä af 60, coo Man, hwaraf hälften är bestämd för de aktiva arméerna, öst) hälften för Reserf-armeen.	109:115	0:157	& gt ; Frankrike för nästa ar , kommer likasom i ar att bestä af 60 , coo Man , hwaraf hälften är bestämd för de aktiva arméerna , öst ) hälften för Reserf-armeen .	26	0:35	$ gt $ frankrike för nästa ar $ komma likasom i ar att bestä af 60 $ coo man $ hwaraf hälft vara bestämd för en aktiv armé $ öst $ hälft för $ $
aktiv		1817	1	bib11653828_18170913_144028_212_0002_alto.xml-0-16	 	dtktS Intit, thuru it had- fij uppdraget att göra för Brittiska handeln sanssa fördel, aktiva propositioner, och deribland den, att för 20 är erbjusa Stora LZritannien en rxclufiv handel med Nya Grenada och Benezuela; detta oartadt, kunde Lon Ivs« Maria del Real, pä sin fira gånger férnpace anhällan, icke fS en » onserence n.cd Mmistern för uliifeé ärenverna.	87:93	0:361	dtktS Intit , thuru it had- fij uppdraget att göra för Brittiska handeln sanssa fördel , aktiva propositioner , och deribland den , att för 20 är erbjusa Stora LZritannien en rxclufiv handel med Nya Grenada och Benezuela ; detta oartadt , kunde Lon Ivs« Maria del Real , pä sin fira gånger férnpace anhällan , icke fS en » onserence n.cd Mmistern för uliifeé ärenverna .	16	0:67	dtkts intit $ thuru it $ fij uppdrag att göra för brittisk handel sanssa fördel $ aktiv proposition $ och deribland den $ att för 20 vara erbjusa stor lzritannien en rxclufiv handel med ny grenada och benezuela $ denna oartad $ kunna lo $ maria del real $ pä sig fira gång férnpace anhällan $ icke få en $ onserence $ mmistern för uliifeé ärenverna $
aktiv		1814	1	bib13506739_18140415_144030_85_0008_alto.xml-1-3	 	biljet till den aktiva ärteiäitn Nio i, pa Lael.	16:22	0:48	biljet till den aktiva ärteiäitn Nio i , pa Lael .	3	0:11	biljet till den aktiv ärteiäitn nio i $ pa lael $
aktiv		1793	1	bib11653828_17930814_144028_183_0004_alto.xml-6-19	 	11 Hwar och en stom angifwer förbrytelser emot detta Decret., erhäller «n trevje:idrk af warorne, som aktiv wid hivarje öswerträdelse komma at confisqueraS.	102:107	0:156	11 Hwar och en stom angifwer förbrytelser emot detta Decret . , erhäller «n trevje:idrk af warorne , som aktiv wid hivarje öswerträdelse komma at confisqueraS .	19	0:27	11 hwar och en stom angifwer förbrytelse emot denna decret $ $ erhälla $ $ af warorne $ som aktiv wid hivarje öswerträdelse komma at confisqueras $
aktiv		1828	1	bib11653828_18280324_144028_71_0003_alto.xml-13-22	 	Konungen en kraftig föreställning häremot, tillkännagifwande att medel wäl sunneS till utbetalande - af solden för manflap och underbefäl wld den aktiva armen, men att Lfficerarne mäste, i sörhällande t B stna grader, i&to en del af fina löner innesiKx tillika beswärade sig Hr Remisa öfwer widcrbörandes mistbrttk att tillsanda honom i Konungens namn utfärdade befallningar rörande mänadtliga gratifikationers utbeta, lande tit wisia flyddlingar och andra obehöriga personer, äsivensom han skildrade nödwändigheten att minsta utgifterna för bäsh^llningen.	146:152	0:556	Konungen en kraftig föreställning häremot , tillkännagifwande att medel wäl sunneS till utbetalande - af solden för manflap och underbefäl wld den aktiva armen , men att Lfficerarne mäste , i sörhällande t B stna grader , i&to en del af fina löner innesiKx tillika beswärade sig Hr Remisa öfwer widcrbörandes mistbrttk att tillsanda honom i Konungens namn utfärdade befallningar rörande mänadtliga gratifikationers utbeta , lande tit wisia flyddlingar och andra obehöriga personer , äsivensom han skildrade nödwändigheten att minsta utgifterna för bäsh^llningen .	22	0:84	konung en kraftig föreställning häremot $ tillkännagifwande att medel wäl sunnes till utbetala $ af sold för manflap och underbefäl wld den aktiv arm $ men att lfficerarne mäste $ i sörhällande t b stna grad $ $ en del af fin lön innesikx tillika beswärade sig hr remisa öfwer widcrbörandes mistbrttk att tillsanda han i konung namn utfärda befallning rörande mänadtliga gratifikation utbeta $ lande tit wisia flyddlingar och andra obehörig person $ äsivensom han skildra nödwändigheten att liten utgift för $ $
aktiv		1816	1	bib19225772_18160828_148004_98_0004_alto.xml-16-8	 	E. Magnus, svin afwenledes reglerar aua Bolagets Aktiva och	49:55	0:59	E. Magnus , svin afwenledes reglerar aua Bolagets Aktiva och	8	0:10	$ magnus $ svin afwenledes reglera aua bolag aktiv och
aktiv		1829	1	bib19277277_18290406_147682_79_0001_alto.xml-4-13	 	regclmästigt, och man pästär alt 20,000 man stola wara bestämda till ben aktiva Arln^en wid Donau och 30,000 man till Livadien.	73:79	0:127	regclmästigt , och man pästär alt 20,000 man stola wara bestämda till ben aktiva Arln^en wid Donau och 30,000 man till Livadien .	13	0:23	regclmästigt $ och man pästär alt $ man stola wara bestämd till ben aktiv $ wid donau och $ man till livadien $
aktiv		1830	1	bib11653828_18300111_144028_7_0002_alto.xml-0-8	 	infallande krig tvänna klasser beväring genast ingingo i aktiv tjenst, så återstode trenne.	57:62	0:91	infallande krig tvänna klasser beväring genast ingingo i aktiv tjenst , så återstode trenne .	8	0:15	infalla krig tvänna klass beväring genast ingingo i aktiv tjenst $ så återstå trenne $
aktiv		1829	1	bib11653828_18290204_144028_28_0004_alto.xml-3-7	 	häruti skaffa sig ett värn mot den aktiva armén.	35:41	0:48	häruti skaffa sig ett värn mot den aktiva armén .	7	0:10	häruti skaffa sig en värn mot den aktiv armé $
aktiv		1798	1	bib11653828_17980202_144028_27_0002_alto.xml-17-2	 	Jag stak aktiv banara ben fäsom eli dyrbar pant af eder wanjkvp.	9:14	0:64	Jag stak aktiv banara ben fäsom eli dyrbar pant af eder wanjkvp .	2	0:13	jag stake aktiv banara ben fäsom eli dyrbar pant af ni wanjkvp $
aktiv		1827	1	bib11653828_18271004_144028_232_0001_alto.xml-2-6	 	nägot befäl, förr än det aktiva kriget utbröt, i följd hwaraf referenten tagit stg anledning att göra ett flags panegyrik öfwer framlidne H. E. Fältmarffalken Grefwe Esten, utan att jag med ett enda ord i biografien för dest » missöden beffyllt nämnde Fältmarskalk, eller ali dan ens rimligen till General Vegesacks owerkfamhet, i Tuffland ätminstone, kunnat föranleda.	25:31	0:369	nägot befäl , förr än det aktiva kriget utbröt , i följd hwaraf referenten tagit stg anledning att göra ett flags panegyrik öfwer framlidne H . E. Fältmarffalken Grefwe Esten , utan att jag med ett enda ord i biografien för dest » missöden beffyllt nämnde Fältmarskalk , eller ali dan ens rimligen till General Vegesacks owerkfamhet , i Tuffland ätminstone , kunnat föranleda .	6	0:65	nägot befäl $ förr än den aktiv krig utbryta $ i följa hwaraf referent ta stg anledning att göra en flaga panegyrik öfwer framliden h $ $ fältmarffalken grefwe est $ utan att jag med en enda ord i biografi för dest $ missöde beffyllt nämna fältmarskalk $ eller ali dag ens rimligen till general vegesacks owerkfamhet $ i tuffland ätminstone $ kunna föranleda $
aktiv		1822	1	bib19225772_18220104_148004_2_0001_alto.xml-3-5	 	tusen man stola fattas i aktiv tjenst, och genast hafwa 4200 man Linietruppar och 6000 man Provincial Milis uppbrutit till Galliciens gränsor; De stola sammanträffa i Astorga.	25:30	0:175	tusen man stola fattas i aktiv tjenst , och genast hafwa 4200 man Linietruppar och 6000 man Provincial Milis uppbrutit till Galliciens gränsor ; De stola sammanträffa i Astorga .	5	0:30	tusen man stola fatta i aktiv tjenst $ och genast hafwa 4200 man linietruppar och 6000 man provincial milis uppbryta till galliciens gränsor $ de stola sammanträffa i astorga $
aktiv		1830	1	bib11653828_18301015_144028_239_0004_alto.xml-2-24	 	kallas till vapen, indelta i två klasser, den ena utgörande nationalgardet, bestämdt till hemortens försvar, och den andra bildande den aktiva armén, bestående af alle ogifta invånare från 18 till 40 år, 7) Om det behöfs till fiendens fördrifvande, reser sig hela befolkningen i massa, utan afseende på ålder eller kön.	136:142	0:319	kallas till vapen , indelta i två klasser , den ena utgörande nationalgardet , bestämdt till hemortens försvar , och den andra bildande den aktiva armén , bestående af alle ogifta invånare från 18 till 40 år , 7 ) Om det behöfs till fiendens fördrifvande , reser sig hela befolkningen i massa , utan afseende på ålder eller kön .	24	0:61	kalla till vapen $ indelt i två klass $ den ena utgöra nationalgarde $ bestämdt till hemort försvar $ och den andra bildande den aktiv armé $ bestå af alle ogift invånare från 18 till 40 år $ 7 $ om den behöfs till fiende fördrifvande $ resa sig hel befolkning i massa $ utan afseende på ålder eller kön $
aktiv		1816	1	bib19225772_18160827_148004_97_0004_alto.xml-7-8	 	E. Magnus, ftin äfwenledes reglerar alla Bolagets Aktiva och	50:56	0:60	E. Magnus , ftin äfwenledes reglerar alla Bolagets Aktiva och	8	0:10	$ magnus $ ftin äfwenledes reglera all bolag aktiv och
aktiv		1799	1	bib11653828_17990209_144028_34_0002_alto.xml-0-10	 	CJ wik ni fan L lien iste » ofrofrt arbete aktiv b!!	43:48	0:52	CJ wik ni fan L lien iste » ofrofrt arbete aktiv b ! !	10	0:14	cj wik ni fan l lie isy $ ofrofrt arbete aktiv b $ $
aktiv		1829	1	bib11653828_18290121_144028_16_0004_alto.xml-0-29	 	ineralMajor Pankratiews befäl, i distriktet Khoi befintliga trupperna, aftågade dessa till sin nya bestämmelse, oell den 20 November ofvertog General Panktatiew i Baja&id befälet öfver den aktiva armens venstra flygel.	189:195	0:218	ineralMajor Pankratiews befäl , i distriktet Khoi befintliga trupperna , aftågade dessa till sin nya bestämmelse , oell den 20 November ofvertog General Panktatiew i Baja&id befälet öfver den aktiva armens venstra flygel .	29	0:34	ineralmajor pankratiews befäl $ i distrikt khoi befintlig trupp $ aftågade denna till sig ny bestämmelse $ oell den 20 november ofvertog general panktatiew i $ befäl öfver den aktiv arm venstra flygel $
aktiv		1830	1	bib11653828_18301018_144028_241_0003_alto.xml-2-1	 	den aktiva och den passiva personen, Sfvensom sjelfva ceremonien med alla dess detaljer^ äro behandlade med all önsklig utförlighet — Af en motsvarande moralisk styggelse äro de flesta andra karakterer och uppträden här tecknas.	4:10	0:228	den aktiva och den passiva personen , Sfvensom sjelfva ceremonien med alla dess detaljer^ äro behandlade med all önsklig utförlighet — Af en motsvarande moralisk styggelse äro de flesta andra karakterer och uppträden här tecknas .	1	0:36	den aktiv och den passiv person $ sfvensom sjelfva ceremoni med all den $ äro behandla med all önsklig utförlighet $ af en motsvara moralisk styggelse äro en mången andra karakter och uppträde här teckna $
aktiv		1825	1	bib11653828_18250322_144028_67_0002_alto.xml-9-22	 	bruka nominativen än ackusaliven af plurala, ur Lalincn tagna proprior; säledeS Carré, Philippi, liksom Caune, Delphi- De aktiva verberna ha i öfwcrsältningen pä urgammalt wis bchällil de Latinskas rektion.	122:128	0:206	bruka nominativen än ackusaliven af plurala , ur Lalincn tagna proprior ; säledeS Carré , Philippi , liksom Caune , Delphi- De aktiva verberna ha i öfwcrsältningen pä urgammalt wis bchällil de Latinskas rektion .	22	0:35	bruka nominativ än ackusaliven af plural $ ur lalincn ta proprior $ säledes carré $ philippi $ liksom caune $ $ en aktiv verb ha i öfwcrsältningen pä urgammal wis bchällil en latinsk rektion $
aktiv		1807	1	bib19225772_18071118_148004_132_0002_alto.xml-13-7	 	Läsare » ogillar således icke äfiyen ert aktivt bruk af	41:47	0:55	Läsare » ogillar således icke äfiyen ert aktivt bruk af	7	0:10	läsare $ ogilla således icke äfiyen ni aktiv bruk af
aktiv		1829	1	bib11653828_18290416_144028_88_0003_alto.xml-4-28	 	Ryska trupperna framrycka från alla håll emöt Donau, och det är väl ingen tvifvel underkastadt, att man arnar blockera de Turluska Denan fästningarna och tillika operera aktivt ifrån Varna.	170:176	0:189	Ryska trupperna framrycka från alla håll emöt Donau , och det är väl ingen tvifvel underkastadt , att man arnar blockera de Turluska Denan fästningarna och tillika operera aktivt ifrån Varna .	28	0:32	rysk trupp framrycka från all håll emöt donau $ och den vara väl ingen tvifvel underkastadt $ att man arnar blockera en turluska denan fästning och tillika operera aktiv ifrån varna $
aktiv		1802	1	bib11653825_18021216_145134_150_0002_alto.xml-5-2	 	wid den aktiva Armäen, stola inom 8 dagar inställa sig.	8:14	0:55	wid den aktiva Armäen , stola inom 8 dagar inställa sig .	2	0:12	wid den aktiv armäen $ stola inom 8 dag inställa sig $
aktiv		1826	1	bib11653828_18260708_144028_155_0002_alto.xml-3-23	 	uppbädade till tjenstgöring; genom ett k kesta dagar utiärdadt cirkulär frän Krigsministern hemförlofwas 17 af dessa regementcr och blott tolf bibehållas i aktiv ' tjust, oberäknade grenadrerkompanierna, som införlifwas med Kongl, gardet.	156:161	0:238	uppbädade till tjenstgöring ; genom ett k kesta dagar utiärdadt cirkulär frän Krigsministern hemförlofwas 17 af dessa regementcr och blott tolf bibehållas i aktiv ' tjust , oberäknade grenadrerkompanierna , som införlifwas med Kongl , gardet .	23	0:37	uppbädade till tjenstgöring $ genom en k kesta dag utiärdadt cirkulär frän krigsminister hemförlofwas 17 af denna regementcr och blott tolf bibehålla i aktiv $ tjusa $ oberäknad grenadrerkompanierna $ som införlifwas med kongl $ garde $
aktiv		1824	1	bib11653828_18240522_144028_118_0003_alto.xml-11-4	 	låtit anteckna sig till aktiv tjenstgöring, hafwa tills widare blvkt 3,000 blifwit antagne, dels för att icke alltför mycket blotta hufwudstaden pK mili » tärcr, dels af financiella orsaker Dessa trupper äro fördelta pa tjugu i hamnen liggande transportfartyg, och stola med första gynnande wind gä under segel.	24:29	0:311	låtit anteckna sig till aktiv tjenstgöring , hafwa tills widare blvkt 3,000 blifwit antagne , dels för att icke alltför mycket blotta hufwudstaden pK mili » tärcr , dels af financiella orsaker Dessa trupper äro fördelta pa tjugu i hamnen liggande transportfartyg , och stola med första gynnande wind gä under segel .	4	0:53	låta anteckna sig till aktiv tjenstgöring $ hafwa tills widare blvkt $ blifwit anta $ dels för att icke alltför mycket blott hufwudstaden pk mili $ tärcr $ dels af financiella orsak denna trupp äro fördelta pa tjugu i hamn ligga transportfartyg $ och stola med första gynnande wind gä under segel $
aktiv		1829	1	bib11653828_18290225_144028_46_0003_alto.xml-8-15	 	erbjuder fyra månader till förrättande af alla landtmannasyslor, hvilka just äro årstiden för ett aktivt krigs förande.	98:104	0:119	erbjuder fyra månader till förrättande af alla landtmannasyslor , hvilka just äro årstiden för ett aktivt krigs förande .	15	0:19	erbjuda fyra månad till förrätta af all landtmannasyslor $ hvilka just äro årstid för en aktiv krig förande $
aktiv		1812	1	bib19225772_18121007_148004_114_0001_alto.xml-0-4	 	' lhafioaren för alla aktiva Armeerne, Generalen af Infanteriet Först Golonitschew Kutusow, inberättar till Kejsaren frän Högqwarteret wid Kyrkobyn Bsrodins följande: Af d.	22:28	0:172	' lhafioaren för alla aktiva Armeerne , Generalen af Infanteriet Först Golonitschew Kutusow , inberättar till Kejsaren frän Högqwarteret wid Kyrkobyn Bsrodins följande : Af d .	4	0:27	$ lhafioaren för all aktiv armeerne $ general af infanteri först golonitschew kutusow $ inberätta till kejsare frän högqwarteret wid kyrkobyn bsrodins följande $ af d $
aktiv		1802	1	bib11653828_18020317_144028_62_0002_alto.xml-6-9	 	» 4 polenser werka sä mot hwcirandra att ben aktiva principens 7 poleufer werka frän centrum till periferien, och genom deras tendens till form bilda de den nedstigande ordningen frän l fia 7.	45:51	0:192	» 4 polenser werka sä mot hwcirandra att ben aktiva principens 7 poleufer werka frän centrum till periferien , och genom deras tendens till form bilda de den nedstigande ordningen frän l fia 7 .	9	0:35	$ 4 polenser werka sä mot hwcirandra att ben aktiv princip 7 poleufer werka frän centrum till periferi $ och genom de tendens till form bilda en den nedstiga ordning frän l fia 7 $
aktiv		1829	1	bib11653828_18290909_144028_208_0003_alto.xml-11-13	 	det förljudes, äro alla permitterade militärer af kongl, gärdet inkallade tilt aktiv tjenstgöring.	79:84	0:98	det förljudes , äro alla permitterade militärer af kongl , gärdet inkallade tilt aktiv tjenstgöring .	13	0:16	den förljudas $ äro all permittera militär af kongl $ gärde inkalla tilt aktiv tjenstgöring $
aktiv		1829	1	bib11653828_18290314_144028_61_0004_alto.xml-3-16	 	ärnade äfven medelst lottning uttaga Zs.oSo man lill krigstjenst; af det.manskap sorn öfverblefve efter den aktiva arméns kompletterande, skulle formeras nya regementer alt användas emot Amerika.	108:114	0:195	ärnade äfven medelst lottning uttaga Zs.oSo man lill krigstjenst ; af det.manskap sorn öfverblefve efter den aktiva arméns kompletterande , skulle formeras nya regementer alt användas emot Amerika .	16	0:29	ärna äfven medelst lottning uttaga $ man lill krigstjenst $ af $ sorn öfverblefve efter den aktiv armé komplettera $ skola formera ny regementer alt använda emot amerika $
aktiv		1829	1	bib19277277_18290220_147682_42_0001_alto.xml-4-68	 	ömse sidor synas härarne intagit sina winker » qwarter, och Turkista Soldaten lycke- ej ännu kunna undertrycka sin owilja söv ett winterf.ilttäg; ty enligt ärckilliga bref frän Constailtinopel wandra de irrsgulie.ra trupperna wid Balkan ifrån sine stationer, sör att, efter gammatt bruk, tillbringa wintern, fo » i del beier, wid egen brasa / Blott pä en punkt tyckes dek ännu gä aktivt tillwäga, nemligen i Liwadien, Beorien ech Tkarnanien, hwarcst Demetrius Ipsilanti, nästan utan att oroas, marscherar genom det incllan wikarne af Salo ' a och ^eirun liggande landet och, som det syne-, sätter sig i besittning af åistilliga befästade platser.	380:386	0:646	ömse sidor synas härarne intagit sina winker » qwarter , och Turkista Soldaten lycke- ej ännu kunna undertrycka sin owilja söv ett winterf.ilttäg ; ty enligt ärckilliga bref frän Constailtinopel wandra de irrsgulie.ra trupperna wid Balkan ifrån sine stationer , sör att , efter gammatt bruk , tillbringa wintern , fo » i del beier , wid egen brasa / Blott pä en punkt tyckes dek ännu gä aktivt tillwäga , nemligen i Liwadien , Beorien ech Tkarnanien , hwarcst Demetrius Ipsilanti , nästan utan att oroas , marscherar genom det incllan wikarne af Salo ' a och ^eirun liggande landet och , som det syne- , sätter sig i besittning af åistilliga befästade platser .	68	0:116	ömse sida syna här inta sig winker $ qwarter $ och turkista soldat $ ej ännu kunna undertrycka sig owilja söva en $ $ ty enligt ärckilliga bref frän constailtinopel wandra en $ trupp wid balkan ifrån sine station $ sör att $ efter gammatt bruk $ tillbringa wintern $ fo $ i del beier $ wid egen brasa $ blott pä en punkt tycka dek ännu gä aktiv tillwäga $ nemligen i liwadien $ beorien ech tkarnanien $ hwarcst demetrius ipsilanti $ nästan utan att oroa $ marschera genom den incllan wikarne af salo $ a och $ ligga land och $ som den $ $ sätta sig i besittning af åistilliga befästade plats $
aktiv		1829	1	bib11653823_18290908_0_207_0002_alto.xml-12-14	 	As de sedan korrt tiv enrollerade 80,000 man är ungefär hälften r.dan satt i aktivt tillstånd.	77:83	0:94	As de sedan korrt tiv enrollerade 80,000 man är ungefär hälften r.dan satt i aktivt tillstånd .	14	0:17	as de sedan korrt tiv enrollera $ man vara ungefär hälft $ sitta i aktiv tillstånd $
aktiv		1829	1	bib11653828_18290915_144028_213_0002_alto.xml-8-3	 	ÖfverBefälhafvaren tor den aktiva armén Ilar till Dans Majit insändt rapporter örn dess operation till den i3 dennes, hvaraf följande är det hufvudsakliga: Efter fiendens reträtt från Järnbol beordrades GeneralMajorerne Ragowski och Sawadski att sälla sig i besittning af defiléerna vid Tschelikawak och Tschenge, sorn ännu vörö i Turkarnes våld, äfvensom GeneralLöjtnant Krassowski anbefalldes att från Marasch utföra en rörelse rnot Schumla, i afsigt att komma i närmare förbindelse med hufvudarmén.	27:33	0:501	ÖfverBefälhafvaren tor den aktiva armén Ilar till Dans Majit insändt rapporter örn dess operation till den i3 dennes , hvaraf följande är det hufvudsakliga : Efter fiendens reträtt från Järnbol beordrades GeneralMajorerne Ragowski och Sawadski att sälla sig i besittning af defiléerna vid Tschelikawak och Tschenge , sorn ännu vörö i Turkarnes våld , äfvensom GeneralLöjtnant Krassowski anbefalldes att från Marasch utföra en rörelse rnot Schumla , i afsigt att komma i närmare förbindelse med hufvudarmén .	3	0:77	öfverbefälhafvare tor den aktiv armé ila till dan maji insändt rapport örn den operation till den i3 denna $ hvaraf följande vara den hufvudsaklig $ efter fiende reträtt från järnbol beordra generalmajorerne ragowski och sawadski att säll sig i besittning af defilé vid tschelikawak och tschenge $ sorn ännu vörö i turk våld $ äfvensom generallöjtnant krassowski anbefalla att från marasch utföra en rörelse rnot schumla $ i afsigt att komma i nära förbindelse med hufvudarmén $
aktiv		1794	1	bib11653828_17941128_144028_273_0003_alto.xml-9-30	 	Konunga-Magtenö fortfarande: men del förtryter mig, at en man st.. l arcklagas säsom Högförrädare blott derföre at han talar om Männistjuns Rättigheter — — Jag päminncr mig aktiv hwad Johnson fade när Lord Gordon fridomdes:" Jaghatar Lord Gordon, men jag tyckerom at han blifwit frikänd; ty jerg Listar mit Fädernesland och mig stielf".	173:178	0:336	Konunga-Magtenö fortfarande : men del förtryter mig , at en man st .. l arcklagas säsom Högförrädare blott derföre at han talar om Männistjuns Rättigheter — — Jag päminncr mig aktiv hwad Johnson fade när Lord Gordon fridomdes : " Jaghatar Lord Gordon , men jag tyckerom at han blifwit frikänd ; ty jerg Listar mit Fädernesland och mig stielf " .	30	0:62	$ fortfarande $ men del förtryta jag $ at en man st $ l arcklagas säsom högförrädare blott derföre at han tala om männistjuns rättighet $ $ jag päminncr jag aktiv hwad johnson fade när lord gordon fridomdes $ $ jaghatar lord gordon $ men jag tyckerom at han blifwit frikänna $ ty jerg lista mit fädernesland och jag stielf $ $
aktiv		1802	1	bib19223423_18020519_145063_40_0003_alto.xml-2-1	 	Fregatten Aktive ifrån Gibraltar, och dä Kapitencn icke wille puukiligen foga sig e ' ler författningarna, rörande qwarantänen, blcf han iifftfa med en niis Engelff Kapiten och cn del af manstapet tagen i arrest.	10:16	0:212	Fregatten Aktive ifrån Gibraltar , och dä Kapitencn icke wille puukiligen foga sig e ' ler författningarna , rörande qwarantänen , blcf han iifftfa med en niis Engelff Kapiten och cn del af manstapet tagen i arrest .	1	0:38	fregatt aktiv ifrån gibraltar $ och dä kapitencn icke wille puukiligen foga sig e $ le författning $ rörande qwarantänen $ blcf han iifftfa med en niis engelff kapiten och cn del af manstapet ta i arrest $
