lemma	pos	date	grouping	identifier	description	context	indexes_target_token	indexes_target_sentence	context_tokenized	indexes_target_token_tokenized	indexes_target_sentence_tokenized	context_lemmatized
aktiv		1795	1	bib11653792_17950502_146919_18_0001_alto.xml-1-2	 	Hon ^yncs aktiv munter, men Prinsen sällan rätt glad.	10:15	0:53	Hon ^yncs aktiv munter , men Prinsen sällan rätt glad .	2	0:11	hon $ aktiv munter $ men prins sällan rätt glad $
aktiv		1829	1	bib11653828_18290218_144028_40_0003_alto.xml-1-12	 	Det förljudes nu, alt styrkan af detta slags trupper vid den aktiva operations-armén skall okas till trellie regementer (" ungefär 5o, ooo man).	61:67	0:144	Det förljudes nu , alt styrkan af detta slags trupper vid den aktiva operations-armén skall okas till trellie regementer ( " ungefär 5o , ooo man ) .	12	0:28	den förljudas nu $ alt styrka af denna slag trupp vid den aktiv $ skola oka till trellie regementer $ $ ungefär 5o $ ooo man $ $
aktiv		1822	1	bib19223423_18221026_145063_86_0002_alto.xml-3-21	 	°) I Berlin är en Förordning utkommen rörande werkställigheten af Civi! » Dom« stolars U stag emot Militärprrioner HsS aktiva (fbrmodel.	119:125	0:136	° ) I Berlin är en Förordning utkommen rörande werkställigheten af Civi ! » Dom« stolars U stag emot Militärprrioner HsS aktiva ( fbrmodel .	21	0:25	$ $ i berlin vara en förordning $ rörande werkställighet af civi $ $ $ stol u stag emot militärprrioner hss aktiv $ fbrmodel $
aktiv		1792	1	bib11653828_17920308_144028_57_0002_alto.xml-5-8	 	Skulle man wal gista til at hwartenda kommer aktiv af nägot	45:50	0:59	Skulle man wal gista til at hwartenda kommer aktiv af nägot	8	0:11	skola man wal gista til at hwartenda komma aktiv af nägot
aktiv		1813	1	bib19225772_18130202_148004_12_0002_alto.xml-15-11	 	uttagas bland dem, hwilke ännu icke blifwit kallade till den aktiva Armeen, c) 150,000 man af konstriptioncn för är 1814.	61:67	0:121	uttagas bland dem , hwilke ännu icke blifwit kallade till den aktiva Armeen , c ) 150,000 man af konstriptioncn för är 1814 .	11	0:24	uttagas bland de $ hwilke ännu icke blifwit kalla till den aktiv armeen $ c $ $ man af konstriptioncn för vara 1814 $
aktiv		1805	1	bib11653825_18050204_145134_14_0002_alto.xml-11-23	 	i Frankrike för nasta Sr kommer, likasom i är, att besia af 60,200 man, hwaraf hälften är bestämd för de aktiva Armecrne och hälften för RcserftArmecn.	105:111	0:151	i Frankrike för nasta Sr kommer , likasom i är , att besia af 60,200 man , hwaraf hälften är bestämd för de aktiva Armecrne och hälften för RcserftArmecn .	23	0:30	i frankrike för nasta sr komma $ likasom i vara $ att besia af $ man $ hwaraf hälft vara bestämd för en aktiv armecrne och hälft för rcserftarmecn $
aktiv		1811	1	bib11653792_18111012_146919_41_0002_alto.xml-12-1	 	som aktiv will bära det kostbara och nya, af stg sjelf komma til det naturliga och enkla; Astwingar Ni henne det sä werkar dock twäng ingen bättring, och med första frihet utbryter Mode-sjukan i löjcliga och kostbara fymptomer.	4:9	0:227	som aktiv will bära det kostbara och nya , af stg sjelf komma til det naturliga och enkla ; Astwingar Ni henne det sä werkar dock twäng ingen bättring , och med första frihet utbryter Mode-sjukan i löjcliga och kostbara fymptomer .	1	0:42	som aktiv will bära den kostbar och ny $ af stg sjelf komma til den naturlig och enkel $ astwingar ni hon den sä werkar dock twäng ingen bättring $ och med första frihet utbryta $ i löjcliga och kostbar fymptomer $
aktiv		1821	1	bib19225772_18210321_148004_34_0002_alto.xml-6-8	 	redan förklarat sig att antaga befälet öfwer z aktiva Divisioner.	47:53	0:65	redan förklarat sig att antaga befälet öfwer z aktiva Divisioner .	8	0:11	redan förklara sig att anta befäl öfwer z aktiv division $
aktiv		1807	1	bib11653792_18070711_146919_28_0002_alto.xml-6-3	 	De fattige fä aktiv mäst för stna penningar när de köpa pä de	14:19	0:61	De fattige fä aktiv mäst för stna penningar när de köpa pä de	3	0:13	en fattig fä aktiv mäst för stna penning när de köpa pä en
aktiv		1827	1	bib11653828_18270426_144028_96_0001_alto.xml-4-30	 	I Bolivia är ben pä lifstld ' utnä, nnde Presidenten denna punkt P8 honom beror hela regelmessigheten i wärk system, utan att han derföre är berättigad till nägon aktiv inblandning.	163:168	0:181	I Bolivia är ben pä lifstld ' utnä , nnde Presidenten denna punkt P8 honom beror hela regelmessigheten i wärk system , utan att han derföre är berättigad till nägon aktiv inblandning .	30	0:33	i bolivia vara ben pä lifstld $ utnä $ nnde president denna punkt p8 han bero hel regelmessigheten i wärk system $ utan att han derföre vara berättiga till nägon aktiv inblandning $
aktiv		1791	1	bib11653828_17910510_144028_106_0002_alto.xml-5-12	 	H » vilkin stulle icke önska sig denna, ofta nyttiga, aktiv behagliga svaghet,	54:59	0:78	H » vilkin stulle icke önska sig denna , ofta nyttiga , aktiv behagliga svaghet ,	12	0:16	h $ vilkin stulle icke önska sig denna $ ofta nyttig $ aktiv behaglig svaghet $
aktiv		1823	1	bib19277346_18230816_147394_33_0003_alto.xml-11-2	 	Der är aktiv rädeligt att St himlen kfmrläta omsorgen att straffa	7:12	0:65	Der är aktiv rädeligt att St himlen kfmrläta omsorgen att straffa	2	0:11	der vara aktiv rädeligt att st himmel kfmrläta omsorg att straffa
aktiv		1895	2	bib15873371_18950813_145112_218_0002_alto.xml-45-16	 	står följande: » Under loppet af hvart qvartår skall kontrollrådet minst en gång genomgå illa aktiva och tillse, att bokföring egt rum till dagen före tillsynen.... samt för öfrigt tillse allt hvad som det an-j ser nödvändigt ».	94:100	0:228	står följande : » Under loppet af hvart qvartår skall kontrollrådet minst en gång genomgå illa aktiva och tillse , att bokföring egt rum till dagen före tillsynen .... samt för öfrigt tillse allt hvad som det an-j ser nödvändigt » .	16	0:42	stå följa $ $ under lopp af hvart qvartår skola kontrollråd föga en gång genomgå illa aktiv och tillse $ att bokföring egt rum till dag före tillsyn $ samt för öfrig tillse allt hvad som den $ se nödvändig $ $
aktiv		1895	2	bib15978012_18950617_148361_138_0002_alto.xml-38-1	 	Äfven aktivt deltog han i de offentliga angelägenheterna inom den stad, där han under tidigare som senare mannaålder satts att verka.	6:12	0:133	Äfven aktivt deltog han i de offentliga angelägenheterna inom den stad , där han under tidigare som senare mannaålder satts att verka .	1	0:23	äfven aktiv delta han i en offentlig angelägenhet inom den stad $ där han under tidig som sen mannaålder sätta att verka $
aktiv		1895	2	bib15975087_18951018_145596_161_0003_alto.xml-66-18	 	nes gemål skildras däremot som en svag energilös man, som för länge sedan upphört att taga någon aktiv del i sitt lands regering.	97:102	0:129	nes gemål skildras däremot som en svag energilös man , som för länge sedan upphört att taga någon aktiv del i sitt lands regering .	18	0:25	nes gemål skildra däremot som en svag energilös man $ som för länge sedan upphöra att ta någon aktiv del i sig land regering $
aktiv		1895	2	bib19225758_18950425_144022_95_0001_alto.xml-4-1	 	De aktiva gymnaster, som äro hågade att deltaga, uppmanas särskildt att infinna sig.	3:9	0:84	De aktiva gymnaster , som äro hågade att deltaga , uppmanas särskildt att infinna sig .	1	0:16	en aktiv gymnast $ som äro hågad att delta $ uppmana särskildt att $ sig $
aktiv		1900	2	bib11653838_19001221_147024_51_0001_alto.xml-44-45	 	skyttegille lossats 35, 523; ät ven här står Streninge gillet i andra rummet med 12, 330, Norrköping: med 10,904 o. s. v; det unga (1899 bildade) Finspongs gill * kommer med en skottsiffra af 10,610 på 71 aktiva skyttar.	205:211	0:220	skyttegille lossats 35 , 523 ; ät ven här står Streninge gillet i andra rummet med 12 , 330 , Norrköping : med 10,904 o. s. v ; det unga ( 1899 bildade ) Finspongs gill * kommer med en skottsiffra af 10,610 på 71 aktiva skyttar .	45	0:48	skyttegille lossa 35 $ 523 $ äta ven här stå streninge gille i andra rum med 12 $ 330 $ norrköping $ med $ $ $ v $ den ung $ 1899 bilda $ finspongs gill $ komma med en skottsiffra af $ på 71 aktiv skytt $
aktiv		1895	2	bib19277277_18951225_147683_352_0004_alto.xml-114-1	 	» aktiva milisen », som tjenstgör i 3 år och	2:8	0:44	» aktiva milisen » , som tjenstgör i 3 år och	1	0:11	$ aktiv milis $ $ som tjenstgöra i 3 år och
aktiv		1896	2	bib11653790_18960131_145648_5_0006_alto.xml-71-2	 	honom till aktiv deltagare strandade lika mycke: mot hans drumliga ben som mot hans ohjälpliga slöhet.	11:16	0:102	honom till aktiv deltagare strandade lika mycke : mot hans drumliga ben som mot hans ohjälpliga slöhet .	2	0:18	han till aktiv deltagare stranda lika mycke $ mot han drumlig ben som mot han ohjälplig slöhet $
aktiv		1900	2	bib11653811_19000207_145317_20_0002_alto.xml-10-20	 	» Sweden » af Oskarshamn om 168 reg.ton har sålts till rederi i Marstal för 31,000 kr., skonerten » Aktiv » af Brantevik till rederi i Pataholm för 6,000 kr.	100:105	0:157	» Sweden » af Oskarshamn om 168 reg.ton har sålts till rederi i Marstal för 31,000 kr. , skonerten » Aktiv » af Brantevik till rederi i Pataholm för 6,000 kr .	20	0:32	$ sweden $ af oskarshamn om 168 $ ha sälja till rederi i marstal för $ $ $ skonert $ aktiv $ af brantevik till rederi i pataholm för $ kr $
aktiv		1899	2	bib11653811_18991216_145317_194_0006_alto.xml-62-22	 	innehålla ett upprop till mi lisen att ställa sig under fanorna och göra garnisonstjenst, så att hela rikets disponibla trupper i aktiv tjenst kunna af sändas till Sydafrika.	130:135	0:174	innehålla ett upprop till mi lisen att ställa sig under fanorna och göra garnisonstjenst , så att hela rikets disponibla trupper i aktiv tjenst kunna af sändas till Sydafrika .	22	0:30	innehålla en upprop till mi lisen att ställa sig under fana och göra garnisons $ så att hel rike disponibel trupp i aktiv tjenst kunna af sända till sydafrika $
aktiv		1895	2	bib15873371_18950318_145112_76_0003_alto.xml-113-42	 	— Den konkurrens, som man fruktar att finna hos en gemensam konsul, när olika intressen göra sig gällande — ett fall Born i verkligheten så ytterst sällan skall inträffa —, den skall ju uppenbarligen bli långt mer påtaglig och aktiv, om man i samma hamn ber både en norsk och en svensk konsul.	227:232	0:293	— Den konkurrens , som man fruktar att finna hos en gemensam konsul , när olika intressen göra sig gällande — ett fall Born i verkligheten så ytterst sällan skall inträffa — , den skall ju uppenbarligen bli långt mer påtaglig och aktiv , om man i samma hamn ber både en norsk och en svensk konsul .	42	0:58	$ den konkurrens $ som man frukta att finna hos en gemensam konsul $ när olik intresse göra sig gälla $ en fall born i verklighet så ytterst sällan skola inträffa $ $ den skola ju uppenbarligen bli lång mer påtaglig och aktiv $ om man i samma hamn be både en norsk och en svensk konsul $
aktiv		1898	2	bib11653811_18980202_145317_18_0003_alto.xml-27-4	 	Riksdagen regelbundet bland de aktiva statsembetsmännen, får sitta på den ansvarsfulla platsen stundom några månader, stundom längre, oell flyttas derefter af Kongl.	31:37	0:165	Riksdagen regelbundet bland de aktiva statsembetsmännen , får sitta på den ansvarsfulla platsen stundom några månader , stundom längre , oell flyttas derefter af Kongl .	4	0:26	riksdag regelbunden bland en aktiv statsembetsmännen $ få sitta på den ansvarsfull plats stundom någon månad $ stundom länge $ oell flytta derefter af kongl $
aktiv		1895	2	bib15650814_18950917_146365_217_0001_alto.xml-87-0	 	aktiva medlemmar kallas till allmän årssam mankomst ä Lilla hotellsalongen fredagen den SiO september kl. precis 7 e. m. Obs.J Viktiga frågor angående sällskapets verksamhet under arbetsåret.	0:6	0:191	aktiva medlemmar kallas till allmän årssam mankomst ä Lilla hotellsalongen fredagen den SiO september kl. precis 7 e. m . Obs.J Viktiga frågor angående sällskapets verksamhet under arbetsåret .	0	0:29	aktiv medlem kalla till allmän årssam mankomst ä liten hotellsalongen fredag den sio september $ precis 7 $ m $ $ viktig fråga angående sällskap verksamhet under arbetsår $
aktiv		1895	2	bib15975087_18950916_145596_143_0003_alto.xml-91-44	 	» Le Figaro » tillfogar, att den ryska pressan ju aldrig publicerar någon annan mening än den, sorn är rådande på högsta ort, och afsikten med parisertidningens artikel är då att hänleda uppmärksamheten på, huru redan förmodandet att en mera aktiv engelsk utrikespolitik är förestående sätter Rysslands varma känslor för Frankrike i ytterligare stark spänning.	242:247	0:360	» Le Figaro » tillfogar , att den ryska pressan ju aldrig publicerar någon annan mening än den , sorn är rådande på högsta ort , och afsikten med parisertidningens artikel är då att hänleda uppmärksamheten på , huru redan förmodandet att en mera aktiv engelsk utrikespolitik är förestående sätter Rysslands varma känslor för Frankrike i ytterligare stark spänning .	44	0:60	$ le figaro $ tillfoga $ att den rysk pressan ju aldrig publicera någon annan mening än den $ sorn vara rå på hög ort $ och afsikt med parisertidningens artikel vara då att hänleda uppmärksamhet på $ huru redan förmodande att en mera aktiv engelsk utrikespolitik vara förestå sätta ryssland varm känsla för frankrike i ytterlig stark spänning $
aktiv		1901	2	bib11653790_19010118_145648_5_0003_alto.xml-38-11	 	Då redan nu ett antal af 32 personer tecknat sig såsom aktiva medlemmar ', beslöts bildandet af en själfständig skytteförening under namn af » Krylbo frivilliga skyttegille », hvilket skulle ansluta sig till Dalarnes skytteförhund.	55:61	0:231	Då redan nu ett antal af 32 personer tecknat sig såsom aktiva medlemmar ' , beslöts bildandet af en själfständig skytteförening under namn af » Krylbo frivilliga skyttegille » , hvilket skulle ansluta sig till Dalarnes skytteförhund .	11	0:38	då redan nu en antal af 32 person teckna sig såsom aktiv medlem $ $ besluta bildande af en själfständig skytteförening under namn af $ krylbo frivillig skyttegille $ $ hvilket skola ansluta sig till dal skytteförhund $
aktiv		1898	2	bib11653811_18981125_145317_182_0003_alto.xml-114-16	 	från tillförlitligt håll meddelats St.-T., kommer prins Eugen inom kort att uppgifva sin ställning såsom aktiv officer.	105:110	0:119	från tillförlitligt håll meddelats St.-T. , kommer prins Eugen inom kort att uppgifva sin ställning såsom aktiv officer .	16	0:19	från tillförlitlig håll meddela $ $ komma prins eugen inom kort att uppgifva sig ställning såsom aktiv officer $
aktiv		1895	2	bib11653836_18950524_147011_21_0004_alto.xml-88-33	 	Härens aktiva styrka utgjorde i Maj 1894 100,000 man; denna styrka kan dock enligt Japans härorganisation betydligt ökas, och då en sådan ökning nu utan tvifvel skall företagas, kommer den aktiva styrkan att kunna uppbringas till innemot 300,000 man.	189:195	0:250	Härens aktiva styrka utgjorde i Maj 1894 100,000 man ; denna styrka kan dock enligt Japans härorganisation betydligt ökas , och då en sådan ökning nu utan tvifvel skall företagas , kommer den aktiva styrkan att kunna uppbringas till innemot 300,000 man .	33	0:43	här aktiv styrka utgöra i maj 1894 $ man $ denna styrka kunna dock enligt japan härorganisation betydlig öka $ och då en sån ökning nu utan tvifvel skola företa $ komma den aktiv styrka att kunna uppbringa till innemot $ man $
aktiv		1895	2	bib19225758_18950504_144022_103_0006_alto.xml-194-5	 	Sammanträde med medlemmar i den aktiva gruppen hölls i söndags, därvid meddelades styrelsens och revisorernas berättelse samt beviljades ansvarsfrihet för det gångna årets förvaltning.	32:38	0:184	Sammanträde med medlemmar i den aktiva gruppen hölls i söndags , därvid meddelades styrelsens och revisorernas berättelse samt beviljades ansvarsfrihet för det gångna årets förvaltning .	5	0:26	sammanträde med medlem i den aktiv grupp hålla i söndag $ därvid meddela styrelse och revisor berättelse samt bevilja ansvarsfrihet för den gångna år förvaltning $
aktiv		1896	2	bib15873936_18961017_147385_121_0002_alto.xml-133-3	 	blott af de aktiva, gäller endast, så länge soldaten är medlem af orden, och afgifves ej för lifstiden.	12:18	0:103	blott af de aktiva , gäller endast , så länge soldaten är medlem af orden , och afgifves ej för lifstiden .	3	0:22	blott af en aktiv $ gälla endast $ så länge soldat vara medlem af ord $ och afgifves ej för lifstid $
aktiv		1895	2	bib19277277_18951105_147683_302_0001_alto.xml-28-22	 	D« personer, tom ön.ka genomgå fullständig aamaritkurs nied 5 lektioner linder loppet uf två och en half vecka oeh derigenom blifva aktiva medlemmar af Svenska Sntnnritföreningen, kunna derom göra anmälan mnntligen ellar holst skriftligen hos Regementsintendenten TOU Heijne, Östermalmsgatan AS 57, eller genom anteckning å för ändamålet framlagd lista 1 Hrr Samson & Wallins Bokhandel, lii 7 Drottninggatan.	132:138	0:408	D« personer , tom ön.ka genomgå fullständig aamaritkurs nied 5 lektioner linder loppet uf två och en half vecka oeh derigenom blifva aktiva medlemmar af Svenska Sntnnritföreningen , kunna derom göra anmälan mnntligen ellar holst skriftligen hos Regementsintendenten TOU Heijne , Östermalmsgatan AS 57 , eller genom anteckning å för ändamålet framlagd lista 1 Hrr Samson & Wallins Bokhandel , lii 7 Drottninggatan .	22	0:64	$ person $ tom $ genomgå fullständig aamaritkurs nied 5 lektion linder lopp uf två och en half vecka oeh derigenom blifva aktiv medlem af svensk sntnnritföreningen $ kunna derom göra anmälan mnntligen ellar holst skriftligen hos regementsintendent tou heijne $ östermalmsgatan as 57 $ eller genom anteckning å för ändamål framlagd lista 1 hrr samson $ wallin bokhandel $ lii 7 drottninggatan $
aktiv		1895	2	bib19277349_18950919_147403_120_0001_alto.xml-47-4	 	och uppmanas aila Gillets aktiva medlemmar, som ännu ej för året skiutit 60 skott, att gära detta, på det statsunderstöd för dem må erhållas.	26:32	0:141	och uppmanas aila Gillets aktiva medlemmar , som ännu ej för året skiutit 60 skott , att gära detta , på det statsunderstöd för dem må erhållas .	4	0:28	och uppmana aila gille aktiv medlem $ som ännu ej för år skiutit 60 skott $ att gära denna $ på den statsunderstöd för de må erhålla $
aktiv		1897	2	bib11653790_18971203_145648_95_0005_alto.xml-36-19	 	Intet under därför, att Goldmanns borgenä rer blefvo vid dåligt lynne, sedan de efter konkursen undersökt gäldenärens aktiva.	118:124	0:125	Intet under därför , att Goldmanns borgenä rer blefvo vid dåligt lynne , sedan de efter konkursen undersökt gäldenärens aktiva .	19	0:21	intet under därför $ att goldmanns borgenä rer blefvo vid dålig lynne $ sedan de efter konkurs undersöka gäldenär aktiv $
aktiv		1895	2	bib19227462_18950506_147640_104_0006_alto.xml-312-16	 	Tyska riksbankens veckorapport den 2 maj, jemförd med nästförutpångna vecka utvisar följande hufvudsakiiga förändringar: Aktiva.	121:127	0:128	Tyska riksbankens veckorapport den 2 maj , jemförd med nästförutpångna vecka utvisar följande hufvudsakiiga förändringar : Aktiva .	16	0:18	tysk riksbank veckorapport den 2 maj $ jemföra med nästförutpångna vecka utvisa följa hufvudsakiiga förändring $ aktiv $
aktiv		1897	2	bib11653811_18970426_145317_63_0004_alto.xml-83-9	 	Från Athén telegraferas: Allmänna meningen kräfver ett mera aktivt ingripande af konung Georg, som anses hålla sig väl mycket tillbaka.	60:66	0:135	Från Athén telegraferas : Allmänna meningen kräfver ett mera aktivt ingripande af konung Georg , som anses hålla sig väl mycket tillbaka .	9	0:23	från athén telegrafera $ allmän mening kräfva en mera aktiv ingripande af konung georg $ som anse hålla sig väl mycket tillbaka $
aktiv		1895	2	bib15650837_18951105_146391_258_0002_alto.xml-108-25	 	För att vinna de enropeiska makternas bifall och medverkan dertill lät Carl Joban Sverige förbinda sig till de uppoffringar och den risk, sorn ett aktivt uppträdande i den stora striden mot Frankrikes mäktige kejsare måste medförs; med deras stöd tvång ban Danmark att genom freden i Kiel, mot erhållande af Sveriges sista besittning på andra sidan Östersjön, afträda Norge tili Sverige och nödgade derpå norrmännen att till Norges konung » välja och erkänna » Sveriges mot de vilkor, sorn från svenska sidan medgåfvoe den 4 November 1814.	147:153	0:539	För att vinna de enropeiska makternas bifall och medverkan dertill lät Carl Joban Sverige förbinda sig till de uppoffringar och den risk , sorn ett aktivt uppträdande i den stora striden mot Frankrikes mäktige kejsare måste medförs ; med deras stöd tvång ban Danmark att genom freden i Kiel , mot erhållande af Sveriges sista besittning på andra sidan Östersjön , afträda Norge tili Sverige och nödgade derpå norrmännen att till Norges konung » välja och erkänna » Sveriges mot de vilkor , sorn från svenska sidan medgåfvoe den 4 November 1814 .	25	0:93	för att vinna en enropeiska makt bifall och medverkan dertill låta carl joban sverige förbinda sig till en uppoffring och den risk $ sorn en aktiv uppträdande i den stor strid mot frankrike mäktig kejsare måste medföra $ med de stöd tvång ban danmark att genom fred i kiel $ mot erhålla af sverige sista besittning på andra sida östersjön $ afträda norge tili sverige och nödga derpå norrman att till norge konung $ välja och erkänna $ sverige mot en vilkor $ sorn från svensk sida medgåfvoe den 4 november 1814 $
aktiv		1901	2	bib11653811_19011213_145317_193_0003_alto.xml-23-28	 	Af dessa framgår, att S. Möre består af 16 socknar, och således måste bland dessa finnas 15, som icke kunna räkna hr O. som » aktiv » innevånare och således ej som sin respektive tidningsreferent.	126:131	0:196	Af dessa framgår , att S. Möre består af 16 socknar , och således måste bland dessa finnas 15 , som icke kunna räkna hr O. som » aktiv » innevånare och således ej som sin respektive tidningsreferent .	28	0:39	af denna framgå $ att $ mör bestå af 16 socken $ och således måste bland denna finna 15 $ som icke kunna räkna hr $ som $ aktiv $ innevånare och således ej som sig respektive tidningsreferent $
aktiv		1895	2	bib19225758_18950216_144022_40_0007_alto.xml-69-6	 	nya förordning lär komma att från aktivt deltagande i nästa kongress utesluta de förnämsta engelska arbetarledarne, hrr Iveir Hardie, John Burns och Tom Mann, såvida de ej innan dess skaffa sig arbete inom sina yrken eller blifva tjänstemän inom sina fackföreningar.	34:40	0:266	nya förordning lär komma att från aktivt deltagande i nästa kongress utesluta de förnämsta engelska arbetarledarne , hrr Iveir Hardie , John Burns och Tom Mann , såvida de ej innan dess skaffa sig arbete inom sina yrken eller blifva tjänstemän inom sina fackföreningar .	6	0:45	ny förordning lär komma att från aktiv deltagande i nästa kongress utesluta en förnäm engelsk arbetarledarne $ hrr iveir hardie $ john burns och tom mann $ såvida de ej innan dess skaffa sig arbete inom sig yrke eller blifva tjänsteman inom sig fackförening $
aktiv		1900	2	bib11653838_19000427_147024_17_0002_alto.xml-20-10	 	ha ett par intresserade perso ner börjat verka för folkskolegossarnes aktiva deltagande i skyttegillets sträfvande.	70:76	0:115	ha ett par intresserade perso ner börjat verka för folkskolegossarnes aktiva deltagande i skyttegillets sträfvande .	10	0:16	ha en par intressera perso ner börja verka för folkskole aktiv deltagande i skyttegille sträfvande $
aktiv		1895	2	bib15873936_18950223_147385_24_0002_alto.xml-88-5	 	Kristliga föreningens af unge män aktiva medlemmar hade årssammanträde å föreningens lokal i onsdags.	34:40	0:101	Kristliga föreningens af unge män aktiva medlemmar hade årssammanträde å föreningens lokal i onsdags .	5	0:15	kristlig förening af ung man aktiv medlem ha årssammanträde å förening lokal i onsdag $
aktiv		1901	2	bib11653811_19010720_145317_110_0003_alto.xml-22-15	 	har en man aflidit, som kunde berömma sig af att ha varit den äldste aktive officeren i verlden.	69:75	0:96	har en man aflidit , som kunde berömma sig af att ha varit den äldste aktive officeren i verlden .	15	0:20	ha en man aflidit $ som kunna berömma sig af att ha vara den gammal aktiv officer i verld $
aktiv		1903	2	bib11653790_19030922_12541_74_0004_alto.xml-16-5	 	ning till åhörarne, att aktivt deltaga i kampen mot rusdryckerna; det dugde vid striden mot dem lika litet som vid revolution att vara neutral.	24:30	0:143	ning till åhörarne , att aktivt deltaga i kampen mot rusdryckerna ; det dugde vid striden mot dem lika litet som vid revolution att vara neutral .	5	0:27	ning till åhörare $ att aktiv delta i kamp mot rusdryck $ den dugde vid strid mot de lika liten som vid revolution att vara neutral $
