lemma	pos	date	grouping	identifier	description	context	indexes_target_token	indexes_target_sentence	context_tokenized	indexes_target_token_tokenized	indexes_target_sentence_tokenized	context_lemmatized
aktiv		1790	1	bib11653828_17900316_144028_62_0002_alto.xml-1-86	 	Theatren, fattat en särdeles hög lanke om sig sjelf; hade dock hans enfaldighet, lättrogenhet och löjliga utseende (ty han ivar liten lii wäxten, nied ek stort hufwud och tjocka bech) gifwit någre lustige Spottfoglar, i hwilkaS hander hans olyckliga stjerna honom förde, anledning at inbilla honom de aldraorimtigaste saker, underkasta honom be hum ilian tåste prof, och, Set som underligast ar, utan at han kunde stilja sig ifrån detta Sällskap, i hwilket han aktiv spelte en sa löjlig person: twärtom hade man inbillat hönö '. », ar alla de motgångar och alla försök han undergick wörö allenast förberedande grader til något lysande öde, som honom wantade- Hans bespottare hade påfunnit, at kalla alla desis prof, nied et nytt ord, poinsinots mystificarioner, hwilka han borde underkasta sig för at winna de ljus, de förstånds - och sinneskrafter, som stulle göra honom til den alstans, värdaste man, och gifwa honom det högsta hedersrum ibland fransyska Auclorer.	461:466	0:966	Theatren , fattat en särdeles hög lanke om sig sjelf ; hade dock hans enfaldighet , lättrogenhet och löjliga utseende ( ty han ivar liten lii wäxten , nied ek stort hufwud och tjocka bech ) gifwit någre lustige Spottfoglar , i hwilkaS hander hans olyckliga stjerna honom förde , anledning at inbilla honom de aldraorimtigaste saker , underkasta honom be hum ilian tåste prof , och , Set som underligast ar , utan at han kunde stilja sig ifrån detta Sällskap , i hwilket han aktiv spelte en sa löjlig person : twärtom hade man inbillat hönö ' . » , ar alla de motgångar och alla försök han undergick wörö allenast förberedande grader til något lysande öde , som honom wantade- Hans bespottare hade påfunnit , at kalla alla desis prof , nied et nytt ord , poinsinots mystificarioner , hwilka han borde underkasta sig för at winna de ljus , de förstånds - och sinneskrafter , som stulle göra honom til den alstans , värdaste man , och gifwa honom det högsta hedersrum ibland fransyska Auclorer .	86	0:180	theatren $ fatta en särdeles hög lanke om sig sjelf $ ha dock han enfaldighet $ lättrogenhet och löjlig utseende $ ty han ivar liten lii wäxten $ nied ek stor hufwud och tjock bech $ gifwit någre lustig spottfoglar $ i hwilkas hand han olycklig stjerna han föra $ anledning at inbilla han en aldraorimtigaste sak $ underkasta han be hum ilian tåste prof $ och $ s som underlig ar $ utan at han kunna stilja sig ifrån denna sällskap $ i hwilket han aktiv spela man säga löjlig person $ twärtom ha man inbilla hönö $ $ $ $ ar all en motgång och all försök han undergå wörö allenast förbereda grad til någon lysa öde $ som han $ han bespottare ha påfinna $ at kalla all desi prof $ nied et ny ord $ poinsinots mystificarioner $ hwilka han böra underkasta sig för at winna en ljus $ en förstånd $ och sinneskraft $ som stulle göra han til den alstans $ värd man $ och gifwa han den hög hedersrum ibland fransyska auclorer $
aktiv		1829	1	bib19223423_18290812_145063_64_0002_alto.xml-3-1	 	ren aktiva armsen af den 21 dennes, har den lyckligt passerat K » » tschik, och derunder i flere smärre fäktningar frLntagit fienden 10 kanoner, 14 sanor och 400 sängar.	4:10	0:169	ren aktiva armsen af den 21 dennes , har den lyckligt passerat K » » tschik , och derunder i flere smärre fäktningar frLntagit fienden 10 kanoner , 14 sanor och 400 sängar .	1	0:34	ren aktiv arms af den 21 denna $ ha den lycklig passera k $ $ tschik $ och derunder i flere smärre fäktning frlntagit fiende 10 kanon $ 14 sanor och 400 säng $
aktiv		1796	1	bib11653828_17960213_144028_36_0001_alto.xml-3-17	 	man upfnnnit wapen, och man arbetade beständigt pä deras förbättring; men den starkarcs bäga förblef aktiv farligare och hans hugg mera dödande.	101:106	0:144	man upfnnnit wapen , och man arbetade beständigt pä deras förbättring ; men den starkarcs bäga förblef aktiv farligare och hans hugg mera dödande .	17	0:25	man upfnnnit wapen $ och man arbeta beständig pä de förbättring $ men den starkarcs bäga förblef aktiv farlig och han hugg mera döda $
aktiv		1795	1	bib11653828_17950610_144028_129_0003_alto.xml-2-41	 	Sophia eller Sofia, Filosof eller philosoph, Filip eller philipp, Stephan eller Stefan, 0 f. w. Llkwäl ser man, at Romarne aldrig wägat striswa dessa och dylika ord nied samma k som i felix eller filiusj utan aktiv uttryckt dem med ph; vch sä länge Scholan wil sä hafwa, böra mi samwetsgrant behälla samma ph, för at ej göra förargelse i den larda weridén; oaktadt wi äro lika fluge, huru de prononcerat det.	209:214	0:408	Sophia eller Sofia , Filosof eller philosoph , Filip eller philipp , Stephan eller Stefan , 0 f. w. Llkwäl ser man , at Romarne aldrig wägat striswa dessa och dylika ord nied samma k som i felix eller filiusj utan aktiv uttryckt dem med ph ; vch sä länge Scholan wil sä hafwa , böra mi samwetsgrant behälla samma ph , för at ej göra förargelse i den larda weridén ; oaktadt wi äro lika fluge , huru de prononcerat det .	41	0:83	sophia eller sofia $ filosof eller philosoph $ filip eller philipp $ stephan eller stefan $ 0 $ $ llkwäl se man $ at romarne aldrig wägat striswa denna och dylik ord nied samma k som i felix eller filiusj utan aktiv uttrycka de med ph $ vch sä länge scholan wil sä hafwa $ böra mi samwetsgrant behälla samma ph $ för at ej göra förargelse i den larda weridén $ oaktadt wi äro lika fluge $ huru de prononcera den $
aktiv		1802	1	bib15650837_18020507_146391_37_0002_alto.xml-9-20	 	civiliserade Europa, ännu wara det band, som inwänarena med hwarandra, och mätte dygder som hon fordrar, aktiv wara med uplysningcn öfwercnsstämmandc!	105:110	0:150	civiliserade Europa , ännu wara det band , som inwänarena med hwarandra , och mätte dygder som hon fordrar , aktiv wara med uplysningcn öfwercnsstämmandc !	20	0:26	civilisera europa $ ännu wara den band $ som inwänarena med hwarandra $ och mäta dygd som hon fordra $ aktiv wara med uplysningcn öfwercnsstämmandc $
aktiv		1829	1	bib13506739_18290826_144030_196_0008_alto.xml-1-6	 	Swar afwakraS uti förseglad biljet till Aktiv, som inlemmS	40:45	0:58	Swar afwakraS uti förseglad biljet till Aktiv , som inlemmS	6	0:10	swar afwakras uti försegla biljet till aktiv $ som inlemms
aktiv		1810	1	bib11653828_18101215_144028_294_0001_alto.xml-0-31	 	rika är folket ännu gansta srifft; men deremot herrstar i de Södra Staternas hamnar, förnemligast i Charlestown och Havannah, den sä kallade Climaksfebern, svin wid denna ärstkd aktiv wisar sig der och är mycket farlig för utländningar, lin och med för Amerikaner ifrän norra orterna.	178:183	0:284	rika är folket ännu gansta srifft ; men deremot herrstar i de Södra Staternas hamnar , förnemligast i Charlestown och Havannah , den sä kallade Climaksfebern , svin wid denna ärstkd aktiv wisar sig der och är mycket farlig för utländningar , lin och med för Amerikaner ifrän norra orterna .	31	0:51	rik vara folk ännu gansta srifft $ men deremot herrstar i en södra stat hamn $ förnemligast i charlestown och havannah $ den sä kalla climaksfebern $ svin wid denna ärstkd aktiv wisar sig der och vara mycket farlig för utländningar $ lin och med för amerikan ifrän norra ort $
aktiv		1792	1	bib11653828_17921106_144028_257_0003_alto.xml-11-8	 	Jag bedyrar, Herr Manuel, at jag aktiv alstat niit Folk, och at desi	33:38	0:68	Jag bedyrar , Herr Manuel , at jag aktiv alstat niit Folk , och at desi	8	0:16	jag bedyra $ herr manuel $ at jag aktiv alstat niit folk $ och at desi
aktiv		1830	1	bib11653828_18300212_144028_35_0002_alto.xml-11-61	 	tryad eller treenighet, hvars första person af manligt kön är Budha, en symbol af den al » strands kraften; den andra af qvinligt kön Mr Dharrna, den födande, kraftens typ; den tredje, som utgår af de båda första, är Sanga, deras son, som representerar den nuvarande skapande kraften, eller den aktiva skaparen och verldsstyraren.	295:301	0:330	tryad eller treenighet , hvars första person af manligt kön är Budha , en symbol af den al » strands kraften ; den andra af qvinligt kön Mr Dharrna , den födande , kraftens typ ; den tredje , som utgår af de båda första , är Sanga , deras son , som representerar den nuvarande skapande kraften , eller den aktiva skaparen och verldsstyraren .	61	0:66	tryad eller treenighet $ hvars första person af manlig kön vara budha $ en symbol af den al $ strand kraft $ den andra af qvinlig kön mr dharrna $ den föda $ kraft typ $ den tredje $ som utgå af en båda första $ vara sanga $ de son $ som representera den nuvarande skapa kraft $ eller den aktiv skapare och verldsstyraren $
aktiv		1829	1	bib11653828_18290326_144028_70_0002_alto.xml-6-20	 	Och om de instängde ej försvaras af trupper till lands, hvilka blott för deris skull bMve hindrade att mera aktivt användas annorstädes, kunde lätt hända, såsom Hr N. anfört om ett skepp i Holland, att de genom en coup de main af landsatte- husarer skulle eröfra ».	108:114	0:265	Och om de instängde ej försvaras af trupper till lands , hvilka blott för deris skull bMve hindrade att mera aktivt användas annorstädes , kunde lätt hända , såsom Hr N . anfört om ett skepp i Holland , att de genom en coup de main af landsatte- husarer skulle eröfra » .	20	0:53	och om de instänga ej försvara af trupp till land $ hvilka blott för deri skulle bmve hindra att mera aktiv använda annorstädes $ kunna lätt hända $ såsom hr n $ anföra om en skepp i holland $ att de genom en coup de main af $ husar skola eröfra $ $
aktiv		1830	1	bib19277277_18300709_147682_155_0001_alto.xml-47-3	 	entledigad frän sin aktiva tjenst och ex-deputcraden Poifcrré de Cbre, förlustig sina funktioner.	20:26	0:97	entledigad frän sin aktiva tjenst och ex-deputcraden Poifcrré de Cbre , förlustig sina funktioner .	3	0:15	entlediga frän sig aktiv tjenst och $ poifcrré de cbre $ förlustig sig funktion $
aktiv		1829	1	bib11653828_18290804_144028_177_0002_alto.xml-3-4	 	de år 1828 i aktiv bandel använda Engelska fartyg var 23, 356, således 7000 liera än år l8&gt; 4Sistnämnde år var Brittiska sjömännens antal endast 1 14 000, men år 1828 värdet 181, 000.	13:18	0:186	de år 1828 i aktiv bandel använda Engelska fartyg var 23 , 356 , således 7000 liera än år l8&gt ; 4Sistnämnde år var Brittiska sjömännens antal endast 1 14 000 , men år 1828 värdet 181 , 000 .	4	0:40	en år 1828 i aktiv bandel använda engelsk fartyg vara 23 $ 356 $ således 7000 liera än år $ $ 4sistnämnde år vara brittisk sjöman antal endast 1 14 000 $ men år 1828 värde 181 $ 000 $
aktiv		1813	1	bib19225772_18130430_148004_48_0001_alto.xml-11-25	 	— Uppehållande Senaten har d. z utfärdat ett Senatskonsiilt af innehäll att en styrka af 180,000 stola stallas till Krigsministerns disposition för att föröka de aktiva Armcerna, nemi.	162:168	0:184	— Uppehållande Senaten har d. z utfärdat ett Senatskonsiilt af innehäll att en styrka af 180,000 stola stallas till Krigsministerns disposition för att föröka de aktiva Armcerna , nemi .	25	0:30	$ uppehålla senat ha $ z utfärda en senatskonsiilt af innehälla att en styrka af $ stola stalla till krigsminister disposition för att föröka en aktiv armcerna $ nemi $
aktiv		1797	1	bib11653792_17971125_146919_47_0003_alto.xml-7-162	 	Som pä de ställen ber Allmänheten samlas, i synnerhet wid Kyrkorne en mpckcnhct med Städar och andre Äktyg, som til wedcrbörandes afhämtande bestämde äro, finnas stöka tilsammans i en sädan trängsel och oordning, at de icke allenast äro hwarannan til hinder och uppehöll, utan ockfä aldeles igenstänga wägen, at de gäende ej utan mycken swärighct kunna tränga sig fram, samt ofta aro uti wäda, at af okynnige häst-kreatur warda skadade; Altsä och til förekommande af stift vskick, och pä det wid sädane tilfällen alt mä ordentcligcn tilgä, samt Allmänheten hafwa en fri och bcqwämkig ntgäng, utan at af hwarandra blifwa uppchällne, har Magistraten pröfwat nödigt förordna, det bör wid alla ställen der flere Eqvipage" samlas, gatan hällas öppen, och i synnerhet wid Kyrkorne, nägon icke hälla med Slädar eller annat Äktyg närmare Kyrkodörrcn an pä twä alnar ifrän wästra sidan af wägen, hwarwid aktiv bör i akttagas, at Torget til tädan bredd häller 0pct, at Allmänheten med beqwämlighct kan färdas och gä emellan Äsgatorne, samt öfwer Torget tik Fahlu gata och lil Slagg-gatan.	895:900	0:1078	Som pä de ställen ber Allmänheten samlas , i synnerhet wid Kyrkorne en mpckcnhct med Städar och andre Äktyg , som til wedcrbörandes afhämtande bestämde äro , finnas stöka tilsammans i en sädan trängsel och oordning , at de icke allenast äro hwarannan til hinder och uppehöll , utan ockfä aldeles igenstänga wägen , at de gäende ej utan mycken swärighct kunna tränga sig fram , samt ofta aro uti wäda , at af okynnige häst-kreatur warda skadade ; Altsä och til förekommande af stift vskick , och pä det wid sädane tilfällen alt mä ordentcligcn tilgä , samt Allmänheten hafwa en fri och bcqwämkig ntgäng , utan at af hwarandra blifwa uppchällne , har Magistraten pröfwat nödigt förordna , det bör wid alla ställen der flere Eqvipage " samlas , gatan hällas öppen , och i synnerhet wid Kyrkorne , nägon icke hälla med Slädar eller annat Äktyg närmare Kyrkodörrcn an pä twä alnar ifrän wästra sidan af wägen , hwarwid aktiv bör i akttagas , at Torget til tädan bredd häller 0pct , at Allmänheten med beqwämlighct kan färdas och gä emellan Äsgatorne , samt öfwer Torget tik Fahlu gata och lil Slagg-gatan .	162	0:196	som pä en ställe be allmänhet samla $ i synnerhet wid kyrkorne en mpckcnhct med städa och andra äktyg $ som til wedcrbörandes afhämta bestämma äro $ finna stöka tilsamman i en sädan trängsel och oordning $ at de icke allenast äro hwarannan til hinder och uppehålla $ utan ockfä aldeles igenstänga wägen $ at de gäende ej utan mycken swärighct kunna tränga sig fram $ samt ofta aro uti wäda $ at af okynnig $ warda skada $ altsä och til förekomma af stift vskick $ och pä den wid sädane tilfällen alt mä ordentcligcn tilgä $ samt allmänhet hafwa en fri och bcqwämkig ntgäng $ utan at af hwarandra blifwa uppchällne $ ha magistrat pröfwat nödig förordna $ den böra wid all ställe der flere eqvipage $ samla $ gata hälla öppen $ och i synnerhet wid kyrkorne $ nägon icke hälla med släde eller annan äktyg nära kyrkodörrcn an pä twä aln ifrän wästra sida af wägen $ hwarwid aktiv böra i aktta $ at torg til tädan bredd hälla 0pct $ at allmänhet med beqwämlighct kunna färdas och gä emellan äsgatorne $ samt öfwer torg tik fahlu gata och lil $ $
aktiv		1822	1	bib19223423_18221026_145063_86_0001_alto.xml-0-6	 	Regeringen spsielsätter sig med organisering as aktiva Milisen / sam	48:54	0:68	Regeringen spsielsätter sig med organisering as aktiva Milisen / sam	6	0:10	regering spsielsätter sig med organisering as aktiv milis $ simma
aktiv		1828	1	bib11653828_18280704_144028_151_0001_alto.xml-9-54	 	trupperna ett stycke borrtom DaudPascha, och tog afsted af dem med de orden:" Häl » len Er tappra; jag stall snart komma ester.-" Portens förhoppningar tyckas stödja sig psi besia stridskrafter, och ehuru man här wet, att Rystarnes styrka utgör ivo, 000 » nan för den aktiva armen och 60,000 för reserven / hwaremot Porten ej förmär hopbringa mer än 80,000 man, garnisonerna inberäknade, sä medgifwer dock den Otto, niannista stoltheten Icke ett ögonblicks twifwel om segern.	268:274	0:475	trupperna ett stycke borrtom DaudPascha , och tog afsted af dem med de orden : " Häl » len Er tappra ; jag stall snart komma ester.- " Portens förhoppningar tyckas stödja sig psi besia stridskrafter , och ehuru man här wet , att Rystarnes styrka utgör ivo , 000 » nan för den aktiva armen och 60,000 för reserven / hwaremot Porten ej förmär hopbringa mer än 80,000 man , garnisonerna inberäknade , sä medgifwer dock den Otto , niannista stoltheten Icke ett ögonblicks twifwel om segern .	54	0:89	trupp en stycke borrtom daudpascha $ och ta afsted af de med en ord $ $ häl $ len ni tapper $ jag stall snar komma $ $ port förhoppning tycka stödja sig psi besia stridskrafter $ och ehuru man här wet $ att rystarnes styrka utgöra ivo $ 000 $ nan för den aktiv arm och $ för reserv $ hwaremot port ej förmär hopbringa mer än $ man $ garnison inberäkna $ sä medgifwer dock den otto $ niannista stolthet icke en ögonblick twifwel om seger $
aktiv		1792	1	bib11653828_17920703_144028_151_0003_alto.xml-19-20	 	för dem nied sig, och öfwar deni i korta utflygter, låter deni wäga smä fall, hwilka hon aktiv hindrar / i det hon styndar sig lil deras hjelp.	89:94	0:143	för dem nied sig , och öfwar deni i korta utflygter , låter deni wäga smä fall , hwilka hon aktiv hindrar / i det hon styndar sig lil deras hjelp .	20	0:32	för de nied sig $ och öfwar deni i kort utflygt $ låta deni wäga smä fall $ hwilka hon aktiv hindra $ i den hon styndar sig lil de hjelp $
aktiv		1825	1	bib11653828_18250414_144028_84_0003_alto.xml-7-63	 	Anmärkaren söker widare insinuera, såsom skulle profektet innehålla inrättningen af en ny brandkorps af 27; nian med nödigt befäl och stor kostnad, me » rälta förhällandel är, all nuwarande Brandwaktskorps blott skulle ökas med 6r nian, för alt utgöra en ändamälscnligare organiserad brandkorps, under nödigt befäl, hwilkcn brcinekorps, fördelad i n kaserner, med cn aktiv spruta i hwardera kasernen, barde pä kallelse natt eller dag hasta dem till hfelp, hos hwilka eldsolpcka uppkommit och innan den hunnit utbryta: en äkgard som saknas wid nuwarande kldstäckningsanstaller, der hjclpen, först ester utbruten eld, medelst klämtning och larm famlas, och icke sällan ankommer kill elden kwä timmar sednare an cldswädan af husfolket blifwil känd.	367:372	0:745	Anmärkaren söker widare insinuera , såsom skulle profektet innehålla inrättningen af en ny brandkorps af 27 ; nian med nödigt befäl och stor kostnad , me » rälta förhällandel är , all nuwarande Brandwaktskorps blott skulle ökas med 6r nian , för alt utgöra en ändamälscnligare organiserad brandkorps , under nödigt befäl , hwilkcn brcinekorps , fördelad i n kaserner , med cn aktiv spruta i hwardera kasernen , barde pä kallelse natt eller dag hasta dem till hfelp , hos hwilka eldsolpcka uppkommit och innan den hunnit utbryta : en äkgard som saknas wid nuwarande kldstäckningsanstaller , der hjclpen , först ester utbruten eld , medelst klämtning och larm famlas , och icke sällan ankommer kill elden kwä timmar sednare an cldswädan af husfolket blifwil känd .	63	0:128	anmärkare söka widare insinuera $ såsom skola profektet innehålla inrättning af en ny brandkorps af 27 $ nia med nödig befäl och stor kostnad $ me $ rälta förhällandel vara $ all nuwarande brandwaktskorps blott skola öka med 6r nia $ för alt utgöra en ändamälscnligare organisera brandkorps $ under nödig befäl $ hwilkcn brcinekorps $ fördela i n kasern $ med cn aktiv spruta i hwardera kasern $ barde pä kallelse natt eller dag hasta de till hfelp $ hos hwilka eldsolpcka uppkomma och innan den hinna utbryta $ en äkgard som sakna wid nuwarande kldstäckningsanstaller $ der hjclpen $ först est $ eld $ medelst klämtning och larm famla $ och icke sällan ankomma kille eld kwä timme sednare an cldswädan af husfolk blifwil känd $
aktiv		1796	1	bib11653828_17960323_144028_67_0002_alto.xml-16-4	 	De äro i sälffap aktiv alswarsamme; sällan ser man en Mor le, aU	17:22	0:64	De äro i sälffap aktiv alswarsamme ; sällan ser man en Mor le , aU	4	0:15	de äro i sälffap aktiv alswarsamme $ sällan se man en mor le $ au
aktiv		1810	1	bib19277346_18100203_147394_2_0003_alto.xml-0-40	 	- ^aktadt menniskans skröplighet är hon likrväl banad till förnuftig — Om hon upphör, att wara ber, plägas och frätes hon af oro och förwirring, och är icke mera öfrverrnS med stg sjelf; och afsmak följer aktiv de flärdnöjen, som förnuftet ogillar.	205:210	0:248	- ^aktadt menniskans skröplighet är hon likrväl banad till förnuftig — Om hon upphör , att wara ber , plägas och frätes hon af oro och förwirring , och är icke mera öfrverrnS med stg sjelf ; och afsmak följer aktiv de flärdnöjen , som förnuftet ogillar .	40	0:48	$ $ menniska skröplighet vara hon likrväl bana till förnuftig $ om hon upphöra $ att wara be $ pläga och fräta hon af oro och förwirring $ och vara icke mera öfrverrns med stg sjelf $ och afsmak följa aktiv en flärdnöjen $ som förnuft ogilla $
aktiv		1812	1	bib11653828_18120227_144028_48_0002_alto.xml-3-25	 	besteg sig & gt; iu kill 18 pence; han borre wara sin Herre behjelpclig att uppsöka gamla luli; hwarföre ve v ek aktiv delade sig pä serffilla häll.	113:118	0:148	besteg sig & gt ; iu kill 18 pence ; han borre wara sin Herre behjelpclig att uppsöka gamla luli ; hwarföre ve v ek aktiv delade sig pä serffilla häll .	25	0:32	bestiga sig $ gt $ iu kill 18 penny $ han borre wara sig herre behjelpclig att uppsöka gammal luli $ hwarföre ve v ek aktiv dela sig pä serffilla häll $
aktiv		1829	1	bib19277277_18291116_147682_266_0001_alto.xml-4-26	 	': Grefwe Toll har blifwil utnämnd list Riddare af S:t GeorgS Ordens andra klaff, till belöning för de förljenster han ädagalagt fäftin chef sbr aktiva Arim-ens General-Stab under sednaste fältläg.	145:151	0:197	' : Grefwe Toll har blifwil utnämnd list Riddare af S:t GeorgS Ordens andra klaff , till belöning för de förljenster han ädagalagt fäftin chef sbr aktiva Arim-ens General-Stab under sednaste fältläg .	26	0:33	$ $ grefwe toll ha blifwil utnämna list riddare af $ georgs orden andra klaff $ till belöning för en förljenster han ädagalagt fä chef sbr aktiv arim $ under sednaste fältläg $
aktiv		1828	1	bib11653828_18280122_144028_18_0002_alto.xml-11-24	 	kommer säledes, säival igenom sin inre organism, som genom sin belägenhet, att utgöra en nöowändig öfwergäng frän Set passiva till det aktiva lifwet, frän det mera jkol-lika Akademista till det fria medborgerliga, dä den nybildade läkaren stall börja att tänka och werka, icke säfom cn maschin, drjfmen af yttre krafter, utan sond en fullbildad man, so n bär kraften inom sig.	135:141	0:376	kommer säledes , säival igenom sin inre organism , som genom sin belägenhet , att utgöra en nöowändig öfwergäng frän Set passiva till det aktiva lifwet , frän det mera jkol-lika Akademista till det fria medborgerliga , dä den nybildade läkaren stall börja att tänka och werka , icke säfom cn maschin , drjfmen af yttre krafter , utan sond en fullbildad man , so n bär kraften inom sig .	24	0:71	komma säledes $ säival igenom sig inre organism $ som genom sig belägenhet $ att utgöra en nöowändig öfwergäng frän s passiv till den aktiv lifwet $ frän den mera $ akademista till den fri medborgerlig $ dä den nybildad läkare stall börja att tänka och werka $ icke säfom cn maschin $ drjfmen af yttre kraft $ utan sond en fullbildad man $ so n bära kraft inom sig $
aktiv		1812	1	bib13506739_18120829_144030_200_0002_alto.xml-2-3	 	dct Re, Aktive Kueägare i detta afseende täckas-samlas pä Börsen i gula - alen nalia Diaabnp ten 31 Aug.	8:14	0:104	dct Re , Aktive Kueägare i detta afseende täckas-samlas pä Börsen i gula - alen nalia Diaabnp ten 31 Aug .	3	0:21	dct re $ aktiv kueägare i denna afseende $ pä börs i gul $ al nalia diaabnp ten 31 aug $
aktiv		1829	1	bib11653828_18290707_144028_153_0003_alto.xml-23-23	 	härtill är, dels att man vill skona soldaten » helsa, som mycket lider genom den starka hettan, dels att den aktiva armés ej tyckes	109:115	0:131	härtill är , dels att man vill skona soldaten » helsa , som mycket lider genom den starka hettan , dels att den aktiva armés ej tyckes	23	0:27	härtill vara $ dels att man vilja skona soldat $ helsa $ som mycket lida genom den stark hetta $ dels att den aktiv armé ej tycka
aktiv		1827	1	bib11653828_18270228_144028_49_0003_alto.xml-7-28	 	£effi1 stulle de bli alltför kostsamma att underlätta, emedan de till största delen lefwa af dagspenning, och man säledes, i fall man försatte dem i aktiv tjenstgöring, mäste loswa dcm akt draga försorg för deras hustrurs och barns uppehälle.	149:154	0:242	£effi1 stulle de bli alltför kostsamma att underlätta , emedan de till största delen lefwa af dagspenning , och man säledes , i fall man försatte dem i aktiv tjenstgöring , mäste loswa dcm akt draga försorg för deras hustrurs och barns uppehälle .	28	0:44	$ stulle de bli alltför kostsam att underlätta $ emedan de till stor del lefwa af dagspenning $ och man säledes $ i fall man försätta de i aktiv tjenstgöring $ mäste loswa dcm akt dra försorg för de hustru och barn uppehälle $
aktiv		1829	1	bib11653828_18290428_144028_96_0003_alto.xml-9-19	 	har till deras underhåll anslagit 5o, ooo Francs månadtligen, hvilket är ungefärligen lika mycket, sorn deras aktiva sold skulle hesliga sig till.	110:116	0:146	har till deras underhåll anslagit 5o , ooo Francs månadtligen , hvilket är ungefärligen lika mycket , sorn deras aktiva sold skulle hesliga sig till .	19	0:26	ha till de underhåll anslå 5o $ ooo franc månadtligen $ hvilket vara ungefärligen lika mycket $ sorn de aktiv sold skola hesliga sig till $
