lemma	pos	date	grouping	identifier	description	context	indexes_target_token	indexes_target_sentence	context_tokenized	indexes_target_token_tokenized	indexes_target_sentence_tokenized	context_lemmatized
aktiv		1895	2	bib19225758_18950617_144022_138_0003_alto.xml-66-54	 	för Sveriges frivilliga skytteföreningar hade hos k. m:t hemstält, att samtliga frivilliga skytteföreningar i riket, hvilka stålt sig till efterrättelse i k, brefvet den 15 December 1893 för rikets frivilliga skytteväsen utfärdade bestämmelser, mätie erhålla tillstånd att från statens förråd få såsom lån utbekomma ett 1867 års gevär för hvarje aktiv medlem af sådan förening.	346:351	0:377	för Sveriges frivilliga skytteföreningar hade hos k. m:t hemstält , att samtliga frivilliga skytteföreningar i riket , hvilka stålt sig till efterrättelse i k , brefvet den 15 December 1893 för rikets frivilliga skytteväsen utfärdade bestämmelser , mätie erhålla tillstånd att från statens förråd få såsom lån utbekomma ett 1867 års gevär för hvarje aktiv medlem af sådan förening .	54	0:60	för sverige frivillig skytteförening ha hos $ $ hemstält $ att samtlig frivillig skytteförening i rike $ hvilka stålt sig till efterrättelse i k $ brefvet den 15 december 1893 för rike frivillig skytteväsen utfärda bestämmelse $ mätie erhålla tillstånd att från stat förråd få såsom lån utbekomma en 1867 år gevär för hvarje aktiv medlem af sån förening $
aktiv		1895	2	bib15760690_18950620_145050_93_0002_alto.xml-36-1	 	Äswen aktivt deltog han i de offentliga angelägenheterna inom den stad, der han under tidigare som senare mannaålder satts att werka.	6:12	0:133	Äswen aktivt deltog han i de offentliga angelägenheterna inom den stad , der han under tidigare som senare mannaålder satts att werka .	1	0:23	äswen aktiv delta han i en offentlig angelägenhet inom den stad $ der han under tidig som sen mannaålder sätta att werka $
aktiv		1896	2	bib11653811_18960608_145317_86_0003_alto.xml-161-26	 	från jord gödd med chilisalpeter, ha ock gifvit till resultat, att vattnet, i synnerhet på de årstider, då plantorna ej äro i aktiv växt, innehåller betydliga mängder af det värdefulla ämnet, hvilket ju är liktydande med en motsvarande förlust för jordegaren.	126:131	0:259	från jord gödd med chilisalpeter , ha ock gifvit till resultat , att vattnet , i synnerhet på de årstider , då plantorna ej äro i aktiv växt , innehåller betydliga mängder af det värdefulla ämnet , hvilket ju är liktydande med en motsvarande förlust för jordegaren .	26	0:48	från jord göda med chilisalpeter $ ha ock gifvit till resultat $ att vatten $ i synnerhet på en årstid $ då planta ej äro i aktiv växt $ innehålla betydlig mängd af den värdefull ämne $ hvilket ju vara liktydande med en motsvara förlust för jord $
aktiv		1895	2	bib11653790_18950222_145648_9_0002_alto.xml-131-8	 	Af årsberättelsen framgick, att gillet räknar 35 aktiva och 4 passiva ledamöter, att under fjorårets öfaingar lossats	49:55	0:117	Af årsberättelsen framgick , att gillet räknar 35 aktiva och 4 passiva ledamöter , att under fjorårets öfaingar lossats	8	0:19	af årsberättelse framgå $ att gille räkna 35 aktiv och 4 passiv ledamot $ att under fjorårets öfaingar lossa
aktiv		1895	2	bib19227462_18950209_147640_34_0003_alto.xml-9-3	 	Ett stort antal aktive officerare vid narmén och flottan hafva kommenderats katt åhöra föredraget.	16:22	0:98	Ett stort antal aktive officerare vid narmén och flottan hafva kommenderats katt åhöra föredraget .	3	0:15	en stor antal aktiv officer vid narmén och flotta hafva kommendera katt åhöra föredrag $
aktiv		1895	2	bib15978012_18951204_148361_283_0002_alto.xml-80-6	 	pondenten framhåller, att ett ofördröjligt aktivt uppträdande från makternas sida är nödvändigt, enär sultanen nu fått för sig, att det räder oenighet mellan dem, och handlar därefter.	43:49	0:184	pondenten framhåller , att ett ofördröjligt aktivt uppträdande från makternas sida är nödvändigt , enär sultanen nu fått för sig , att det räder oenighet mellan dem , och handlar därefter .	6	0:32	pondenten framhålla $ att en ofördröjlig aktiv uppträdande från makt sida vara nödvändig $ enär sultan nu få för sig $ att den räd oenighet mellan de $ och handla därefter $
aktiv		1895	2	bib15760600_18950820_146401_98_0003_alto.xml-179-9	 	från Englands sida torde den kinesiska regeringen gripa till aktiva åtgärder, hvilka drottningen hoppas måtte medföra åsyftad verkan.	61:67	0:133	från Englands sida torde den kinesiska regeringen gripa till aktiva åtgärder , hvilka drottningen hoppas måtte medföra åsyftad verkan .	9	0:20	från england sida torde den kinesisk regering gripa till aktiv åtgärd $ hvilka drottning hoppa må medföra åsyfta verkan $
aktiv		1895	2	bib15650837_18950223_146391_46_0003_alto.xml-101-20	 	dag vid första läsningen antagit Fabres af regeriigen understödda förslag, enligt hvilket en parlamentsledamot, sorn icke slutat sin aktiva militårtjenet, befrias frän återstående delen deraf.	133:139	0:192	dag vid första läsningen antagit Fabres af regeriigen understödda förslag , enligt hvilket en parlamentsledamot , sorn icke slutat sin aktiva militårtjenet , befrias frän återstående delen deraf .	20	0:29	dag vid första läsning anta fabres af regeriigen understödd förslag $ enligt hvilket en parlamentsledamot $ sorn icke sluta sig aktiv militårtjenet $ befria frän återstå del deraf $
aktiv		1895	2	bib15760600_18950614_146401_70_0002_alto.xml-65-12	 	skyldige våra landsmän i Örebro tack, ej blott för hvad de aktivt verkat för vårt mottagande utan också och kanske ännu mera för det sätt, på hvilket de hedrat det värmländska namnet utom hembygden.	59:65	0:198	skyldige våra landsmän i Örebro tack , ej blott för hvad de aktivt verkat för vårt mottagande utan också och kanske ännu mera för det sätt , på hvilket de hedrat det värmländska namnet utom hembygden .	12	0:37	skyldig vi landsman i örebro tack $ ej blott för hvad de aktiv verka för vi mottagande utan också och kanske ännu mera för den sätt $ på hvilket de hedra den värmländsk namn utom hembygd $
aktiv		1895	2	bib19225758_18950612_144022_134_0003_alto.xml-27-9	 	8:s styrelse söka åstadkomma den önskade närmare sammanslutningen mellan aktiva och passiva medlemmar i C.	73:79	0:106	8:s styrelse söka åstadkomma den önskade närmare sammanslutningen mellan aktiva och passiva medlemmar i C .	9	0:16	$ styrelse söka åstadkomma den önska nära sammanslutning mellan aktiv och passiv medlem i c $
aktiv		1895	2	bib19277277_18950810_147683_215_0004_alto.xml-174-19	 	äro öfver 400 deltagare anmälda, under det att sistnämnda år antalet anmälda utgjorde 372, hvaraf cirka 300 aktivt deltogo.	108:114	0:123	äro öfver 400 deltagare anmälda , under det att sistnämnda år antalet anmälda utgjorde 372 , hvaraf cirka 300 aktivt deltogo .	19	0:22	äro öfver 400 deltagare anmäla $ under den att sistnämnd år antal anmäla utgöra 372 $ hvaraf cirka 300 aktiv deltogo $
aktiv		1896	2	bib11653811_18960724_145317_111_0003_alto.xml-75-22	 	Det är icke utan sina goda skäl som de korsikanska gendarmerna få räkna sin tjenstetid på Korsika lika med en lika lång aktiv tjenst i fält.	120:125	0:140	Det är icke utan sina goda skäl som de korsikanska gendarmerna få räkna sin tjenstetid på Korsika lika med en lika lång aktiv tjenst i fält .	22	0:27	den vara icke utan sig god skäl som en korsikansk gendarm få räkna sig tjenstetid på korsika lik med en lika lång aktiv tjenst i fält $
aktiv		1895	2	bib15873371_18950111_145112_10_0002_alto.xml-15-25	 	förberedande stegen hade tagits, tillräckliga att göra luften väl laddad med obestämda farhågor och menniskornas sinnen mogna för någon ny utveckling, börjades de aktiva måtten oeh stegen, på ett slaga bekymmerslöst, omedvetei sätt, liksom örn tingens gudomliga ordning hade råkat ut för en öfvergående dissonans — intet vidare.	163:169	0:328	förberedande stegen hade tagits , tillräckliga att göra luften väl laddad med obestämda farhågor och menniskornas sinnen mogna för någon ny utveckling , börjades de aktiva måtten oeh stegen , på ett slaga bekymmerslöst , omedvetei sätt , liksom örn tingens gudomliga ordning hade råkat ut för en öfvergående dissonans — intet vidare .	25	0:54	förbereda steg ha ta $ tillräcklig att göra luft väl ladda med obestämd farhåga och menniska sinne mogen för någon ny utveckling $ börja en aktiv mått oeh steg $ på en slaga bekymmerslös $ omedvetei sätt $ liksom örn ting gudomlig ordning ha råka ut för en öfvergående dissonans $ intet vid $
aktiv		1895	2	bib19227291_18950223_145289_23_0003_alto.xml-68-34	 	Med anledning af konungens sista skrifvelse skrifver ” Morgenbladet": ” Utan att ega en alldeles effektiv regering bar konungen i sina förhandlingar med det radikala partiet varit hänvisad till ett personligt ocb aktivt uppträdande i politiken, och det har då mäst ligga nära för de förenade rikenas monark att särskildt framhålla de synpunkter, som för honom ställa sig som bufvudpuukterna i arbetet för unionens upprätthållande och befästande.	213:219	0:445	Med anledning af konungens sista skrifvelse skrifver ” Morgenbladet " : ” Utan att ega en alldeles effektiv regering bar konungen i sina förhandlingar med det radikala partiet varit hänvisad till ett personligt ocb aktivt uppträdande i politiken , och det har då mäst ligga nära för de förenade rikenas monark att särskildt framhålla de synpunkter , som för honom ställa sig som bufvudpuukterna i arbetet för unionens upprätthållande och befästande .	34	0:72	med anledning af konung sista skrifvelse skrifver $ morgenbladet $ $ $ utan att ega en alldeles effektiv regering bära konung i sig förhandling med den radikal parti vara hänvisa till en personlig ocb aktiv uppträdande i politik $ och den ha då mäst ligga nära för en förena rike monark att särskildt framhålla en synpunkt $ som för han ställa sig som bufvudpuukterna i arbete för union upprätthålla och befästa $
aktiv		1896	2	bib15650835_18960313_146472_41_0007_alto.xml-45-0	 	aktiva fackföreningsmedlemmarne afslogo denna begäran, föreslog motionären bildandet af en understödskassa och anhöll örn elt förskott af 25,000 francs.	0:6	0:152	aktiva fackföreningsmedlemmarne afslogo denna begäran , föreslog motionären bildandet af en understödskassa och anhöll örn elt förskott af 25,000 francs .	0	0:21	aktiv fackföreningsmedlemmarne afslogo denna begäran $ föreslå motionär bildande af en understödskassa och anhålla örn elt förskott af $ franc $
aktiv		1900	2	bib11653811_19000822_145317_129_0004_alto.xml-62-20	 	Vid föreningens början ingingo omkring 40 medlemmar i densamma och nu är antalet omkring 70, hvaraf de allra flesta aktiva deltagare, som lossat närmare 3,000 skott under de få timmar öfningarna pågått och dervid ett jemförelsevis stort antal deltagare » skjutit upp » sig i Usta klassen.	116:122	0:288	Vid föreningens början ingingo omkring 40 medlemmar i densamma och nu är antalet omkring 70 , hvaraf de allra flesta aktiva deltagare , som lossat närmare 3,000 skott under de få timmar öfningarna pågått och dervid ett jemförelsevis stort antal deltagare » skjutit upp » sig i Usta klassen .	20	0:50	vid förening början ingingo omkring 40 medlem i densamma och nu vara antal omkring 70 $ hvaraf en allra mången aktiv deltagare $ som lossa nära $ skott under en få timme öfning pågå och dervid en jemförelsevis stor antal deltagare $ skjuta upp $ sig i usta klass $
aktiv		1899	2	bib11653811_18991115_145317_176_0003_alto.xml-109-29	 	För att stödja sina påståenden gaf nu åklagaren en närmare skildring af ecartéspelet, pointerande att spelet endast rörde sig örn 5 kort samt att i detsamma deltogo både aktiva och passiva spelare.	170:176	0:197	För att stödja sina påståenden gaf nu åklagaren en närmare skildring af ecartéspelet , pointerande att spelet endast rörde sig örn 5 kort samt att i detsamma deltogo både aktiva och passiva spelare .	29	0:34	för att stödja sig påstående gaf nu åklagare en nära skildring af ecartéspelet $ pointera att spel endast röra sig örn 5 kort samt att i densamma deltogo både aktiv och passiv spelare $
aktiv		1895	2	bib19227462_18950708_147640_155_0002_alto.xml-77-34	 	Den bekante irländsko parlamentsmedlemmen Sexton har likaledes offentliggjort en skrifvelse, i hvilket han meddelar, att han icke skall söka blifva återvald i sin valkrets, utan tänker draga sig till baka från aktivt deltagande i det politiska lifvet.	210:216	0:251	Den bekante irländsko parlamentsmedlemmen Sexton har likaledes offentliggjort en skrifvelse , i hvilket han meddelar , att han icke skall söka blifva återvald i sin valkrets , utan tänker draga sig till baka från aktivt deltagande i det politiska lifvet .	34	0:41	den bekant irländsko parlamentsmedlem sexton ha likaledes offentliggöra en skrifvelse $ i hvilket han meddela $ att han icke skola söka blifva återvälja i sig valkrets $ utan tänka dra sig till baka från aktiv deltagande i den politisk lifvet $
aktiv		1895	2	bib19277349_18950611_147403_76_0002_alto.xml-188-11	 	funderade också på, örn det ej vore lämpligt om våra aktiva nykterhetsvänner numera ägnade litet större uppmärksamhet åt de obrutna bygderna, äfven med fara att verksamheten drefves mindre kraftigt å sådana platser, där nykterheten dock står jämföi ’ elsevis högt.	53:59	0:264	funderade också på , örn det ej vore lämpligt om våra aktiva nykterhetsvänner numera ägnade litet större uppmärksamhet åt de obrutna bygderna , äfven med fara att verksamheten drefves mindre kraftigt å sådana platser , där nykterheten dock står jämföi ’ elsevis högt .	11	0:44	fundera också på $ örn den ej vara lämplig om vi aktiv nykterhetsvän numera ägna liten stor uppmärksamhet åt en obruten bygd $ äfven med fara att verksamhet drefves föga kraftig å sån plats $ där nykterhet dock stå jämföi $ elsevis hög $
aktiv		1895	2	bib15873371_18950808_145112_213_0002_alto.xml-198-1	 	Sparbankens aktiva uppgifvas nu tili 81,575 kr., medan deiå insatts i sparkassemedel 331,433 kr.	12:18	0:96	Sparbankens aktiva uppgifvas nu tili 81,575 kr. , medan deiå insatts i sparkassemedel 331,433 kr .	1	0:16	sparbank aktiv upp nu tili $ $ $ medan deiå insätta i sparkassemedel $ kr $
aktiv		1895	2	bib15873371_18950930_145112_266_0003_alto.xml-107-11	 	i$ke Kina detta vilkor, ämnar engelske befälhafvaren gifva order örn aktiva åtgärder.	69:75	0:85	i$ke Kina detta vilkor , ämnar engelske befälhafvaren gifva order örn aktiva åtgärder .	11	0:14	$ kina denna vilkor $ ämna engelsk befälhafvare gifva order örn aktiv åtgärd $
aktiv		1896	2	bib15873936_18961013_147385_119_0003_alto.xml-62-26	 	helt oförmodadt lemnat sin politiska tillbakadragenhet och med mycken skärpa uttalat sig om grymheterna mot Armenien samt gjort sig till tolk för en mera kraftig och aktiv politik från Englands sida äfven på egen hand gentemot Porten.	166:171	0:234	helt oförmodadt lemnat sin politiska tillbakadragenhet och med mycken skärpa uttalat sig om grymheterna mot Armenien samt gjort sig till tolk för en mera kraftig och aktiv politik från Englands sida äfven på egen hand gentemot Porten .	26	0:38	hel oförmodad lemna sig politisk tillbakadragenhet och med mycken skärpa uttala sig om grymhet mot armenien samt göra sig till tolk för en mera kraftig och aktiv politik från england sida äfven på egen hand gentemot port $
aktiv		1895	2	bib19227462_18951001_147640_228_0002_alto.xml-50-39	 	Då de senaste tjugufem årens ekonomiska utveckling, på samma gång kapitalet tillväxt med en större hastighet än vanligt, dock företer en kännbar minskning i kapitalafkastningen, i det att de såsom jordbrukare, industriidkare och köp män aktive kapitalisterne fått vidkännas skärpt konkurrens och sjunkande varupris och de passive kapitalisterne eller räntetagarne varit underkastade betydliga räntenedsättningar, med andra ord då det räder motsägelse mellan statistikens glädjande vittnesbörd och den missnöjda allmänna meningen i landet, sådan den kommer till uttryck hos de egendoms- och bildningsinnehafvande klasserna, så ligger den slutsatsen naturligtvis nära tillhands, att det öfverklagade ekonomiska betrycket företrädesvis träfiat de samhällsklasser, hvilka ega produktionsmedlen eller kapitalet, medan deremot nationens allmänna välstånd eller den stora arbetaremajoritetens lefnadsvilkor fortfarit att törkotras.	237:243	0:924	Då de senaste tjugufem årens ekonomiska utveckling , på samma gång kapitalet tillväxt med en större hastighet än vanligt , dock företer en kännbar minskning i kapitalafkastningen , i det att de såsom jordbrukare , industriidkare och köp män aktive kapitalisterne fått vidkännas skärpt konkurrens och sjunkande varupris och de passive kapitalisterne eller räntetagarne varit underkastade betydliga räntenedsättningar , med andra ord då det räder motsägelse mellan statistikens glädjande vittnesbörd och den missnöjda allmänna meningen i landet , sådan den kommer till uttryck hos de egendoms- och bildningsinnehafvande klasserna , så ligger den slutsatsen naturligtvis nära tillhands , att det öfverklagade ekonomiska betrycket företrädesvis träfiat de samhällsklasser , hvilka ega produktionsmedlen eller kapitalet , medan deremot nationens allmänna välstånd eller den stora arbetaremajoritetens lefnadsvilkor fortfarit att törkotras .	39	0:128	då en sen tjugufem år ekonomisk utveckling $ på samma gång kapital tillväxt med en stor hastighet än vanlig $ dock förete en kännbar minskning i kapital $ i den att de såsom jordbrukare $ industriidkare och köp man aktiv kapitalist få vidkännas skärpa konkurrens och sjunka varupris och en passiv kapitalist eller räntetagarne vara underkasta betydlig räntenedsättning $ med andra ord då den räd motsägelse mellan statistik glädja vittnesbörd och den missnöjd allmän mening i land $ sån den komma till uttryck hos en egendom och bildningsinnehafvande klass $ så ligga den slutsats naturligtvis nära tillhands $ att den öfverklaga ekonomisk betryck företrädesvis träfiat en samhällsklass $ hvilka ega produktionsmedel eller kapital $ medan deremot nation allmän välstånd eller den stor arbetaremajoritetens lefnadsvilkor fortfara att törkotras $
aktiv		1896	2	bib15975090_18961128_148377_148_0004_alto.xml-48-5	 	och pris sändes till » Aktiv », Norra Annonsbyrån, Stockholm.	23:28	0:61	och pris sändes till » Aktiv » , Norra Annonsbyrån , Stockholm .	5	0:13	och pris sända till $ aktiv $ $ norra annonsbyrå $ stockholm $
aktiv		1899	2	bib11653811_18990317_145317_42_0002_alto.xml-106-21	 	om möjligheten att i hast åter samla vår spridda trupp, ty båda två äro vi angelägna att få komma i aktiv tjenst igen.	100:105	0:118	om möjligheten att i hast åter samla vår spridda trupp , ty båda två äro vi angelägna att få komma i aktiv tjenst igen .	21	0:25	om möjlighet att i hast åter samla vi spridd trupp $ ty båda två äro vi angelägen att få komma i aktiv tjenst igen $
aktiv		1895	2	bib19277277_18950411_147683_99_0001_alto.xml-16-25	 	De personer, som önska genomgå fallständig samaritkurs med 5 lektioner neder loppet af t v i. och en half recka och derigenom blifva aktiva medlemmar af Svenska Samaritföreningen, knnna derom göra anmälan muntligen eller helst skriftligen hos Regementstntendenten Toli Holjuo, Östermalmsgatan Al 2 B, eller genom anteckning å för ändamålet framlagd lista i Hrr Samson & Wallin » Bokhandel, Alf 7 Drottninggatan.	133:139	0:411	De personer , som önska genomgå fallständig samaritkurs med 5 lektioner neder loppet af t v i . och en half recka och derigenom blifva aktiva medlemmar af Svenska Samaritföreningen , knnna derom göra anmälan muntligen eller helst skriftligen hos Regementstntendenten Toli Holjuo , Östermalmsgatan Al 2 B , eller genom anteckning å för ändamålet framlagd lista i Hrr Samson & Wallin » Bokhandel , Alf 7 Drottninggatan .	25	0:69	en person $ som önska genomgå fallständig samaritkurs med 5 lektion neder lopp af t v i $ och en half recka och derigenom blifva aktiv medlem af svensk samaritförening $ knnna derom göra anmälan muntligen eller gärna skriftligen hos regementstntendenten toli holjuo $ östermalmsgatan al 2 b $ eller genom anteckning å för ändamål framlagd lista i hrr samson $ wallin $ bokhandel $ alf 7 drottninggatan $
aktiv		1896	2	bib11653830_18960309_146968_20_0001_alto.xml-41-23	 	inflytande, och det är säkert, att man mycket lyssnar till hans ord, oaktadt han ej synnerligen ofta framträder i den aktiva politiken.	118:124	0:135	inflytande , och det är säkert , att man mycket lyssnar till hans ord , oaktadt han ej synnerligen ofta framträder i den aktiva politiken .	23	0:26	inflytande $ och den vara säker $ att man mycket lyssna till han ord $ oaktadt han ej synnerligen ofta framträda i den aktiv politik $
aktiv		1897	2	bib11653815_18970830_146944_99_0003_alto.xml-61-13	 	Simla telegraferas till ” Times": Afridierna afböllo sig på tisdagen från aktiva fiendtligbeter och stannade i bärgen, där de känna sig säkra för angrepp.	74:80	0:154	Simla telegraferas till ” Times " : Afridierna afböllo sig på tisdagen från aktiva fiendtligbeter och stannade i bärgen , där de känna sig säkra för angrepp .	13	0:28	simla telegrafera till $ times $ $ afridierna afböllo sig på tisdag från aktiv fiendtligbeter och stanna i bärgen $ där de känna sig säker för angrepp $
aktiv		1896	2	bib19227291_18960901_145289_105_0003_alto.xml-56-20	 	kostnader, som blefve en följd af den nya härordningens genomförande, så litet kännbara sorn möjligt, skall den aktiva tjenstetiden nedsättas från 28 till 24 månader, hvarigenom det årliga tillskottet icke kommer att öfverskrida sex till åtta millioner.	112:118	0:253	kostnader , som blefve en följd af den nya härordningens genomförande , så litet kännbara sorn möjligt , skall den aktiva tjenstetiden nedsättas från 28 till 24 månader , hvarigenom det årliga tillskottet icke kommer att öfverskrida sex till åtta millioner .	20	0:42	kostnad $ som blefve en följd af den ny härordning genomförande $ så liten kännbar sorn möjlig $ skola den aktiv tjenstetid nedsätta från 28 till 24 månad $ hvarigenom den årlig tillskott icke komma att öfverskrida sex till åtta million $
aktiv		1895	2	bib19227462_18950816_147640_189_0003_alto.xml-177-15	 	att profåret, som det nu är anordnadt, gifver kandidaten för lite tillfälle att aktivt deltaga i undervisningen, hvarigenom han hindras att utveckla sin disciplinära förmåga och ej får tillfälle att försöka sig i den vigtiga uppgiften, att på egen hand föra en afdelning framåt till ett bestämdt resultat i fråga om uppfostran och undervisning.	80:86	0:344	att profåret , som det nu är anordnadt , gifver kandidaten för lite tillfälle att aktivt deltaga i undervisningen , hvarigenom han hindras att utveckla sin disciplinära förmåga och ej får tillfälle att försöka sig i den vigtiga uppgiften , att på egen hand föra en afdelning framåt till ett bestämdt resultat i fråga om uppfostran och undervisning .	15	0:59	att profår $ som den nu vara anordnadt $ gifver kandidat för lite tillfälle att aktiv delta i undervisning $ hvarigenom han hindra att utveckla sig disciplinär förmåga och ej få tillfälle att försöka sig i den vigtig uppgift $ att på egen hand föra en afdelning framåt till en bestämdt resultat i fråga om uppfostran och undervisning $
aktiv		1902	2	bib11653811_19020630_145317_97_0002_alto.xml-30-25	 	I ett af sina senaste nummer har St. D. fäst uppmärksamheten på, hurusom en fordran, att fullgjorda medborgerliga rättigheter böra vara villkoret för aktiv rösträtt, är synnerligen öfverensstämmande med svenskt åskådningssätt och icke heller strider mot begreppet allmän rösträtt.	150:155	0:280	I ett af sina senaste nummer har St. D. fäst uppmärksamheten på , hurusom en fordran , att fullgjorda medborgerliga rättigheter böra vara villkoret för aktiv rösträtt , är synnerligen öfverensstämmande med svenskt åskådningssätt och icke heller strider mot begreppet allmän rösträtt .	25	0:43	i en af sig sen nummer ha $ $ fästa uppmärksamhet på $ hurusom en fordran $ att fullgöra medborgerlig rättighet böra vara villkor för aktiv rösträtt $ vara synnerligen öfverensstämmande med svensk åskådningssätt och icke heller strida mot begrepp allmän rösträtt $
aktiv		1895	2	bib15761570_18951003_146176_164_0002_alto.xml-2-4	 	i, passiva och aktiva medlemmar kalias till extra I jg, y.	15:21	0:58	i , passiva och aktiva medlemmar kalias till extra I jg , y .	4	0:14	i $ passiv och aktiv medlem kalias till extra i jg $ y $
aktiv		1895	2	bib19225758_18950729_144022_173_0002_alto.xml-144-5	 	tid tillsammans med honom såsom aktiv officer i bulgariska armén.	32:37	0:65	tid tillsammans med honom såsom aktiv officer i bulgariska armén .	5	0:11	tid tillsammans med han såsom aktiv officer i bulgarisk armé $
