lemma	pos	date	grouping	identifier	description	context	indexes_target_token	indexes_target_sentence	context_tokenized	indexes_target_token_tokenized	indexes_target_sentence_tokenized	context_lemmatized
fången		1793	1	bib19520388_17930306_147487_10_0003_alto.xml-0-115	 	du styrd lif en ffirfwMiq oifi föragtad Liga, fini * lil bine egne Uagar och dine friwilliqi » isne Deklarationer: Naiwuernr kunna icke mera ira dina löfttn, fia Du nied wald och fiåmnniit mil många Nne ©rännar al emot Deras öfwenygelfe andra De reger ingssåkk, hwarunder de lange befunnit sig lycklige, och du gör patagklige Ingrev & gt; Lllcurrale Maylere dmikövle och as dig garanterade rättigheter: dit förut ärorika namn är b.stäcka ', dä man bemist brott och twart emot din besiynriic bag, Du låtit förföra dig ar utan rallwiso, utan ädelmod eller medlidande sträcka under D ' lan Hufwudel af dea Konung, forn fången & gt; dm magt ivar nr stand ot widare stada bia, om ha » det ock tvelat; men forn d » lil » iwer stöd kände hade ek godt hjerta, el fromt finne, forn kunnat för.edas til » iitzlaa; men aldrig warit sjelfmant grym.	616:622	0:836	du styrd lif en ffirfwMiq oifi föragtad Liga , fini * lil bine egne Uagar och dine friwilliqi » isne Deklarationer : Naiwuernr kunna icke mera ira dina löfttn , fia Du nied wald och fiåmnniit mil många Nne ©rännar al emot Deras öfwenygelfe andra De reger ingssåkk , hwarunder de lange befunnit sig lycklige , och du gör patagklige Ingrev & gt ; Lllcurrale Maylere dmikövle och as dig garanterade rättigheter : dit förut ärorika namn är b.stäcka ' , dä man bemist brott och twart emot din besiynriic bag , Du låtit förföra dig ar utan rallwiso , utan ädelmod eller medlidande sträcka under D ' lan Hufwudel af dea Konung , forn fången & gt ; dm magt ivar nr stand ot widare stada bia , om ha » det ock tvelat ; men forn d » lil » iwer stöd kände hade ek godt hjerta , el fromt finne , forn kunnat för.edas til » iitzlaa ; men aldrig warit sjelfmant grym .	115	0:167	du styra lif en ffirfwmiq oifi föragtad liga $ fini $ lil bine egen uagar och dine friwilliqi $ isne deklaration $ naiwuernr kunna icke mera ira du löfttn $ fia du nied wald och fiåmnniit mil många nne $ al emot de öfwenygelfe andra en reger ingssåkk $ hwarunder de langa befinna sig lycklig $ och du göra patagklige ingrev $ gt $ lllcurrale maylere dmikövle och as du garantera rättighet $ dit förut ärorik namn vara $ $ $ dä man bemist brott och twart emot du besiynriic bag $ du låta förföra du ar utan rallwiso $ utan ädelmod eller medlidande sträcka under d $ lan hufwudel af dea konung $ forn fången $ gt $ dm magt ivar nr stand o widare stada bia $ om ha $ den ock tvelat $ men forn d $ lil $ iwer stöd känna ha ek god hjerta $ el from finne $ forn kunna $ til $ iitzlaa $ men aldrig warit sjelfmant grym $
fången		1816	1	bib11653825_18160328_145134_38_0002_alto.xml-13-1	 	fatt fången, innan ben inspärrades i tornet, är bibeyållen sådan som ben war för rz år sedan, och statt nu anwäpdas till Bonta, n » mare eller Capell.	5:11	0:150	fatt fången , innan ben inspärrades i tornet , är bibeyållen sådan som ben war för rz år sedan , och statt nu anwäpdas till Bonta , n » mare eller Capell .	1	0:33	fatt fången $ innan ben inspärra i torn $ vara bibeyållen sån som ben war för rz år sedan $ och stadd nu anwäpdas till bonta $ n $ mare eller capell $
fången		1829	1	bib11653828_18290815_144028_187_0001_alto.xml-10-12	 	sorn fången, meli likväl fri genom sina behag, oell Elisabet fången i andan oaktadt sin thron ' o. s. v.	61:67	0:104	sorn fången , meli likväl fri genom sina behag , oell Elisabet fången i andan oaktadt sin thron ' o. s. v.	12	0:22	sorn fången $ meli likväl fri genom sig behag $ oell elisabet fången i anda oaktadt sig thron $ $ $ $
fången		1790	1	bib11653792_17900410_146919_14_0002_alto.xml-6-36	 	derefter straxt i land och stormade; de Poster och Folk, som wörö i Fästningen, sprungo genast, utan at lossa stolt; gamla Invalider, svin intet hrmno sä fort undan, blefwo fångne, men sedermera återlämnade.	173:179	0:207	derefter straxt i land och stormade ; de Poster och Folk , som wörö i Fästningen , sprungo genast , utan at lossa stolt ; gamla Invalider , svin intet hrmno sä fort undan , blefwo fångne , men sedermera återlämnade .	36	0:42	derefter straxt i land och storma $ en post och folk $ som wörö i fästning $ sprungo genast $ utan at lossa stolt $ gammal invalid $ svin intet hrmno sä fort undan $ blefwo fången $ men sedermera återlämna $
fången		1800	1	bib11653828_18000628_144028_143_0004_alto.xml-0-8	 	hund frälste honom frän at bli dödad eller fången.	43:49	0:50	hund frälste honom frän at bli dödad eller fången .	8	0:10	hund frälsa han frän at bli döda eller fången $
fången		1830	1	bib11653828_18301119_144028_269_0004_alto.xml-2-6	 	Oin den medlidsamma qvinnan vet hvarest fången vistas, så smyger hon sig nattetid in i hans tält, och söker fästa en trådsända om hatts arm eller ben, eller gifva honom den i munnen; derefter begifver hon sig, uppvecklande nystanet, till nästa tält, väcker der en slumrande Arab och lägger nystanet på hans bröst, sägande: ' ' Se upp I jng besvär dig vid kärleken till Gud och dig sjelf, att taga detta under ditt beskydd."	40:46	0:423	Oin den medlidsamma qvinnan vet hvarest fången vistas , så smyger hon sig nattetid in i hans tält , och söker fästa en trådsända om hatts arm eller ben , eller gifva honom den i munnen ; derefter begifver hon sig , uppvecklande nystanet , till nästa tält , väcker der en slumrande Arab och lägger nystanet på hans bröst , sägande : ' ' Se upp I jng besvär dig vid kärleken till Gud och dig sjelf , att taga detta under ditt beskydd . "	6	0:87	oin den medlidsam qvinna veta hvarest fången vistas $ så smyga hon sig nattetid in i han tält $ och söka fästa en trådsända om hatt arm eller ben $ eller gifva han den i mun $ derefter begifver hon sig $ uppveckla nystan $ till nästa tält $ väcka der en slumra arab och lägga nystan på han bröst $ sägande $ $ $ se upp i jng besvär du vid kärlek till gud och du sjelf $ att ta denna under du beskydd $ $
fången		1808	1	bib19225772_18081118_148004_132_0001_alto.xml-3-265	 	Beredd att på denna tid, som redan förut war bestämd, emottaga attaque, wax det mig icke owantadt akt samma moment tiden utgick, erhålla Rapport att tm » förpostkedja blifwit attaquerad, och med den häftighet och öfwerlagftnhet i styrka, alt den måste drag » sig på denna sidan Wirda bro, hwilIen genom manstap som derwid woro i beredst.. p^ till hälften blef uppriswen^ Kort derpå börjades en haflig canoneld ifrån fiendens sida af det Artilleri han transporterat upoå de straxt bakom nämnde past bclagne höjder, men bkf ifrån wåra batierier, som woro placerade uppå de fsrmoniigaste liallen localen medgaf, med lika listighet beswarad, och erhöll General-Majoren Furst Dolgmucki, som förde Avantgardet, redan i hörja » as affairen en sä swär bletzure af en eanonkula, att han en kort stund derefter aflid, t Under detta drogo sig så wal deras Jagare som Infanteri öfwer bron, den de sä wida reparerade, alt någre man i sönder kunde komma öfwer på denna sidan patzet, och sedan de i skygd af en straxt derwid belägen gård, hunnit samla en betydlig styrka, begynte de sprida sig i kedja och avancerade på detta satt, oaktadt en oafbruten både Artilleri- och mousquettert-eld, under wåra batterier, som de med storm sökte intaga; men blefwo af wåra troppar med den bravoure och häftighet tillbakadrifne och förföljde ända bakom Wirda bro, att deras förlust under affairen, fom påstod i 6 timmar intill mörkningen, utgjorde, utom 2 st. fångne Officerare, Majoren wid 4:de Jägare-Regementet Abernibeston och Capitenen w&gt; d samma Regcniente Rusinoff, 2me Under - Officerare och 69 man, öfwer 200 dsdskjutne och 16 »	1434:1440	0:1614	Beredd att på denna tid , som redan förut war bestämd , emottaga attaque , wax det mig icke owantadt akt samma moment tiden utgick , erhålla Rapport att tm » förpostkedja blifwit attaquerad , och med den häftighet och öfwerlagftnhet i styrka , alt den måste drag » sig på denna sidan Wirda bro , hwilIen genom manstap som derwid woro i beredst .. p^ till hälften blef uppriswen^ Kort derpå börjades en haflig canoneld ifrån fiendens sida af det Artilleri han transporterat upoå de straxt bakom nämnde past bclagne höjder , men bkf ifrån wåra batierier , som woro placerade uppå de fsrmoniigaste liallen localen medgaf , med lika listighet beswarad , och erhöll General-Majoren Furst Dolgmucki , som förde Avantgardet , redan i hörja » as affairen en sä swär bletzure af en eanonkula , att han en kort stund derefter aflid , t Under detta drogo sig så wal deras Jagare som Infanteri öfwer bron , den de sä wida reparerade , alt någre man i sönder kunde komma öfwer på denna sidan patzet , och sedan de i skygd af en straxt derwid belägen gård , hunnit samla en betydlig styrka , begynte de sprida sig i kedja och avancerade på detta satt , oaktadt en oafbruten både Artilleri- och mousquettert-eld , under wåra batterier , som de med storm sökte intaga ; men blefwo af wåra troppar med den bravoure och häftighet tillbakadrifne och förföljde ända bakom Wirda bro , att deras förlust under affairen , fom påstod i 6 timmar intill mörkningen , utgjorde , utom 2 st. fångne Officerare , Majoren wid 4:de Jägare-Regementet Abernibeston och Capitenen w&gt ; d samma Regcniente Rusinoff , 2me Under - Officerare och 69 man , öfwer 200 dsdskjutne och 16 »	265	0:296	bereda att på denna tid $ som redan förut war bestämd $ emotta attaque $ wax den jag icke owantadt akt samma moment tid utgå $ erhålla rapport att tm $ förpostkedja blifwit attaquerad $ och med den häftighet och öfwerlagftnhet i styrka $ alt den måste drag $ sig på denna sida wirda bro $ hwilien genom manstap som derwid woro i beredst $ $ till hälft blef $ kort derpå börja en haflig canoneld ifrån fiende sida af den artilleri han transportera upoå en straxt bakom nämna past bclagne höjd $ men bkf ifrån wåra batierier $ som woro placera uppå en fsrmoniigaste liallen localen medgaf $ med lika listighet beswarad $ och erhålla $ furst dolgmucki $ som föra avantgarde $ redan i hörja $ as affairen en sä swär bletzure af en eanonkula $ att han en kort stund derefter aflid $ t under denna drogo sig så wal de jagare som infanteri öfwer bro $ den en sä wida reparera $ alt någre man i sönder kunna komma öfwer på denna sida patzet $ och sedan de i skygd af en straxt derwid belägen gård $ hinna samla en betydlig styrka $ begynna de sprida sig i kedja och avancera på denna sitta $ oaktadt en oafbruten både artilleri och $ $ under wåra batteri $ som de med storm söka inta $ men blefwo af wåra tropp med den bravoure och häftighet tillbakadrifne och förfölja ända bakom wirda bro $ att de förlust under affairen $ få påstå i 6 timme intill mörkning $ utgöra $ utom 2 $ fången officer $ major wid $ $ abernibeston och capitenen $ $ d samma regcniente rusinoff $ 2me under $ officer och 69 man $ öfwer 200 dsdskjutne och 16 $
fången		1830	1	bib11653828_18301109_144028_260_0002_alto.xml-22-3	 	biet lian likväl fången och upphängd tillika med sin tappre och olycklige anförvandt. ”	17:23	0:87	biet lian likväl fången och upphängd tillika med sin tappre och olycklige anförvandt . ”	3	0:15	bi lian likväl fången och $ tillika med sig tapper och olycklig anförvandt $ $
fången		1829	1	bib11653828_18290902_144028_202_0002_alto.xml-14-2	 	förevitade den fångne Konungen hans gudlöshet all tåla Kristi mördare i sitt land, befallte han, att alla, som icke födde sig med mekaniska och handarbeten, skulle utdrifvas.	15:21	0:174	förevitade den fångne Konungen hans gudlöshet all tåla Kristi mördare i sitt land , befallte han , att alla , som icke födde sig med mekaniska och handarbeten , skulle utdrifvas .	2	0:32	förevita den fången konung han gudlöshet all tåla kristi mördare i sig land $ befallte han $ att all $ som icke föda sig med mekanisk och handarbete $ skola utdrifvas $
fången		1829	1	bib11653828_18290618_144028_138_0002_alto.xml-7-23	 	fullföljde denna åtgärd med sådan stränghet, att han icke drog i betänkande att hålla Engelsmän, Italienare, Portugiser och andra fremlingar fångna i sina stater.	141:147	0:162	fullföljde denna åtgärd med sådan stränghet , att han icke drog i betänkande att hålla Engelsmän , Italienare , Portugiser och andra fremlingar fångna i sina stater .	23	0:28	fullfölja denna åtgärd med sån stränghet $ att han icke dra i betänkande att hålla engelsman $ italienare $ portugis och andra fremlingar fången i sig stat $
fången		1809	1	bib11653825_18090810_145134_93_0002_alto.xml-11-13	 	desertion, jemte den han lidit i sårade, döda » de och fångne, fulländar detz förstöring.	55:61	0:89	desertion , jemte den han lidit i sårade , döda » de och fångne , fulländar detz förstöring .	13	0:19	desertion $ jemte den han lida i såra $ död $ de och fången $ fullända detz förstöring $
fången		1829	1	bib11653828_18290710_144028_156_0003_alto.xml-10-12	 	6)" För att preja sig till penningar håller polisen menniskor fångna i deras egna hus, och plågar och oroar dem olagligen på allt möjligt sätt, innan hon förer dem inför domaren » Detta sker icke endast vid tillfällen, som rora stora förbrytelser, såsom mord och röfverier, utan äfven vid sådana, då fråga endast Sr om landtegendom, äktenskap, o. s. v. Om deo fångnes död häraf blir följden, såsom ofta	62:68	0:402	6 ) " För att preja sig till penningar håller polisen menniskor fångna i deras egna hus , och plågar och oroar dem olagligen på allt möjligt sätt , innan hon förer dem inför domaren » Detta sker icke endast vid tillfällen , som rora stora förbrytelser , såsom mord och röfverier , utan äfven vid sådana , då fråga endast Sr om landtegendom , äktenskap , o. s. v. Om deo fångnes död häraf blir följden , såsom ofta	12	0:80	6 $ $ för att preja sig till penning hålla polis menniska fången i de egen hus $ och plåga och oroa de olagligen på all möjlig sätt $ innan hon förer de inför domare $ denna ske icke endast vid tillfälle $ som rora stor förbrytelse $ såsom mord och röfveri $ utan äfven vid sån $ då fråga endast sr om landtegendom $ äktenskap $ $ $ $ om deo fången död häraf bli följd $ såsom ofta
fången		1790	1	bib13506739_17900802_144030_175_0001_alto.xml-5-28	 	lOen som emottagir Tjugu stycken Fångar och därutdswer, äger, om han sä ästundar, at därjämte, sj lånat tilgången medaifwer, erhålla någon «f de fångne Under-off^erarne, som öfwer dem kan hafwa » åseende, och til hwilken Wi oaskertadt wilja betala famma underhäll i alla delar, som hsnom ann » rs under sängenstapen bestås.	145:151	0:323	lOen som emottagir Tjugu stycken Fångar och därutdswer , äger , om han sä ästundar , at därjämte , sj lånat tilgången medaifwer , erhålla någon «f de fångne Under-off^erarne , som öfwer dem kan hafwa » åseende , och til hwilken Wi oaskertadt wilja betala famma underhäll i alla delar , som hsnom ann » rs under sängenstapen bestås .	28	0:61	lo som emottagir tjugu styck fånge och därutdswer $ äga $ om han sä ästundar $ at därjämte $ sj låna tilgång medaifwer $ erhålla någon $ en fången $ $ som öfwer de kunna hafwa $ åseende $ och til hwilken wi oaskertadt wilja betala famma underhäll i all del $ som hsnom ann $ r under sängenstapen bestå $
fången		1829	1	bib11653828_18290603_144028_126_0002_alto.xml-19-1	 	gånger fången och ständigt dömd till hårdare fängelsestraff, finner Petit ingen fjettra för stark, intet galler, ingen mur, ingen dörr eller lås oemotståndlig, till dess han nu omsider hvilar ut i Toulons Bagno.	7:13	0:211	gånger fången och ständigt dömd till hårdare fängelsestraff , finner Petit ingen fjettra för stark , intet galler , ingen mur , ingen dörr eller lås oemotståndlig , till dess han nu omsider hvilar ut i Toulons Bagno .	1	0:39	gång fången och ständig dömd till hård fängelsestraff $ finna petit ingen fjettra för stark $ intet galler $ ingen mur $ ingen dörr eller lås oemotståndlig $ till dess han nu omsider hvilar ut i toulons bagno $
fången		1792	1	bib11653828_17920810_144028_183_0002_alto.xml-4-5	 	Lasten, wid desi sötter fången, Krostad af desi ögonkast, Såg sig; och för första gången Vlygdcs wid at wara Last.	24:30	0:114	Lasten , wid desi sötter fången , Krostad af desi ögonkast , Såg sig ; och för första gången Vlygdcs wid at wara Last .	5	0:25	last $ wid desi sötter fången $ krostad af desi ögonkast $ se sig $ och för $ gång vlygdcs wid at wara last $
fången		1826	1	bib13506739_18261013_144030_227_0002_alto.xml-7-1	 	— Fången nickade bifall till hwarje ord af den berättandes mun, Likasom han welat säga:" Herrn har alldeles.	2:8	0:108	— Fången nickade bifall till hwarje ord af den berättandes mun , Likasom han welat säga : " Herrn har alldeles .	1	0:22	$ fången nicka bifall till hwarje ord af den berätta mun $ likasom han welat säga $ $ herr ha alldeles $
fången		1829	1	bib11653828_18290926_144028_223_0003_alto.xml-3-18	 	uppbragte för någon tid sedan ett vackert Amerikanskt hvalfiskfångarefartyg och insände det till vår hamn; besättningen hålles fången på San Miguel.	127:133	0:148	uppbragte för någon tid sedan ett vackert Amerikanskt hvalfiskfångarefartyg och insände det till vår hamn ; besättningen hålles fången på San Miguel .	18	0:23	uppbragt för någon tid sedan en vacker amerikansk hvalfiskfångarefartyg och insända den till vi hamn $ besättning hålla fången på san miguel $
fången		1829	1	bib11653828_18290918_144028_216_0002_alto.xml-19-1	 	han fången sin ytterligare tjenst; men allt hvad han i detta ögonblick kunde anskaffa till hans ■vederqvickelse, bestod i en kopp té.	4:10	0:133	han fången sin ytterligare tjenst ; men allt hvad han i detta ögonblick kunde anskaffa till hans ■vederqvickelse , bestod i en kopp té .	1	0:25	han fången sig ytterlig tjenst $ men all hvad han i denna ögonblick kunna anskaffa till han $ $ bestå i en kopp té $
fången		1826	1	bib13506739_18261013_144030_227_0002_alto.xml-13-2	 	— - Fången lyssnade med synbar tillfredsställelse och stolthet till denna historia om hans bragder; hwarefter han släpptes pa fri fot, frikänd från alt hafwa stulit de gamla timmermans-redstapen, som woro litet eller intet warda och till hwilka ej heller någon egare anmält sig.	4:10	0:278	— - Fången lyssnade med synbar tillfredsställelse och stolthet till denna historia om hans bragder ; hwarefter han släpptes pa fri fot , frikänd från alt hafwa stulit de gamla timmermans-redstapen , som woro litet eller intet warda och till hwilka ej heller någon egare anmält sig .	2	0:48	$ $ fången lyssna med synbar tillfredsställelse och stolthet till denna historia om han bragd $ hwarefter han släppa pa fri fot $ frikänna från alt hafwa stjäla en gammal $ $ som woro liten eller intet warda och till hwilka ej heller någon egare anmäla sig $
fången		1829	1	bib11653828_18290917_144028_215_0001_alto.xml-5-2	 	Miller blef fången såsom parlamentär och slöt i denna folkrättsvidriga fångenskap	12:18	0:81	Miller blef fången såsom parlamentär och slöt i denna folkrättsvidriga fångenskap	2	0:11	miller blef fången såsom parlamentär och sluta i denna folkrättsvidrig fångenskap
fången		1796	1	bib11653828_17960514_144028_108_0001_alto.xml-2-14	 	fördunklat glansen af förra Bataillen wid ' Montenotte, fiendens förlust bestått i 9202 fångne och 2522 döde, utom 15 Fanor och 42 Kanoner; hwaremot Fransmännens bestigit sig lil Z eller 422 döde och blcsicradc.	88:94	0:211	fördunklat glansen af förra Bataillen wid ' Montenotte , fiendens förlust bestått i 9202 fångne och 2522 döde , utom 15 Fanor och 42 Kanoner ; hwaremot Fransmännens bestigit sig lil Z eller 422 döde och blcsicradc .	14	0:38	fördunkla glans af förra bataillen wid $ montenotte $ fiende förlust bestå i 9202 fången och 2522 död $ utom 15 fana och 42 kanon $ hwaremot fransman bestiga sig lil z eller 422 död och blcsicradc $
fången		1825	1	bib13506739_18251024_144030_246_0003_alto.xml-10-8	 	Trycket har uikommit: Grundreglor och Tankar af Fången på S; t	48:54	0:62	Trycket har uikommit : Grundreglor och Tankar af Fången på S ; t	8	0:13	tryck ha uikommit $ grundreglor och tank af fången på s $ t
fången		1827	1	bib19277277_18270213_147682_36_0001_alto.xml-38-7	 	— tillade han — jag ger mig fången; jag wille blott radda min och min familjs ära.	28:34	0:82	— tillade han — jag ger mig fången ; jag wille blott radda min och min familjs ära .	7	0:19	$ tillägga han $ jag ge jag fången $ jag wille blott radda jag och jag familj ära $
fången		1829	1	bib11653828_18290723_144028_167_0002_alto.xml-9-7	 	" Borrt ifrån mig," röt fången åt honom och vände sig derpå till en af Voltigörerna, sägande:" Kamrat, gif mig något alt dricka; ' ' soldaten räckte honom sin flaska och rökaren, nyss förut i strid med honom på lif och död, drack nu derutur.	24:30	0:241	" Borrt ifrån mig , " röt fången åt honom och vände sig derpå till en af Voltigörerna , sägande : " Kamrat , gif mig något alt dricka ; ' ' soldaten räckte honom sin flaska och rökaren , nyss förut i strid med honom på lif och död , drack nu derutur .	7	0:55	$ borrt ifrån jag $ $ ryta fången åt han och vända sig derpå till en af voltigör $ säga $ $ kamrat $ gif jag något alt dricka $ $ $ soldat räcka han sig flaska och rökare $ nyss förut i strid med han på lif och död $ dricka nu derutur $
fången		1804	1	bib19223423_18040718_145063_57_0003_alto.xml-0-17	 	r&lt; tl Nelson Ika li hotat bombardera Livorno och förklara betz hamn blockerad, om dc fångne ej befriades.	88:94	0:108	r&lt ; tl Nelson Ika li hotat bombardera Livorno och förklara betz hamn blockerad , om dc fångne ej befriades .	17	0:21	$ $ tl nelson ika lie hota bombardera livorno och förklara betz hamn blockera $ om dc fången ej befria $
fången		1830	1	bib11653828_18300208_144028_31_0003_alto.xml-14-31	 	l ’ a, i koloniens auktionshu^, offentligen till den mestbjudande mot kontant betalning, so n genast erlägges, försäljas; en Rappurielle (skall betyda: en liten fången Negrinna), en fången sjö nan, en fången timmerman, vinättika, åtskilliga klädespersedlar och andra effekter.	161:167	0:276	l ’ a , i koloniens auktionshu^ , offentligen till den mestbjudande mot kontant betalning , so n genast erlägges , försäljas ; en Rappurielle ( skall betyda : en liten fången Negrinna ) , en fången sjö nan , en fången timmerman , vinättika , åtskilliga klädespersedlar och andra effekter .	31	0:52	l $ a $ i koloni $ $ offentligen till den mestbjudande mot kontant betalning $ so n genast erlägga $ försälja $ en rappurielle $ skola betyda $ en liten fången negrinna $ $ en fången sjö nan $ en fången timmerman $ vinättika $ åtskillig klädespersedel och andra effekt $
fången		1830	1	bib11653828_18301018_144028_241_0003_alto.xml-3-39	 	Ahlefeld, tillika ined deras tjenare Musdaemon — hvilken är Grefvinnans älskare och far åt dess son — anstiftat ett uppror bland grafarbetare och landtfolk, hvarvid flera hundrade af dessa oskyldiga omkomma, for att — förderfva den fångne Greiflenfeld, hvilken beskylles för att vara dess upphofsman.	232:238	0:300	Ahlefeld , tillika ined deras tjenare Musdaemon — hvilken är Grefvinnans älskare och far åt dess son — anstiftat ett uppror bland grafarbetare och landtfolk , hvarvid flera hundrade af dessa oskyldiga omkomma , for att — förderfva den fångne Greiflenfeld , hvilken beskylles för att vara dess upphofsman .	39	0:50	ahlefeld $ tillika ined de tjenare musdaemon $ hvilken vara grefvinna älskare och far åt den son $ anstifta en uppror bland grafarbetare och landtfolk $ hvarvid flera hundrade af denna oskyldig omkomma $ fara att $ förderfva den fången greiflenfeld $ hvilken beskylla för att vara den upphofsman $
fången		1829	1	bib11653828_18290710_144028_156_0003_alto.xml-10-72	 	6)" För att preja sig till penningar håller polisen menniskor fångna i deras egna hus, och plågar och oroar dem olagligen på allt möjligt sätt, innan hon förer dem inför domaren » Detta sker icke endast vid tillfällen, som rora stora förbrytelser, såsom mord och röfverier, utan äfven vid sådana, då fråga endast Sr om landtegendom, äktenskap, o. s. v. Om deo fångnes död häraf blir följden, såsom ofta	360:367	0:402	6 ) " För att preja sig till penningar håller polisen menniskor fångna i deras egna hus , och plågar och oroar dem olagligen på allt möjligt sätt , innan hon förer dem inför domaren » Detta sker icke endast vid tillfällen , som rora stora förbrytelser , såsom mord och röfverier , utan äfven vid sådana , då fråga endast Sr om landtegendom , äktenskap , o. s. v. Om deo fångnes död häraf blir följden , såsom ofta	72	0:80	6 $ $ för att preja sig till penning hålla polis menniska fången i de egen hus $ och plåga och oroa de olagligen på all möjlig sätt $ innan hon förer de inför domare $ denna ske icke endast vid tillfälle $ som rora stor förbrytelse $ såsom mord och röfveri $ utan äfven vid sån $ då fråga endast sr om landtegendom $ äktenskap $ $ $ $ om deo fången död häraf bli följd $ såsom ofta
