lemma	pos	date	grouping	identifier	description	context	indexes_target_token	indexes_target_sentence	context_tokenized	indexes_target_token_tokenized	indexes_target_sentence_tokenized	context_lemmatized
fången		1902	2	bib11653838_19020103_147024_1_0003_alto.xml-221-11	 	skjuten i venstra benet, vid Pultava sårad och vid Dniepern fången.	60:66	0:67	skjuten i venstra benet , vid Pultava sårad och vid Dniepern fången .	11	0:13	skjuta i venstra ben $ vid pultava såra och vid dniepern fången $
fången		1901	2	bib11653811_19010403_145317_52_0003_alto.xml-122-4	 	De två vakterna förde fången fram till bordet, och på ett tecken af kommissarien aflägsnade de sig utom hörhåll.	22:28	0:112	De två vakterna förde fången fram till bordet , och på ett tecken af kommissarien aflägsnade de sig utom hörhåll .	4	0:21	en två vakt föra fången fram till bord $ och på en tecken af kommissarie aflägsna de sig utom hörhåll $
fången		1897	2	bib11653811_18970203_145317_18_0003_alto.xml-206-6	 	tog sin gäst, f. d. fången, med till sin hydda, der de båda sträckte ut sig på några mattor.	20:26	0:92	tog sin gäst , f. d. fången , med till sin hydda , der de båda sträckte ut sig på några mattor .	6	0:23	ta sig gäst $ $ $ fången $ med till sig hydda $ der en båda sträcka ut sig på någon matta $
fången		1896	2	bib19227291_18960718_145289_86_0002_alto.xml-101-18	 	ramlade ned från sina platser rrte i det brinnande köket, och örn de några ögonblick till legat fångna i sömnen, skulle alla tre dessa lif varit till — spillogifna.	96:102	0:164	ramlade ned från sina platser rrte i det brinnande köket , och örn de några ögonblick till legat fångna i sömnen , skulle alla tre dessa lif varit till — spillogifna .	18	0:32	ramla ned från sig plats rrte i den brinna kök $ och örn de någon ögonblick till ligga fången i sömn $ skola all tre denna lif vara till $ spillogifna $
fången		1895	2	bib15650837_18951016_146391_241_0003_alto.xml-86-5	 	En del högre hovas-officerare hållas fångna, till dess afväpningen blifvit veikstäld.	37:43	0:85	En del högre hovas-officerare hållas fångna , till dess afväpningen blifvit veikstäld .	5	0:13	en del hög $ hålla fången $ till dess afväpningen blifvit veikstäld $
fången		1896	2	bib15975090_18961107_148377_139_0003_alto.xml-88-5	 	Det antages att flickorna hållas fångna af en muhamedansk scheik, som vill söka förmå dem att öfvergå till Islam och inträda i harem.	33:39	0:133	Det antages att flickorna hållas fångna af en muhamedansk scheik , som vill söka förmå dem att öfvergå till Islam och inträda i harem .	5	0:25	den anta att flicka hålla fången af en muhamedansk scheik $ som vilja söka förmå de att öfvergå till islam och inträda i harem $
fången		1895	2	bib19225758_18951019_144022_244_0002_alto.xml-97-8	 	En vän till d:r Bayol har besökt den fångne Behanzin, men förbjöds att med honom tala örn den förre guvernören.	37:43	0:111	En vän till d:r Bayol har besökt den fångne Behanzin , men förbjöds att med honom tala örn den förre guvernören .	8	0:22	en vän till $ bayol ha besöka den fången behanzin $ men förbjuda att med han tala örn den förra guvernör $
fången		1895	2	bib19277277_18950108_147683_7_0008_alto.xml-52-8	 	rymde P. från fångföraren sedan denne och fången under färden till länsfängelset inkommit en stuga logis för fångföraren, men kunde af donne ej återfinnas, oj heller af sedermera utsända personer.	42:48	0:196	rymde P . från fångföraren sedan denne och fången under färden till länsfängelset inkommit en stuga logis för fångföraren , men kunde af donne ej återfinnas , oj heller af sedermera utsända personer .	8	0:34	rymma p $ från fångförare sedan denna och fången under färd till länsfängelse inkomma en stuga logi för fångförare $ men kunna af donne ej återfinna $ oj heller af sedermera utsända person $
fången		1895	2	bib15761097_18950709_145020_80_0003_alto.xml-71-1	 	här fången, under det man realiserade möbler och inventarier i hennes hus.	4:10	0:74	här fången , under det man realiserade möbler och inventarier i hennes hus .	1	0:14	här fången $ under den man realisera möbel och inventarier i hon hus $
fången		1895	2	bib11653790_18951025_145648_44_0006_alto.xml-80-23	 	Jag skyndade genast till den stad, där assisdomstolen för året hade sitt säte, och erhöll med någon svårighet tillstånd att besöka fången i det fängelse, lian där satt i. Ilan förnekade inför mig högtidligt, att han hade sig något bekant rörande mordet och aflade en helig ed på, att han var oskyldig.	131:137	0:301	Jag skyndade genast till den stad , där assisdomstolen för året hade sitt säte , och erhöll med någon svårighet tillstånd att besöka fången i det fängelse , lian där satt i . Ilan förnekade inför mig högtidligt , att han hade sig något bekant rörande mordet och aflade en helig ed på , att han var oskyldig .	23	0:59	jag skynda genast till den stad $ där assisdomstolen för år ha sig säte $ och erhålla med någon svårighet tillstånd att besöka fången i den fängelse $ lian där sätta i $ ilan förneka inför jag högtidlig $ att han ha sig någon bekant rörande mord och aflägga en helig ed på $ att han vara oskyldig $
fången		1895	2	bib19227291_18950702_145289_78_0003_alto.xml-46-52	 	Gråtande och klagande begrofvo familjens qvinliga medlemmar, klädda i svart, örn aftonen det hemska örat i ett hörn af trädgården och täckte grafven med en stor sten, medan lorden återvände från staden, der han telegraferat till fl^n en elske konsuln närmast den trakt, hvarest Giuseppe höll Robert fången, bedjande honom ombesörja fångens lösköpande för den begärda summan, hvilken han skickade genom en bank.	299:305	0:410	Gråtande och klagande begrofvo familjens qvinliga medlemmar , klädda i svart , örn aftonen det hemska örat i ett hörn af trädgården och täckte grafven med en stor sten , medan lorden återvände från staden , der han telegraferat till fl^n en elske konsuln närmast den trakt , hvarest Giuseppe höll Robert fången , bedjande honom ombesörja fångens lösköpande för den begärda summan , hvilken han skickade genom en bank .	52	0:71	gråta och klaga begrofvo familj qvinlig medlem $ klä i svart $ örn afton den hemsk öra i en hörn af trädgård och täcka grafva med en stor sten $ medan lord återvända från stad $ der han telegrafera till $ en elske konsul nära den trakt $ hvarest giuseppe hålla robert fången $ be han ombesörja fång lösköpa för den begära summa $ hvilken han skicka genom en bank $
fången		1895	2	bib19225758_18950529_144022_123_0002_alto.xml-165-12	 	fånge: » Hvad bragte er hit, min vän? » Fången vresigt: » Detsamma sorn förde er hit — begäret att lägga mig i andras angelägenheter.	40:46	0:133	fånge : » Hvad bragte er hit , min vän ? » Fången vresigt : » Detsamma sorn förde er hit — begäret att lägga mig i andras angelägenheter .	12	0:30	fånge $ $ hvad bringa er hit $ jag vän $ $ fången vresig $ $ densamma sorn föra ni hit $ begär att lägga jag i annan angelägenhet $
fången		1900	2	bib11653811_19000129_145317_15_0001_alto.xml-52-11	 	engelsmän i de främsta förskansningarna hafva gifvit sig ocb föras nu fångna till hufvudlägret.	70:76	0:95	engelsmän i de främsta förskansningarna hafva gifvit sig ocb föras nu fångna till hufvudlägret .	11	0:15	engelsman i en främst förskansning hafva gifvit sig ocb föra nu fången till hufvudlägret $
fången		1895	2	bib15873936_18950417_147385_46_0002_alto.xml-175-27	 	återgifva vi följande stycke om socialismen: » I den socialistiska staten skall guldkalfvens tempel vara jemnadt med marken, produktionen håller icke längre det personliga intresset fånget och individernas kamp för tillvaron har blifvit Öfverflyttad på samhället såsom helhet Alen därmed försvinna också de jorna driffjädrarne till arbete: hoppet örn vinning och nödvändighetens kraf.	182:188	0:384	återgifva vi följande stycke om socialismen : » I den socialistiska staten skall guldkalfvens tempel vara jemnadt med marken , produktionen håller icke längre det personliga intresset fånget och individernas kamp för tillvaron har blifvit Öfverflyttad på samhället såsom helhet Alen därmed försvinna också de jorna driffjädrarne till arbete : hoppet örn vinning och nödvändighetens kraf .	27	0:57	återgifva vi följa stycke om socialism $ $ i den socialistisk stat skola guldkalfvens tempel vara jemnadt med mark $ produktion hålla icke lång den personlig intresse fången och individ kamp för tillvaro ha blifvit öfverflytta på samhälle såsom helhet al därmed försvinna också en jorna driffjäder till arbete $ hopp örn vinning och nödvändighet kraf $
fången		1895	2	bib15650837_18950729_146391_173_0003_alto.xml-114-5	 	beherska Korea och hålla konungen fången London den 28 Juli.	34:40	0:60	beherska Korea och hålla konungen fången London den 28 Juli .	5	0:11	beherska korea och hålla konung fången london den 28 juli $
fången		1900	2	bib11653811_19000818_145317_127_0004_alto.xml-66-10	 	tillkallats, ha värderat jernbiten till 60 öre, men fången ansåg, att om han tillgripit den för att sälja den, han vid försäljningen icke skulle kunnat få mera än 6 öre för densamma.	52:58	0:182	tillkallats , ha värderat jernbiten till 60 öre , men fången ansåg , att om han tillgripit den för att sälja den , han vid försäljningen icke skulle kunnat få mera än 6 öre för densamma .	10	0:37	tillkalla $ ha värdera jernbiten till 60 öre $ men fången anse $ att om han tillgripa den för att sälja den $ han vid försäljning icke skola kunna få mera än 6 öre för densamma $
fången		1895	2	bib19277349_18951212_147403_156_0003_alto.xml-105-4	 	lia varit vansinnig eller fången i en ond dröm, då jag kunde förgäta allt... men nu lia klockorna befriat mig... Eugéne försökte att med våld draga henne ned i båten, men hon slet sig lös och sprang i vild ångest upp mot klock¬	26:32	0:227	lia varit vansinnig eller fången i en ond dröm , då jag kunde förgäta allt ... men nu lia klockorna befriat mig ... Eugéne försökte att med våld draga henne ned i båten , men hon slet sig lös och sprang i vild ångest upp mot klock¬	4	0:47	lia vara vansinnig eller fången i en ond dröm $ då jag kunna förgäta allt $ men nu lia klocka befria jag $ eugéne försöka att med våld dra hon ned i båt $ men hon slita sig lös och springa i vild ångest upp mot $
fången		1895	2	bib15761570_18950403_146176_58_0003_alto.xml-147-5	 	Denna formula upprepades oupphörligt och fången bibehöll sitt sinneslugn hela tiden ända tills presten Alphonse Lemaitre framkallades.	41:47	0:134	Denna formula upprepades oupphörligt och fången bibehöll sitt sinneslugn hela tiden ända tills presten Alphonse Lemaitre framkallades .	5	0:18	denna formula upprepa oupphörlig och fången bibehålla sig sinneslugn hel tid ända tills prest alphonse lemaitre framkalla $
fången		1896	2	bib11653811_18960905_145317_136_0003_alto.xml-134-1	 	— Fången synes känna igen eder, fortsatte domaren, och ehuru det är mot all¬ it t	2:8	0:81	— Fången synes känna igen eder , fortsatte domaren , och ehuru det är mot all¬ it t	1	0:18	$ fången synas känna igen ni $ fortsätta domare $ och ehuru den vara mot $ it t
fången		1895	2	bib19277349_18950409_147403_46_0003_alto.xml-82-12	 	det gjorde hon ändå ej, ty » festglädjen tog henne hastigt fången.	59:65	0:66	det gjorde hon ändå ej , ty » festglädjen tog henne hastigt fången .	12	0:14	den göra hon ändå ej $ ty $ festglädje ta hon hastig fången $
fången		1896	2	bib11653830_18960203_146968_10_0003_alto.xml-122-0	 	Fången svarade icke, men det hördes ett svagt slamrande af en kedja.	0:6	0:68	Fången svarade icke , men det hördes ett svagt slamrande af en kedja .	0	0:14	fången svara icke $ men den höra en svag slamrande af en kedja $
fången		1895	2	bib19227291_18950521_145289_60_0003_alto.xml-100-0	 	Fången får samma kost sorn kolonisoldaterna, dock ej något vin; sådant får han, endast om han sjelf vill betala det.	0:6	0:116	Fången får samma kost sorn kolonisoldaterna , dock ej något vin ; sådant får han , endast om han sjelf vill betala det .	0	0:24	fången få samma kost sorn kolonisoldaterna $ dock ej någon vin $ sån få han $ endast om han sjelf vilja betala den $
fången		1903	2	bib11653790_19030127_12541_7_0002_alto.xml-122-27	 	bad honom ursäkta, att jag störde honom och föreläde honom därpå utan omsvep min begäran om benådning för general Moreno de las Penas och de öfriga fångna officerarne.	148:154	0:167	bad honom ursäkta , att jag störde honom och föreläde honom därpå utan omsvep min begäran om benådning för general Moreno de las Penas och de öfriga fångna officerarne .	27	0:30	be han ursäkta $ att jag störa han och föreläde han därpå utan omsvep jag begäran om benådning för general moreno de las pen och en öfrig fången officerarne $
fången		1896	2	bib19277301_18960123_145146_7_0004_alto.xml-96-36	 	Åter såg han sig om efter bevisningsmateriel i denna natur, med hvars bilder hon förtrollade honom, tills han kände sig som fångad i den, såsom han alltid under den gångna tiden känt sig fången af hennes vexlande stämningar.	187:193	0:224	Åter såg han sig om efter bevisningsmateriel i denna natur , med hvars bilder hon förtrollade honom , tills han kände sig som fångad i den , såsom han alltid under den gångna tiden känt sig fången af hennes vexlande stämningar .	36	0:42	åter se han sig om efter bevisningsmateriel i denna natur $ med hvars bild hon förtrolla han $ tills han känna sig som fånga i den $ såsom han alltid under den gångna tid känna sig fången af hon vexla stämning $
fången		1895	2	bib15873371_18951019_145112_286_0002_alto.xml-133-8	 	En vän till d:r Bayol har besökt den fångne Behanzin, men förbjöds alt med honom tala örn den förre guvernören.	37:43	0:111	En vän till d:r Bayol har besökt den fångne Behanzin , men förbjöds alt med honom tala örn den förre guvernören .	8	0:22	en vän till $ bayol ha besöka den fången behanzin $ men förbjuda alt med han tala örn den förra guvernör $
fången		1902	2	bib11653838_19020131_147024_5_0002_alto.xml-99-15	 	Med anledning häraf har till därvarande komité ankommit en tacksamhetsskrifvelse från de å nämnda plats fångna skandinaviema.	104:110	0:125	Med anledning häraf har till därvarande komité ankommit en tacksamhetsskrifvelse från de å nämnda plats fångna skandinaviema .	15	0:18	med anledning häraf ha till därvarande komité ankomma en tacksamhets från de å nämna plats fången skandinaviema $
fången		1895	2	bib19277349_18951015_147403_131_0003_alto.xml-55-2	 	Lik ett fånget rofdjur vandrade han fram och tillbaka i sin trånga cell, hela tiden lyssnande efter stegen af den budbärare, som skulle kalla honom tillbaka till friheten och lifvets nöjen.	8:14	0:189	Lik ett fånget rofdjur vandrade han fram och tillbaka i sin trånga cell , hela tiden lyssnande efter stegen af den budbärare , som skulle kalla honom tillbaka till friheten och lifvets nöjen .	2	0:34	lik en fången rofdjur vandra han fram och tillbaka i sig trång cell $ hel tid lyssna efter steg af den budbärare $ som skola kalla han tillbaka till frihet och lifvets nöje $
fången		1903	2	bib11653838_19030911_147024_37_0002_alto.xml-213-11	 	De hade fallit i en listigt utlagd fälla och voro ohjälpligt fångna och bundna innan de ens hunnit tänka sig för.	61:67	0:113	De hade fallit i en listigt utlagd fälla och voro ohjälpligt fångna och bundna innan de ens hunnit tänka sig för .	11	0:22	de ha falla i en listig $ fälla och voro ohjälplig fången och binda innan de ens hinna tänka sig för $
fången		1895	2	bib15873371_18951227_145112_352_0003_alto.xml-84-21	 	början vilja försöka utan strid tvinga de upproriske att gifva sig; men är det sannt, att desse nedgjort den fångna turkiska garnisonen, hvilket emellertid ej tyckes vara alldeles säkert, så drabbas de väl i alla fall af eli sorgligt öde.	109:115	0:238	början vilja försöka utan strid tvinga de upproriske att gifva sig ; men är det sannt , att desse nedgjort den fångna turkiska garnisonen , hvilket emellertid ej tyckes vara alldeles säkert , så drabbas de väl i alla fall af eli sorgligt öde .	21	0:45	början vilja försöka utan strid tvinga en upprorisk att gifva sig $ men vara den sannt $ att desse nedgöra den fången turkisk garnison $ hvilket emellertid ej tycka vara alldeles säker $ så drabba de väl i all fall af eli sorglig öde $
fången		1902	2	bib11653811_19020405_145317_50_0003_alto.xml-4-13	 	offentliggör en utförlig berättelse örn det tillfälle, då australiska officerare lafö skjuta fångna boer.	93:99	0:105	offentliggör en utförlig berättelse örn det tillfälle , då australiska officerare lafö skjuta fångna boer .	13	0:16	offentliggöra en utförlig berättelse örn den tillfälle $ då australisk officer lafö skjuta fången boer $
fången		1895	2	bib19225758_18950420_144022_91_0006_alto.xml-149-12	 	Van vid ödets gissel och vid bojans gnissel, är jag hjälplöst fången, slö och aldrig fri.	62:68	0:89	Van vid ödets gissel och vid bojans gnissel , är jag hjälplöst fången , slö och aldrig fri .	12	0:19	van vid öde gissel och vid boja gnissel $ vara jag hjälplös fången $ slö och aldrig fri $
fången		1900	2	bib11653811_19000523_145317_78_0004_alto.xml-111-0	 	Fången fördes till stationen i hyrvagn och belagd med handbojor.	0:6	0:64	Fången fördes till stationen i hyrvagn och belagd med handbojor .	0	0:11	fången föra till station i hyrvagn och belägga med handboja $
fången		1895	2	bib15975090_18950704_148377_78_0003_alto.xml-99-61	 	Derefter tvingades mrs Gordon, genom hot med revolvrar, att skrifva under en del papper, hvarigenom hon dels sålde sitt lösörebo till Krähn ooh qvitterBde priset, 1,100 pund, och dels förklarade att hon för gjorda tjenster skänkt sin väu Krähn de pengar ooh dyrbarheter, man nyss frånröfvat henne, Under tre dygn satt hon sedan här fången, noder det man realiserade möbler oeh inventarier i hennes hus.	332:338	0:402	Derefter tvingades mrs Gordon , genom hot med revolvrar , att skrifva under en del papper , hvarigenom hon dels sålde sitt lösörebo till Krähn ooh qvitterBde priset , 1,100 pund , och dels förklarade att hon för gjorda tjenster skänkt sin väu Krähn de pengar ooh dyrbarheter , man nyss frånröfvat henne , Under tre dygn satt hon sedan här fången , noder det man realiserade möbler oeh inventarier i hennes hus .	61	0:74	derefter tvinga mrs gordon $ genom hot med revolver $ att skrifva under en del papper $ hvarigenom hon dels sälja sig lösörebo till krähn ooh qvitterbde pris $ $ pund $ och dels förklara att hon för göra tjenst skänka sig väu krähn en peng ooh dyrbarhet $ man nyss frånröfva hon $ under tre dygn sitta hon sedan här fången $ nod den man realisera möbel oeh inventarier i hon hus $
fången		1895	2	bib15975087_18950925_145596_148_0003_alto.xml-38-14	 	Denna kolonn skall uppsöka oest befria medlemmar af Flateers expedition, som tuaregerna bålla fångna.	94:100	0:101	Denna kolonn skall uppsöka oest befria medlemmar af Flateers expedition , som tuaregerna bålla fångna .	14	0:16	denna kolonn skola uppsöka oest befria medlem af flateers expedition $ som tuareg bålla fången $
fången		1895	2	bib19277277_18950505_147683_121_0006_alto.xml-53-28	 	Hvart jag än mig vände, nesa och elände pressat slafvens änne ner med fruktlös hamn Van vid ödets gissel och vid bojans gnissel, är jag hjelplöst fången, slö och aldrig fri.	146:152	0:173	Hvart jag än mig vände , nesa och elände pressat slafvens änne ner med fruktlös hamn Van vid ödets gissel och vid bojans gnissel , är jag hjelplöst fången , slö och aldrig fri .	28	0:35	hvart jag än jag vända $ nesa och elände pressa slaf änne ner med fruktlös hamn van vid öde gissel och vid boja gnissel $ vara jag hjelplös fången $ slö och aldrig fri $
fången		1895	2	bib15978012_18950910_148361_210_0002_alto.xml-28-21	 	antaga11 — säger länsstyrelsen — „att i många, för att icke säga de flesta fall, både den dag, fången införpassats till fängelset, som ock den, då han därifrån frigifvits och skall fortskaffa sig till hemmet, Så förlorade för honom såsom arbetsdagar.	95:101	0:250	antaga11 — säger länsstyrelsen — „att i många , för att icke säga de flesta fall , både den dag , fången införpassats till fängelset , som ock den , då han därifrån frigifvits och skall fortskaffa sig till hemmet , Så förlorade för honom såsom arbetsdagar .	21	0:48	antaga11 $ säga länsstyrelse $ $ i mången $ för att icke säga en mången fall $ både den dag $ fången $ till fängelse $ som ock den $ då han därifrån frigifvits och skola fortskaffa sig till hem $ så förlora för han såsom arbetsdag $
fången		1897	2	bib11653811_18970326_145317_47_0003_alto.xml-136-27	 	blods mot denna det heligas makt, understödd dervid af den onda andemakten, hvars välde ju kringskäres oell förminskas för hvarje gång en menniskosjäl gifver sig fången under Kristi heliga makt.	162:168	0:194	blods mot denna det heligas makt , understödd dervid af den onda andemakten , hvars välde ju kringskäres oell förminskas för hvarje gång en menniskosjäl gifver sig fången under Kristi heliga makt .	27	0:33	blod mot denna den helig makt $ understödd dervid af den ond andemakt $ hvars välde ju kringskära oell förminska för hvarje gång en menniskosjäl gif sig fången under kristi helig makt $
fången		1895	2	bib19225758_18950611_144022_133_0002_alto.xml-87-82	 	sjukdom skall ni genast underrättas » Samma försäkringar har fängelsedirektören upprepat för en medarbetare i Standard; på dennes fråga, örn Wilde värkligen arbetade i trampkvarnen, vägrade han svara, men han tilläde: » Allt hvad jag kan säga är, att ingen fånge här tvingas till något arbete, om icke läkarne, som noga undersöka honom, förklarat honom i stånd att utföra detsamma. » Le Temps ’ korrespondent meddelar från en god källa: » Fången har känt sig mycket medtagen af tvångsarbetet, men det har icke ett ögonblick varit fara för hans förnuft.	439:445	0:552	sjukdom skall ni genast underrättas » Samma försäkringar har fängelsedirektören upprepat för en medarbetare i Standard ; på dennes fråga , örn Wilde värkligen arbetade i trampkvarnen , vägrade han svara , men han tilläde : » Allt hvad jag kan säga är , att ingen fånge här tvingas till något arbete , om icke läkarne , som noga undersöka honom , förklarat honom i stånd att utföra detsamma . » Le Temps ’ korrespondent meddelar från en god källa : » Fången har känt sig mycket medtagen af tvångsarbetet , men det har icke ett ögonblick varit fara för hans förnuft .	82	0:103	sjukdom skola ni genast underrätta $ samma försäkran ha fängelsedirektör upprepa för en medarbetare i standard $ på denna fråga $ örn wilde värkligen arbeta i trampkvarn $ vägra han svara $ men han tilläde $ $ all hvad jag kunna säga vara $ att ingen fånge här tvinga till någon arbete $ om icke läkare $ som noga undersöka han $ förklara han i stånd att utföra densamma $ $ le temp $ korrespondent meddela från en god källa $ $ fången ha känna sig mycket medta af tvångsarbete $ men den ha icke en ögonblick vara fara för han förnuft $
fången		1896	2	bib11653811_18960118_145317_9_0003_alto.xml-189-0	 	Fången gaf intet svar, men detta kom i stället från en rasslande länk och en barsk röst utanför.	0:6	0:96	Fången gaf intet svar , men detta kom i stället från en rasslande länk och en barsk röst utanför .	0	0:20	fången gaf intet svar $ men denna komma i ställ från en rassla länk och en barsk röst utanför $
fången		1895	2	bib15760600_18950124_146401_10_0002_alto.xml-61-46	 	Vända vi oss nu till den af hrr opponenter så förkättrade Helgeandsholmen såsom plats för ett riksdagshus och tänka oss det för den samma afsedda palatset der uppfördt, så tro vi, skrifver artikelförfattaren i den fortfarande citerade tidningen, att man måste vara fullständigt fången i förutfattade och genom oupphörligt upprepande inpluggade meningar, örn man ej skall se och erkänna de stora företrädena hos denna plats.	278:284	0:423	Vända vi oss nu till den af hrr opponenter så förkättrade Helgeandsholmen såsom plats för ett riksdagshus och tänka oss det för den samma afsedda palatset der uppfördt , så tro vi , skrifver artikelförfattaren i den fortfarande citerade tidningen , att man måste vara fullständigt fången i förutfattade och genom oupphörligt upprepande inpluggade meningar , örn man ej skall se och erkänna de stora företrädena hos denna plats .	46	0:70	vända vi vi nu till den af hrr opponent så förkättrad helgeandsholmen såsom plats för en riksdagshus och tänka vi den för den samma afsedda palats der uppfördt $ så tro vi $ skrifver artikelförfattare i den fortfarande citera tidning $ att man måste vara fullständig fången i förutfattad och genom oupphörlig upprepa $ mening $ örn man ej skola se och erkänna en stor företräde hos denna plats $
