lemma	pos	date	grouping	identifier	description	context	indexes_target_token	indexes_target_sentence	context_tokenized	indexes_target_token_tokenized	indexes_target_sentence_tokenized	context_lemmatized
fången		1829	1	bib11653828_18290905_144028_205_0002_alto.xml-17-7	 	af sitt hus, observerat den fremmande fången förrän hon fattade den häftigaste passion för honom och genast gak honom ett bevis deraf *) ^ i det hon skickade till middag åt honom ett fat kostlig Currie fett slags ragu af åtskilliga kött- och fiskarter med ris), en liten korg nied utvald frukt och ett krus palmvin, - vin, - ofvanpå låg ett betellöf, kärlekens symbol.	38:44	0:368	af sitt hus , observerat den fremmande fången förrän hon fattade den häftigaste passion för honom och genast gak honom ett bevis deraf * ) ^ i det hon skickade till middag åt honom ett fat kostlig Currie fett slags ragu af åtskilliga kött- och fiskarter med ris ) , en liten korg nied utvald frukt och ett krus palmvin , - vin , - ofvanpå låg ett betellöf , kärlekens symbol .	7	0:73	af sig hus $ observera den fremmande fången förrän hon fatta den häftig passion för han och genast gak han en bevis deraf $ $ $ i den hon skicka till middag åt han en fat kostlig currie fett slag ragu af åtskillig kött och fiskart med ris $ $ en liten korg nied utvald frukt och en krus palmvin $ $ vin $ $ ofvanpå ligga en betellöf $ kärlek symbol $
fången		1792	1	bib13506739_17921101_144030_253_0001_alto.xml-3-11	 	Det sista som Manuel berättat Folket i paris, angående dea fångne Konungen, är följande:	59:65	0:88	Det sista som Manuel berättat Folket i paris , angående dea fångne Konungen , är följande :	11	0:17	den sista som manuel berätta folk i pari $ angående dea fången konung $ vara följande $
fången		1830	1	bib13506739_18300830_144030_199_0001_alto.xml-13-0	 	Fången nedföll då och slog sig hårdr, i anseei de	0:6	0:49	Fången nedföll då och slog sig hårdr , i anseei de	0	0:11	fången nedfalla då och slå sig hårdr $ i anseei de
fången		1829	1	bib11653828_18290722_144028_166_0003_alto.xml-16-7	 	_ ' ' Godt," sade fången," tag då bara litet hö med så att jag må ligga mjukare. ' '	18:24	0:84	_ ' ' Godt , " sade fången , " tag då bara litet hö med så att jag må ligga mjukare . ' '	7	0:25	$ $ $ god $ $ säga fången $ $ ta då bara liten hö med så att jag må ligga mjuk $ $ $
fången		1829	1	bib11653828_18291014_144028_238_0002_alto.xml-1-4	 	Är det ali plåga fången utan nylla för hvarken honom sjelf eller det allmänna?	17:23	0:78	Är det ali plåga fången utan nylla för hvarken honom sjelf eller det allmänna ?	4	0:15	vara den ali plåga fången utan nylla för hvarken han sjelf eller den allmän $
fången		1830	1	bib11653828_18301207_144028_284_0001_alto.xml-6-11	 	sker aftonen före slaget vid Fahlköping, i hvilket han blir fången.	60:66	0:67	sker aftonen före slaget vid Fahlköping , i hvilket han blir fången .	11	0:13	ske afton före slag vid fahlköping $ i hvilket han bli fången $
fången		1829	1	bib11653828_18290912_144028_211_0002_alto.xml-12-14	 	Dervid hade Patricierne blott få inskränkningar i sitt godtycke: de måste endast ge fången ett skålp. mjöl om dagen i 60 dagar, och kedjorna fingo icke väga mer än i5 skålp.; men om skulden efter dessa 60 dagar icke var betalt, t.llhörde den plebejiska kroppen helt och hållet borgenären, som efter behag kunde förfara dermed.	84:90	0:326	Dervid hade Patricierne blott få inskränkningar i sitt godtycke : de måste endast ge fången ett skålp. mjöl om dagen i 60 dagar , och kedjorna fingo icke väga mer än i5 skålp. ; men om skulden efter dessa 60 dagar icke var betalt , t.llhörde den plebejiska kroppen helt och hållet borgenären , som efter behag kunde förfara dermed .	14	0:61	dervid ha patricierne blott få inskränkning i sig godtycke $ de måste endast ge fången en $ mjöl om dag i 60 dag $ och kedja fingo icke väga mer än i5 $ $ men om skuld efter denna 60 dag icke vara betala $ $ den plebejisk kropp hel och hållen borgenär $ som efter behag kunna förfara dermed $
fången		1809	1	bib11653825_18090810_145134_93_0002_alto.xml-13-3	 	några döde och fångne, inskeppade de sig åter.	15:21	0:46	några döde och fångne , inskeppade de sig åter .	3	0:10	någon död och fången $ inskeppa de sig åter $
fången		1829	1	bib11653828_18290917_144028_215_0002_alto.xml-15-1	 	och fången; för våra truppers eld nedstör » tade hela leder af de flyende ifrån Condorkankis branta bergsklippor.	4:10	0:113	och fången ; för våra truppers eld nedstör » tade hela leder af de flyende ifrån Condorkankis branta bergsklippor .	1	0:20	och fången $ för vi trupp eld nedstör $ tade hel led af en fly ifrån condorkankis brant bergsklippa $
fången		1822	1	bib11653823_18220822_144010_194_0001_alto.xml-9-16	 	Irland, font kallat sig Capiten Nock, meli heter Walter FitzMorris, har gisivrt sig fången; hans kropp och helsa hafwa, geno!	84:90	0:125	Irland , font kallat sig Capiten Nock , meli heter Walter FitzMorris , har gisivrt sig fången ; hans kropp och helsa hafwa , geno !	16	0:26	irland $ font kalla sig capiten nock $ meli heta walter fitzmorris $ ha gisivrt sig fången $ han kropp och helsa hafwa $ geno $
fången		1830	1	bib11653828_18300420_144028_89_0004_alto.xml-9-6	 	— I anledning deraf, att fången 1:0 verkligen varit örn hord på det republikanska skeppet, sorn angripit Sicilianska fregatten Minerva, kanonbålarna oell de nied den förenade Engelska fartygen, & gt;, vid hvilket tillfälle flere af Hans Brittiska Maj:Is undersåtare blifvit dödade eller sårade, och 2:0 att han ej, före detta anfall, sökt undankomma, hvartill lian ögonskenligen haft tillfälle, dömde na Krigsrätten honora till döden.	25:31	0:434	— I anledning deraf , att fången 1:0 verkligen varit örn hord på det republikanska skeppet , sorn angripit Sicilianska fregatten Minerva , kanonbålarna oell de nied den förenade Engelska fartygen , & gt ; , vid hvilket tillfälle flere af Hans Brittiska Maj:Is undersåtare blifvit dödade eller sårade , och 2:0 att han ej , före detta anfall , sökt undankomma , hvartill lian ögonskenligen haft tillfälle , dömde na Krigsrätten honora till döden .	6	0:76	$ i anledning deraf $ att fången $ verkligen vara örn hord på den republikansk skepp $ sorn angripa siciliansk fregatt minerva $ kanonbålarna oell de nied den förena engelsk fartyg $ $ gt $ $ vid hvilket tillfälle flere af han brittisk $ undersåtare blifvit döda eller såra $ och $ att han ej $ före denna anfall $ söka undankomma $ hvartill lian ögonskenligen ha tillfälle $ döma na krigsrätt honora till död $
fången		1829	1	bib11653828_18290626_144028_144_0004_alto.xml-10-21	 	blek häraf till den grad uppretad, att han gaf Öfversten en örfil och en spark, samt lät föra honom fången till Belemstornet.	100:106	0:125	blek häraf till den grad uppretad , att han gaf Öfversten en örfil och en spark , samt lät föra honom fången till Belemstornet .	21	0:25	blek häraf till den grad $ $ att han gaf öfverste en örfil och en spark $ samt låta föra han fången till belemstornet $
fången		1830	1	bib11653828_18301001_144028_227_0002_alto.xml-5-4	 	Sorn utaf en trollkraft fången I ett magiskt underland, Nu hans längtan första gången Stilla häpen stod i brand.	24:30	0:112	Sorn utaf en trollkraft fången I ett magiskt underland , Nu hans längtan första gången Stilla häpen stod i brand .	4	0:21	sorn utaf en trollkraft fången i en magisk underland $ nu han längtan $ gång stilla häpen stå i brand $
fången		1807	1	bib11653825_18071031_145134_131_0003_alto.xml-8-4	 	med undantag af de fångne som ställe åter / lemnäs, war 326 dödade, 674 sårade och 228 saknade, tillsammans n88- Genera » terne Auchmuty och Craufurd wörö redan återkomne till England » ned samma stepp som bragte dessa underrättelser.	19:25	0:234	med undantag af de fångne som ställe åter / lemnäs , war 326 dödade , 674 sårade och 228 saknade , tillsammans n88- Genera » terne Auchmuty och Craufurd wörö redan återkomne till England » ned samma stepp som bragte dessa underrättelser .	4	0:43	med undantag af en fången som ställe åter $ lemnäs $ war 326 döda $ 674 såra och 228 sakna $ tillsammans $ genera $ terne auchmuty och craufurd wörö redan återkomma till england $ ned samma stepp som bringa denna underrättelse $
fången		1829	1	bib11653828_18290722_144028_166_0003_alto.xml-17-14	 	Under det några al truppen flätade en bår af kastanjegrenar och andra förbundo den fångnes sår, såg man Mateo med sin hustru komma den väg, som bar ned ifrån småskogen.	83:90	0:168	Under det några al truppen flätade en bår af kastanjegrenar och andra förbundo den fångnes sår , såg man Mateo med sin hustru komma den väg , som bar ned ifrån småskogen .	14	0:33	under den någon al trupp fläta en bår af kastanjegrenar och andra förbundo den fången sår $ se man mateo med sig hustru komma den väg $ som bära ned ifrån småskog $
fången		1829	1	bib11653828_18290122_144028_17_0004_alto.xml-9-10	 	från Kina af den 21 Juni angifva, att den fångne rebellen Tschaw Kih-Urh blifvit från vestra Tartariet i en bur förd till Peking, hvarest Kejsarn fortfor att belöna de Officerare sorn utmärkt sig vid de upproriskes besegrande.	42:48	0:226	från Kina af den 21 Juni angifva , att den fångne rebellen Tschaw Kih-Urh blifvit från vestra Tartariet i en bur förd till Peking , hvarest Kejsarn fortfor att belöna de Officerare sorn utmärkt sig vid de upproriskes besegrande .	10	0:40	från kina af den 21 juni angifva $ att den fången rebell tschaw $ blifvit från vestra tartariet i en bur föra till peking $ hvarest kejsarn fortfara att belöna en officer sorn utmärka sig vid en upprorisk besegra $
fången		1804	1	bib11653828_18040224_144028_46_0003_alto.xml-7-23	 	de fientliga Skutorna jenuväl fastnat och icke kunde komma urställct, blcfwo ella uppå dem öifintlige mävnade Personer snart twungne att gifwa sig fångne.	147:153	0:154	de fientliga Skutorna jenuväl fastnat och icke kunde komma urställct , blcfwo ella uppå dem öifintlige mävnade Personer snart twungne att gifwa sig fångne .	23	0:25	en fientlig skuta jenuväl fastna och icke kunna komma urställct $ blcfwo ella uppå de öifintlige mävnade person snar twungne att gifwa sig fången $
fången		1824	1	bib19227291_18240512_145289_19_0002_alto.xml-0-17	 	härstädes i fängsligt förwar hällne Engelsmannen George Matthews (som war i Riegos suite och bl?f fången med honom) har nu andtligen bliswit ulemnad till Engelsta Ministern, med tillsagelse at han genast stall afresa frän Spanien, samt att han sörwerkat lifwet, om han någonsin j, ädaneft, r biträder detta land.	98:104	0:312	härstädes i fängsligt förwar hällne Engelsmannen George Matthews ( som war i Riegos suite och bl ?f fången med honom ) har nu andtligen bliswit ulemnad till Engelsta Ministern , med tillsagelse at han genast stall afresa frän Spanien , samt att han sörwerkat lifwet , om han någonsin j , ädaneft , r biträder detta land .	17	0:58	härstädes i fängslig förwar hällne engelsman george matthews $ som war i riegos suite och bl $ fången med han $ ha nu andtligen bliswit ulemnad till engelsta minister $ med tillsagelse at han genast stall afresa frän spanien $ samt att han sörwerkat lifwet $ om han någonsin j $ ädaneft $ r biträda denna land $
fången		1829	1	bib11653828_18291029_144028_251_0001_alto.xml-4-38	 	le det kunna hända, ali genom Gens ’ darmernas öfverdrifna nit, någon oskyldig härigenom kunde komma att arresteras; meli förhållandet skulle då snart utredas och lian försättas i frihet, eller örn han nödgades qvarblifva fången till följande morgonen, vöre en natt, tillbragt i ett annat snyggt rum, än dess eget; väl icke någon så särdeles stor misshandling; men detta exempel, några gånger statueradt, skulle likväl hära de nyttigaste följder.	222:228	0:446	le det kunna hända , ali genom Gens ’ darmernas öfverdrifna nit , någon oskyldig härigenom kunde komma att arresteras ; meli förhållandet skulle då snart utredas och lian försättas i frihet , eller örn han nödgades qvarblifva fången till följande morgonen , vöre en natt , tillbragt i ett annat snyggt rum , än dess eget ; väl icke någon så särdeles stor misshandling ; men detta exempel , några gånger statueradt , skulle likväl hära de nyttigaste följder .	38	0:81	le den kunna hända $ ali genom gen $ darmernas öfverdrifna nit $ någon oskyldig härigenom kunna komma att arrestera $ meli förhållande skola då snar utreda och lian försätta i frihet $ eller örn han nödga qvarblifva fången till följa morgon $ vöre en natt $ tillbringa i en annan snygg rum $ än den egen $ väl icke någon så särdeles stor misshandling $ men denna exempel $ någon gång statueradt $ skola likväl hära en nyttig följd $
fången		1830	1	bib11653828_18301120_144028_270_0004_alto.xml-5-25	 	Stundom jalusi mellan de inhemska och de fremmhnde, men en förmånlig fångst gör ock ibland så mycket, att en sådan stadsdam befriar sia fångna vän.	136:142	0:147	Stundom jalusi mellan de inhemska och de fremmhnde , men en förmånlig fångst gör ock ibland så mycket , att en sådan stadsdam befriar sia fångna vän .	25	0:28	stundom jalusi mellan en inhemsk och en fremmhnde $ men en förmånlig fångst göra ock ibland så mycket $ att en sån stadsdam befria sia fången vän $
fången		1828	1	bib11653828_18281124_144028_270_0003_alto.xml-21-14	 	Låt varna dig, lor sista gången; Du eljest i din synd blir fången."	59:65	0:67	Låt varna dig , lor sista gången ; Du eljest i din synd blir fången . "	14	0:17	låta varna du $ lor sista gång $ du eljest i du synd bli fången $ $
fången		1829	1	bib11653828_18291014_144028_238_0002_alto.xml-0-67	 	Vi erkänna, ali vi ej tagit de härvarande korrektionsanstalterna i ögnasigte, ali vi således ej känna i fullkomlig detalj förvaltningen derstädes, och då vi ej redan gjort det, ha vi med afsigt underlåtit ali göra det nu, för ali kunna vara så mycket mer oväldiga och utan förkärlek eller fördom kunna hålla oss till den vid desamma etablerade principen, ali låta fången öfva sina krafter på eli produktift yrke, emedan den måste vara en af hufvudpelarena för hela systemets bestånd.	364:370	0:483	Vi erkänna , ali vi ej tagit de härvarande korrektionsanstalterna i ögnasigte , ali vi således ej känna i fullkomlig detalj förvaltningen derstädes , och då vi ej redan gjort det , ha vi med afsigt underlåtit ali göra det nu , för ali kunna vara så mycket mer oväldiga och utan förkärlek eller fördom kunna hålla oss till den vid desamma etablerade principen , ali låta fången öfva sina krafter på eli produktift yrke , emedan den måste vara en af hufvudpelarena för hela systemets bestånd .	67	0:88	vi erkänna $ ali vi ej ta en härvarande korrektionsanstalt i ögnasigte $ ali vi således ej känna i fullkomlig detalj förvaltning derstädes $ och då vi ej redan göra den $ ha vi med afsigt underlåta ali göra den nu $ för ali kunna vara så mycket mer oväldig och utan förkärlek eller fördom kunna hålla vi till den vid densamma etablera princip $ ali låta fången öfva sig kraft på eli produktift yrke $ emedan den måste vara en af hufvudpelarena för hel system bestånd $
fången		1895	2	bib15975087_18951228_145596_201_0003_alto.xml-92-32	 	I kap. 7: 23 läsa vi: » jag ser en annan lag i mina lemmar, som kämpar mot den lag, som är i min ande och griper mig fången i syndens lag, som är i mina lemmar ».	117:123	0:162	I kap. 7 : 23 läsa vi : » jag ser en annan lag i mina lemmar , som kämpar mot den lag , som är i min ande och griper mig fången i syndens lag , som är i mina lemmar » .	32	0:44	i $ 7 $ 23 läsa vi $ $ jag se en annan lag i jag lem $ som kämpa mot den lag $ som vara i jag ande och gripa jag fången i synd lag $ som vara i jag lem $ $
fången		1896	2	bib15650835_18961103_146472_172_0003_alto.xml-74-4	 	Den olyckliga familjen satt fången i en kyrka, som under denna fasans tid hade förvandlats till fängelse, och dit fördes af en trogen tjenarinna två små älskliga systrar till Viktor för att taga afsked af sina föräldrar.	28:34	0:220	Den olyckliga familjen satt fången i en kyrka , som under denna fasans tid hade förvandlats till fängelse , och dit fördes af en trogen tjenarinna två små älskliga systrar till Viktor för att taga afsked af sina föräldrar .	4	0:40	den olycklig familj sitta fången i en kyrka $ som under denna fasa tid ha förvandla till fängelse $ och dit föra af en trogen tjenarinna två liten älsklig syster till viktor för att ta afsked af sig förälder $
fången		1898	2	bib11653811_18980711_145317_104_0003_alto.xml-5-4	 	sjöfolk hölls efter sjöslaget fånget ombord å » Harvard », medan officerarne på sitt hedersord fingo gå fritt omkring ombord.	30:36	0:125	sjöfolk hölls efter sjöslaget fånget ombord å » Harvard » , medan officerarne på sitt hedersord fingo gå fritt omkring ombord .	4	0:22	sjöfolk hålla efter sjöslag fången ombord å $ harvard $ $ medan officerarne på sig hedersord fingo gå fri omkring ombord $
fången		1897	2	bib19227291_18970330_145289_38_0002_alto.xml-116-5	 	Att i vidsträcktare mån lemna fången tillfälle att, gemenligen af nyhetsbegär eller åstundan efter förströelse, förtaga frihetsförlusten någon del af dess karakter synes vara främmande för lagens anda och torde ej heller kunna försvaras med hänvisning till den rätt, som fängelsefånge eger att, örn han vill och kan, skaffa sig större beqvämlighet, än som i allmänhet bestås inom fängelset.	30:36	0:390	Att i vidsträcktare mån lemna fången tillfälle att , gemenligen af nyhetsbegär eller åstundan efter förströelse , förtaga frihetsförlusten någon del af dess karakter synes vara främmande för lagens anda och torde ej heller kunna försvaras med hänvisning till den rätt , som fängelsefånge eger att , örn han vill och kan , skaffa sig större beqvämlighet , än som i allmänhet bestås inom fängelset .	5	0:66	att i vidsträckt mån lemna fången tillfälle att $ gemenligen af nyhetsbegär eller åstundan efter förströelse $ förta frihetsförlust någon del af den karakter synas vara främmande för lag anda och torde ej heller kunna försvara med hänvisning till den rätt $ som fängelsefånge eger att $ örn han vilja och kunna $ skaffa sig stor beqvämlighet $ än som i allmänhet bestå inom fängelse $
fången		1895	2	bib11653815_18950423_146944_48_0003_alto.xml-23-0	 	Fången infördes försedd mod böjer, hvilka dock under förhöret altogos.	0:6	0:70	Fången infördes försedd mod böjer , hvilka dock under förhöret altogos .	0	0:12	fången införa förse mod böja $ hvilka dock under förhör altogos $
fången		1897	2	bib11653811_18970529_145317_82_0003_alto.xml-94-3	 	bäddar och lägger fången sig, sedan ledaren af visitationen först sagt godnatt.	18:24	0:79	bäddar och lägger fången sig , sedan ledaren af visitationen först sagt godnatt .	3	0:14	bädda och lägga fången sig $ sedan ledare af visitation först säga godnatt $
fången		1895	2	bib15869824_18950112_145700_4_0002_alto.xml-124-0	 	fånget tillstånd föda ungar är, enligt en framstående zoologs försäkran, ytterst ovanligt, och endast få exempel därpå gifvas.	0:6	0:126	fånget tillstånd föda ungar är , enligt en framstående zoologs försäkran , ytterst ovanligt , och endast få exempel därpå gifvas .	0	0:22	fången tillstånd föda unge vara $ enligt en framstående zoolog försäkran $ ytterst ovanlig $ och endast få exempel därpå gifvas $
fången		1895	2	bib15650835_18950528_146472_46_0003_alto.xml-130-10	 	sagdt, inte var det gevaldigarne folket ville skåda utan fången, som de hade med sig, det kan en väl begripa.	57:63	0:109	sagdt , inte var det gevaldigarne folket ville skåda utan fången , som de hade med sig , det kan en väl begripa .	10	0:24	sagdt $ inte vara den gevaldigarne folk vilja skåda utan fången $ som de ha med sig $ den kunna en väl begripa $
fången		1895	2	bib19225758_18950727_144022_172_0007_alto.xml-178-19	 	— Nå väl, tio år äro inte en så... — Och på hvad domaren sade, fortsatte fången, som om han icke hört hans ord Vet ni, hvad jag är?	73:79	0:131	— Nå väl , tio år äro inte en så ... — Och på hvad domaren sade , fortsatte fången , som om han icke hört hans ord Vet ni , hvad jag är ?	19	0:35	$ nå väl $ tio år äro inte en så $ $ och på hvad domare säga $ fortsätta fången $ som om han icke höra han ord veta ni $ hvad jag vara $
fången		1896	2	bib19227291_18960111_145289_5_0003_alto.xml-156-6	 	““ Ja“, svarade fången, men denna gång i en hånfull ton.	16:22	0:56	“ “ Ja “ , svarade fången , men denna gång i en hånfull ton .	6	0:16	$ $ ja $ $ svara fången $ men denna gång i en hånfull ton $
fången		1895	2	bib15760600_18951207_146401_145_0004_alto.xml-72-5	 	som häller läsarens uppmärksamhet ständigt fången. » (S.	43:49	0:56	som häller läsarens uppmärksamhet ständigt fången . » ( S .	5	0:11	som hälla läsare uppmärksamhet ständig fången $ $ $ s $
fången		1896	2	bib19227291_18960901_145289_105_0004_alto.xml-59-0	 	Fången — ty det var han fortfarande — gick nämligen här på bryggan ur famn i famn och kringklappades på det hjertligaste.	0:6	0:121	Fången — ty det var han fortfarande — gick nämligen här på bryggan ur famn i famn och kringklappades på det hjertligaste .	0	0:23	fången $ ty den vara han fortfarande $ gå nämligen här på brygga ur famn i famn och kringklappa på den hjertlig $
fången		1895	2	bib19225758_18950119_144022_16_0007_alto.xml-126-1	 	stod fången vid fönstret och belystes af den klart inströmmande dagern.	5:11	0:71	stod fången vid fönstret och belystes af den klart inströmmande dagern .	1	0:12	stå fången vid fönster och belysa af den klar inströmmande dager $
fången		1895	2	bib19227462_18950810_147640_184_0005_alto.xml-160-6	 	Var förnuftig ooh låt flin stackars fångna fogel llyga ut frän Coombe Bysset; annars kan det hända, att han blir diu värste fiende, om du stanger in honom längre.	36:42	0:162	Var förnuftig ooh låt flin stackars fångna fogel llyga ut frän Coombe Bysset ; annars kan det hända , att han blir diu värste fiende , om du stanger in honom längre .	6	0:33	var förnuftig ooh låta flin stackars fången fogel llyga ut frän coombe bysset $ annars kunna den hända $ att han bli diu ond fiende $ om du stanger in han länge $
fången		1895	2	bib15760600_18950110_146401_4_0007_alto.xml-17-0	 	Fången log bittert, och hans hjärta tycktes frysa till is.	0:6	0:58	Fången log bittert , och hans hjärta tycktes frysa till is .	0	0:12	fången le bitter $ och han hjärta tycka frysa till is $
fången		1900	2	bib11653838_19000622_147024_25_0002_alto.xml-109-0	 	Fången ändrade snart uppträdande, och då domaren uppläste den af åklagaren afgifna redogörelsen öfver förloppet vid mordens begående, svarade Nordlund villigt på allt, hvarom han tillfrågades.	0:6	0:192	Fången ändrade snart uppträdande , och då domaren uppläste den af åklagaren afgifna redogörelsen öfver förloppet vid mordens begående , svarade Nordlund villigt på allt , hvarom han tillfrågades .	0	0:30	fången ändra snar uppträdande $ och då domare uppläsa den af åklagare afgifna redogörelse öfver förlopp vid mord begående $ svara nordlund villig på all $ hvarom han tillfråga $
fången		1898	2	bib11653811_18980112_145317_6_0002_alto.xml-86-0	 	Fången Lundqvist är omkring 45 år gammal och undergår 3Vs års fängelse för 7:de resan stöld.	0:6	0:92	Fången Lundqvist är omkring 45 år gammal och undergår 3Vs års fängelse för 7:de resan stöld .	0	0:17	fången lundqvist vara omkring 45 år gammal och undergå 3vs år fängelse för $ resa stöld $
fången		1895	2	bib15975090_18951203_148377_143_0003_alto.xml-170-0	 	Fången förklarades » icke skyldig » till anklagelsen för mord, men hvad den senare anklagelsen för stöld beträffade, sä förklarades han	0:6	0:135	Fången förklarades » icke skyldig » till anklagelsen för mord , men hvad den senare anklagelsen för stöld beträffade , sä förklarades han	0	0:23	fången förklara $ icke skyldig $ till anklagelse för mord $ men hvad den sen anklagelse för stöld beträffa $ sä förklara han
fången		1896	2	bib11653830_18961116_146968_92_0003_alto.xml-145-12	 	hafva vunnit en stor seger: tjugutusen preussare dödade och tyske kronprinsen fången.	78:84	0:85	hafva vunnit en stor seger : tjugutusen preussare dödade och tyske kronprinsen fången .	12	0:14	hafva vinna en stor seger $ tjugutusen preussare döda och tysk kronprins fången $
fången		1896	2	bib15873936_18960917_147385_108_0003_alto.xml-171-2	 	Håkan, fången, var icke så grofväxt som rättaren, men betydligt vigare.	7:13	0:71	Håkan , fången , var icke så grofväxt som rättaren , men betydligt vigare .	2	0:15	håkan $ fången $ vara icke så grofväxt som rättare $ men betydlig vig $
fången		1895	2	bib19225758_18950601_144022_126_0003_alto.xml-113-9	 	Under de tre första månaderna af strafftiden får icke fången skrifva till någon elier erhålla någon underrättelse utifrån.	54:60	0:122	Under de tre första månaderna af strafftiden får icke fången skrifva till någon elier erhålla någon underrättelse utifrån .	9	0:19	under en tre första månad af strafftid få icke fången skrifva till någon elier erhålla någon underrättelse utifrån $
