lemma	pos	date	grouping	identifier	description	context	indexes_target_token	indexes_target_sentence	context_tokenized	indexes_target_token_tokenized	indexes_target_sentence_tokenized	context_lemmatized
uppfattning		1829	1	bib13506739_18290521_144030_116_0001_alto.xml-14-56	 	begrepp om ett grundlagsdnligt klander af en Styrelseåtgärd, att, utan att frånkänna stg sin moralista wigt, det ej behöfde låna något biträde af uttryckens nästan materiella tyngd, för hwilkas urwal, en erkänd strifcställare-förmåga icke kan fin » a någon ursäkt i Språkets ofta föremitadc fattigdom eller i behofwet af tavkarnes lättare uppfattning; ej heller wäntade jag, att i ett ämne, der grannlagenheten bjöd att ej widröra de politista orsaker, som dermed kunde stå i sammanhang, Friherre Änckarswärd stuile omnämna dem pa ett sätt, hwarizenom, efter min förmening och för att nyttja hans egna ord, landers sjelfftändighet kimdc uppoffras.	339:350	0:647	begrepp om ett grundlagsdnligt klander af en Styrelseåtgärd , att , utan att frånkänna stg sin moralista wigt , det ej behöfde låna något biträde af uttryckens nästan materiella tyngd , för hwilkas urwal , en erkänd strifcställare-förmåga icke kan fin » a någon ursäkt i Språkets ofta föremitadc fattigdom eller i behofwet af tavkarnes lättare uppfattning ; ej heller wäntade jag , att i ett ämne , der grannlagenheten bjöd att ej widröra de politista orsaker , som dermed kunde stå i sammanhang , Friherre Änckarswärd stuile omnämna dem pa ett sätt , hwarizenom , efter min förmening och för att nyttja hans egna ord , landers sjelfftändighet kimdc uppoffras .	56	0:112	begrepp om en grundlagsdnligt klander af en styrelseåtgärd $ att $ utan att frånkänna stg sig moralista wigt $ den ej behöfva låna någon biträde af uttryck nästan materiell tyngd $ för hwilkas urwal $ en erkänd $ icke kunna fin $ a någon ursäkt i språk ofta föremitadc fattigdom eller i behofwet af tavkarnes lätt uppfattning $ ej heller wäntade jag $ att i en ämne $ der grannlagenhet bjuda att ej widröra en politista orsak $ som dermed kunna stå i sammanhang $ friherre änckarswärd stuile omnämna de pa en sätt $ hwarizenom $ efter jag förmening och för att nyttja han egen ord $ lander sjelfftändighet kimdc uppoffra $
uppfattning		1817	1	bib11653828_18170219_144028_41_0003_alto.xml-3-4	 	Försök till en ny uppfattning af hufwudgrunderna för Allmänna Spräk, läran.	18:29	0:75	Försök till en ny uppfattning af hufwudgrunderna för Allmänna Spräk , läran .	4	0:13	försök till en ny uppfattning af hufwudgrunderna för allmän spräk $ lära $
uppfattning		1830	1	bib11653828_18300421_144028_90_0003_alto.xml-14-17	 	känd för åtskilliga större kompositioner, har i detta arbets på ett genialiskt sätt ådagalagt sin poetiska uppfattning af ämnet, siri rikedom på frappanta idéer och en effektfull instrumentation.	107:118	0:195	känd för åtskilliga större kompositioner , har i detta arbets på ett genialiskt sätt ådagalagt sin poetiska uppfattning af ämnet , siri rikedom på frappanta idéer och en effektfull instrumentation .	17	0:31	känd för åtskillig stor komposition $ ha i denna arbets på en genialisk sätt ådagalägga sig poetisk uppfattning af ämne $ siri rikedom på frappant idé och en effektfull instrumentation $
uppfattning		1823	1	bib11653828_18230408_144028_79_0002_alto.xml-9-40	 	hade uti beflutet om det ärofulla Tyssa kriget, och om de bäda Skandinavissa rikenas förening; för oss framställer sig dess förtjenst i detta hänseende säsom den, att icke haswa hindrat ett öfwcrlägfet snikleZ kraftfulla beslut och wisa uppfattning af tiden och dess kraf.	237:248	0:272	hade uti beflutet om det ärofulla Tyssa kriget , och om de bäda Skandinavissa rikenas förening ; för oss framställer sig dess förtjenst i detta hänseende säsom den , att icke haswa hindrat ett öfwcrlägfet snikleZ kraftfulla beslut och wisa uppfattning af tiden och dess kraf .	40	0:47	ha uti beflutet om den ärofull tyssa krig $ och om de bäda skandinavissa rike förening $ för vi framställa sig den förtjenst i denna hänseende säsom den $ att icke haswa hindra en öfwcrlägfet sniklez kraftfull beslut och wisa uppfattning af tid och den kraf $
uppfattning		1829	1	bib19227291_18290311_145289_11_0006_alto.xml-6-64	 	äsigt säfom regel, sta wi färdiga att a » nbabus manibus omfatta den samina, med förbehåll, att den ma gälla ej blott för författaren af Kallitechniken, och för honom alis icke förr, än han » visat vgrunden af uppgifterna: att sä » väl nämde arbete, som ber författaren utgaf öfwer talarckonsten, är i afseende pä ämmts uppfattning och behandlande, principlöst och osammanhängande.	320:331	0:381	äsigt säfom regel , sta wi färdiga att a » nbabus manibus omfatta den samina , med förbehåll , att den ma gälla ej blott för författaren af Kallitechniken , och för honom alis icke förr , än han » visat vgrunden af uppgifterna : att sä » väl nämde arbete , som ber författaren utgaf öfwer talarckonsten , är i afseende pä ämmts uppfattning och behandlande , principlöst och osammanhängande .	64	0:72	äsigt säfom regel $ sta wi färdig att a $ nbabus manibus omfatta den samina $ med förbehåll $ att den ma gälla ej blott för författare af kallitechniken $ och för han alis icke förr $ än han $ visa vgrunden af uppgift $ att sä $ väl nämde arbete $ som be författare utgaf öfwer talarckonsten $ vara i afseende pä ämmts uppfattning och behandla $ principlös och osammanhängande $
uppfattning		1814	1	bib11653828_18140413_144028_83_0004_alto.xml-2-6	 	Silwerstclpe: Försök till en ny uppfattning af hufwudgrunde-na för Allmän, 1«	32:43	0:77	Silwerstclpe : Försök till en ny uppfattning af hufwudgrunde-na för Allmän , 1«	6	0:13	silwerstclpe $ försöka till en ny uppfattning af $ för allmän $ $
uppfattning		1828	1	bib19277277_18280103_147682_2_0001_alto.xml-6-26	 	ben lid, dä Lyckttändningen infaller, och sedermera behörigen underhällas, wid fanima vite af 1 N:or 32 st., som för nraktlatenher af Lycklornes uppfattning ofwanförc är utsatt.	145:156	0:177	ben lid , dä Lyckttändningen infaller , och sedermera behörigen underhällas , wid fanima vite af 1 N:or 32 st. , som för nraktlatenher af Lycklornes uppfattning ofwanförc är utsatt .	26	0:31	ben lid $ dä lyckttändningen infalla $ och sedermera behörigen underhälla $ wid fanima vite af 1 $ 32 $ $ som för nraktlatenher af lycklornes uppfattning ofwanförc vara $ $
uppfattning		1818	1	bib11653828_18180410_144028_81_0003_alto.xml-5-11	 	Ma st adligt i sill utförande, som origtigt i fin uppfattning, är ändamälet med denna nun vördsamma ftan.ställning.	50:61	0:115	Ma st adligt i sill utförande , som origtigt i fin uppfattning , är ändamälet med denna nun vördsamma ftan.ställning .	11	0:21	ma st adlig i sill utförande $ som origtigt i fin uppfattning $ vara ändamälet med denna nun vördsam $ $
uppfattning		1829	1	bib13506739_18290713_144030_158_0001_alto.xml-12-0	 	uppfattningen öfwer Bankens öden arv, att da genom krigstillfällighetcr, derwid andra utwägar saknats rill bestridande af krigskostnaden », Bank » nS credit blifwit anlitad, att sedermera, d8 minnet af oförmågan att ntgöra nödwandiga krigsgärder, och af omöjligheten att erh8lla utlandska eller inländska l8n, swarande emot behofwet förswunnit, har man sökt, utan minsta hänsigt till dr nationnella förluster, och det ständiga qwarst8ende, - med otillräcklig » rtug8ngar, som genom myntet försämrande ' bankrurrer alstrats, likwal tid annan wid ta ai t denna ntwäg, under det skenstal^att den skuldsatta d^len af Nationen skalle förlora, i händelse myntet förbättrades, p8 grund af d.	0:13	0:684	uppfattningen öfwer Bankens öden arv , att da genom krigstillfällighetcr , derwid andra utwägar saknats rill bestridande af krigskostnaden » , Bank » nS credit blifwit anlitad , att sedermera , d8 minnet af oförmågan att ntgöra nödwandiga krigsgärder , och af omöjligheten att erh8lla utlandska eller inländska l8n , swarande emot behofwet förswunnit , har man sökt , utan minsta hänsigt till dr nationnella förluster , och det ständiga qwarst8ende , - med otillräcklig » rtug8ngar , som genom myntet försämrande ' bankrurrer alstrats , likwal tid annan wid ta ai t denna ntwäg , under det skenstal^att den skuldsatta d^len af Nationen skalle förlora , i händelse myntet förbättrades , p8 grund af d .	0	0:117	uppfattning öfwer bank öde arv $ att da genom krigstillfällighetcr $ derwid andra utwägar sakna rill bestrida af krigskostnad $ $ bank $ ns credit blifwit anlita $ att sedermera $ d8 minne af oförmåga att ntgöra nödwandiga krigsgärd $ och af omöjlighet att erh8lla utlandska eller inländsk l8n $ swarande emot behofwet förswunnit $ ha man söka $ utan liten hänsigt till dr nationnella förlust $ och den ständig qwarst8ende $ $ med otillräcklig $ rtug8ngar $ som genom mynt försämra $ bankrurrer alstra $ likwal tid annan wid ta ai t denna ntwäg $ under den $ den skuldsatt $ af nation skalle förlora $ i händelse mynt förbättra $ p8 grund af d $
uppfattning		1830	1	bib11653828_18301110_144028_261_0003_alto.xml-10-2	 	Efter denna uppfattning skulle vi lia föga annat att göra, än öfverlemna det ifrågavarande romanfragmentet till Göthes beundrares obehindrade njutning, örn det icke i en litterär tidning blifvit uppskatt ad t sorn ett fulländad!	12:23	0:228	Efter denna uppfattning skulle vi lia föga annat att göra , än öfverlemna det ifrågavarande romanfragmentet till Göthes beundrares obehindrade njutning , örn det icke i en litterär tidning blifvit uppskatt ad t sorn ett fulländad !	2	0:37	efter denna uppfattning skola vi lia föga annan att göra $ än öfverlemna den ifrågavarande romanfragment till göthes beundrare obehindrad njutning $ örn den icke i en litterär tidning blifvit uppskatt ad t sorn en fullända $
uppfattning		1895	2	bib15873936_18950328_147385_38_0002_alto.xml-95-13	 	redaktör har icke ” instämt ' ’ i något annat än den allmänna uppfattning af ” förhandenvarande förhållanden ”, som i den till honom Eersonligen framstälda och på samma sätt esvarade inbjudningen till mötet var uttryckt.	62:73	0:220	redaktör har icke ” instämt ' ’ i något annat än den allmänna uppfattning af ” förhandenvarande förhållanden ” , som i den till honom Eersonligen framstälda och på samma sätt esvarade inbjudningen till mötet var uttryckt .	13	0:38	redaktör ha icke $ instämma $ $ i någon annan än den allmän uppfattning af $ förhandenvarande förhållande $ $ som i den till han eersonligen framstälda och på samma sätt esvarade inbjudning till möte vara uttrycka $
uppfattning		1895	2	bib15760690_18950930_145050_150_0003_alto.xml-67-8	 	Pä sädant sätt bör man komma till riktig uppfattning om, huru tullbestämmelserna stola affattas, om man, det sär ju tilläggas, har fullt god wilja och dertill jullgod kraft att pä ett rättwist sätt, utan wäldsörande as nägons rätt, ordna del ömtäliga förhällandet.	41:52	0:264	Pä sädant sätt bör man komma till riktig uppfattning om , huru tullbestämmelserna stola affattas , om man , det sär ju tilläggas , har fullt god wilja och dertill jullgod kraft att pä ett rättwist sätt , utan wäldsörande as nägons rätt , ordna del ömtäliga förhällandet .	8	0:49	pä sädant sätt böra man komma till riktig uppfattning om $ huru tullbestämmelse stola affatta $ om man $ den sär ju tillägga $ ha full god wilja och dertill jullgod kraft att pä en rättwist sätt $ utan wäldsörande as nägons rätt $ ordna del ömtäliga förhällande $
uppfattning		1895	2	bib19277277_18951002_147683_268_0006_alto.xml-39-15	 	ingen fara för ögonblicket, ty Rysslands fredskäriek är oförändrad och hela venden hyser den uppfattningen, att det är Rysslands afsigt att hindra Frankrike från ett eventuelt fredsbrott Men frågan är, om Frankrike i längdan kan hållas tillbaka.	93:106	0:245	ingen fara för ögonblicket , ty Rysslands fredskäriek är oförändrad och hela venden hyser den uppfattningen , att det är Rysslands afsigt att hindra Frankrike från ett eventuelt fredsbrott Men frågan är , om Frankrike i längdan kan hållas tillbaka .	15	0:41	ingen fara för ögonblick $ ty ryssland fredskäriek vara oförändrad och hel vend hysa den uppfattning $ att den vara ryssland afsigt att hindra frankrike från en eventuel fredsbrott men fråga vara $ om frankrike i längdan kunna hålla tillbaka $
uppfattning		1897	2	bib11653830_18970308_146968_19_0003_alto.xml-22-14	 	Rlksbankskontor i Gefle före slås af bankoutskottet, som sålunda anslutit sig till bankofullmäktiges uppfattning af frågan, hvar riksbankens nästa afdelningskontor borde inrättas.	101:112	0:179	Rlksbankskontor i Gefle före slås af bankoutskottet , som sålunda anslutit sig till bankofullmäktiges uppfattning af frågan , hvar riksbankens nästa afdelningskontor borde inrättas .	14	0:25	rlksbankskontor i gefle före slå af bankoutskott $ som sålunda ansluta sig till bankofullmäktig uppfattning af fråga $ hvar riksbank nästa afdelning böra inrätta $
uppfattning		1895	2	bib19225758_18951004_144022_231_0002_alto.xml-49-64	 	Såsom gifvet kan väl antagas, att nya lagberedningen för tillämpning af denna § tänkt sig, att fullt fog för godsets återlämnande värkligen skall finnas i följd af fel eller brist eller pfl annan grund, men detta är ingalunda klart uttryckt, utan formuleringen af paragrafens 1 morn., där ordet underrättelse erhållit en så framskjuten plats, kan ingifva den uppfattning, att ett blott förebärande af fel eller brist eller annan anledning är tillräckligt föi köparens befogenhet att vidtaga den försäljningsåtgärd, som mom. 2 sedermera omförmäler.	359:370	0:547	Såsom gifvet kan väl antagas , att nya lagberedningen för tillämpning af denna § tänkt sig , att fullt fog för godsets återlämnande värkligen skall finnas i följd af fel eller brist eller pfl annan grund , men detta är ingalunda klart uttryckt , utan formuleringen af paragrafens 1 morn . , där ordet underrättelse erhållit en så framskjuten plats , kan ingifva den uppfattning , att ett blott förebärande af fel eller brist eller annan anledning är tillräckligt föi köparens befogenhet att vidtaga den försäljningsåtgärd , som mom. 2 sedermera omförmäler .	64	0:93	såsom gifvet kunna väl anta $ att ny lagberedning för tillämpning af denna $ tänka sig $ att full fog för gods återlämna värkligen skola finna i följd af fel eller brist eller pfl annan grund $ men denna vara ingalunda klar uttrycka $ utan formulering af paragraf 1 morn $ $ där ord underrättelse erhålla en så framskjuten plats $ kunna ingifva den uppfattning $ att en blott förebära af fel eller brist eller annan anledning vara tillräcklig föi köpare befogenhet att vidta den försäljningsåtgärd $ som $ 2 sedermera omförmäla $
uppfattning		1896	2	bib11653830_18960507_146968_37_0003_alto.xml-71-5	 	Under dessa förhållanden vardt den uppfattningen allt starkare i Sverige, liksom den bredde sig allt vidare i de stora samhällslagren i vårt grannland, att Norge var i färd med att söka framtvinga unionens upplösning.	35:48	0:217	Under dessa förhållanden vardt den uppfattningen allt starkare i Sverige , liksom den bredde sig allt vidare i de stora samhällslagren i vårt grannland , att Norge var i färd med att söka framtvinga unionens upplösning .	5	0:37	under denna förhållande vardt den uppfattning allt stark i sverige $ liksom den bre sig all vid i en stor samhällslager i vi grannland $ att norge vara i färd med att söka framtvinga union upplösning $
uppfattning		1900	2	bib11653790_19000518_145648_39_0003_alto.xml-32-22	 	dels * på grund af det ovanligt ringa barnantalet och dels till följd af lärarens höga ålder, och blef denna skolrådets uppfattning af stämman gillad och antagen, Till församlingsombud vid den till den 30 maj utsatta ekonomiska besiktningen å komministers- och klockareboställena utsågos Nises Lars Andersson i Åkerö ooh Nygårds Lars Olsson i Noret, Frågan örn intagning och lästid m. m., som stämman för det blifvande skolreglementet egde att bestämma, uppsköts tills vidare, Ångbåtstrafiken ä Siljan ärm snart i full gång, i det att ångaren Gustaf Wasa nu upptagit sina turer mellan Mora och Insjön, och flottningsbolagets ångare nu börjat sin verksamhet för året, Ångaren Rättvik väntades till Leksand den 16 maj för första gången i år, men antagligt är, att den till följd af den inåt Rättviken drifna isen måste ännu några dagar uppskjuta resan — skrifves den 15 dennes till Länstidningen.	120:131	0:894	dels * på grund af det ovanligt ringa barnantalet och dels till följd af lärarens höga ålder , och blef denna skolrådets uppfattning af stämman gillad och antagen , Till församlingsombud vid den till den 30 maj utsatta ekonomiska besiktningen å komministers- och klockareboställena utsågos Nises Lars Andersson i Åkerö ooh Nygårds Lars Olsson i Noret , Frågan örn intagning och lästid m . m . , som stämman för det blifvande skolreglementet egde att bestämma , uppsköts tills vidare , Ångbåtstrafiken ä Siljan ärm snart i full gång , i det att ångaren Gustaf Wasa nu upptagit sina turer mellan Mora och Insjön , och flottningsbolagets ångare nu börjat sin verksamhet för året , Ångaren Rättvik väntades till Leksand den 16 maj för första gången i år , men antagligt är , att den till följd af den inåt Rättviken drifna isen måste ännu några dagar uppskjuta resan — skrifves den 15 dennes till Länstidningen .	22	0:157	dels $ på grund af den ovanlig ringa barnantal och dels till följd af lärare hög ålder $ och blef denna skolråd uppfattning af stämma gilla och anta $ till församlingsombud vid den till den 30 maj $ ekonomisk besiktning å $ och klockareboställena utsågos nises lars andersson i åkerö ooh nygårds lars olsson i nor $ fråga örn intagning och lästid m $ m $ $ som stämma för den blifvande skolreglemente egde att bestämma $ uppskjuta tills vid $ ångbåtstrafik ä siljan ärm snar i full gång $ i den att ångare gustaf wasa nu uppta sig tur mellan mora och insjö $ och flottningsbolag ångare nu börja sig verksamhet för år $ ångare rättvik vänta till leksand den 16 maj för $ gång i år $ men antaglig vara $ att den till följd af den inåt rättvik drifna is måste ännu någon dag uppskjuta resa $ skrifves den 15 denna till länstidningen $
uppfattning		1895	2	bib15873936_18950302_147385_27_0003_alto.xml-79-21	 	som förr, att därtill har detta parti f. n. hvarken vilja eller förmåga. » Den stora skilnaden i uppfattning som ledde till, att förhandlingarna mellan de tre politiska grupperna strandade, är att högern och de moderate vilja fri och obunden förhandling med Sverige öfver hela linien, medan de radikale halla på den Moursundska dagordningen och i konsulatsaken blott vilja förhandla örn afvecklingen, men icke örn upplösningen af den bestående gemensamheten.	97:108	0:458	som förr , att därtill har detta parti f. n . hvarken vilja eller förmåga . » Den stora skilnaden i uppfattning som ledde till , att förhandlingarna mellan de tre politiska grupperna strandade , är att högern och de moderate vilja fri och obunden förhandling med Sverige öfver hela linien , medan de radikale halla på den Moursundska dagordningen och i konsulatsaken blott vilja förhandla örn afvecklingen , men icke örn upplösningen af den bestående gemensamheten .	21	0:78	som förr $ att därtill ha denna parti $ n $ hvarken vilja eller förmåga $ $ den stor skilnad i uppfattning som leda till $ att förhandling mellan en tre politisk grupp stranda $ vara att höger och en moderat vilja fri och obunden förhandling med sverige öfver hel linie $ medan de radikal halla på den moursundska dagordning och i konsulatsaken blott vilja förhandla örn afvecklingen $ men icke örn upplösning af den bestå gemensamhet $
uppfattning		1895	2	bib19225758_18950220_144022_43_0002_alto.xml-71-2	 	0 klar uppfattning af hvad som kändt i Ar ' menieD, emedan de turkiska myndigheterna hunnit deportera eller fängsla nästan alla kristna, hvilkas vittnesmål de Luktade.	7:18	0:167	0 klar uppfattning af hvad som kändt i Ar ' menieD , emedan de turkiska myndigheterna hunnit deportera eller fängsla nästan alla kristna , hvilkas vittnesmål de Luktade .	2	0:29	0 klar uppfattning af hvad som kändt i ar $ menied $ emedan en turkisk myndighet hinna deportera eller fängsla nästan all kristen $ hvilkas vittnesmål en lukta $
uppfattning		1895	2	bib15873371_18950704_145112_178_0002_alto.xml-115-19	 	Den ytterligare behandling som spörsmålet nu fått inom komitén torde enligt min åsigt icke vara egnad att rubba denna uppfattning utan snarare att befästa densamma.	118:129	0:164	Den ytterligare behandling som spörsmålet nu fått inom komitén torde enligt min åsigt icke vara egnad att rubba denna uppfattning utan snarare att befästa densamma .	19	0:26	den ytterlig behandling som spörsmål nu få inom komitén torde enligt jag åsigt icke vara egna att rubba denna uppfattning utan snar att befästa densamma $
uppfattning		1895	2	bib19277277_18950722_147683_196_0008_alto.xml-41-20	 	Badeblatt » yttrar härom: » Fru S:s utomordentligt sympatiska ooh valklingande stämma jemtö hennes dramatiska, örn den finnsto uppfattning och örn en ypperlig skola vittnande föredrag hunfördo den talrika publiken till stormande bifallstecken, hvilka slutligen förunleddo sångerskan att såsom extranummer sjunga » Uebers Juhr », visa af Bohm. » Fru Elleli Hartmann bar efter en månads vistelse i Paris och sedermera genomgången brunnskur i Vichy återkommit till Sverige och utflyttat till Furusund för att tillbringa någon tid derstädes.	127:138	0:537	Badeblatt » yttrar härom : » Fru S:s utomordentligt sympatiska ooh valklingande stämma jemtö hennes dramatiska , örn den finnsto uppfattning och örn en ypperlig skola vittnande föredrag hunfördo den talrika publiken till stormande bifallstecken , hvilka slutligen förunleddo sångerskan att såsom extranummer sjunga » Uebers Juhr » , visa af Bohm . » Fru Elleli Hartmann bar efter en månads vistelse i Paris och sedermera genomgången brunnskur i Vichy återkommit till Sverige och utflyttat till Furusund för att tillbringa någon tid derstädes .	20	0:84	badeblatt $ yttra härom $ $ fru $ utomordentlig sympatisk ooh valklingande stämma jemtö hon dramatisk $ örn den finnsto uppfattning och örn en ypperlig skola vittna föredrag hunfördo den talrik publik till storma bifallstecken $ hvilka slutligen förunleddo sångerska att såsom extranummer sjunga $ uebers juhr $ $ visa af bohm $ $ fru elleli hartmann bära efter en månad vistelse i paris och sedermera genomgå brunnskur i vichy återkomma till sverige och utflytta till furusund för att tillbringa någon tid derstädes $
uppfattning		1895	2	bib19227462_18951024_147640_248_0003_alto.xml-22-28	 	Vi vilja ej betvifla, att han genom sina sträf vallden ville gagna, mea vi kunna ej annat än beklaga, att ban ej bade nog klar uppfattning att hålla sig fri från löjliga öfverdrifter och att han till och med på sina sista dagar lät sig drifvas af en doktrinär kosmopolitism, för hvilken fosterlandskänslans enklaste kraf någon gång Ängö träda i skuggan, en en skugga som då icke kundo undgå att falla öfver honom sjelf.	127:138	0:419	Vi vilja ej betvifla , att han genom sina sträf vallden ville gagna , mea vi kunna ej annat än beklaga , att ban ej bade nog klar uppfattning att hålla sig fri från löjliga öfverdrifter och att han till och med på sina sista dagar lät sig drifvas af en doktrinär kosmopolitism , för hvilken fosterlandskänslans enklaste kraf någon gång Ängö träda i skuggan , en en skugga som då icke kundo undgå att falla öfver honom sjelf .	28	0:80	vi vilja ej betvifla $ att han genom sig sträf vallden vilja gagna $ mea vi kunna ej annan än beklaga $ att ban ej be nog klar uppfattning att hålla sig fri från löjlig öfverdrift och att han till och med på sig sista dag låta sig drifva af en doktrinär kosmopolitism $ för hvilken fosterlandskänslans enkel kraf någon gång ängö trä i skugga $ en en skugga som då icke kundo undgå att falla öfver han sjelf $
uppfattning		1895	2	bib19277277_18950512_147683_128_0005_alto.xml-104-13	 	det måste erkännas, och otvifvelaktigt porträttlikt, men likväl af tämligen prosaisk uppfattning och säger oss jusi ingenting.	85:96	0:126	det måste erkännas , och otvifvelaktigt porträttlikt , men likväl af tämligen prosaisk uppfattning och säger oss jusi ingenting .	13	0:20	den måste erkänna $ och otvifvelaktig porträttlik $ men likväl af tämligen prosaisk uppfattning och säga vi jusi ingenting $
uppfattning		1895	2	bib19349359_18950228_148383_25_0002_alto.xml-88-4	 	i enkla drag den uppfattning som i dessa dagar är det vida öfvervägmde svenska flertalets, deras som icke vilja kränka någons rätt, men som ock hilla på sia egon!	17:28	0:162	i enkla drag den uppfattning som i dessa dagar är det vida öfvervägmde svenska flertalets , deras som icke vilja kränka någons rätt , men som ock hilla på sia egon !	4	0:32	i enkel drag den uppfattning som i denna dag vara den vida öfvervägmde svensk flertal $ de som icke vilja kränka någon rätt $ men som ock hilla på sia egon $
