lemma	pos	date	grouping	identifier	description	context	indexes_target_token	indexes_target_sentence	context_tokenized	indexes_target_token_tokenized	indexes_target_sentence_tokenized	context_lemmatized
uppfattning		1828	1	bib11653828_18281231_144028_300_0003_alto.xml-0-64	 	= Sistlidne Måndag bade Hr Berg, soini hittills varit vanligt, sin årsrecett på Kongl, teatern, hvarvid August och Theodor eller Kammarpagerne, samt IJigeni elen andra uppfördes, tvänne stycken, sorn visserligen icke ega nå-: got högt konstvärde, aldraminst det sistnämnda, men sorn dock guteras af allmänheten, 1 den ena för Hr Hjortsbergs utmärkt karakteristiska uppfattning af Fredrik deri störes roll, ’ och den andra, emedan det alltid skall finnas en klass af publiken, sorn tycker örn att böra en Ifigeni med basröst, att de Grekiska hskitarna fara på eri ångbåt, Thoas i skjubbskinsH pels, Orest med trekantig hatt, Pylad ätande smörgås, o. s. v. en smak, sorn måhända ändå icke hör till de samsta.	365:376	0:706	= Sistlidne Måndag bade Hr Berg , soini hittills varit vanligt , sin årsrecett på Kongl , teatern , hvarvid August och Theodor eller Kammarpagerne , samt IJigeni elen andra uppfördes , tvänne stycken , sorn visserligen icke ega nå- : got högt konstvärde , aldraminst det sistnämnda , men sorn dock guteras af allmänheten , 1 den ena för Hr Hjortsbergs utmärkt karakteristiska uppfattning af Fredrik deri störes roll , ’ och den andra , emedan det alltid skall finnas en klass af publiken , sorn tycker örn att böra en Ifigeni med basröst , att de Grekiska hskitarna fara på eri ångbåt , Thoas i skjubbskinsH pels , Orest med trekantig hatt , Pylad ätande smörgås , o. s. v. en smak , sorn måhända ändå icke hör till de samsta .	64	0:134	$ sistliden måndag be hr berg $ soini hittills vara vanlig $ sig årsrecett på kongl $ teater $ hvarvid august och theodor eller kammarpagerne $ samt ijigeni el andra uppföra $ tvänne styck $ sorn visserligen icke ega nå $ got hög konstvärde $ aldraminst den sistnämnd $ men sorn dock gutera af allmänhet $ 1 den ena för hr hjortsbergs utmärkt karakteristisk uppfattning af fredrik deri störa roll $ $ och den andra $ emedan den alltid skola finna en klass af publik $ sorn tycka örn att böra en ifigeni med basröst $ att en grekisk hskitarna fara på eri ångbåt $ thoas i skjubbskinsh pels $ orest med trekantig hatt $ pylad ätande smörgås $ $ $ $ en smak $ sorn måhända ändå icke höra till en samsta $
uppfattning		1813	1	bib11653825_18130215_145134_20_0004_alto.xml-4-20	 	till JiiteckningsbafmsreS än bugade Kypares underrättelse härigenom kungiordt ' varder, med tillkännagifwa » de alt af de härstädes sörwaraSe Uppfattnings.	142:154	0:155	till JiiteckningsbafmsreS än bugade Kypares underrättelse härigenom kungiordt ' varder , med tillkännagifwa » de alt af de härstädes sörwaraSe Uppfattnings .	20	0:22	till jiiteckningsbafmsres än buga kypare underrättelse härigenom kungiordt $ varda $ med tillkännagifwa $ en alt af en härstädes sörwarase uppfattning $
uppfattning		1828	1	bib19277277_18281230_147682_304_0001_alto.xml-17-72	 	Proposition, rörande anslag till en waltenledning frän Lycki by till Staden Carlskrona, upplälic Herr Landegren ett memorial, deruti pä wälgrundadc stät tillstyrktes den älgärd, i afseende pä det stora antal af motioner om anslag af allmänna medel, som till Stats Utskottet blifwit remitterade, alt de, sä midt möjligt ware, ' mätlc ett sammanhang hos Ständen till afgörande förekomma, samt en sni » marist uppfattning af alla anslag, som komma isräga, jemte xrovifionclt förslag öfwer ben som möjligen kunde koni, ma att tillstyrkas, genom Utstottet föranstaltas ock, sä styndsamt som möiliat, genom trycket Ständen meddelas.	407:418	0:626	Proposition , rörande anslag till en waltenledning frän Lycki by till Staden Carlskrona , upplälic Herr Landegren ett memorial , deruti pä wälgrundadc stät tillstyrktes den älgärd , i afseende pä det stora antal af motioner om anslag af allmänna medel , som till Stats Utskottet blifwit remitterade , alt de , sä midt möjligt ware , ' mätlc ett sammanhang hos Ständen till afgörande förekomma , samt en sni » marist uppfattning af alla anslag , som komma isräga , jemte xrovifionclt förslag öfwer ben som möjligen kunde koni , ma att tillstyrkas , genom Utstottet föranstaltas ock , sä styndsamt som möiliat , genom trycket Ständen meddelas .	72	0:110	proposition $ rörande anslag till en waltenledning frän lycki by till stad carlskrona $ upplälic herr landegren en memorial $ deruti pä wälgrundadc stät tillstyrka den älgärd $ i afseende pä den stor antal af motion om anslag af allmän medel $ som till stats utskott blifwit remittera $ alt de $ sä midt möjlig ware $ $ mätlc en sammanhang hos ständen till afgöra förekomma $ samt en sni $ marist uppfattning af all anslag $ som komma isräga $ jemte xrovifionclt förslag öfwer ben som möjligen kunna koni $ ma att tillstyrka $ genom utstottet föranstalta ock $ sä styndsamt som möiliat $ genom tryck ständen meddela $
uppfattning		1818	1	bib11653828_18180224_144028_45_0003_alto.xml-1-6	 	arbete, hwilken wisar sig wid uppfattningen af särskilta Pastorers löneinkomster?	30:43	0:81	arbete , hwilken wisar sig wid uppfattningen af särskilta Pastorers löneinkomster ?	6	0:12	arbete $ hwilken wisar sig wid uppfattning af särskilta pastor löneinkomst $
uppfattning		1825	1	bib11653828_18251205_144028_282_0003_alto.xml-15-47	 	Äbergsson i den smårå och otacksamma rolen af cn förnäm herre, oupphörligt bedragen af sina omilfliingar, ulan att fåfalla i löjlighet, eller giswa något utbrokt-åt sin förtrytelse och dermcv någon lyftning ål karaktcrcn, samt Hr Torslow såsom Cherubin, spelte alla lilio rigkig uppfattning of sina roler, nied natur och wärme, men ingen öf« wcrdrift Mill Strömstedt, säsoln Grcfw.nnan / och Hr Ciderwall sokn Torriiio, hade obetydliga roler, Ulen wörö nästan de, soln bast hördes, ech hwilkas organ tycktes lättast och ulan ansträngning fylla fa!en.	279:290	0:550	Äbergsson i den smårå och otacksamma rolen af cn förnäm herre , oupphörligt bedragen af sina omilfliingar , ulan att fåfalla i löjlighet , eller giswa något utbrokt-åt sin förtrytelse och dermcv någon lyftning ål karaktcrcn , samt Hr Torslow såsom Cherubin , spelte alla lilio rigkig uppfattning of sina roler , nied natur och wärme , men ingen öf« wcrdrift Mill Strömstedt , säsoln Grcfw.nnan / och Hr Ciderwall sokn Torriiio , hade obetydliga roler , Ulen wörö nästan de , soln bast hördes , ech hwilkas organ tycktes lättast och ulan ansträngning fylla fa !en .	47	0:98	äbergsson i den smårå och otacksam rol af cn förnäm herre $ oupphörlig bedra af sig omilfliingar $ ulan att fåfalla i löjlighet $ eller giswa någon $ sig förtrytelse och dermcv någon lyftning ål karaktcrcn $ samt hr torslow såsom cherubin $ spela all lilio rigkig uppfattning of sig roler $ nied natur och wärme $ men ingen $ wcrdrift mill strömstedt $ säsoln $ $ och hr ciderwall sokn torriiio $ ha obetydlig roler $ ulen wörö nästan en $ soln bast höra $ ech hwilkas organ tycka lätt och ulan ansträngning fylla fa $ $
uppfattning		1819	1	bib13506739_18191018_144030_241_0002_alto.xml-4-22	 	dä kyckttändningen infaller, och sedermcra behörigen underhÄlas, wid.sanuna wite af En Riksdaler Tretiotwä Skillingar, som för uraktlåtenhet af Lycktornes uppfattning oswanföre är utsatt.	155:166	0:187	dä kyckttändningen infaller , och sedermcra behörigen underhÄlas , wid.sanuna wite af En Riksdaler Tretiotwä Skillingar , som för uraktlåtenhet af Lycktornes uppfattning oswanföre är utsatt .	22	0:27	dä kyckttändningen infalla $ och sedermcra behörigen underhälas $ $ wite af en riksdaler tretiotwä skilling $ som för uraktlåtenhet af lycktornes uppfattning oswanföre vara $ $
uppfattning		1829	1	bib19277277_18291016_147682_240_0001_alto.xml-3-0	 	uppfattningen af mära uttryck hoS deni, font ifrän desamma dragit den (lutfaitB.	0:13	0:80	uppfattningen af mära uttryck hoS deni , font ifrän desamma dragit den ( lutfaitB .	0	0:15	uppfattning af mära uttryck hos deni $ font ifrän densamma dra den $ lutfaitb $
uppfattning		1829	1	bib13506739_18291118_144030_268_0006_alto.xml-50-35	 	Och?tllmänheten m8 i öfrigt afgöra, hwilket utmärker den mest" oförlåtliga advokatur"," den mest ohölida partisthet för ensidiga 8sigter och interetzen", an » tingen Ref:t förswar för sin uppfattning utaf Hr af B:s meNiug mcd dctz i » fr8gawarande yttrande, eller Tit.	188:199	0:268	Och ?tllmänheten m8 i öfrigt afgöra , hwilket utmärker den mest " oförlåtliga advokatur " , " den mest ohölida partisthet för ensidiga 8sigter och interetzen " , an » tingen Ref:t förswar för sin uppfattning utaf Hr af B:s meNiug mcd dctz i » fr8gawarande yttrande , eller Tit .	35	0:51	och $ m8 i öfrig afgöra $ hwilket utmärka den mycket $ oförlåtlig advokatur $ $ $ den mycket ohölida partisthet för ensidig 8sigter och interetzen $ $ an $ ting $ förswar för sig uppfattning utaf hr af b meniug mcd dctz i $ fr8gawarande yttrande $ eller tit $
uppfattning		1820	1	bib13506739_18200117_144030_12_0002_alto.xml-5-23	 	dä Lyckttcsndningen infaller, ock sedermera behörigen underhållas, wiv samma wite af En Riksdaler Tretiotwa Skillingar, som för uraktlåtenhet af Lyckrornes uppfattning osivansöxe ar utsatt.	156:167	0:189	dä Lyckttcsndningen infaller , ock sedermera behörigen underhållas , wiv samma wite af En Riksdaler Tretiotwa Skillingar , som för uraktlåtenhet af Lyckrornes uppfattning osivansöxe ar utsatt .	23	0:28	dä lyckttcsndningen infalla $ ock sedermera behörigen underhålla $ wiv samma wite af en riksdaler tretiotwa skilling $ som för uraktlåtenhet af lyckrornes uppfattning osivansöxe ar $ $
uppfattning		1815	1	bib11653828_18151208_144028_286_0001_alto.xml-7-50	 	Ä nyttjar man i mänga Skolor dktza torra Compendier i Geographien, hwilka, liksom de flesta andra hos oA hittills allmänt brukade Läroböcker, täsla med hwar, ondra uti att öfw ' rlasta minnet med en stympad kännedom om en mängd saker, liksom förständet och en fullständig uppfattning af de saker som döm läras '.vore.vore egenskaper, hwilka wid undervisningen förtjente mindre afseende.	272:283	0:386	Ä nyttjar man i mänga Skolor dktza torra Compendier i Geographien , hwilka , liksom de flesta andra hos oA hittills allmänt brukade Läroböcker , täsla med hwar , ondra uti att öfw ' rlasta minnet med en stympad kännedom om en mängd saker , liksom förständet och en fullständig uppfattning af de saker som döm läras ' .vore .vore egenskaper , hwilka wid undervisningen förtjente mindre afseende .	50	0:69	ä nyttja man i mänga skola dktza torr compendier i geographien $ hwilka $ liksom en mången annan hos oa hittills allmän bruka lärobok $ täsla med hwar $ ondra uti att öfw $ rlasta minne med en stympa kännedom om en mängd sak $ liksom förständet och en fullständig uppfattning af en sak som döma lära $ $ $ egenskap $ hwilka wid undervisning förtjente liten afseende $
uppfattning		1830	1	bib11653828_18300503_144028_100_0002_alto.xml-17-11	 	angar vilja vi yttra oss om dess musikaliska värde efter vår uppfattning af kompositionen.	61:72	0:90	angar vilja vi yttra oss om dess musikaliska värde efter vår uppfattning af kompositionen .	11	0:15	angar vilja vi yttra vi om den musikalisk värde efter vi uppfattning af komposition $
uppfattning		1823	1	bib11653823_18230321_144010_67_0003_alto.xml-2-56	 	Genom personlig ätgärd pä stället, har det lyckatS att frän en af de första mekaniska werkstäder i London, förtiden soniniar erhälla ej endast ett fullständigt inachineri för det Mudderwcrk nied ängmachin om 8 hastars kraft, som redan är i gäng wid Motala, utan ock twenne af de stickligaste arbetarne, dels för uppfattning deraf, och dels för inrättningen af sädane Werkstäder och anläggningar, hwilka kör tillwerkmng och underhäll af mera sammansatta mekanista werk äro nödige.	312:323	0:479	Genom personlig ätgärd pä stället , har det lyckatS att frän en af de första mekaniska werkstäder i London , förtiden soniniar erhälla ej endast ett fullständigt inachineri för det Mudderwcrk nied ängmachin om 8 hastars kraft , som redan är i gäng wid Motala , utan ock twenne af de stickligaste arbetarne , dels för uppfattning deraf , och dels för inrättningen af sädane Werkstäder och anläggningar , hwilka kör tillwerkmng och underhäll af mera sammansatta mekanista werk äro nödige .	56	0:82	genom personlig ätgärd pä ställ $ ha den lyckas att frän en af en första mekanisk werkstäder i london $ förtiden soniniar erhälla ej endast en fullständig inachineri för den mudderwcrk nied ängmachin om 8 hastars kraft $ som redan vara i gäng wid motala $ utan ock twenne af en stickligaste arbetare $ dels för uppfattning deraf $ och dels för inrättning af sädane werkstäder och anläggning $ hwilka köra tillwerkmng och underhäll af mera sammansatt mekanista werk äro nödig $
uppfattning		1829	1	bib11653828_18290518_144028_113_0001_alto.xml-2-9	 	mer geni, uppfattade olika lättare och abstraherade af uppfattningen af fenomenernas form med skicklighet de regler de följde.	55:68	0:126	mer geni , uppfattade olika lättare och abstraherade af uppfattningen af fenomenernas form med skicklighet de regler de följde .	9	0:20	mer geni $ uppfatta olik lätt och abstrahera af uppfattning af fenomenernas form med skicklighet en regel de följa $
uppfattning		1827	1	bib11653828_18270321_144028_67_0003_alto.xml-5-10	 	Swerige antagit, fästom uttrycket af fin, af Statens uppfattning utaf Lutherskt, Evangeliska Loran?	53:64	0:99	Swerige antagit , fästom uttrycket af fin , af Statens uppfattning utaf Lutherskt , Evangeliska Loran ?	10	0:17	swerige anta $ fästa uttryck af fin $ af stat uppfattning utaf luthersk $ evangelisk loran $
uppfattning		1825	1	bib11653828_18250107_144028_4_0001_alto.xml-2-19	 	sälcdes oförändrad, med undantag af ett par biografiffa rättelser, öfwerlcinnande ät läsaren sjelf, att efter egen uppfattning gilla eller.modifiera förfat » harens yttranden: & gt; ' ' Hr von Rosenstein omfattade hela Europeiska Litteraturen, war kännare af che Hesta, sä lefwande, som döda sprakén och utmärkte sig genom rättskaffens moder » ärade ränksätb Han dog i Stockholm den 7 sistl. Augusti.	115:126	0:400	sälcdes oförändrad , med undantag af ett par biografiffa rättelser , öfwerlcinnande ät läsaren sjelf , att efter egen uppfattning gilla eller.modifiera förfat » harens yttranden : & gt ; ' ' Hr von Rosenstein omfattade hela Europeiska Litteraturen , war kännare af che Hesta , sä lefwande , som döda sprakén och utmärkte sig genom rättskaffens moder » ärade ränksätb Han dog i Stockholm den 7 sistl. Augusti .	19	0:70	sälcdes oförändrad $ med undantag af en par biografiffa rättelse $ öfwerlcinnande äta läsare sjelf $ att efter egen uppfattning gilla $ förfat $ hare yttrande $ $ gt $ $ $ hr von rosenstein omfatta hel europeisk litteratur $ war kännare af che hesta $ sä lefwande $ som döda sprakén och utmärka sig genom rättskaffens moder $ ära ränksätb han dö i stockholm den 7 $ augusti $
uppfattning		1829	1	bib11653828_18291118_144028_268_0001_alto.xml-3-43	 	tillegna sig hans korrekthet i stilén — och mången har äfven trott, att detta var hans utmärkande individualitet; men det var likväl något helt annat, sorn stämplade hans poesi; det var tankarnas djup, känslans värma, förståndets hela uppfattning af ämnet, detta trängande till grunden af aaken, men icke längre, denna redlighet att se den sådan hon var, att ej deri vilja upptäcka mer än sorn verkligen Lanns der; denna jemnvigt emellan förstånd •ch fantasi, med ett ord, denna mognad j vilton och förmågan, sorn utgjorde hans skalde¬	235:246	0:535	tillegna sig hans korrekthet i stilén — och mången har äfven trott , att detta var hans utmärkande individualitet ; men det var likväl något helt annat , sorn stämplade hans poesi ; det var tankarnas djup , känslans värma , förståndets hela uppfattning af ämnet , detta trängande till grunden af aaken , men icke längre , denna redlighet att se den sådan hon var , att ej deri vilja upptäcka mer än sorn verkligen Lanns der ; denna jemnvigt emellan förstånd •ch fantasi , med ett ord , denna mognad j vilton och förmågan , sorn utgjorde hans skalde¬	43	0:101	tillegna sig han korrekthet i stilén $ och mången ha äfven tro $ att denna vara han utmärka individualitet $ men den vara likväl någon hel annan $ sorn stämpla han poesi $ den vara tank djup $ känsla värma $ förstånd hel uppfattning af ämne $ denna tränga till grund af aaken $ men icke länge $ denna redlighet att se den sån hon vara $ att ej deri vilja upptäcka mer än sorn verkligen lanns der $ denna jemnvigt emellan förstånd $ fantasi $ med en ord $ denna mognad j vilton och förmåga $ sorn utgöra han $
uppfattning		1829	1	bib19277277_18290725_147682_169_0001_alto.xml-15-22	 	päsiä, att Ministbren icke wille uppfatta Samhällets behof, men han wille bestrida att Ministeren ädagalagt för » lägan äfen sädan Uppfattning.	131:142	0:143	päsiä , att Ministbren icke wille uppfatta Samhällets behof , men han wille bestrida att Ministeren ädagalagt för » lägan äfen sädan Uppfattning .	22	0:24	päsiä $ att ministbren icke wille uppfatta samhälle behof $ men han wille bestrida att ministeren ädagalagt för $ lägan äfen sädan uppfattning $
uppfattning		1829	1	bib19277277_18290522_147682_117_0001_alto.xml-10-53	 	grundlagsenligt klander af en Styrelfeätgärd, att, utan att fränkänna sig sin moralista wigt, det ej bchbfde läna nägot biträde af uttryckens nästan materiella tyngd, för hwilkas urwal en erkänd stifkställare-förmäga icke kan finna nägon ursäkt i Spräkets ofta fbrcwitade fattigdom, eller i behof, ver af tankarncs lättare uppfattning; ej heller wäntade jag, att i ett ämne, ber grannlagenhcten bjöd att ej widröra dk kölilista orsaker, solli dermed kunde stä i sammanhang.	323:334	0:473	grundlagsenligt klander af en Styrelfeätgärd , att , utan att fränkänna sig sin moralista wigt , det ej bchbfde läna nägot biträde af uttryckens nästan materiella tyngd , för hwilkas urwal en erkänd stifkställare-förmäga icke kan finna nägon ursäkt i Spräkets ofta fbrcwitade fattigdom , eller i behof , ver af tankarncs lättare uppfattning ; ej heller wäntade jag , att i ett ämne , ber grannlagenhcten bjöd att ej widröra dk kölilista orsaker , solli dermed kunde stä i sammanhang .	53	0:82	grundlagsenlig klander af en styrelfeätgärd $ att $ utan att fränkänna sig sig moralista wigt $ den ej bchbfde läna nägot biträde af uttryck nästan materiell tyngd $ för hwilkas urwal en erkänd $ icke kunna finna nägon ursäkt i spräkets ofta fbrcwitade fattigdom $ eller i behof $ ver af tankarncs lätt uppfattning $ ej heller wäntade jag $ att i en ämne $ be grannlagenhcten bjuda att ej widröra dk kölilista orsak $ solli dermed kunna stä i sammanhang $
uppfattning		1816	1	bib11653828_18161129_144028_279_0004_alto.xml-2-5	 	wara en borgen för mogen uppfattning af Materien, sunda detaller, wärdlgt spräk.	25:36	0:80	wara en borgen för mogen uppfattning af Materien , sunda detaller , wärdlgt spräk .	5	0:15	wara en borgen för mogen uppfattning af materie $ sund detaller $ wärdlgt spräk $
uppfattning		1814	1	bib11653828_18140420_144028_89_0002_alto.xml-0-6	 	8 ^ orsak till en ny uppfattning af hufwudgrunderna for allmänna Språkläran, af Apel Gabriel Silwcrstolpe.	21:32	0:106	8 ^ orsak till en ny uppfattning af hufwudgrunderna for allmänna Språkläran , af Apel Gabriel Silwcrstolpe .	6	0:18	8 $ orsak till en ny uppfattning af hufwudgrunderna fara allmän språklära $ af apel gabriel silwcrstolpe $
uppfattning		1830	1	bib11653828_18301210_144028_287_0002_alto.xml-7-20	 	Att man för skådeplatsen mäste ha förvärfvat skickligheten, att med djup känsla, bil — dadt förstånd och varm uppfattning djupt intränga i ett skaldeverks anda, så att man icke blott nödtorftigt begriper den enskilta ' roll, ' roll, man deri skall föreställa, utan förstår det i alla sina delar, i sin helhet, och artistiskt förmår uppfatta det; att man äfven för det minsta, för versens skanderande, för det ralia uttalet och tonvigten på fremmande ord och namn, för gåendet, ståendet oell rörelserna på teater, behöfver lia genomgått en sådan skola sorn soldaten hos sin exercismästare, denna fordran synes för våra moderna Roscier et * orimligt pedanteri.	110:121	0:658	Att man för skådeplatsen mäste ha förvärfvat skickligheten , att med djup känsla , bil — dadt förstånd och varm uppfattning djupt intränga i ett skaldeverks anda , så att man icke blott nödtorftigt begriper den enskilta ' roll , ' roll , man deri skall föreställa , utan förstår det i alla sina delar , i sin helhet , och artistiskt förmår uppfatta det ; att man äfven för det minsta , för versens skanderande , för det ralia uttalet och tonvigten på fremmande ord och namn , för gåendet , ståendet oell rörelserna på teater , behöfver lia genomgått en sådan skola sorn soldaten hos sin exercismästare , denna fordran synes för våra moderna Roscier et * orimligt pedanteri .	20	0:122	att man för skådeplats mäste ha förvärfvat skicklighet $ att med djup känsla $ bil $ dadt förstånd och varm uppfattning djup intränga i en skaldeverk anda $ så att man icke blott nödtorftig begripa den enskilta $ roll $ $ roll $ man deri skola föreställa $ utan förstå den i all sig del $ i sig helhet $ och artistisk förmå uppfatta den $ att man äfven för den liten $ för vers skanderande $ för den ralia uttal och tonvigt på fremmande ord och namn $ för gående $ stående oell rörelse på teater $ behöfva lia genomgå en sån skola sorn soldat hos sig exercismästare $ denna fordran synas för vi modern roscier et $ orimlig pedanteri $
uppfattning		1826	1	bib13506739_18260614_144030_124_0008_alto.xml-14-8	 	uppdrag med en beflnlsamhct, som röjde sann uppfattning af de heliga motiver, hwilka utgjorde Sällstapcts föreningSpunet.	44:55	0:121	uppdrag med en beflnlsamhct , som röjde sann uppfattning af de heliga motiver , hwilka utgjorde Sällstapcts föreningSpunet .	8	0:19	uppdrag med en beflnlsamhct $ som röja sann uppfattning af en helig motiver $ hwilka utgöra sällstapcts föreningspunet $
uppfattning		1814	1	bib11653828_18140419_144028_88_0004_alto.xml-1-6	 	Silrverstclpc: Försök till em ny uppfattning af hufwudgrunderna för Allmänna	33:44	0:76	Silrverstclpc : Försök till em ny uppfattning af hufwudgrunderna för Allmänna	6	0:11	silrverstclpc $ försöka till em ny uppfattning af hufwudgrunderna för allmän
uppfattning		1821	1	bib11653828_18210724_144028_170_0001_alto.xml-4-5	 	äro grundade i en djup uppfattning af menstliga utwecklingens gäng, cch det är i Historiens sp§r hail söker utleta, huru, under denna ständigt framstridande utweckling, de krafter, soln nu dertill äro sälte i rörelse, stola frambringa nya fbrhällanden.	23:34	0:252	äro grundade i en djup uppfattning af menstliga utwecklingens gäng , cch det är i Historiens sp§r hail söker utleta , huru , under denna ständigt framstridande utweckling , de krafter , soln nu dertill äro sälte i rörelse , stola frambringa nya fbrhällanden .	5	0:45	äro grunda i en djup uppfattning af menstliga utwecklingens gäng $ cch den vara i historia $ hail söka utleta $ huru $ under denna ständig framstridande utweckling $ en kraft $ soln nu dertill äro sälte i rörelse $ stola frambringa ny fbrhällanden $
uppfattning		1814	1	bib11653806_18140223_145120_29_0003_alto.xml-3-24	 	Af trycket bar i vefla dagar utkommet cch * im s på He ' rar Wiborgs och MterS Boilådor: Försök till en ny uppfattning as Huswudzrunde na för Allmänna Sprckk Läran, ines 8 Tabeller af Karn, marhcrrcn m. m. Apel Gabr.	107:118	0:216	Af trycket bar i vefla dagar utkommet cch * im s på He ' rar Wiborgs och MterS Boilådor : Försök till en ny uppfattning as Huswudzrunde na för Allmänna Sprckk Läran , ines 8 Tabeller af Karn , marhcrrcn m . m . Apel Gabr .	24	0:47	af tryck bära i vefla dag $ cch $ im s på he $ rar wiborgs och mters boilådor $ försöka till en ny uppfattning as huswudzrunde na för allmän sprckk lära $ ines 8 tabell af karn $ marhcrrcn m $ m $ apel gabr $
