lemma	pos	date	grouping	identifier	description	context	indexes_target_token	indexes_target_sentence	context_tokenized	indexes_target_token_tokenized	indexes_target_sentence_tokenized	context_lemmatized
anda		1801	1	bib19520388_18010401_147487_13_0001_alto.xml-1-26	 	ansäg dest Företrädares Prosten Hellmans Dotter, sorn under den 30 Jnlii 1799 liad ' fädt Nådig Resolution uppå dubbel Nådår, och hwilka stnlle til anda ga med April ina vads stut innewarande är, ha siva förlorat dest rätt, at widare Pastors inkomsten ivid detta Pastorat upbara, dä hon dea i r te Ockober&gt; 799 nied Auoirelrren Pankhelträdt i gifte; Sä har bemälce Consistorium, un der den st November sistledet är, medelst Resolution förklarat, det Desiväranden icke agde rättighet tiltrada Pastoratet, förr än der i näder beiviljade dubbla Näbärel lil än » „da	148:152	0:565	ansäg dest Företrädares Prosten Hellmans Dotter , sorn under den 30 Jnlii 1799 liad ' fädt Nådig Resolution uppå dubbel Nådår , och hwilka stnlle til anda ga med April ina vads stut innewarande är , ha siva förlorat dest rätt , at widare Pastors inkomsten ivid detta Pastorat upbara , dä hon dea i r te Ockober&gt ; 799 nied Auoirelrren Pankhelträdt i gifte ; Sä har bemälce Consistorium , un der den st November sistledet är , medelst Resolution förklarat , det Desiväranden icke agde rättighet tiltrada Pastoratet , förr än der i näder beiviljade dubbla Näbärel lil än » „ da	26	0:104	ansäga dest företrädare prost hellman dotter $ sorn under den 30 jnlii 1799 liad $ fädt nådig resolution uppå dubbel nådår $ och hwilka stnlle til anda ga med april i vad stut innewarande vara $ ha siva förlora dest rätt $ at widare pasta inkomst ivid denna pastorat upbara $ dä hon dea i r te $ $ 799 nied auoirelrren pankhelträdt i gifte $ sä ha bemälce consistorium $ un der den st november sistled vara $ medelst resolution förklara $ den desiväranden icke agde rättighet tiltrada pastorat $ förr än der i näder beiviljade dubbel näbärel lil än $ $ da
anda		1792	1	bib11653828_17920806_144028_179_0002_alto.xml-8-31	 	Mi » Herre, stadd pä en resa, har stadnat under Gudstjensten ä en päbuden Högtidsdag, och trädt in i en gammalmodig Bondkyrka, för at deltaga i Församlingens Anda k tsvsn ingar; och min Herre ' char funnit behag i ben afhörda Predikan, som dock ingen ting mindre war an möderne: utan lärdom, utan wältalighct, utan lättsinnigt och man hedrande smicker; föreställande nagl ' a efter förmodan upbyggande men nog triviala sanningar, af Historie, SalighclsLära, Moral, Samhallspligter, jamte lämpliga anledningar och upmuntringar til Ehristeliga, förnuftiga, medborgeliga och undersäteliga tankar, känflor, föresatser och önskningar, i anledning af Texten och^närmarande conjunctur; och alt detta utfördtmed en ffrifart, lämpad ester enfaldiga Ähörares begrepp. — Men dä min Herre, som Ähörare, widkannes detta, sä ar tillika sagdt, at en sä bcstaffad Predikan, hwarken til saker eller skrifsätt, ' innehåller något serdeles, ehuru iväröigt dess författare, såsom en wälmcnande BondPrest, en tänkande och ' god Medborgare.	158:162	0:1018	Mi » Herre , stadd pä en resa , har stadnat under Gudstjensten ä en päbuden Högtidsdag , och trädt in i en gammalmodig Bondkyrka , för at deltaga i Församlingens Anda k tsvsn ingar ; och min Herre ' char funnit behag i ben afhörda Predikan , som dock ingen ting mindre war an möderne : utan lärdom , utan wältalighct , utan lättsinnigt och man hedrande smicker ; föreställande nagl ' a efter förmodan upbyggande men nog triviala sanningar , af Historie , SalighclsLära , Moral , Samhallspligter , jamte lämpliga anledningar och upmuntringar til Ehristeliga , förnuftiga , medborgeliga och undersäteliga tankar , känflor , föresatser och önskningar , i anledning af Texten och^närmarande conjunctur ; och alt detta utfördtmed en ffrifart , lämpad ester enfaldiga Ähörares begrepp . — Men dä min Herre , som Ähörare , widkannes detta , sä ar tillika sagdt , at en sä bcstaffad Predikan , hwarken til saker eller skrifsätt , ' innehåller något serdeles , ehuru iväröigt dess författare , såsom en wälmcnande BondPrest , en tänkande och ' god Medborgare .	31	0:183	mi $ herre $ stadd pä en resa $ ha stadnat under gudstjenst ä en päbuden högtidsdag $ och trädt in i en gammalmodig bondkyrka $ för at delta i församling anda k tsvsn ingar $ och jag herre $ char finna behag i ben afhöra predikan $ som dock ingen ting föga war an möderne $ utan lärdom $ utan wältalighct $ utan lättsinnig och man hedra smicker $ föreställa nagel $ a efter förmodan upbyggande men nog trivial sanning $ af historie $ salighclslära $ moral $ samhallspligter $ jamte lämplig anledning och upmuntringar til ehristeliga $ förnuftig $ medborgeliga och undersäteliga tank $ känflor $ föresats och önskning $ i anledning af text $ conjunctur $ och alt denna utfördtmed en ffrifart $ lämpa est enfaldig ähörares begrepp $ $ men dä jag herre $ som ähörare $ widkannes denna $ sä ar tillika sagdt $ at en sä bcstaffad predikan $ hwarken til sak eller skrifsätt $ $ innehålla något serdeles $ ehuru iväröigt den författare $ såsom en wälmcnande bondprest $ en tänka och $ god medborgare $
anda		1812	1	bib11653825_18121123_145134_136_0002_alto.xml-1-10	 	wara Lätta Troppar under.General Platows befäl förföljde fienden frän Miasma anda till Erenina.	77:81	0:95	wara Lätta Troppar under.General Platows befäl förföljde fienden frän Miasma anda till Erenina .	10	0:14	wara lätta tropp $ platows befäl förfölja fiende frän miasma anda till erenina $
anda		1802	1	bib13506739_18020626_144030_141_0004_alto.xml-6-24	 	Midsommars aston kl. emellan to och 11 om aftonen, förlorades emellan hagalund och Beckers en Rör-Kapp med Benknapp., samt lindad i andan.	132:137	0:138	Midsommars aston kl. emellan to och 11 om aftonen , förlorades emellan hagalund och Beckers en Rör-Kapp med Benknapp . , samt lindad i andan .	24	0:26	midsommar aston $ emellan to och 11 om afton $ förlora emellan hagalund och becker en $ med benknapp $ $ samt linda i anda $
anda		1821	1	bib11653828_18211002_144028_230_0003_alto.xml-7-15	 	potism, och mi se ännu, att rent auicsralista författningar aro förenliga metz en anda af frihet och liberaliiet, som man ofta förgafwes söker i republiker.	82:86	0:156	potism , och mi se ännu , att rent auicsralista författningar aro förenliga metz en anda af frihet och liberaliiet , som man ofta förgafwes söker i republiker .	15	0:29	potism $ och mi se ännu $ att ren auicsralista författning aro förenlig metz en anda af frihet och liberaliiet $ som man ofta förgafwes söka i republik $
anda		1823	1	bib11653828_18231016_144028_240_0003_alto.xml-2-2	 	stilla weikande andan deri, och bwarest denna anda urartar, der urartar dela det sedliga lifwet i oupphörligt sortskridande.	16:21	0:124	stilla weikande andan deri , och bwarest denna anda urartar , der urartar dela det sedliga lifwet i oupphörligt sortskridande .	2	0:21	stilla weikande anda deri $ och bwarest denna anda urarta $ der urarta dela den sedlig lifwet i oupphörlig sortskridande $
anda		1800	1	bib19223423_18000514_145063_39_0004_alto.xml-6-24	 	En Baron, (Tyst förmodeligen,) befallte i sit Testamenteat man ssulle begrafwa honom i en Colonne, som han til den andan lätit utgröpa, och at man nödwändigt ffulle ställa honom uprätt emot Kyrkans stora Pelare, pä det ingen ofralseman stulle gä öfwer hans kropp eller trampa pä hans stoft.	115:120	0:290	En Baron , ( Tyst förmodeligen , ) befallte i sit Testamenteat man ssulle begrafwa honom i en Colonne , som han til den andan lätit utgröpa , och at man nödwändigt ffulle ställa honom uprätt emot Kyrkans stora Pelare , pä det ingen ofralseman stulle gä öfwer hans kropp eller trampa pä hans stoft .	24	0:56	en baron $ $ tyst förmodeligen $ $ befallte i sit testamenteat man ssulle begrafwa han i en colonne $ som han til den anda lätit utgröpa $ och at man nödwändigt ffulle ställa han uprätt emot kyrkans stor pelare $ pä den ingen ofralseman stulle gä öfwer han kropp eller trampa pä han stoft $
anda		1796	1	bib11653828_17960208_144028_31_0003_alto.xml-12-31	 	At Chevaleri-ANdan fordom medförde nägon nytta, kan wälicke nekas; den gas en spänning och rörelsekraft ät det i flummer förfallna Europa; » ren hwem stulle wäl busta denna anda tilbaka i w§r lid?	173:177	0:196	At Chevaleri-ANdan fordom medförde nägon nytta , kan wälicke nekas ; den gas en spänning och rörelsekraft ät det i flummer förfallna Europa ; » ren hwem stulle wäl busta denna anda tilbaka i w§r lid ?	31	0:37	at $ fordom medföra nägon nytta $ kunna wälicke neka $ den gas en spänning och rörelsekraft äta den i flummer förfalla europa $ $ ren hwem stulle wäl busta denna anda tilbaka i $ lid $
anda		1796	1	bib13506739_17960512_144030_106_0004_alto.xml-9-26	 	AfgLende Skeppare: Med Skepparen Lars Ekwall är lägenhet för staktgods pä Norrköping cch däromkring liggande Orter, för billig frakt » Fartyget ligger midtför södra andan af norra Bietualiewägen och afgär den ij.	165:170	0:212	AfgLende Skeppare : Med Skepparen Lars Ekwall är lägenhet för staktgods pä Norrköping cch däromkring liggande Orter , för billig frakt » Fartyget ligger midtför södra andan af norra Bietualiewägen och afgär den ij .	26	0:35	afglende skeppare $ med skeppare lars ekwall vara lägenhet för staktgods pä norrköping cch däromkring ligga ort $ för billig frakt $ fartyg ligga midtför södra anda af norra bietualiewägen och afgär den ij $
anda		1817	1	bib19227291_18170709_145289_28_0002_alto.xml-7-19	 	— Underhuset har fattat det beflut, att Suspeiisioncn af Habeas Corvus Acten stall förblifwa uti kraft och werkan anda till 6 weckor efter början af nästa Parlaments session.	114:118	0:174	— Underhuset har fattat det beflut , att Suspeiisioncn af Habeas Corvus Acten stall förblifwa uti kraft och werkan anda till 6 weckor efter början af nästa Parlaments session .	19	0:30	$ underhus ha fatta den beflut $ att suspeiisioncn af habeas corvus acten stall för uti kraft och werkan anda till 6 weckor efter början af nästa parlament session $
anda		1805	1	bib11653828_18051128_144028_276_0001_alto.xml-13-15	 	hans hufwud emot Kapiten.^ordvö stuldra, i hwilken ställning han, leende, uppgaf andan.	81:86	0:87	hans hufwud emot Kapiten .^ordvö stuldra , i hwilken ställning han , leende , uppgaf andan .	15	0:17	han hufwud emot kapiten $ stuldra $ i hwilken ställning han $ leende $ uppgaf anda $
anda		1801	1	bib11653828_18010112_144028_8_0003_alto.xml-6-22	 	ber, berättas, ak Zeeden stal stutas i Lägret, ob at Arme n ar högst glad at fä se en anda pä stna bcswarligheler.	86:90	0:114	ber , berättas , ak Zeeden stal stutas i Lägret , ob at Arme n ar högst glad at fä se en anda pä stna bcswarligheler .	22	0:27	be $ berätta $ ak zeeden stjäla stuta i läger $ ob at arm n ar hög glad at fä se en anda pä stna bcswarligheler $
anda		1794	1	bib19225792_17940830_147359_35_0006_alto.xml-2-34	 	Diverse Luitgörclser: Som nödigt är, at Stadens Brandsprutor warda försökte och det derwid indelta Arbeksmanstap, bestående af Slanghallare, siare och Pumpare ivid karen warda oftpade, til l, wilken anda Sprntlagen under N:ris i, 2 och z jemte det wid Watnanbringaren indelta Sprutlag, d.	199:203	0:288	Diverse Luitgörclser : Som nödigt är , at Stadens Brandsprutor warda försökte och det derwid indelta Arbeksmanstap , bestående af Slanghallare , siare och Pumpare ivid karen warda oftpade , til l , wilken anda Sprntlagen under N:ris i , 2 och z jemte det wid Watnanbringaren indelta Sprutlag , d .	34	0:52	diverse luitgörclser $ som nödig vara $ at stad brandspruta warda försöka och den derwid indelt arbeksmanstap $ bestå af slanghallare $ siare och pumpare ivid kar warda oftpade $ til l $ wilken anda sprntlagen under $ i $ 2 och z jemte den wid watnanbringaren indelt sprutlag $ d $
anda		1823	1	bib19227291_18230409_145289_15_0002_alto.xml-14-19	 	Han trodde detta sä mycket heldre, som den ssags bildning man der erhåller, hwarken ofwerensstammer med livens anda eller den stigande allmänna upplysningens kraf, som will ali menniflorna stola närma sig till.hwarandra, och icke genom eli flags flrämäsig uppfostran ästadkonima och befordra Ständsstillnader.	111:115	0:309	Han trodde detta sä mycket heldre , som den ssags bildning man der erhåller , hwarken ofwerensstammer med livens anda eller den stigande allmänna upplysningens kraf , som will ali menniflorna stola närma sig till.hwarandra , och icke genom eli flags flrämäsig uppfostran ästadkonima och befordra Ständsstillnader .	19	0:48	han tro denna sä mycket heldre $ som den ssags bildning man der erhålla $ hwarken ofwerensstammer med liv anda eller den stiga allmän upplysning kraf $ som will ali menniflorna stola närma sig $ $ och icke genom eli flags flrämäsig uppfostran ästadkonima och befordra ständsstillnader $
anda		1817	1	bib11653828_18171117_144028_266_0011_alto.xml-7-22	 	kanske efter sekler torde det, för att bruka Herr Vederläggarens ord, hnna » lustgårdar&gt; anlagde efter detina tiden » anda, och der vandraren, på de så hardt fördömda raka gångarna, nalkas ännu ett stycke närmare Humanitetens stora tempel-	121:125	0:242	kanske efter sekler torde det , för att bruka Herr Vederläggarens ord , hnna » lustgårdar&gt ; anlagde efter detina tiden » anda , och der vandraren , på de så hardt fördömda raka gångarna , nalkas ännu ett stycke närmare Humanitetens stora tempel-	22	0:44	kanske efter sekel torde den $ för att bruka herr vederläggaren ord $ hnna $ $ $ anlägga efter detina tid $ anda $ och der vandrare $ på en så hardt fördöma rak gång $ nalkas ännu en stycke nära humanitet stor tempel
anda		1823	1	bib11653828_18230917_144028_215_0003_alto.xml-5-15	 	af Angouleme bref warit egenhändigt skriswet af Konungen i Spanien, cch författadt i samma anda, som pluraliteten af CortcS ' ledamöter allt fed«n flcndt » ligheternas början ädagalagt.	91:95	0:185	af Angouleme bref warit egenhändigt skriswet af Konungen i Spanien , cch författadt i samma anda , som pluraliteten af CortcS ' ledamöter allt fed«n flcndt » ligheternas början ädagalagt .	15	0:31	af angouleme bref warit egenhändig skriswet af konung i spanien $ cch författadt i samma anda $ som pluralitet af cortcs $ ledamot all $ flcndt $ ligheternas början ädagalagt $
anda		1819	1	bib11653828_18190618_144028_138_0002_alto.xml-2-27	 	of sä wänga unga flickor, hwilka en ädelmodig Regering upptager i bäri s stall; och rär man ser der.s egin, förr med clla" anda brott befläckave, - Lrälde^-r u ur hopen upplysta tacksamma b ickor mot himmelen och anropa tsub * ba-mhertighet sön fina barns wäl.	123:127	0:260	of sä wänga unga flickor , hwilka en ädelmodig Regering upptager i bäri s stall ; och rär man ser der.s egin , förr med clla " anda brott befläckave , - Lrälde^-r u ur hopen upplysta tacksamma b ickor mot himmelen och anropa tsub * ba-mhertighet sön fina barns wäl .	27	0:52	of sä wänga ung flicka $ hwilka en ädelmodig regering uppta i bäri s stall $ och rär man se $ egin $ förr med clla $ anda brott befläckave $ $ $ u ur hop $ tacksam b ickor mot himmel och anropa tsub $ $ sön fin barn wäl $
anda		1814	1	bib19225772_18140107_148004_3_0001_alto.xml-5-12	 	En Bataillon af General Boyes Brigade bemäkligade sig batteriet, förföljde fienden anda under fästningens kanoner » ch gjorde flera sängar.	83:87	0:139	En Bataillon af General Boyes Brigade bemäkligade sig batteriet , förföljde fienden anda under fästningens kanoner » ch gjorde flera sängar .	12	0:22	en bataillon af general boye brigade bemäkligade sig batteri $ förfölja fiende anda under fästning kanon $ ch göra flera säng $
anda		1818	1	bib11653828_18180610_144028_130_0001_alto.xml-2-30	 	fodämnen, af beklädnads » och bcqwämlighets-artiklar, samt af jordans arbeten, har alstrat af fij Städer, Handel, Näringar, Styrelse och Ämbeten, Zlrbetsflit och hushållnings anda wid Äkerbruk, wid Handel och Näringar, hafwa gjort Nationerna lyckliga » ch starta.	175:179	0:263	fodämnen , af beklädnads » och bcqwämlighets-artiklar , samt af jordans arbeten , har alstrat af fij Städer , Handel , Näringar , Styrelse och Ämbeten , Zlrbetsflit och hushållnings anda wid Äkerbruk , wid Handel och Näringar , hafwa gjort Nationerna lyckliga » ch starta .	30	0:47	fodämnen $ af beklädnad $ och $ $ samt af jordans arbete $ ha alstra af fij stad $ handel $ näring $ styrelse och ämbete $ zlrbetsflit och hushållning anda wid äkerbruk $ wid handel och näring $ hafwa göra nation lycklig $ ch starta $
anda		1822	1	bib11653828_18221202_144028_281_0001_alto.xml-2-15	 	Om än nied formerna fia tycktes blanda Ett lift af konstnärn stänkt, i Prometheist anda.	83:87	0:88	Om än nied formerna fia tycktes blanda Ett lift af konstnärn stänkt , i Prometheist anda .	15	0:17	om än nied form fia tycka blanda en lift af konstnärn stänka $ i prometheist anda $
anda		1828	1	bib13506739_18280314_144030_63_0001_alto.xml-23-12	 	gömmer sta bakom de förra, det drifves af e » egen anda, det hoppas art atmiiv & gt; rone försäkra sig om en hederlig recraite, om det gamla splitet kan wäckas ur dm dvala, hvari det fallit.	51:55	0:190	gömmer sta bakom de förra , det drifves af e » egen anda , det hoppas art atmiiv & gt ; rone försäkra sig om en hederlig recraite , om det gamla splitet kan wäckas ur dm dvala , hvari det fallit .	12	0:43	gömma sta bakom en förra $ den drifves af e $ egen anda $ den hoppa art atmiiv $ gt $ rone försäkra sig om en hederlig recraite $ om den gammal split kunna wäckas ur dm dvala $ hvari den falla $
anda		1791	1	bib19225772_17910308_148003_19_0001_alto.xml-0-20	 	gatt öfwer Donau utmed Bratta, och icke allenast lagt manga Landstaper 1 Bulgarien i asta, utan ock ströfwat anda in i trakten af Szistove, hwarwid en liten Corps Turkar blif-vit stagen och förstmgrad samt en bror til förra Storviziren blifwit pä platsen.	109:113	0:255	gatt öfwer Donau utmed Bratta , och icke allenast lagt manga Landstaper 1 Bulgarien i asta , utan ock ströfwat anda in i trakten af Szistove , hwarwid en liten Corps Turkar blif-vit stagen och förstmgrad samt en bror til förra Storviziren blifwit pä platsen .	20	0:46	gatt öfwer donau utmed bratta $ och icke allenast lägga manga landstaper 1 bulgarien i asta $ utan ock ströfwat anda in i trakt af szistove $ hwarwid en liten corps turk $ stag och förstmgrad samt en bror til förra storviziren blifwit pä plats $
anda		1815	1	bib11653828_18150623_144028_143_0003_alto.xml-5-50	 	Z) I en liten, helt nyligen utkommen, högst bitter Satir, säges, att sä först) ända de syndare gifevas, som ej wilja tro, alt någon djefwul finnes; men frägas, dä man lasser denna Satirförfattures ffrister cch deraf sä tydligen finner hans anda: är dct wäki möjligt att ett enda ögonblick lunna twifla, att en djefwul iverkliaen giswcL till-?	240:244	0:342	Z ) I en liten , helt nyligen utkommen , högst bitter Satir , säges , att sä först ) ända de syndare gifevas , som ej wilja tro , alt någon djefwul finnes ; men frägas , dä man lasser denna Satirförfattures ffrister cch deraf sä tydligen finner hans anda : är dct wäki möjligt att ett enda ögonblick lunna twifla , att en djefwul iverkliaen giswcL till- ?	50	0:70	z $ i en liten $ hel nyligen $ $ högst bitter satir $ säga $ att sä först $ ända en syndare gifevas $ som ej wilja tro $ alt någon djefwul finna $ men frägas $ dä man lasser denna satirförfattures ffrister cch deraf sä tydligen finna han anda $ vara dct wäki möjlig att en enda ögonblick lunna twifla $ att en djefwul iverkliaen giswcl till $
anda		1791	1	bib11653828_17911003_144028_228_0002_alto.xml-0-65	 	tior hämla det (ämnet til Talek) inom WrtenstapernaS landamär-n, eller pä den allmän » bo Hushållningens ej nog ofta odlade fält- Men dä jag erinrar miz stilnaden emellan ek Tal ocb en Afhandling, samt de flere betänkligheter som mäta i andra afseende »; t sä har jag wändt wig til ben oskyldiga Naturen » svin sä gerna tillåter at öfiverväga anda til ock nied dest sörundcrligheter och tystaste rädstag, och hwilka, änstönr någon gäng ulwecklade, åtminstone icke g isma någor misthag, utan gemenligen behaga de fle^ie af best tänkande inwanare".	343:347	0:546	tior hämla det ( ämnet til Talek ) inom WrtenstapernaS landamär-n , eller pä den allmän » bo Hushållningens ej nog ofta odlade fält- Men dä jag erinrar miz stilnaden emellan ek Tal ocb en Afhandling , samt de flere betänkligheter som mäta i andra afseende » ; t sä har jag wändt wig til ben oskyldiga Naturen » svin sä gerna tillåter at öfiverväga anda til ock nied dest sörundcrligheter och tystaste rädstag , och hwilka , änstönr någon gäng ulwecklade , åtminstone icke g isma någor misthag , utan gemenligen behaga de fle^ie af best tänkande inwanare " .	65	0:101	tia hämla den $ ämne til talek $ inom wrtenstapernas $ $ eller pä den allmän $ bo hushållning ej nog ofta odla fält men dä jag erinra miz stilnaden emellan ek tal ocb en afhandling $ samt en flere betänklighet som mäta i andra afseende $ $ t sä ha jag wändt wig til ben oskyldig natur $ svin sä gerna tillåta at öfiverväga anda til ock nied dest sörundcrligheter och tyst rädstag $ och hwilka $ änstönr någon gäng ulwecklade $ åtminstone icke g isma någor misthag $ utan gemenligen behaga en $ af best tänkande inwanare $ $
anda		1807	1	bib13506739_18070820_144030_191_0002_alto.xml-4-8	 	ehuru ock försallotiden dä redan kunde wara till anda.	49:53	0:54	ehuru ock försallotiden dä redan kunde wara till anda .	8	0:10	ehuru ock försallotiden dä redan kunna wara till anda $
anda		1811	1	bib19223423_18110619_145063_49_0002_alto.xml-5-70	 	Krukomakare«Enkan här i Köpingen, Elsa Rebecka Wetzberg, född Ecbu!tz hwars bSte Fader och Man warit SQorq » re i Karlskrona, har hit » tills under sitt z bäriga Enkesiänd dragils med sin fattigdom i all lpsthet, och utan alt anropa andras hjelp, men är nu mera af älder sängliggande, swag, och lcswcr med en Femlio-ärig äfwen siuklig dotter i största uselhet, Anda till brist pä lunuls första behofwer; och sedan hennes gamla Koja sist » ledne winter ramlade bfw^r ända.	361:365	0:471	Krukomakare«Enkan här i Köpingen , Elsa Rebecka Wetzberg , född Ecbu !tz hwars bSte Fader och Man warit SQorq » re i Karlskrona , har hit » tills under sitt z bäriga Enkesiänd dragils med sin fattigdom i all lpsthet , och utan alt anropa andras hjelp , men är nu mera af älder sängliggande , swag , och lcswcr med en Femlio-ärig äfwen siuklig dotter i största uselhet , Anda till brist pä lunuls första behofwer ; och sedan hennes gamla Koja sist » ledne winter ramlade bfw^r ända .	70	0:91	$ här i köping $ elsa rebecka wetzberg $ föda ecbu $ hwars bste fader och man warit sqorq $ re i karlskrona $ ha hit $ tills under sig z bärig enkesiänd dragils med sig fattigdom i all lpsthet $ och utan alt anropa annan hjelp $ men vara nu mera af älder sängliggande $ swag $ och lcswcr med en $ äfwen siuklig dotter i stor uselhet $ anda till brist pä lunuls första behofwer $ och sedan hon gammal koja sist $ ledne winter ramla $ ända $
anda		1794	1	bib11653828_17940118_144028_14_0004_alto.xml-2-31	 	det yttersta för at minsta wär fara, sedan han dragit lil sig ätstillige Corpser och deras formerat en stark kedja, som sträcker sig ifrän Coblenz, öfwcr Worms, anda intil Maynz.	161:165	0:178	det yttersta för at minsta wär fara , sedan han dragit lil sig ätstillige Corpser och deras formerat en stark kedja , som sträcker sig ifrän Coblenz , öfwcr Worms , anda intil Maynz .	31	0:35	den yttre för at liten wär fara $ sedan han dra lil sig ätstillige corpser och de formera en stark kedja $ som sträcka sig ifrän coblenz $ öfwcr worms $ anda intil maynz $
anda		1815	1	bib11653806_18151104_145120_116_0001_alto.xml-0-17	 	Af detta efterdöme wäckt och genom frikostiga bidrag lifwad, ritbredde sig hastigt denna chri, stcliga anda öswer hela Europa: och inom kort tid bildades i alla Länder Stiftelser af femma beffaffcnhct.	103:107	0:201	Af detta efterdöme wäckt och genom frikostiga bidrag lifwad , ritbredde sig hastigt denna chri , stcliga anda öswer hela Europa : och inom kort tid bildades i alla Länder Stiftelser af femma beffaffcnhct .	17	0:35	af denna efterdöme wäckt och genom frikostig bidrag lifwad $ ritbredde sig hastig denna chri $ stcliga anda öswer hel europa $ och inom kort tid bilda i all land stiftelse af femma beffaffcnhct $
anda		1819	1	bib11653828_18190819_144028_190_0003_alto.xml-11-38	 	ruker man dä brukade vytket mi.istade oläg^nhUen af en sädrn öswersrifwcn arliah f. Dä Henric IV hade kommit wi se under en jr.qt, bad han cn bonde.itt wisa sig pä - ätta wägen och ledsaga honom anda till tet sta e, der han » Tulle träffa sitt hesfolk.	195:199	0:252	ruker man dä brukade vytket mi.istade oläg^nhUen af en sädrn öswersrifwcn arliah f. Dä Henric IV hade kommit wi se under en jr.qt , bad han cn bonde .itt wisa sig pä - ätta wägen och ledsaga honom anda till tet sta e , der han » Tulle träffa sitt hesfolk .	38	0:52	ruker man dä bruka vytket $ $ af en sädrn öswersrifwcn arliah $ dä henric iv ha komma wi se under en $ $ be han cn bonde $ wisa sig pä $ ätta wägen och ledsaga han anda till te sta e $ der han $ tulle träffa sig hesfolk $
