lemma	pos	date	grouping	identifier	description	context	indexes_target_token	indexes_target_sentence	context_tokenized	indexes_target_token_tokenized	indexes_target_sentence_tokenized	context_lemmatized
anda		1825	1	bib11653823_18250929_144010_225_0001_alto.xml-3-27	 	— Jnwänarne förhälla sig stilla och tillföra Engi ista ar-NieLn mycket lifsmedel- — Enligt öfwerensstämmande berättelser af flere officerare, stola tropparne wara lifwade af ben bästa anda, hwal-köre man hoppas kunna winna krigets ändamäl utan att behbfwa en ny expedition, (kl.	184:188	0:278	— Jnwänarne förhälla sig stilla och tillföra Engi ista ar-NieLn mycket lifsmedel- — Enligt öfwerensstämmande berättelser af flere officerare , stola tropparne wara lifwade af ben bästa anda , hwal-köre man hoppas kunna winna krigets ändamäl utan att behbfwa en ny expedition , ( kl.	27	0:45	$ jnwänarne förhälla sig stilla och tillföra engi isy $ mycket lifsmedel $ enligt öfwerensstämmande berättelse af flere officer $ stola tropp wara lifwade af ben bra anda $ $ man hoppa kunna winna krig ändamäl utan att behbfwa en ny expedition $ $ $
anda		1827	1	bib19277277_18270508_147682_106_0001_alto.xml-34-16	 	att denne ström fordom haft etc wida större djup 0 ch att stepp derpä kunnat komina anda till Kulm och Thorn.	84:88	0:109	att denne ström fordom haft etc wida större djup 0 ch att stepp derpä kunnat komina anda till Kulm och Thorn .	16	0:22	att denna ström fordom ha etc wida stor djup 0 ch att stepp derpä kunna komina anda till kulm och thorn $
anda		1820	1	bib11653828_18201117_144028_268_0004_alto.xml-11-12	 	fä mycket font möjligt denna den gamla tidens och de gamla principernas anda, svin den närwarande revolutionen blifwit werkställd, för hwars framgäng hwarje rättwifans och menstlighetens wän mäste uppsända brinnande önskningar.	72:76	0:227	fä mycket font möjligt denna den gamla tidens och de gamla principernas anda , svin den närwarande revolutionen blifwit werkställd , för hwars framgäng hwarje rättwifans och menstlighetens wän mäste uppsända brinnande önskningar .	12	0:34	fä mycket font möjlig denna den gammal tid och en gammal princip anda $ svin den närwarande revolution blifwit werkställd $ för hwars framgäng hwarje rättwifans och menstlighetens wän mäste uppsända brinna önskning $
anda		1808	1	bib11653828_18081128_144028_277_0003_alto.xml-1-19	 	derstöddes wid.infallet af ett Detachement Tiraillcurer, som commenderades af Don Vallarar de vittalla, och förföljde Fransoserne Anda till Lerin.	130:134	0:146	derstöddes wid .infallet af ett Detachement Tiraillcurer , som commenderades af Don Vallarar de vittalla , och förföljde Fransoserne Anda till Lerin .	19	0:23	derstödja wid $ af en detachement tiraillcurer $ som commenderades af don vallarar en vittalla $ och förfölja fransos anda till lerin $
anda		1829	1	bib11653828_18290126_144028_20_0002_alto.xml-2-80	 	de i ordalaget; men vi anse detta fel likväl mindre, än det falska i åsigterna, det försåtliga, snä jande eller kränkande i syftningen, och vi tro det i synnerhet vara värdigt en bildad, upplyst och frisinnad församling, att börja sitt hyllande af de liberala principerna, med något undseende lör uttryckets bristfällighet, samt förbise det ojemna, kantiga eller utsväfvande i sjelfva frasen, lör att fästa en odelad uppmärksamhet vid sjelfva andan och kärnan i { ramställningen.	443:448	0:479	de i ordalaget ; men vi anse detta fel likväl mindre , än det falska i åsigterna , det försåtliga , snä jande eller kränkande i syftningen , och vi tro det i synnerhet vara värdigt en bildad , upplyst och frisinnad församling , att börja sitt hyllande af de liberala principerna , med något undseende lör uttryckets bristfällighet , samt förbise det ojemna , kantiga eller utsväfvande i sjelfva frasen , lör att fästa en odelad uppmärksamhet vid sjelfva andan och kärnan i { ramställningen .	80	0:87	en i ordalag $ men vi anse denna fel likväl föga $ än den falsk i åsigt $ den försåtlig $ snä jande eller kränka i syftning $ och vi tro den i synnerhet vara värdig en bilda $ upplyst och frisinnad församling $ att börja sig hyllande af en liberal princip $ med någon undseende lör uttryck bristfällighet $ samt förbise den ojemn $ kantig eller utsväfvande i sjelfva fras $ lör att fästa en odelad uppmärksamhet vid sjelfva anda och kärna i $ ramställning $
anda		1817	1	bib13506739_18170809_144030_182_0008_alto.xml-12-15	 	G. Lundqwist, och widfastad en z alnars lang Mening ked och i yttre andan deraf en gul Saffians-Rem.	68:73	0:100	G . Lundqwist , och widfastad en z alnars lang Mening ked och i yttre andan deraf en gul Saffians-Rem .	15	0:21	g $ lundqwist $ och widfastad en z aln lang mening ked och i yttre anda deraf en gul $ $
anda		1811	1	bib19225792_18111116_147359_46_0002_alto.xml-0-43	 	fördelas, och dels om medel till bestridande af utzjfterne för nya Begrafningsplatsens widare beredning, enar den lid af z:ne är, under hwilka Slädens Jnwänare ätagit sig » alt till della ändamäl ärligen bidraga, med delta ärs flur löper till anda.	243:247	0:248	fördelas , och dels om medel till bestridande af utzjfterne för nya Begrafningsplatsens widare beredning , enar den lid af z:ne är , under hwilka Slädens Jnwänare ätagit sig » alt till della ändamäl ärligen bidraga , med delta ärs flur löper till anda .	43	0:45	fördela $ och dels om medel till bestrida af utzjfterne för ny begrafningsplats widare beredning $ ena den lid af $ vara $ under hwilka släde jnwänare ätagit sig $ alt till della ändamäl ärligen bidra $ med delta ärs flur löpa till anda $
anda		1793	1	bib11653828_17930831_144028_198_0001_alto.xml-1-27	 	Br0siel förmalcs, at större delen af ren förenta Armeen & gt; Flandern, och förnämligast kavalleriet, satt sig i marche för at tränga fram anda eil Paris och, om möjeiigt är, befria den olvckliga Drottningen frän fit Fängcfte och det Mordswärd som l » e&gt; me botar.	139:143	0:267	Br0siel förmalcs , at större delen af ren förenta Armeen & gt ; Flandern , och förnämligast kavalleriet , satt sig i marche för at tränga fram anda eil Paris och , om möjeiigt är , befria den olvckliga Drottningen frän fit Fängcfte och det Mordswärd som l » e&gt ; me botar .	27	0:54	br0siel förmalcs $ at stor del af ren förenta armeen $ gt $ flandern $ och förnämlig kavalleri $ sitta sig i marche för at tränga fram anda eil paris och $ om möjeiigt vara $ befria den olvckliga drottning frän fit fängcfte och den mordswärd som l $ $ $ me bota $
anda		1828	1	bib19277277_18280229_147682_51_0001_alto.xml-15-24	 	ehuru deras skötsel wärdslösas till ben grad, att de alla, sinä och stora, ständigt gä tillsammans, sä att kalfwarnc dia anda till tredje äret.	121:125	0:143	ehuru deras skötsel wärdslösas till ben grad , att de alla , sinä och stora , ständigt gä tillsammans , sä att kalfwarnc dia anda till tredje äret .	24	0:29	ehuru de skötsel wärdslösas till ben grad $ att en all $ sinä och stor $ ständig gä tillsammans $ sä att kalfwarnc dia anda till tredje äret $
anda		1815	1	bib11653828_18150607_144028_129_0002_alto.xml-16-7	 	ifrän den kusten ber han landsteg, anda in i fin Hufwudstad » hwilken nu äter, liksom alla Fransmäns hjerton, är uppchlld af wära dyrbaraste minnen.	35:39	0:148	ifrän den kusten ber han landsteg , anda in i fin Hufwudstad » hwilken nu äter , liksom alla Fransmäns hjerton , är uppchlld af wära dyrbaraste minnen .	7	0:29	ifrän den kust be han landstiga $ anda in i fin hufwudstad $ hwilken nu äta $ liksom all fransman hjerton $ vara uppchlld af wära dyrbar minne $
anda		1809	1	bib11653806_18090407_145120_42_0002_alto.xml-0-3	 	Matte den Patr-otiffa andan nu om någonsin w^ckiS, lif-vas och utbredas för der Stora, det Adla!!"	22:27	0:98	Matte den Patr-otiffa andan nu om någonsin w^ckiS , lif-vas och utbredas för der Stora , det Adla ! ! "	3	0:21	matte den $ anda nu om någonsin $ $ $ och utbre för der stor $ den adla $ $ $
anda		1895	2	bib15873936_18950622_147385_73_0002_alto.xml-77-34	 	Att unionen i likhet med do flesta andra människoverk af hög ålder kan behöfva vissa jemkningar i tidsenlig riktning, är själfklart; ty alldenstund tiderna förändra sig och människan påverkas af den tidens anda, uti hvilken hon * utvecklas, är det ju ej underligt, om unionens stiftare och deras söners söner kunnat bilda sig olika åsikter om hvarjehanda lifsförhållanden, och att således vissa delar af det statsförbund som ingicks mellan våra förfäder skulle kunna önskas modifierade eller omdanade uti en eller annan detalj, hvarmed vi som nu lefva skulle kunna finna oss mera tillfredsstälda.	206:210	0:596	Att unionen i likhet med do flesta andra människoverk af hög ålder kan behöfva vissa jemkningar i tidsenlig riktning , är själfklart ; ty alldenstund tiderna förändra sig och människan påverkas af den tidens anda , uti hvilken hon * utvecklas , är det ju ej underligt , om unionens stiftare och deras söners söner kunnat bilda sig olika åsikter om hvarjehanda lifsförhållanden , och att således vissa delar af det statsförbund som ingicks mellan våra förfäder skulle kunna önskas modifierade eller omdanade uti en eller annan detalj , hvarmed vi som nu lefva skulle kunna finna oss mera tillfredsstälda .	34	0:101	att union i likhet med do mången andra människoverk af hög ålder kunna behöfva viss jemkning i tidsenlig riktning $ vara själfklart $ ty alldenstund tid förändra sig och människa påverka af den tid anda $ uti hvilken hon $ utveckla $ vara den ju ej underlig $ om union stiftare och de son son kunna bilda sig olik åsikt om hvarjehanda lifsförhållanden $ och att således viss del af den statsförbund som ingå mellan vi förfader skola kunna önska modifiera eller omdana uti en eller annan detalj $ hvarmed vi som nu lefva skola kunna finna vi mera tillfredsstälda $
anda		1897	2	bib19227291_18970316_145289_32_0002_alto.xml-75-29	 	att riksförsamlingar i utlandet gifva förtroendevota åt ministrar, men att en dylik procedur skall tillämpas i våra enkla kommunala institutioner, är hittills okändt och föga öfverensstämmande med andan i våra kommunalförfattningar11.	197:202	0:234	att riksförsamlingar i utlandet gifva förtroendevota åt ministrar , men att en dylik procedur skall tillämpas i våra enkla kommunala institutioner , är hittills okändt och föga öfverensstämmande med andan i våra kommunalförfattningar11 .	29	0:34	att riksförsamling i utland gifva förtroendevotum åt minister $ men att en dylik procedur skola tillämpa i vi enkel kommunal institution $ vara hittills okänd och föga öfverensstämmande med anda i vi kommunalförfattningar11 $
anda		1903	2	bib11653811_19030228_145317_34_0003_alto.xml-141-18	 	landet jagas vi i dessa dagar från föredrag till föredrag, så att vi hålla på att mista andan.	88:93	0:94	landet jagas vi i dessa dagar från föredrag till föredrag , så att vi hålla på att mista andan .	18	0:20	land jaga vi i denna dag från föredrag till föredrag $ så att vi hålla på att mista anda $
anda		1898	2	bib11653811_18980314_145317_41_0002_alto.xml-93-6	 	Deb ryckte till och drog efter andan då hon mötte hans blick, hon visste ej hvarför, men dessa ögon påminde henne om något och förde henne långt bort från skolrummet.	31:36	0:166	Deb ryckte till och drog efter andan då hon mötte hans blick , hon visste ej hvarför , men dessa ögon påminde henne om något och förde henne långt bort från skolrummet .	6	0:33	deb rycka till och dra efter anda då hon möta han blick $ hon veta ej hvarför $ men denna öga påminna hon om någon och föra hon lång bort från skolrum $
anda		1895	2	bib19227462_18950329_147640_74_0002_alto.xml-100-39	 	delser kan det nu skedda blifva en lärdom för dem, som i fråga om lämpligheten af allmän rösträtt ännu kunna vara tveksamma om att låta dem stå utanför, hvilka genom sina röster kunna bidraga till att försämra andan hos en korpora tion, som är satt att utöfva det vigtiga varfvet som lagstiftare och bestämmande part i en mäDgd vigtiga ärenden.	210:215	0:344	delser kan det nu skedda blifva en lärdom för dem , som i fråga om lämpligheten af allmän rösträtt ännu kunna vara tveksamma om att låta dem stå utanför , hvilka genom sina röster kunna bidraga till att försämra andan hos en korpora tion , som är satt att utöfva det vigtiga varfvet som lagstiftare och bestämmande part i en mäDgd vigtiga ärenden .	39	0:64	delser kunna den nu ske blifva en lärdom för de $ som i fråga om lämplighet af allmän rösträtt ännu kunna vara tveksam om att låta de stå utanför $ hvilka genom sig röst kunna bidra till att försämra anda hos en korpora tion $ som vara sätta att utöfva den vigtig varfvet som lagstiftare och bestämma part i en mädgd vigtig ärende $
anda		1895	2	bib19225758_18950411_144022_85_0002_alto.xml-178-29	 	Och härtill kommer, att den s. k. parlamentarismen, hvilken John Sverdrup trodde sig hafva infört i Norge, icke ingår den norska statsförfattningens vare sig bokstaf eller anda, lika litet som i Sveriges, allra minst då Norges 8. k. parlamentarism saknar detta styrelsesystems första och väsentliga förutsättning, nämligen rättigheten för regeringen att upplösa representantförsamlingen och vädja till valmännen.	172:176	0:412	Och härtill kommer , att den s. k. parlamentarismen , hvilken John Sverdrup trodde sig hafva infört i Norge , icke ingår den norska statsförfattningens vare sig bokstaf eller anda , lika litet som i Sveriges , allra minst då Norges 8 . k. parlamentarism saknar detta styrelsesystems första och väsentliga förutsättning , nämligen rättigheten för regeringen att upplösa representantförsamlingen och vädja till valmännen .	29	0:65	och härtill komma $ att den $ $ parlamentarism $ hvilken john sverdrup tro sig hafva införa i norge $ icke ingå den norsk statsförfattning $ sig bokstaf eller anda $ lika liten som i sverige $ allra föga då norge 8 $ $ parlamentarism sakna denna styrelsesystem första och väsentlig förutsättning $ nämligen rättighet för regering att upplösa representantförsamling och vädja till valman $
anda		1896	2	bib15869824_18960715_145700_56_0002_alto.xml-78-12	 	För att Andrakammarvalen till nästa riksdagsperiod skola gå i ” folkriksdagens ” anda ha herrarna på Stockholmsbänken, storstrejkens och ” kraftåtgärdernas ” målsmän Jonathan Olsson, David Bergström och Julius Mankell, jemte en klick liksinnade landsortsriksdagsmän hittat på att inom Andra kammaren plantera en telning af ” folkriksdagen ”.	81:85	0:341	För att Andrakammarvalen till nästa riksdagsperiod skola gå i ” folkriksdagens ” anda ha herrarna på Stockholmsbänken , storstrejkens och ” kraftåtgärdernas ” målsmän Jonathan Olsson , David Bergström och Julius Mankell , jemte en klick liksinnade landsortsriksdagsmän hittat på att inom Andra kammaren plantera en telning af ” folkriksdagen ” .	12	0:52	för att andrakammarval till nästa riksdagsperiod skola gå i $ folkriksdag $ anda ha herre på stockholmsbänken $ storstrejk och $ kraftåtgärd $ målsman jonathan olsson $ david bergström och julius mankell $ jemte en klick liksinnad landsortsriksdagsman hitta på att inom andra kammare plantera en telning af $ folkriksdag $ $
anda		1895	2	bib15760600_18950620_146401_73_0004_alto.xml-95-99	 	Baron von Mobrenheim, som vid sin ankomst helsades med militära hederabetygel ser, yttrade vid öfverlämnandet af ordensiu sign jerna:" I tsarens, min höge herakares namn har jag härmed ämn att till eders excellens öfverlämna insignierna till kejser liga Andras-orden, hvilka hans majestät ber eder mottaga som ett bevis på hans högs vänskap samt ber eder i dem se en ny un derpant på de känslor, af hvilka hans majestät alltjämt är besjälad gent emot Frankrike och dess ärade öfverhufvud, sorn på del värdigaste sätt förkroppsligar den ädla karakteren och den fredliga andan hos deri stora nation, hvilken beklädt eder med sitt högsta ämbete.	569:574	0:642	Baron von Mobrenheim , som vid sin ankomst helsades med militära hederabetygel ser , yttrade vid öfverlämnandet af ordensiu sign jerna : " I tsarens , min höge herakares namn har jag härmed ämn att till eders excellens öfverlämna insignierna till kejser liga Andras-orden , hvilka hans majestät ber eder mottaga som ett bevis på hans högs vänskap samt ber eder i dem se en ny un derpant på de känslor , af hvilka hans majestät alltjämt är besjälad gent emot Frankrike och dess ärade öfverhufvud , sorn på del värdigaste sätt förkroppsligar den ädla karakteren och den fredliga andan hos deri stora nation , hvilken beklädt eder med sitt högsta ämbete .	99	0:113	baron von mobrenheim $ som vid sig ankomst helsades med militär hederabetygel se $ yttra vid öfverlämnande af ordensiu sign jerna $ $ i tsar $ jag hög herakares namn ha jag härmed ämn att till ed excellens öfverlämna insignier till kejser liga $ $ hvilka han majestät be ni motta som en bevis på han hög vänskap samt be ni i de se en ny un derpant på en känsla $ af hvilka han majestät alltjämt vara besjälad gen emot frankrike och den ära öfverhufvud $ sorn på del värdig sätt förkroppsliga den ädel karakter och den fredlig anda hos deri stor nation $ hvilken beklädt ni med sig hög ämbete $
anda		1895	2	bib19225758_18950805_144022_179_0001_alto.xml-39-9	 	liberalt öfvertag, som en sådan utjämning i liberal anda af de båda partiernas politiska och särskildt socialpolitiska trossatser, som man under närvarande valkampanj iakttagit, öfver hufvud kunnat bli möjlig.	52:56	0:209	liberalt öfvertag , som en sådan utjämning i liberal anda af de båda partiernas politiska och särskildt socialpolitiska trossatser , som man under närvarande valkampanj iakttagit , öfver hufvud kunnat bli möjlig .	9	0:33	liberal öfvertag $ som en sån utjämning i liberal anda af en båda parti politisk och särskildt socialpolitisk trossats $ som man under närvara valkampanj iaktta $ öfver hufvud kunna bli möjlig $
anda		1896	2	bib19277301_18961205_145146_101_0003_alto.xml-39-16	 	Jnwigningstalet anflöt sig till Kristi ord till sammaritanfla qwinnan om det rätta gudstjenstfirandet och tillbedjandet i anda och sanning, börjande:" Gud är en ande och de, som tillbedja honom, böra tillbedja i anda och sanning."	122:126	0:230	Jnwigningstalet anflöt sig till Kristi ord till sammaritanfla qwinnan om det rätta gudstjenstfirandet och tillbedjandet i anda och sanning , börjande : " Gud är en ande och de , som tillbedja honom , böra tillbedja i anda och sanning . "	16	0:42	jnwigningstalet anflöt sig till kristi ord till sammaritanfla qwinnan om den rätt gudstjenstfirandet och tillbedjande i anda och sanning $ börja $ $ gud vara en ande och de $ som tillbe han $ böra tillbe i anda och sanning $ $
anda		1896	2	bib15873936_18960808_147385_91_0003_alto.xml-148-54	 	starka vinden var det emellertid ej godt att manövrera båten, hvarför en 30 — 40 vändningar fingo göras, allt under det att alla möjliga och omöjliga saker — rorkulting, åror m. m. smått och godt som fanns i båten — med verkligt dödsförakt användes af våra svettdrypande och efter andan flåsande jägare såsom projektiler på den stackars anden, som dök och dök och som med så lugn resignation som situationen kräfde tog del af händelsernas utveckling.	281:286	0:450	starka vinden var det emellertid ej godt att manövrera båten , hvarför en 30 — 40 vändningar fingo göras , allt under det att alla möjliga och omöjliga saker — rorkulting , åror m . m . smått och godt som fanns i båten — med verkligt dödsförakt användes af våra svettdrypande och efter andan flåsande jägare såsom projektiler på den stackars anden , som dök och dök och som med så lugn resignation som situationen kräfde tog del af händelsernas utveckling .	54	0:83	stark vind vara den emellertid ej god att manövrera båt $ hvarför en 30 $ 40 vändning fingo göra $ all under den att all möjlig och omöjlig sak $ rorkulting $ åra m $ m $ smått och god som finna i båt $ med verklig dödsförakt använda af vi svettdrypande och efter anda flåsa jägare såsom projektil på den stackars and $ som dyka och dyka och som med så lugn resignation som situation kräfva ta del af händelse utveckling $
anda		1901	2	bib11653811_19011018_145317_161_0003_alto.xml-35-13	 	Mången tycker nog att denna min krönika är skrifven i alldeles för allvarlig anda.	77:81	0:82	Mången tycker nog att denna min krönika är skrifven i alldeles för allvarlig anda .	13	0:15	mången tycka nog att denna jag krönika vara skrifven i alldeles för allvarlig anda $
anda		1895	2	bib19227291_18950430_145289_51_0003_alto.xml-125-1	 	ska andan är fulldöd, och evangeliet å nyo kan * tagas örn hand af uåg & gt; t slags romerska själasörjare, samvelsbindare ocb samvetslösare.	4:9	0:141	ska andan är fulldöd , och evangeliet å nyo kan * tagas örn hand af uåg & gt ; t slags romerska själasörjare , samvelsbindare ocb samvetslösare .	1	0:28	skola anda vara fulldöd $ och evangelium å nyo kunna $ ta örn hand af uåg $ gt $ t slag romersk själasörjare $ samvelsbindare ocb samvetslös $
anda		1895	2	bib15650837_18951213_146391_291_0004_alto.xml-64-20	 	Härmed erbjnds3 låsaren en illustrerad familjebok al idleste och bästa slag, helt visst på grund af sin sedliga sorn anda, sin gripande framstållniogskoBst och sitt höga ämne skall blifva en kärkommen gåfva för lärda och olärda, höga ccb låga.	117:121	0:243	Härmed erbjnds3 låsaren en illustrerad familjebok al idleste och bästa slag , helt visst på grund af sin sedliga sorn anda , sin gripande framstållniogskoBst och sitt höga ämne skall blifva en kärkommen gåfva för lärda och olärda , höga ccb låga .	20	0:43	härmed erbjnds3 låsar en illustrera familjebok al idleste och bra slag $ hel viss på grund af sig sedlig sorn anda $ sig gripa framstållniogskobst och sig hög ämne skola blifva en kärkommen gåfva för lära och olärd $ hög ccb låg $
anda		1900	2	bib11653811_19000328_145317_48_0003_alto.xml-214-6	 	Men när Lotta slutligen måste draga andan åt sig, sprang Jonas till sina kläder och snodde rätt på en butelj i fickan och höll den bra länge för munnen.	36:41	0:152	Men när Lotta slutligen måste draga andan åt sig , sprang Jonas till sina kläder och snodde rätt på en butelj i fickan och höll den bra länge för munnen .	6	0:31	men när lotta slutligen måste dra anda åt sig $ springa jonas till sig kläder och sno rätt på en butelj i ficka och hålla den bra länge för mun $
anda		1895	2	bib15760600_18950112_146401_5_0001_alto.xml-9-15	 	vill, fortfarande som hittills, verka för det beståendes utveckling i nationel och kristlig anda, vill icke motsätta sig det nya derföre att det är nytt, men ej heller kassera det gamla derföre att det är gammalt, utan i hvarje föreliggande fall pröfva, först och främst örn det föreslagna nya verkligen innebär en förbättring och icke allenast är ett af en modern nyhetsäflan framkalladt löst hugskott, samt vidare örn det föreslagna nya derjämte är lämpligt för våra förhållanden och passar in i vår historiska utveckling.	92:96	0:524	vill , fortfarande som hittills , verka för det beståendes utveckling i nationel och kristlig anda , vill icke motsätta sig det nya derföre att det är nytt , men ej heller kassera det gamla derföre att det är gammalt , utan i hvarje föreliggande fall pröfva , först och främst örn det föreslagna nya verkligen innebär en förbättring och icke allenast är ett af en modern nyhetsäflan framkalladt löst hugskott , samt vidare örn det föreslagna nya derjämte är lämpligt för våra förhållanden och passar in i vår historiska utveckling .	15	0:92	vilja $ fortfarande som hittills $ verka för den bestående utveckling i nationel och kristlig anda $ vilja icke motsätta sig den ny derföre att den vara ny $ men ej heller kassera den gammal derföre att den vara gammal $ utan i hvarje föreligga fall pröfva $ först och främst örn den föreslå ny verkligen innebära en förbättring och icke allenast vara ett af en modern nyhetsäflan framkalladt lös hugskott $ samt vid örn den föreslå ny derjämte vara lämplig för vi förhållande och passa in i vi historisk utveckling $
anda		1900	2	bib11653838_19001207_147024_49_0003_alto.xml-16-20	 	ungefär en timme och kippade efter andan i hvarje ögonblick, tills han plötsligen själf begynte djupt och kraftigt draga andan utan minsta hjälp.	121:126	0:145	ungefär en timme och kippade efter andan i hvarje ögonblick , tills han plötsligen själf begynte djupt och kraftigt draga andan utan minsta hjälp .	20	0:25	ungefär en timme och kippa $ anda i hvarje ögonblick $ tills han plötsligen själf begynna djup och kraftig dra anda utan liten hjälp $
