lemma	pos	date	grouping	identifier	description	context	indexes_target_token	indexes_target_sentence	context_tokenized	indexes_target_token_tokenized	indexes_target_sentence_tokenized	context_lemmatized
anda		1895	2	bib19227462_18951206_147640_285_0002_alto.xml-186-91	 	Lika litet later det förneka sig, att det är ett nytt bevis på det ständigt fortsätta, tillmötesgående Sverige i unionella frågor alltid ådagalagt, att konungen sett sig i stånd att på svenska regeringens tillstyrkan bi lil: t å., u a unionskomité, ty kraf ven på ändrade unionsbestämmelser hafva, som bekant, först utgått från Norge, oeh flir Sverige hade fördelen ej förbjudit det, hvartill rätten gifvit kraft: ett fasthållande vid status quo och en fortsatt tillämpning af unionsbestämmelserna i den anda, för hvilken de vid sitt uppgörande af båda folken ansågos vara uttryck, och på det sätt, hvartill snart ett sekels praxis ytterligare skänkt äfven käfdens berättigande.	504:508	0:678	Lika litet later det förneka sig , att det är ett nytt bevis på det ständigt fortsätta , tillmötesgående Sverige i unionella frågor alltid ådagalagt , att konungen sett sig i stånd att på svenska regeringens tillstyrkan bi lil : t å . , u a unionskomité , ty kraf ven på ändrade unionsbestämmelser hafva , som bekant , först utgått från Norge , oeh flir Sverige hade fördelen ej förbjudit det , hvartill rätten gifvit kraft : ett fasthållande vid status quo och en fortsatt tillämpning af unionsbestämmelserna i den anda , för hvilken de vid sitt uppgörande af båda folken ansågos vara uttryck , och på det sätt , hvartill snart ett sekels praxis ytterligare skänkt äfven käfdens berättigande .	91	0:122	lika liten later den förneka sig $ att den vara en ny bevis på den ständig fortsätta $ tillmötesgå sverige i unionell fråga alltid ådagalägga $ att konung se sig i stånd att på svensk regering tillstyrkan bi lil $ t å $ $ u a unionskomité $ ty kraf vina på ändra unionsbestämmelser hafva $ som bekant $ först utgå från norge $ oeh flir sverige ha fördel ej förbjuda den $ hvartill rätt gifvit kraft $ en fasthållande vid status $ och en fortsätta tillämpning af unionsbestämmelserna i den anda $ för hvilken de vid sig uppgöra af båda folk ansågos vara uttryck $ och på den sätt $ hvartill snar en sekel praxis ytterlig skänka äfven käfdens berättigande $
anda		1895	2	bib15873371_18950314_145112_72_0003_alto.xml-19-21	 	och det framhafves, att kristendomen och kyrkan skall verka på samhället icke genom våldsamma medel, utan ge nom den anda, som den låter intränga i menniskornas bjertan, genom offervillighetens, sjelfbeherskningens och sjelfförsakelsens anda.	117:121	0:242	och det framhafves , att kristendomen och kyrkan skall verka på samhället icke genom våldsamma medel , utan ge nom den anda , som den låter intränga i menniskornas bjertan , genom offervillighetens , sjelfbeherskningens och sjelfförsakelsens anda .	21	0:39	och den framhafva $ att kristendom och kyrka skola verka på samhälle icke genom våldsam medel $ utan ge nom den anda $ som den låta intränga i menniska bjertan $ genom offervillighet $ sjelfbeherskningens och sjelfförsakelse anda $
anda		1895	2	bib15873936_18951008_147385_118_0002_alto.xml-133-7	 	— Ett talrikt besökt möte i Hopar anda Ilar enhälligt uttalat sig för nödvändigheten af en skyndsam och fullständig revision af de unionella bestämmelserna.	34:38	0:156	— Ett talrikt besökt möte i Hopar anda Ilar enhälligt uttalat sig för nödvändigheten af en skyndsam och fullständig revision af de unionella bestämmelserna .	7	0:25	$ en talrik besöka möte i hop anda ila enhällig uttala sig för nödvändighet af en skyndsam och fullständig revision af en unionell bestämmelse $
anda		1895	2	bib11653790_18950215_145648_8_0001_alto.xml-4-18	 	Tidningen kommer att innehålla: Artiklar, i fosterländsk och samhällsbevarande, men på samma gång praktiskt reformvänlig anda.	121:125	0:126	Tidningen kommer att innehålla : Artiklar , i fosterländsk och samhällsbevarande , men på samma gång praktiskt reformvänlig anda .	18	0:20	tidning komma att innehålla $ artikel $ i fosterländsk och samhällsbevarande $ men på samma gång praktisk reformvänlig anda $
anda		1902	2	bib11653838_19020110_147024_2_0002_alto.xml-44-1	 	följ anda intressanta meddelanden: Örn Sveriges försvarskrafter handlade ett föredrag, tom den 17 December hölls i ryska officeraklubben i Helsingfors af öiverstetöjtnanten vid generalstaben Schnoff och som refereras i Bobrikoffs tidning.	5:9	0:238	följ anda intressanta meddelanden : Örn Sveriges försvarskrafter handlade ett föredrag , tom den 17 December hölls i ryska officeraklubben i Helsingfors af öiverstetöjtnanten vid generalstaben Schnoff och som refereras i Bobrikoffs tidning .	1	0:34	följa anda intressant meddelande $ örn sverige försvarskraft handla en föredrag $ tom den 17 december hålla i rysk officeraklubben i helsingfors af öiverstetöjtnanten vid generalstab schnoff och som referera i bobrikoffs tidning $
anda		1895	2	bib15760600_18950831_146401_103_0005_alto.xml-67-9	 	testamentet, som lärer oss att tillbedja Gud i anda och sanning, med hjärtats tro, verksam i kärleken?	47:51	0:102	testamentet , som lärer oss att tillbedja Gud i anda och sanning , med hjärtats tro , verksam i kärleken ?	9	0:21	testamente $ som lärer vi att tillbe gud i anda och sanning $ med hjärta tro $ verksam i kärlek $
anda		1895	2	bib19227462_18950308_147640_57_0002_alto.xml-87-4	 	ett uttryck af den anda, som besjälar officerarne vid de beridna vapenslagen inom armén, samt ett prof på uthållighet latset, ocb skicklighet i fältmessig ridning.	19:23	0:163	ett uttryck af den anda , som besjälar officerarne vid de beridna vapenslagen inom armén , samt ett prof på uthållighet latset , ocb skicklighet i fältmessig ridning .	4	0:29	en uttryck af den anda $ som besjäla officerarne vid en beriden vapenslag inom armé $ samt en prof på uthållighet latset $ ocb skicklighet i fältmessig ridning $
anda		1895	2	bib15650835_18950604_146472_48_0003_alto.xml-216-10	 	han befinner sig på hemmets mark, vågade han draga andan.	51:56	0:57	han befinner sig på hemmets mark , vågade han draga andan .	10	0:12	han befinna sig på hem mark $ våga han dra anda $
anda		1897	2	bib11653790_18970409_145648_28_0003_alto.xml-125-11	 	härtill äro, att soldaterna befinna sig i utmärkt kondition, andan i de olika kårerna är förträfflig, lifsmedel och ammunition finnas i stor mängd, ställningarna äro äfven af naturen starkt befästa, så att en fiende kommer att få stora svä righeter att komma upp till dem, ännu mindre att gå förbi dem.	61:66	0:302	härtill äro , att soldaterna befinna sig i utmärkt kondition , andan i de olika kårerna är förträfflig , lifsmedel och ammunition finnas i stor mängd , ställningarna äro äfven af naturen starkt befästa , så att en fiende kommer att få stora svä righeter att komma upp till dem , ännu mindre att gå förbi dem .	11	0:58	härtill äro $ att soldat befinna sig i utmärka kondition $ anda i en olik kår vara förträfflig $ lifsmedel och ammunition finna i stor mängd $ ställning äro äfven af natur stark befästa $ så att en fiende komma att få stor svä righeter att komma upp till de $ ännu liten att gå förbi de $
anda		1903	2	bib11653838_19031016_147024_42_0001_alto.xml-51-36	 	frivilliga skytteväsendet har sålunda väl fylle sitt ena hufvudäudamål: att befrämja skjutskickligheten bland svenska folket, och det har icke brustit i fullgörandet af sin andra hufvuduppgift: att utveckla och höja svenska folkets fosterländska anda samt väcka och underhålla ett lefvande intresse för fäderneslandets försvar.	246:250	0:327	frivilliga skytteväsendet har sålunda väl fylle sitt ena hufvudäudamål : att befrämja skjutskickligheten bland svenska folket , och det har icke brustit i fullgörandet af sin andra hufvuduppgift : att utveckla och höja svenska folkets fosterländska anda samt väcka och underhålla ett lefvande intresse för fäderneslandets försvar .	36	0:48	frivillig skytteväsende ha sålunda väl fylla sig ena hufvudäudamål $ att befrämja skjutskicklighet bland svensk folk $ och den ha icke brista i fullgörande af sig andra hufvuduppgift $ att utveckla och höja svensk folk fosterländsk anda samt väcka och underhålla en lefvande intresse för fädernesland försvar $
anda		1901	2	bib11653811_19011030_145317_168_0004_alto.xml-102-77	 	» Undertecknade lärare vid Upsala universitet vilja härmed gifva uttryck åt vår glädje och tillfredsställelse öfver att den man, som af universiteten kårats till den högste målsmannen för deras intressen, visat sig vid ett tillfälle, då den vetenskapliga forskningens frihet angripits, tolka universitetsstatuternas stadgande rörande laga befordringsgrunder på samma sätt, som vi professorer under en mer eller mindre långvarig tids handläggning af akademiska befordringsfrågor funnit vara det af statuternas både bokstaf och anda fordrade, och som vi alla lärare af ena eller andra slaget äro lifligt och fast öfvertygade om vara etet enda för den vetenskapliga forskningens frihet fullt betryghande. »	526:530	0:703	» Undertecknade lärare vid Upsala universitet vilja härmed gifva uttryck åt vår glädje och tillfredsställelse öfver att den man , som af universiteten kårats till den högste målsmannen för deras intressen , visat sig vid ett tillfälle , då den vetenskapliga forskningens frihet angripits , tolka universitetsstatuternas stadgande rörande laga befordringsgrunder på samma sätt , som vi professorer under en mer eller mindre långvarig tids handläggning af akademiska befordringsfrågor funnit vara det af statuternas både bokstaf och anda fordrade , och som vi alla lärare af ena eller andra slaget äro lifligt och fast öfvertygade om vara etet enda för den vetenskapliga forskningens frihet fullt betryghande . »	77	0:108	$ underteckna lärare vid upsala universitet vilja härmed gifva uttryck åt vi glädje och tillfredsställelse öfver att den man $ som af universitet kåra till den hög målsman för de intresse $ visa sig vid en tillfälle $ då den vetenskaplig forskning frihet angripa $ tolka universitetsstatuternas stadgande rörande laga befordringsgrund på samma sätt $ som vi professor under en mer eller föga långvarig tid handläggning af akademisk befordringsfråga finna vara den af statut både bokstaf och anda fordra $ och som vi all lärare af ena eller andra slag äro liflig och fast öfvertyga om vara etet enda för den vetenskaplig forskning frihet full betryghande $ $
anda		1896	2	bib15975090_18960307_148377_30_0003_alto.xml-112-49	 	— Dä ’ va ’ klokt tänkt af far dinl Nu får Tilda ta Sven i Störjamålen och bo här, och så flöttar ja ’ te ’ ertl lät hon och klappade pojken på kinderna och kramade honom örn halsen, så den stackarn knappt kunde få fram andan.	220:225	0:226	— Dä ’ va ’ klokt tänkt af far dinl Nu får Tilda ta Sven i Störjamålen och bo här , och så flöttar ja ’ te ’ ertl lät hon och klappade pojken på kinderna och kramade honom örn halsen , så den stackarn knappt kunde få fram andan .	49	0:51	$ dä $ va $ klok tänka af far dinl nu få tilda ta sven i störjamålen och bo här $ och så flöttar ja $ te $ ertl låta hon och klappa pojke på kind och krama han örn hals $ så den stackarn knapp kunna få fram anda $
anda		1895	2	bib11653811_18950202_145317_19_0003_alto.xml-7-36	 	" kautschukparagraferna" i vmstörtningSlagsörflaget, angäende straff för den, som uppmanar till wissa bestämda förbrytelser och öfwerträdelsir eller förklarar dem lofwärda, antogs centermedlemmarne i kommissionen den frän nationalliberalt häll i re » geringswänlig anda söreflagna redaktionen, enligt hwilken straff bör tillämpas, om oswannämnda framställningar äro egnade att uppegga till efterföljd.	265:269	0:401	" kautschukparagraferna " i vmstörtningSlagsörflaget , angäende straff för den , som uppmanar till wissa bestämda förbrytelser och öfwerträdelsir eller förklarar dem lofwärda , antogs centermedlemmarne i kommissionen den frän nationalliberalt häll i re » geringswänlig anda söreflagna redaktionen , enligt hwilken straff bör tillämpas , om oswannämnda framställningar äro egnade att uppegga till efterföljd .	36	0:56	$ kautschukparagraf $ i vmstörtningslagsörflaget $ angäende straff för den $ som uppmana till wissa bestämd förbrytelse och öfwerträdelsir eller förklara de lofwärda $ anta centermedlemmarne i kommission den frän nationalliberal häll i re $ geringswänlig anda söreflagna redaktion $ enligt hwilken straff böra tillämpa $ om oswannämnda framställan äro egna att uppegga till efterföljd $
anda		1895	2	bib19277277_18950809_147683_214_0002_alto.xml-15-62	 	Ur kanslirådet Kastmans förord: » — öfvertygade » om vi äro, att detta arbete ■kall blifva till verkligt gagn för alla, som ägna » ig åt lärarekallet, och särskildt för varande och blifvande lärare och lärarinnor vid folkskolan, anse vi oss kunna med fällt skäl förorda det 6åväl för dess gedigna innehåll sorn för den varmt kristliga anda, soia genomgår detsamma. »	335:339	0:366	Ur kanslirådet Kastmans förord : » — öfvertygade » om vi äro , att detta arbete ■kall blifva till verkligt gagn för alla , som ägna » ig åt lärarekallet , och särskildt för varande och blifvande lärare och lärarinnor vid folkskolan , anse vi oss kunna med fällt skäl förorda det 6åväl för dess gedigna innehåll sorn för den varmt kristliga anda , soia genomgår detsamma . »	62	0:69	ur kansliråd kastman förord $ $ $ öfvertyga $ om vi äro $ att denna arbete $ blifva till verklig gagn för all $ som ägna $ ig åt lärarekall $ och särskildt för vara och blifvande lärare och lärarinna vid folkskola $ anse vi vi kunna med fälla skäl förorda den 6åväl för den gedigen innehåll sorn för den varm kristlig anda $ soia genomgå densamma $ $
anda		1896	2	bib15975090_18960818_148377_102_0002_alto.xml-65-48	 	ordet af hr Waldau, hvilken, efter att hafva redogjort för förhållandena inom valdistriktet beträffande valet, särskildt påpekade, med anledning af att många kandidater ur skilda läger blifvit ifrågasatta, nödvändigheten af enighet och att till kandidat utsåges en person, som arbetade i samma anda som afgångne riksdagsmannen August Petersson i Hasselstad, hvilken såväl offentligen som enskildt afsagt sig återval, och ville han derför såsom kandidat till riksdagsman för mötet föreslå godsegaren L.	294:298	0:501	ordet af hr Waldau , hvilken , efter att hafva redogjort för förhållandena inom valdistriktet beträffande valet , särskildt påpekade , med anledning af att många kandidater ur skilda läger blifvit ifrågasatta , nödvändigheten af enighet och att till kandidat utsåges en person , som arbetade i samma anda som afgångne riksdagsmannen August Petersson i Hasselstad , hvilken såväl offentligen som enskildt afsagt sig återval , och ville han derför såsom kandidat till riksdagsman för mötet föreslå godsegaren L .	48	0:80	ord af hr waldau $ hvilken $ efter att hafva redogöra för förhållande inom valdistrikt beträffande val $ särskildt påpeka $ med anledning af att många kandidat ur skild läger blifvit ifrågasätta $ nödvändighet af enighet och att till kandidat utse en person $ som arbeta i samma anda som afgångne riksdagsman august petersson i hasselstad $ hvilken $ offentligen som enskildt afsäga sig återval $ och vilja han derför såsom kandidat till riksdagsman för möte föreslå godsegaren l $
anda		1901	2	bib11653838_19010809_147024_32_0001_alto.xml-31-45	 	styrka, och örn man nu frågar, hvilken åtgärd från deras sida, som representera den konservativa åskådningen, är den mest önskvärda och behöfliga, tror jag det vara, att äfven dessa samla sig kring ett bestämdt program. ” I samma anda uttalade sig generaldirektören Wieselgren.	230:234	0:277	styrka , och örn man nu frågar , hvilken åtgärd från deras sida , som representera den konservativa åskådningen , är den mest önskvärda och behöfliga , tror jag det vara , att äfven dessa samla sig kring ett bestämdt program . ” I samma anda uttalade sig generaldirektören Wieselgren .	45	0:51	styrka $ och örn man nu fråga $ hvilken åtgärd från de sida $ som representera den konservativ åskådning $ vara den mycket önskvärd och behöflig $ tro jag den vara $ att äfven denna samla sig kring en bestämdt program $ $ i samma anda uttala sig generaldirektör wieselgren $
anda		1895	2	bib19227291_18951109_145289_134_0002_alto.xml-93-8	 	i lefnadsteckningar, poem och uppsatser i religiös anda, prydes af 10 planscher.	51:55	0:80	i lefnadsteckningar , poem och uppsatser i religiös anda , prydes af 10 planscher .	8	0:15	i lefnadsteckningar $ poem och uppsats i religiös anda $ pryda af 10 plansch $
anda		1895	2	bib15975090_18950730_148377_89_0004_alto.xml-24-12	 	Det lär vara skolläraren och riksdagsmannen Fridtjuv Berg, sorn ingjutit sin anda i mötesbestyrelsen.	77:81	0:101	Det lär vara skolläraren och riksdagsmannen Fridtjuv Berg , sorn ingjutit sin anda i mötesbestyrelsen .	12	0:16	den lär vara skollärare och riksdagsman fridtjuv berg $ sorn ingjuta sig anda i mötesbestyrelsen $
anda		1895	2	bib11653830_18950911_146968_104_0003_alto.xml-79-36	 	Han satt och drömde om Geneviéve; hon insmög sig ständigt i alla hans tankar; liksom doften af en blomma, som vi fästat i knapphålet blandar sig med vår andedrägt, när vi draga andan.	177:182	0:183	Han satt och drömde om Geneviéve ; hon insmög sig ständigt i alla hans tankar ; liksom doften af en blomma , som vi fästat i knapphålet blandar sig med vår andedrägt , när vi draga andan .	36	0:38	han sitta och drömma om geneviéve $ hon insmyga sig ständig i all han tank $ liksom doft af en blomma $ som vi fästad i knapphål blanda sig med vi andedrägt $ när vi dra anda $
anda		1903	2	bib11653811_19030523_145317_79_0002_alto.xml-181-10	 	framhåller, att det var den » i äkta lutherska anda för evaDgelisk-luthersb gudstjänst komponerade » passionsmu siken, Lukas passionen af den på 1600talet lefvande tyske tonsättaren Hein¬	47:51	0:187	framhåller , att det var den » i äkta lutherska anda för evaDgelisk-luthersb gudstjänst komponerade » passionsmu siken , Lukas passionen af den på 1600talet lefvande tyske tonsättaren Hein¬	10	0:29	framhålla $ att den vara den $ i äkta luthersk anda för $ gudstjänst komponera $ passionsmu sik $ lukas passion af den på 1600talet lefvande tysk tonsättare $
anda		1900	2	bib11653811_19000526_145317_80_0002_alto.xml-90-23	 	tro, att Englands sympati för Förenta staterna under spanska kriget nu icke skulle återgäldas, Äfven oppositionens chef Rosebury telegraferade i samma anda.	151:155	0:156	tro , att Englands sympati för Förenta staterna under spanska kriget nu icke skulle återgäldas , Äfven oppositionens chef Rosebury telegraferade i samma anda .	23	0:25	tro $ att england sympati för $ stat under spansk krig nu icke skola återgälda $ äfven opposition chef rosebury telegrafera i samma anda $
anda		1895	2	bib19277277_18950524_147683_139_0006_alto.xml-34-70	 	ffiy * Kanslirådet Knstman afslntar sitt förord för detta arbete mod följande ord: » Öfvertyg.iclc som vi Uro att nä ilin (Ia arboto skall blifva till verkligt gagn för alla, som egna sig åt lUrarekailet och särskildt för varande och blifvande lärare och lärarinnor vid folkskolan, anse vi oss kunna nied fullt skäl förorda det så viii för dess gedigna innehåll som för den varmt kristliga anda, sorn genomgår det sannnn. »	390:394	0:423	ffiy * Kanslirådet Knstman afslntar sitt förord för detta arbete mod följande ord : » Öfvertyg.iclc som vi Uro att nä ilin ( Ia arboto skall blifva till verkligt gagn för alla , som egna sig åt lUrarekailet och särskildt för varande och blifvande lärare och lärarinnor vid folkskolan , anse vi oss kunna nied fullt skäl förorda det så viii för dess gedigna innehåll som för den varmt kristliga anda , sorn genomgår det sannnn . »	70	0:78	ffiy $ kansliråd knstman afslntar sig förord för denna arbete mod följa ord $ $ $ som vi uro att nä ili $ ia arboto skola blifva till verklig gagn för all $ som egen sig åt lurarekailet och särskildt för vara och blifvande lärare och lärarinna vid folkskola $ anse vi vi kunna nied full skäl förorda den så viii för den gedigen innehåll som för den varm kristlig anda $ sorn genomgå den sannnn $ $
anda		1895	2	bib15761570_18951224_146176_212_0022_alto.xml-124-26	 	För dagen må endast anföras ett“ on dit *, som visar, om ingenting annat, så åtminstone hur man rätt allmänt uppfattat den anda, som besjälat de ledande inom 1893 års järnvägskomité.	123:127	0:182	För dagen må endast anföras ett “ on dit * , som visar , om ingenting annat , så åtminstone hur man rätt allmänt uppfattat den anda , som besjälat de ledande inom 1893 års järnvägskomité .	26	0:37	för dag må endast anföra en $ $ dit $ $ som visa $ om ingenting annan $ så åtminstone hur man rätt allmän uppfatta den anda $ som besjäla en leda inom 1893 år järnvägs $
anda		1895	2	bib15761570_18950612_146176_97_0002_alto.xml-62-23	 	väl dock hufvudsaken, ty örn en annan, icke prästerlig person skulle komma ‘ olycka * är det förvisso säkert att dessa andans män ej skulle röra ett lillfinger för att rädda.	119:125	0:174	väl dock hufvudsaken , ty örn en annan , icke prästerlig person skulle komma ‘ olycka * är det förvisso säkert att dessa andans män ej skulle röra ett lillfinger för att rädda .	23	0:34	väl dock hufvudsak $ ty örn en annan $ icke prästerlig person skola komma $ olycka $ vara den förvisso säker att denna anda man ej skola röra en lillfinger för att rädda $
anda		1897	2	bib19227291_18970610_145289_69_0002_alto.xml-98-52	 	O. D., det berömda Lpsalasällskapet, serenad för de närvarande och lät deni dervid höra Lange-Mullers berömda qvartett“ Kornmodsglansen ved Midnatstid.“ natstid.“ Pauserna mellan de olika sångerna och talen utfylldes med sällskapligt samspråk och umgänge: det utbredde sig öfver hela sällskapet en gemytlig och behaglig anda, som tillät samtlige både herrar och damer att njuta af supén i matsalen utan att låta sig allt	320:324	0:420	O. D. , det berömda Lpsalasällskapet , serenad för de närvarande och lät deni dervid höra Lange-Mullers berömda qvartett “ Kornmodsglansen ved Midnatstid . “ natstid . “ Pauserna mellan de olika sångerna och talen utfylldes med sällskapligt samspråk och umgänge : det utbredde sig öfver hela sällskapet en gemytlig och behaglig anda , som tillät samtlige både herrar och damer att njuta af supén i matsalen utan att låta sig allt	52	0:72	$ $ $ den berömd lpsalasällskapet $ serenad för en närvarande och låta deni dervid höra $ berömd qvartett $ kornmodsglansen ved midnatstid $ $ natstid $ $ paus mellan en olik sång och tal utfylla med sällskaplig samspråk och umgänge $ den utbre sig öfver hel sällskap en gemytlig och behaglig anda $ som tillåta samtlig både herre och dam att njuta af supé i matsal utan att låta sig allt
anda		1895	2	bib15760690_18950202_145050_19_0001_alto.xml-67-6	 	Uti dina händer befaller jag min anda; du häfver mig förlöst Herre, du trofaste Gud.	33:37	0:84	Uti dina händer befaller jag min anda ; du häfver mig förlöst Herre , du trofaste Gud .	6	0:18	uti du hand befalla jag jag anda $ du häfva jag förlösa herre $ du trofast gud $
anda		1895	2	bib19225758_18950824_144022_196_0006_alto.xml-15-2	 	I denna anda talade jag också nu, men ' här mötte mig en öfverraskning.	8:12	0:71	I denna anda talade jag också nu , men ' här mötte mig en öfverraskning .	2	0:16	i denna anda tala jag också nu $ men $ här möta jag en öfverraskning $
anda		1895	2	bib15650837_18950726_146391_171_0003_alto.xml-6-56	 	Kilanda församlings småskola Hilda Charlotta Hansson hade hos justitieombudsmannen anmält skolrådets ordförande kyrkoherden L. Hegardt för det denne till ett för henne af skolrådet ntfär dadt, synnerligen bedrande och berömmande af skedsbetyg fogat en g. k. reservation, i hvilken han beskylde klaganden för att hafva bediifvit ■in lärarinoeverksambct i snedvriden, separatistisk anda.	380:384	0:385	Kilanda församlings småskola Hilda Charlotta Hansson hade hos justitieombudsmannen anmält skolrådets ordförande kyrkoherden L . Hegardt för det denne till ett för henne af skolrådet ntfär dadt , synnerligen bedrande och berömmande af skedsbetyg fogat en g . k. reservation , i hvilken han beskylde klaganden för att hafva bediifvit ■in lärarinoeverksambct i snedvriden , separatistisk anda .	56	0:58	kilanda församling småskola hilda charlotta hansson ha hos justitieombudsman anmäla skolråd ordförande kyrkoherde l $ hegardt för den denna till en för hon af skolråd ntfär dadt $ synnerligen bedrande och berömma af skedsbetyg foga en g $ $ reservation $ i hvilken han beskylde klagande för att hafva bediifvit $ lärarinoeverksambct i snedvrida $ separatistisk anda $
anda		1901	2	bib11653811_19010731_145317_116_0003_alto.xml-39-20	 	Den qväfvande heta atmosfären med stanken från smutsiga kök, ruttna grönsaker och förderfvade fiskaffall gör det motbjudande att draga andan.	135:140	0:141	Den qväfvande heta atmosfären med stanken från smutsiga kök , ruttna grönsaker och förderfvade fiskaffall gör det motbjudande att draga andan .	20	0:22	den qväfva het atmosfär med stank från smutsig kök $ rutten grönsak och förderfva fiskaffall göra den motbjudande att dra anda $
